b'\\u201cModi\\u2019s government had choreographed Mr. Trump\\u2019s visit as a demonstration of India\\u2019s rising stature on the world st\\u2026 https://t.co/VH94WzELMh',b'1232287952371318784',b'Michele Madigan Somerville',b'NYpoet',"b'Brooklyn, NY'","b'3 kids, 3 books: GLAMOUROUS LIFE, soon. Essays: NYTimes et al. Fmr teacher: Grade 1 to Uni. MTS Harvard, MFA Brooklyn College. @indietheology Blocked by Trump.'",b'3502',b'2315',b'134',b'5911',b'17230',b'False',b'False',b'False',b'False',b'2009-05-26 01:12:45'
b'@nadeemmalik @realDonaldTrump @ImranKhanPTI DT gave lolypop to GOP in order to complete their mission against the s\\u2026 https://t.co/Gi2Tmh3kz9',b'1232287949204664320',b'Muneer Ahmed Memon',b'MuneerAhmedMem8',b'',b'',b'6',b'27',b'0',b'183',b'45',b'False',b'True',b'True',b'False',b'2015-05-30 13:26:53'
b'@tedcruz Stop the racism A-hole. Pretty sad when you feel threatened by a Muslim woman.',b'1232287948923658241',b'Dr. Melissa Pollock',b'MelissaPolloc19',b'Ireland ',"b'Ph.D University St. Andrews\\nPublished 2 books: Lion, Lily, Leopard\\n& Scotland after loss of Normandy. Taught: UCD, TCD, St. Andrews & Edinburgh.'",b'302',b'602',b'3',b'15666',b'14038',b'False',b'False',b'False',b'False',b'2017-07-03 17:31:29'
b'@msisodia Saare muslim log hai kr payge aap kuch',b'1232287942665633792',b'Vinay Kaushik',b'VinayKa13177592',b'',b'instagram I.d -it_vinaykaushik',b'3',b'36',b'0',b'3',b'23',b'False',b'False',b'True',b'False',b'2020-01-15 12:56:02'
b'@nazia_e @kapsology I am not an Indian Muslim and I also do not trust the police or the government to protect me anymore.',b'1232287936869216256',b'Trillion $ BaBa !',b'Mr_Incoggnito',"b'Pune, India'",b'A patriot must always be ready to defend his country against his government.',b'817',b'5',b'23',b'67886',b'130241',b'False',b'False',b'True',b'False',b'2014-03-14 14:49:56'
b'I demand stringent punishment for rioters irrespective they belong to RSS SiMI Bajrangdal BJP AAP Congress Hindu Mu\\u2026 https://t.co/H8dOZvQttO',b'1232287907894841345',b'Abidasad',b'Abidasad3',b'',b'',b'8',b'260',b'0',b'429',b'133',b'False',b'True',b'True',b'False',b'2017-12-16 07:13:27'
"b'Can your tell your non Muslim brothers to boycott petrol &amp; resign from the job where they are working in UAE, Saudi\\u2026 https://t.co/E3qrqhu3fP'",b'1232287902601764864',b'Shaikh Adnan \\u0639\\u062f\\u0646\\u0627\\u0646',b'IamAdnanSk',b'India',b'Activists /\\nIndian Muslim \\U0001f1ee\\U0001f1f3/ Junior Computer Engineer.',b'633',b'771',b'1',b'7374',b'45080',b'False',b'False',b'True',b'False',b'2015-07-07 08:06:34'
b'Dear @AmitShah jo bhi videos saamne aayi hain usmein jisne bhi hinsa ki hai sab ki gaand kutai karo chahey Hindu ho\\u2026 https://t.co/30rQhKUCdv',b'1232287902370918401',b'Anuj Khurana \\U0001f1ee\\U0001f1f3',b'HaddHaiYaar',"b'Delhi NCR, INDIA'","b'Trying to be a Businessman. Movies, TV series, sports lover. Lazy Blogger. Memes.\\nInstagram- HaddHaiYaar'",b'6082',b'629',b'86',b'136945',b'41598',b'False',b'False',b'False',b'False',b'2009-06-30 07:39:48'
"b'@Jhanzaib_S You should cry for Hindu brothers too. ,why only partial love(Randirona) for muslim brother .'",b'1232287892061507584',b'Sudipto Sarkar',b'Sudipta_Sarkar_',b'Kolkata',b'Pagal ho kya',b'9',b'47',b'0',b'531',b'1944',b'False',b'False',b'False',b'False',b'2016-05-20 17:15:17'
"b'Do you know? That To become a muslim, a person of any race or culture must say a simple statement or creed. (i.e. t\\u2026 https://t.co/LlVBwKOpvm'",b'1232287890677342213',b'_\\u0644\\u0622\\u062c\\u0644\\u0643 \\u0634\\u064e\\u064a\\u0645\\u0652 .',b'FOR_Shimaa11',b'',b': \\u0645\\u0646 \\u0623\\u0639\\u0645\\u0627\\u0642 \\u0642\\u0644\\u0628\\u064a \\u0647\\u0648 \\u0627\\u0644\\u062f\\u0639\\u0627\\u0621 \\u0639\\u0646\\u062f\\u0645\\u0627 \\u064a\\u0628\\u062a\\u062f\\u0623 \\u0648\\u064a\\u062e\\u062a\\u0645 \\u0628\\u0625\\u0633\\u0645 \\u0634\\u064a\\u0645\\u0627\\u0621 \\u060c \\u0627\\u0644\\u0644\\u0647\\u0645 \\u0623\\u062c\\u0639\\u0644\\u0647\\u0627 \\u0645\\u0646 \\u0623\\u0633\\u0639\\u062f \\u062e\\u0644\\u0642\\u0643 \\u060c \\u0648\\u0627\\u062c\\u0639\\u0644 \\u0647\\u0627\\u0644\\u062d\\u0633\\u0627\\u0628 \\u062d\\u062c\\u0647 \\u0644\\u0647\\u0627 \\u0644\\u0627 \\u0639\\u0644\\u064a\\u0647\\u0627 \\u2665\\u2665',b'56',b'67',b'1',b'32091',b'0',b'False',b'False',b'True',b'False',b'2013-11-15 15:45:25'
b'@ANSHUBAJPAI1 @priyankagandhi Are wah tum log to Sena par bhi ungli uthane wale log ho taking bas apne parti and Muslim me karte ho',b'1232287877511254017',b'nadan chhore',b'virendr38644639',b'',b'tum jaise ghatiya Socha wale ko aaina dikhana',b'137',b'566',b'0',b'2746',b'7717',b'False',b'False',b'True',b'False',b'2015-08-01 19:03:46'
b'@RealKrutika Mujhe pata hai kruti tum bahut dukhi ho kyunki tum desh se bahut pyar karti kuch asim fans honge jo ki\\u2026 https://t.co/kpm2ItJ0Ar',b'1232287869152059392',b'pratibha\\U0001f49e',b'Pratibh55516724',b'',b'i love my country and modi ji \\U0001f64f\\U0001f64f\\U0001f64f\\U0001f64f\\U0001f64f\\U0001f64f\\U0001f64f',b'237',b'203',b'0',b'17125',b'14914',b'False',b'False',b'True',b'False',b'2019-10-06 16:59:42'
"b""I am a Hindu and I don't feel safe in my own country, a Hindu country, because it is infested with violent ezzlam!c\\u2026 https://t.co/QDHzeTQGlT""",b'1232287866111180802',b'Jaya',b'SimplyJaya1',b'',b'Proud Hindu',b'1001',b'484',b'0',b'24667',b'24102',b'False',b'False',b'True',b'False',b'2019-04-30 11:58:50'
"b'#SupremeSacrifice\\nThe Gallant Warrior Of Delhi Police,who fought against the odds of the society and attained the m\\u2026 https://t.co/Kh39j10nmq'",b'1232287865486311424',b'BeingKesri',b'ArunKChourasia',"b'Gujarat, India'",b'Hyper Nationalist - loves Patriotism - Responsible Citizen of India',b'24',b'71',b'0',b'188',b'127',b'False',b'False',b'True',b'False',b'2016-12-17 09:32:19'
b'@iamseeratraza @Kai_Schultz Yes Muslim terrorists not Hindus... Correct it.',b'1232287863972253702',b'Deep',b'LenkaDevi',b'',b'Style',b'2',b'57',b'0',b'1412',b'14',b'False',b'False',b'True',b'False',b'2020-01-18 13:40:47'
"b'You deranged person, how do you know he is a dalit?\\n\\nAnd muslim women standing for reservation is not just for dali\\u2026 https://t.co/cIaXO0pKOH'",b'1232287861761662978',b'(((Dominique Fisherwoman)))',b'AbbakkaHypatia',b'Begumpura',b'Writer. Objectivist. Ambedkarite. Renaissance Woman. Romantic Realist. Classical Liberal. Laissez Faire Capitalist. Atheist. Tribal. WWBD (What would Buffy do?)',b'4666',b'2325',b'53',b'170136',b'122527',b'False',b'False',b'False',b'False',b'2009-03-26 13:21:11'
b'@AamirSeyaar @IndiasMuslims We trust that our Hindu brothers will protect us  nor all the hindus are anti-muslim or\\u2026 https://t.co/YHbtFnFTfs',b'1232287858876207110',b'Sehbaj Ahmad',b'AhmadSehbaj',b'',"b'mera mazhab hindustan , meri  jaan samvidhan , meri muhabet bhaichara . hindustan zindabad \\U0001f1ee\\U0001f1f3\\U0001f60d\\U0001f60d'",b'68',b'217',b'0',b'612',b'478',b'False',b'False',b'True',b'False',b'2020-01-03 19:05:37'
"b'@RanaAyyub has exposed herself today, not s single tweet condemning the violence by Muslim community, but she build\\u2026 https://t.co/RV43l1dIKO'",b'1232287857416527872',b'Sushant shetty',b'The_Outlaw_Poet',"b'Mumbai, India'",b'May the Quotes be with you.',b'146',b'278',b'1',b'1177',b'3066',b'False',b'False',b'False',b'False',b'2009-08-22 15:03:48'
"b'@LtGovDelhi Sir why not army is deployed sir , still in muslim areas those goons along with your police are roaming\\u2026 https://t.co/LjzzR1xndn'",b'1232287855478636545',b'Satyameva jayate \\u0938\\u0924\\u094d\\u092f \\u092e\\u0947\\u0935 \\u091c\\u092f\\u0924\\u0947 \\u0633\\u062a\\u064a\\u0627 \\u0645\\u064a\\u0648\\u0627 \\u062c\\u064a\\u062a\\u0649',b'lier2345',b'',b'Aeronautical engineer |\\n Education at its best',b'36',b'238',b'0',b'923',b'794',b'False',b'True',b'True',b'False',b'2019-12-19 18:09:20'
"b""@hatindersinghr1 Crackdown in response to policeman Rattan Lal's death should be on both Hindu and Muslim rioters. Not only on Muslims""",b'1232287854748786688',b'Ashok Singh Garcha',b'AshokSGarcha',"b'Ludhiana, India'","b'President, Abrahamic and Indo-Abrahamic Association (AIAA), Old Sanawarian, Old Stephenian  JEWISH, CHRISTIAN, MUSLIM and SIKH UNITY !'",b'969',b'1388',b'9',b'6761',b'1728',b'False',b'False',b'True',b'False',b'2011-08-05 15:36:30'
"b""@ndtv @ravishndtv @AAPDelhi @INCIndia \\n@LtGovDelhi @DelhiPolice \\nAs we don't have jobs thats y play hindu-Muslim..\\u2026 https://t.co/xqFaegSqco""",b'1232287852362379264',b'Arsad',b'araalam',"b'Jammu, Jammu And Kashmir'",b'',b'28',b'102',b'0',b'177',b'482',b'False',b'False',b'False',b'False',b'2010-05-06 10:55:44'
"b'Sesama muslim adalah saudara, jika ada masalah maka beri dukungan agar tidak ada yang terdzolimi.\\n &gt;&gt;\\u2026 https://t.co/1hSyx2GQkL'",b'1232287851594702848',b'Putri Fakhira',b'PutriFakhira8',b'',b'santai',b'50',b'77',b'0',b'1322',b'5',b'False',b'False',b'True',b'False',b'2019-04-17 05:39:31'
b'@IlhanMN More like your possible ties to the Muslim Brotherhood through CAIR',b'1232287842392399874',b'\\u274c Kathy Owrey\\u274c',b'kathy_owrey',b'Northwest USA',b'AMERICAN CITIZENS COME FIRST..#MAGA..#KAG.. THINK GLOBALISTS R THE REAL DANGER NOT EACH OTHER.. SHARE LINKS & OPINIONS.. #WALKAWAY in early 2000s',b'3679',b'3498',b'2',b'42213',b'23166',b'False',b'False',b'True',b'False',b'2016-10-29 03:12:48'
b'#BTSonFallon #Bangladesh  #BTSTakeOverNYC  #blockchain  #dhaka https://t.co/IOayrGhbbS  #Muslim',b'1232287841398317056',b'Rena J. Sontag',b'RenaSontag',"b'Missouri, USA'","b""I'm a strong woman who will fight for my love ones.. lol""",b'48',b'508',b'0',b'655',b'258',b'False',b'False',b'True',b'False',b'2019-05-17 04:53:10'
b'@Purwa18 @sabu_jupiter @akhilakadaddy @RanaAyyub Thank for asking.CAA stand along is not issue but with combination\\u2026 https://t.co/Etk7TGyayR',b'1232287831961157634',b'Shakeeb',b'shakeeb_a_khan',b'India',b'RT are my belief. Pro Social Justice.',b'483',b'1070',b'57',b'17861',b'61830',b'False',b'False',b'False',b'False',b'2009-08-04 10:09:32'
"b'#MadhyaPradesh; CM #KamalNath gave nod to hike honorarium of #Muslim clerics, to hike the honorarium of imams from\\u2026 https://t.co/0s3dT0FBHN'",b'1232287824566607873',b'Anil Dubey',b'anilscribe',b'Somewhere',"b'Journalist, RT\\u2260Endorsement; Views=Personal, personal space'",b'5860',b'476',b'47',b'15007',b'7579',b'False',b'False',b'False',b'False',b'2011-07-01 07:39:26'
b'@aadil_khan01 1/2 I have had and still have muslim friends. I had one in school who I used to share my bench with.\\u2026 https://t.co/jRTRCFkuIC',b'1232287816652148737',b'karyakarta',b'Aman10143785',"b'Mumbai, India'",b'',b'18',b'570',b'0',b'60',b'484',b'False',b'False',b'True',b'False',b'2017-12-20 18:05:46'
b'@waqas_x Chinese &amp; Indian state have a lot in common when it comes to oppressing minorities. Both are using the sam\\u2026 https://t.co/W4U8lp67Ja',b'1232287794271281152',b'Hassan',b'HassanTMaitla',b'UK',"b'Blessed and forever grateful to the most high...\\n\\nFree Palestine, free Syria, free Kashmir.'",b'113',b'253',b'0',b'1661',b'2831',b'False',b'False',b'False',b'False',b'2011-05-22 16:59:11'
"b'@Amitjanhit Abe Madarchod kuch to sharam kar lo, 2 din se Hinduo kobkaat rahe the muslim jihadi soye the kya . Kejriwal ke dalal'",b'1232287790127185922',b'Vikas Tyagi',b'VikasTy97781986',b'',b'Male\\n32 year old',b'0',b'19',b'0',b'13',b'151',b'False',b'True',b'True',b'False',b'2019-04-25 12:26:58'
"b'Hadeeth\\nThe Prophet( saw) has said:\\n \\u201cLife is sweet, and Allah has made you successors on the earth; so that He may\\u2026 https://t.co/fTUEon96eU'",b'1232287788902514689',b'Buhari Sulaiman',b'muhaddith4',b'Katsina',"b""ABUsite. A student of knowledge.. I fallow Quran and sunnah according to the understanding of predecessors. My Qur'anic reciter; muh'd Ayyub.""",b'84',b'539',b'0',b'260',b'43',b'False',b'False',b'True',b'False',b'2020-01-28 23:41:15'
"b'Saint Rampal Ji Maharaj says Humanity is the religion of all.\\n\\nOur race is living being, humanity is our religion.\\u2026 https://t.co/Cpw4GZVfE7'",b'1232287785546997760',b'Hariom Patel',b'HariimPatel',b'',b'sat Sahib ji Bandi chor ki jai',b'262',b'667',b'0',b'1206',b'844',b'False',b'False',b'True',b'False',b'2019-04-21 10:20:36'
b'Lelaki ini seorang muslim dan kekasihnya seorang Kristian. Dia tidak pernah memaksa kekasihnya memeluk Islam tetapi\\u2026 https://t.co/TxMlkiIGxr',b'1232287783839944704',b'Kiff',b'iffgone',"b'Johor Bahru, Johor'",b'2:152',b'13557',b'198',b'8',b'31364',b'3023',b'False',b'False',b'False',b'False',b'2011-08-03 10:25:04'
b'Umat Islam harus waspada terhadap  upaya kriminalisasi terhadap Muslim yang kritis dan vokal \\n &gt;&gt;\\u2026 https://t.co/z8hm0CcQ0E',b'1232287781163954182',b'Yati Tri',b'yatikediri2',b'',b'Cinta Islam',b'151',b'180',b'0',b'1448',b'293',b'False',b'False',b'True',b'False',b'2019-04-03 08:56:14'
"b'\\u201cSeorang muslim yang murtad dan melakukan tindakan mengacau umat Islam, maka ia boleh dihukum mati.\\u201d (HR. Bukhari dan Muslim)'",b'1232287766806876161',b'Learn Hadits',b'LearnHadits',b'',b'',b'10205',b'4',b'12',b'82466',b'0',b'False',b'False',b'False',b'False',b'2011-10-31 20:04:39'
b'@upasanashindu Kash us Dange Mei tumhara ghar ka koi hota.... Tab Aisa na bolti..\\nKaisi badtameez ho... \\nHindu Dhar\\u2026 https://t.co/C9RwhrIfMr',b'1232287760809123842',b'Nasim Khan',b'Iamnasimkhan',b'Kolkata',"b'Working in Digital Marketing for more than 7 y. If you have any queries related to Digital Marketing,SEO,Social Media ,PPC, please send me a message @webmarcon'",b'377',b'89',b'18',b'138',b'80',b'False',b'False',b'False',b'False',b'2012-08-01 11:06:29'
"b""@MspdcaliKag @MacMaclary her district is majority Muslim, if not her it will be another one' we still won't gain anything by her being gone.""",b'1232287757642412032',b'\\u274cMichael\\U0001f37a\\U0001f608 #MAGA',b'Michael41567028',b'',"b""#MAGATrump can and will do for you like no other has done before him\\U0001f60e Imma dreg according to joe biden  \\U0001f61c\\U0001f92a\\U0001f61b i'll take that a proud one too\\U0001f60f""",b'14543',b'14822',b'3',b'5145',b'4525',b'False',b'False',b'True',b'False',b'2018-08-13 13:23:21'
"b""@sagarikaghose If you are a journalist, why don't you give free fair report s why always anti bjp why not also write on Muslim rioters""",b'1232287757529010176',b'Sunil Bhandari',b'sunbhandari',b'Bangkok',b'',b'2',b'111',b'0',b'41',b'11',b'False',b'False',b'True',b'False',b'2009-12-19 13:36:19'
"b'@imsalmansam @GulRose_views @vinodkapri Pahli bat ye prove nhi hua, aur chalo mene man bhi liya to kya puri ki puri\\u2026 https://t.co/FkJBfidP54'",b'1232287747899117570',b'Vipin chandra Bangwal',b'BangwalVipin',b'',b'I am a simple person.',b'1',b'23',b'0',b'668',b'21',b'False',b'False',b'True',b'False',b'2019-11-14 14:20:58'
"b'@RanaAyyub When MUSALMAN is asked by anyone on the attack on Humanity anywhere, his / her response ""\\nNot Muslim \\nAm\\u2026 https://t.co/ITWBqP4xMv'",b'1232287745835290625',b'\\u0924\\u093e \\u0925\\u0948\\u092f\\u094d\\u092f\\u093e TaThaiyya \\u0913 O \\u0913',b'junkyaar',b'',b'\\u0939\\u092e  \\u0915\\u0941\\u091b  \\u0928\\u0939\\u0940\\u0902  \\u0915\\u0930\\u0924\\u0947  \\u0939\\u0948\\u0902 ...\\u092c\\u0938 \\u0915\\u092e\\u093e\\u0932 \\u0915\\u0930\\u0924\\u0947 \\u0939\\u0948\\u0902... \\U0001f60b..\\u0924\\u093e \\u0925\\u0948\\u092f\\u094d\\u092f\\u093e \\u0924\\u093e \\u0925\\u0948\\u092f\\u094d\\u092f\\u093e \\u0913 \\u0913 \\u0913     Bus kamaal kertey hain Isliye Hum kuch nahi kertey..!..\\u0927\\u0942\\u092e \\u0924\\u093e\\u0928\\u093e \\u0924\\u093e \\u0926\\u0942\\u0902 \\u0924\\u093e \\u0928\\u093e \\u0928\\u093e',b'65',b'1524',b'0',b'3821',b'3425',b'False',b'False',b'False',b'False',b'2019-01-22 17:23:27'
"b""@Youssef_Taha @HannahAllam True. Then again under Muslim custom it really shouldn't happen more than 24 hours after death""",b'1232287723773362177',b'Samer Al-Atrush',b'SameralAtrush',b'\\u062a\\u0648\\u0646\\u0633',b'Journalist based in \\U0001f1f9\\U0001f1f3 covering North Africa. DM open. Stock disclaimer. I hate mangoes.',b'17020',b'2852',b'723',b'38610',b'19817',b'False',b'False',b'False',b'False',b'2011-12-23 10:39:54'
"b'@RubikaLiyaquat @realDonaldTrump Yad rkhnaa..is,dalali k waja se,aap jayda,safe nhi rah payegi...nmbr apka bhi ayega..qki aap bhi muslim hai'",b'1232287722657779712',b'Godse wale chacha',b'nehrukigaltih',b'\\u092d\\u093e\\u0930\\u0924',b'social activists',b'38',b'199',b'0',b'929',b'100',b'False',b'False',b'True',b'False',b'2016-05-01 14:59:40'
"b'me and the other side of the family that is muslim tho, we get TURNT'",b'1232287714227212296',b'bella',b'eurofamiliaa',"b'Stockholm, Sverige'",b'',b'215',b'503',b'0',b'1277',b'681',b'False',b'False',b'True',b'False',b'2019-04-28 18:40:50'
"b'@larissafernand Yes Godhra Redux, when Mad Muslim mobs burnt alive 70 Hindus in train. In Delhi so far they are killing on the roads.'",b'1232287709504376832',b'xyogee',b'xyogee',b'Delhi',b'Solving & Evolving',b'81',b'189',b'1',b'6706',b'21781',b'False',b'False',b'True',b'False',b'2016-05-28 15:24:57'
"b'*Oh Muslim rulers! Refrain now, before doors of apology are closed for you..* \\n\\n*Sayings of Hafeez Jalandhari* https://t.co/FyT0kdb4Q5'",b'1232287707528912898',b'TLP KHI UC16',b'TlpUc16',b'',b'\\u200f\\u0622\\u0641\\u06cc\\u0634\\u0644 \\u0627\\u06a9\\u0627\\u0624\\u0646\\u0679 \\u062a\\u062d\\u0631\\u06cc\\u06a9 \\u0644\\u0628\\u06cc\\u06a9 \\u067e\\u0627\\u06a9\\u0633\\u062a\\u0627\\u0646 \\u06a9\\u0631\\u0627\\u0686\\u06cc \\u06cc\\u0648\\u0633\\u06cc 16',b'59',b'4',b'0',b'225',b'204',b'False',b'False',b'True',b'False',b'2020-01-14 19:45:02'
b'@sbsalman_salman nnocent Muslim killing RSS terrorist ..khud maro to tik koi use roke .. to killing waah ..kisi or\\u2026 https://t.co/PEgrKD7KOj',b'1232287705205133312',b'Rajneesh \\U0001f1ee\\U0001f1f3',b'Rajnees98531092',b'',"b'Men do not attract that which they want, but that which they are.\\n !!\\u0926\\u0947\\u0936 \\u0915\\u0947 \\u0932\\u093f\\u090f \\u092a\\u094d\\u092f\\u093e\\u0930 \\u0939\\u0948 \\u0924\\u094b \\u091c\\u0924\\u093e\\u092f\\u093e \\u0915\\u0930\\u094b, \\u0915\\u093f\\u0938\\u0940 \\u0915\\u093e \\u0907\\u0902\\u091c\\u0924\\u093e\\u0930 \\u092e\\u0924 \\u0915\\u0930\\u094b\\u2026 \\u0917\\u0930\\u094d\\u0935 \\u0938\\u0947 \\u092c\\u094b\\u0932\\u094b \\u201d \\u091c\\u092f \\u0939\\u093f\\u0928\\u094d\\u0926 \\u201c !!'",b'3',b'90',b'0',b'863',b'178',b'False',b'False',b'True',b'False',b'2019-12-09 11:54:28'
b'@NaseerM74144339 @SidrahDP We wronged ourselves by not pushing you out like millions were pushed out and properties\\u2026 https://t.co/rWCmb3k8sg',b'1232287700780105730',b'Indiancow',b'indiancow27',b'',b'',b'15',b'221',b'0',b'107',b'762',b'False',b'False',b'True',b'False',b'2016-06-19 10:41:13'
"b""@nazia_e I am a hindu and i don't trust Muslim sitting next to me any more""",b'1232287699278745600',b'Saharsh Patel',b'Saharsh32584853',b'',b'Proud nationalist\\n\\u092e\\u0947\\u0930\\u0947  \\u0936\\u093f\\u0935 \\u092e\\u0947\\u0930\\u0947 \\u0938\\u0902\\u0938\\u094d\\u0915\\u093e\\u0930\\U0001f6a9\\U0001f6a9\\U0001f6a9\\n\\u0938\\u0941\\u0916\\u0926\\u0941\\u0903\\u0916\\u0947 \\u0938\\u092e\\u0947 \\u0915\\u0943\\u0924\\u094d\\u0935\\u093e \\u0932\\u093e\\u092d\\u093e\\u0932\\u093e\\u092d\\u094c \\u091c\\u092f\\u093e\\u091c\\u092f\\u094c\\u0964\\n\\u0924\\u0924\\u094b \\u092f\\u0941\\u0926\\u094d\\u0927\\u093e\\u092f \\u092f\\u0941\\u091c\\u094d\\u092f\\u0938\\u094d\\u0935 \\u0928\\u0948\\u0935\\u0902 \\u092a\\u093e\\u092a\\u092e\\u0935\\u093e\\u092a\\u094d\\u0938\\u094d\\u092f\\u0938\\u093f\\u0965',b'26',b'64',b'0',b'797',b'1179',b'False',b'False',b'True',b'False',b'2019-12-31 09:34:32'
b'@DaEternalRebel @Kai_Schultz @GhoshAmitav So all dz women are hindu wearing burkha! Shame on u man.... Muslim terrorists r all over d world',b'1232287698259451905',b'Deep',b'LenkaDevi',b'',b'Style',b'2',b'57',b'0',b'1412',b'14',b'False',b'False',b'True',b'False',b'2020-01-18 13:40:47'
"b""Muslim area?\\nI thought there was only Delhi area since when we've Muslim area?\\nRemember #Chandan was killed by thes\\u2026 https://t.co/PmmETGY7SH""",b'1232287695566786560',b'M_\\u0aa8\\u0ac0_\\u0937 \\U0001f1ee\\U0001f1f3\\U0001f6a9',b'M_T_6579',b'India',b'#ModiForever Non Left ideaolgy. Honored by @nsitharamanoffc @OfficeOfRKSingh @Sunariwal_MLA @anujdhar @RahulSinhaBJP @SharmaKhemchand',b'2860',b'277',b'62',b'106428',b'2363',b'False',b'False',b'False',b'False',b'2011-08-16 10:06:10'
b'@Ssaniya25 Hindus are Muslims are very different civilization. The fault lines will continue to exist until muslim\\u2026 https://t.co/Z85WK5d7Nd',b'1232287694736125952',b'D Sharma',b'SSSharma11111',b'India',"b'Software Professional, Machine Learning'",b'165',b'26',b'26',b'60132',b'34031',b'False',b'True',b'False',b'False',b'2015-11-16 11:16:07'
"b'Berulang kali kita saksikan, bagaimana penegakan hukum di negara mayoritas Muslim ini hanya menyasar pada umat Isla\\u2026 https://t.co/WyGMwLW3p0'",b'1232287693985349632',b'Nur Hikmah',b'NurHikm46908875',b'',b'',b'193',b'326',b'0',b'2412',b'450',b'False',b'False',b'True',b'False',b'2018-05-06 02:57:56'
"b'Berulang kali kita saksikan, bagaimana penegakan hukum di negara mayoritas Muslim ini hanya menyasar pada umat Isla\\u2026 https://t.co/832TWKhFDQ'",b'1232287689774333952',b'Ummu syaban',b'SyabanUmmu',b'',b'Ibu pejuang Islam Kaffah\\nCinta Nabi Cinta Syariah',b'58',b'152',b'0',b'803',b'61',b'False',b'False',b'True',b'False',b'2020-01-13 07:34:36'
b'@NikhilG59557473 @Nikhil_1072 @Delhi_Sarcasm @TheDeshBhakt Main 100 bhejun? Farq itna hai tu violence support Kar r\\u2026 https://t.co/SgOZJpJN0f',b'1232287688725757958',b'Talha Khan',b'Tkhann20',b'Delhi',"b'Believe in logic, voice my opinion, confused about career and enjoy traveling.'",b'58',b'163',b'0',b'2501',b'5753',b'False',b'False',b'False',b'False',b'2014-08-11 08:44:40'
b'@darshana213 @nazia_e HN congress 70 salo se abhi tak muslim muslim krti h so bsp tmc sab cast k upar vote mangte h\\u2026 https://t.co/zvMnP7BlYB',b'1232287681222184960',b'Karan Rawat',b'KaranRa22917219',b'',b'',b'0',b'22',b'0',b'11',b'119',b'False',b'False',b'True',b'False',b'2020-02-25 00:31:57'
b'This is done by muslim mob to play victim card.... https://t.co/OItF1d1a0l',b'1232287676566368256',b'AryaBharat',b'AryaBharat10',"b'Indiana, USA'",b'Unapologetic Hindu.\\nBlocked by @sanjukta @sagarikaghose @RiaRevealed',b'134',b'307',b'0',b'6471',b'286',b'False',b'False',b'True',b'False',b'2019-11-08 08:25:45'
b'Indian hindhu muslim are brother and sister\\n#ArrestTerroristKapilMishra\\n#AmitShahResign \\n#GautamGambhir \\n#Muslims\\u2026 https://t.co/mCyrP0bgs5',b'1232287674997841921',b'Abuthahir',b'mkmabu313',b'',b'',b'33',b'96',b'0',b'105',b'102',b'False',b'False',b'True',b'False',b'2016-12-04 18:17:47'
"b'@opiniofIslam Sesama muslim adalah saudara, jika ada masalah maka beri dukungan agar tidak ada yang terdzolimi.\\n &gt;&gt;\\u2026 https://t.co/KT9WL0FedH'",b'1232287673231888385',b'Gandrung1453',b'1453Gundi',"b'Yogyakarta, Indonesia'",b'Activist GEMA Pembebasan',b'59',b'18',b'0',b'186',b'129',b'False',b'False',b'True',b'False',b'2019-05-24 15:57:41'
b'@Miss_Kadyan @ippatel Tell them that they should Stop using Indian infront of Muslim incase use islamic terrorist\\u2026 https://t.co/cd7M6JLHMY',b'1232287670925176833',b'Pankaj Sharma',b'PankajS97051392',b'',b'Represent INDIA\\n#not_andhbakt\\n@narendramodi',b'0',b'18',b'0',b'27',b'15',b'False',b'False',b'True',b'False',b'2019-08-26 06:41:53'
"b'Lah, gue jadi ikutan kaget. Gue bilang aja kalau gue muslim. Kita beda keyakinan. Tapi deseu malah maksa masuk ke r\\u2026 https://t.co/TztOO1vcI9'",b'1232287663895519234',b'Widya Rutami',b'widdyra',"b'Warsaw, Poland'",b'Ibu beranak (masih) satu',b'600',b'465',b'5',b'42351',b'231',b'False',b'False',b'False',b'False',b'2009-06-23 00:35:45'
"b""'Anti-Muslim' law in India upsets the BBC https://t.co/YP2JQBEgh2 via @YouTube \\n\\n\\U0001f92c the BBC it didn\\u2019t upset me!  Trump 2020 \\U0001f601\\U0001f44d\\U0001f3fb\\U0001f44d\\U0001f3fb""",b'1232287662767300614',b'Andy wells',b'Andywel21663520',b'',b'',b'179',b'322',b'0',b'2299',b'1813',b'False',b'False',b'True',b'False',b'2017-06-04 13:57:25'
"b'@SanjayAzadSln Ab na ,bjp bolegi ,na shiv sena bolegi na nhi kuch or partywale bolengee, Yehi baat ager muslim ne k\\u2026 https://t.co/WnwZB5mN2U'",b'1232287649915785217',b'ARif DUndasi',b'arifd786',b'',b'',b'0',b'75',b'0',b'101',b'830',b'False',b'True',b'True',b'False',b'2019-06-02 23:12:30'
b'@itssinghswati @KapilMishra_IND Pehle Muslims ko maaro phir milkar ekta march  nikalo aur jo ghar jale he dukaane l\\u2026 https://t.co/wcKVsXW0Yy',b'1232287645780398080',b'Salman Shaikh',b'SalmanS50628558',b'',b'I love my country',b'37',b'164',b'0',b'1037',b'787',b'False',b'False',b'True',b'False',b'2019-10-04 14:41:17'
b'Jo 25 laashe muslimo ki giri h up me uska kya tum jaise log desh me nafrat ka sauda kar karhe h \\nHindu muslim se ut\\u2026 https://t.co/6ZkreZum3I',b'1232287645193187329',b'sheikh Rizwan Ahmad',b'sheikhrizwan769',b'Lucknow ',b'',b'43',b'58',b'0',b'377',b'298',b'False',b'False',b'True',b'False',b'2013-06-23 07:37:30'
b'the irony of the french establishment &amp; intelligentsia forcing muslim women to take their clothes off at pools &amp; be\\u2026 https://t.co/PkUxB7QT2P',b'1232287638117330950',b'& the oscar goes to... farah-site',b'AttractionF',b'the NW',"b'alaikum assalam, hagrid \\U0001f1e9\\U0001f1ff writing weekly abt film, TV & culture at @oneperfectshot/@rejectnation contact: farah@thefilmbitch.com'",b'1014',b'908',b'20',b'57785',b'50692',b'False',b'False',b'False',b'False',b'2009-03-08 18:39:19'
