"b'@DevjyotGhoshal Police supporting stone pelter,who are this stone pelter ,definetly not anti caa protestors coz the\\u2026 https://t.co/LIhaCG0OlL'",b'1232009503043801088',b'Firasath Ali',b'firasath_ali',b'hyderabad',"b'love politics,its every1s duty to make this country prosper,fascist forces has taken us 10yrs back,I request every 1 to take responsibility to push this fascist'",b'357',b'3409',b'7',b'18297',b'14572',b'False',b'False',b'True',b'False',b'2013-06-16 17:15:42'
b'@Donjon10729665 @MissMuggleborn Nahi nikla. ANI ka source bola. Wo toh Gopal ko bhi baccha bata rahe the. Ye ladka\\u2026 https://t.co/D8iN5KLoTW',b'1232009499235495940',b'Leaf_lover',b'Leaf_lover26',b'Kyu batau?',"b""Don't think about Pakistan. Think about solving our own problems first. Real problems like Unemployment, Economy, Healthcare, Sex Ratio, etc.""",b'368',b'653',b'0',b'9423',b'54168',b'False',b'False',b'True',b'False',b'2010-07-19 11:02:56'
b'@SudarshanNewsTV @INCIndia @priyankagandhi @RahulGandhi @msisodia @ArvindKejriwal @yadavakhilesh Ye kiya hai bjp ne\\u2026 https://t.co/JqdK0DIXnY',b'1232009422194532354',b'jyoti',b'Nisha83855958',b'',"b'social activist, cyber security expert,love music and Flowers.'",b'159',b'186',b'0',b'3549',b'5960',b'False',b'False',b'True',b'False',b'2019-07-01 17:00:08'
b'@RahulGandhi Mr Rahul Anti-CAA/NRC protestors peacefully protesting all these days &amp;the protest spread all over the\\u2026 https://t.co/jCILPqckNX',b'1232009381283123200',b'Alauddin \\u0639\\u0644\\u0627\\u0621 \\u0627\\u0644\\u062f\\u064a\\u0646',b'Alauddin1809',b'India',b'',b'2060',b'2637',b'1',b'17203',b'4171',b'False',b'False',b'True',b'False',b'2017-06-28 06:43:22'
b'Sahi Kaha sir.. aur sir pro CAA isliye hai kyun ki wo bill anti muslim hai.. https://t.co/Al6urPL4vv',b'1232009335859007490',b'Dr. M A Qadeer',b'imdrmaq',"b'Hyderabad, India'","b'Interest in Space Medicine.. Hoping to be a Private Pilot. Likes to travel, fly and Explore. Foodie/Blogger. Political views are personal. RT\\xd7Endorsement.'",b'86',b'177',b'0',b'1650',b'2435',b'False',b'False',b'True',b'False',b'2010-05-21 20:50:36'
b'@Priyanshi__ Who hi tho. Shuru hogaye sab ke sab playing the victim card. Hamari koi galti nahi thi *wahhhh* hindus\\u2026 https://t.co/GHfAH46ORI',b'1232009319211728898',b'S\\u2728',b'devitalizedlif1',b'',b'Carrying a storm.',b'112',b'136',b'1',b'8307',b'3985',b'False',b'False',b'True',b'False',b'2019-06-08 09:26:46'
b'Pro CAA is now anti muslim\\n\\nBut dare call anti CAA as anti Hindu...',b'1232009160494944256',b'mukul \\U0001f1ee\\U0001f1f3',b'MukulAgarwal66',b'Mumbai',b'Certified Bhakt strictly an armchair activist sitting in ac room True liberal\\ndirector: Talentsynergy @talentysnergy1',b'21357',b'392',b'224',b'296541',b'2131',b'False',b'False',b'True',b'False',b'2011-08-16 10:35:21'
b'@SanjayAzadSln @AmitShah \\u092f\\u0939 \\u0938\\u092c \\u0938\\u094b\\u091a\\u0940 \\u0938\\u092e\\u091d\\u0940 \\u091a\\u093e\\u0932 \\u0939\\u0948 \\u092c\\u0940\\u091c\\u0947\\u092a\\u0940 \\u0915\\u0940 \\u092e\\u093f\\u0921\\u093f\\u092f\\u093e \\u091f\\u0930\\u094d\\u092e\\u092a \\u091f\\u0930\\u094d\\u092e\\u092a \\u0915\\u0930 \\u0930\\u0939\\u093e \\u0939\\u0948 \\u0908\\u0927\\u0930 \\u0926\\u093f\\u0932\\u094d\\u0932\\u0940 \\u0915\\u094b pro CAA  \\u0915\\u0947 \\u0926\\u094d\\u0935\\u093e\\u0930\\u093e \\u092b\\u0942\\u0902\\u0915\\u093e \\u0926\\u093f\\u092f\\u093e \\u0917\\u092f\\u093e \\u0964',b'1232009085819613184',b'@Sahil Gandhi',b'AfzalSahil13',"b'New Delhi, India'",b'Social worker',b'107',b'240',b'0',b'545',b'103',b'False',b'False',b'True',b'False',b'2019-03-20 05:24:40'
"b'This should STOP now. Delhi Police should take action, remember your own family, friends, children, women, daughter\\u2026 https://t.co/uZmmaFQNjE'",b'1232009081587527680',b'Rafale~ STARK!',b'staribo',b'HEART',b'FIGHT even when you are ONE!',b'788',b'967',b'0',b'3379',b'3472',b'False',b'False',b'True',b'False',b'2010-07-05 15:01:31'
b'@khamaniyo Both sides are communal and nither has anything to with the CAA. There are genuine pro and anti CAA guys\\u2026 https://t.co/4Vbkq9wRHp',b'1232009029255225344',b'Urban Jamieson',b'prafullsaraf',"b'Surat, Mumbai, Jainagar(Bihar)'",b'.',b'492',b'1830',b'5',b'16101',b'1',b'False',b'False',b'False',b'False',b'2009-07-12 14:09:17'
b'@anuragkashyap72 Then who are Anti CAA protestors..?\\nPatriots...?\\nPro Hindus...?\\nSecular...?\\nPeacefull community...\\u2026 https://t.co/Ira6EZuA6w',b'1232008927195410437',b'Pratik Sawant',b'sawantatwork55',b'HINDUSTAN',"b'Believed in peace whole LIFE but Peace until Hindutva is targeted. \\nProud Hindu Maratha.\\nSaare jaha se Acha,\\nHINDUSTAN HAMARA\\U0001f6a9\\U0001f6a9\\U0001f6a9'",b'552',b'1109',b'0',b'324',b'1855',b'False',b'False',b'True',b'False',b'2013-06-24 07:48:26'
b'This is not ANTI CAA. \\n\\nThis is anti HINDU. \\nAnti national. \\nAnti constitution. \\nAnti humanity. \\nPRO ILLEGAL IMMIGR\\u2026 https://t.co/7CLWzCRd2h',b'1232008915652530177',b'Fou Chimp\\u2757',b'Smoking_Chimp',b'\\u092d\\u093e\\u0930\\u0924 (India)',b'\\u0905\\u092c ! \\u0906\\u0930\\u093e\\u092e \\u091a\\u093e\\u0939\\u093f\\u090f...\\u0935\\u094b \\u092d\\u0940 \\u0915\\u092d\\u0940 \\u0928 \\u0916\\u0924\\u094d\\u092e \\u0939\\u094b\\u0928\\u0947 \\u0935\\u093e\\u0932\\u093e\\u0964',b'45',b'90',b'0',b'90',b'7',b'False',b'False',b'True',b'False',b'2019-11-12 22:15:03'
b'#Cop killed as anti &amp; pro #CAA protesters clash in #Delhi https://t.co/YIuWA6idtV',b'1232008913500983297',b'Anand Prakash Dwivedi',b'anandpdwivedi',b'India',b'A Doctoral Scholar. Interested in the state of art research & development. Contributing towards the overall development of the society #SnT #Shutterbug #Travel',b'6768',b'4808',b'2',b'24083',b'5637',b'False',b'False',b'False',b'False',b'2011-04-15 05:08:34'
b'@sandymridul This is not ANTI CAA. \\n\\nThis is anti HINDU. \\nAnti national. \\nAnti constitution. \\nAnti humanity. \\nPRO I\\u2026 https://t.co/2VSwXLYJNR',b'1232008892126613504',b'Fou Chimp\\u2757',b'Smoking_Chimp',b'\\u092d\\u093e\\u0930\\u0924 (India)',b'\\u0905\\u092c ! \\u0906\\u0930\\u093e\\u092e \\u091a\\u093e\\u0939\\u093f\\u090f...\\u0935\\u094b \\u092d\\u0940 \\u0915\\u092d\\u0940 \\u0928 \\u0916\\u0924\\u094d\\u092e \\u0939\\u094b\\u0928\\u0947 \\u0935\\u093e\\u0932\\u093e\\u0964',b'45',b'90',b'0',b'90',b'7',b'False',b'False',b'True',b'False',b'2019-11-12 22:15:03'
"b""Flag march in Delhi's Maujpur area after clashes between pro and anti CAA protestors https://t.co/TMTQ23rYVx""",b'1232008887462703104',b'Devdiscourse',b'dev_discourse',b'National Capital Region',"b""Devdiscourse: World's leading Website for International Development News, Opinions, Interviews and Breaking News.""",b'78109',b'675',b'59',b'263775',b'912',b'False',b'False',b'False',b'False',b'2017-12-05 08:31:31'
b'Air has been cleared.. what pro CAA means https://t.co/J32a7dIleC',b'1232008829870669827',b'Ironman - The Lohpurush\\U0001f1ee\\U0001f1f3',b'lohpurushironma',b'India',b'Rise and shine. fight for injustice. call spade a spade.',b'239',b'1155',b'0',b'10936',b'3660',b'False',b'False',b'True',b'False',b'2019-09-20 08:16:38'
"b'This is a Proud Hindu who went to Maujpur. Pro CAA? Fuckk off, ye Musalman maarne gaye hain.\\u2026 https://t.co/i57sh77giv'",b'1232008796781699072',b'Orwellian Bareillian \\U0001f1ee\\U0001f1f3',b'Blast_Famous',b'Mera Bharat Mahaan',b'Notionalist. Pseudo-fenimist. Right Wind. Dashbhakt. Ape-Political. Chowkidhani.',b'1743',b'1609',b'40',b'34792',b'23290',b'False',b'False',b'False',b'False',b'2012-02-17 11:33:38'
"b""@BhardwajAnanya @ikaveri @ThePrintIndia Doesn't matter what is his religion,doesn't matter if he is pro CAA or Anti\\u2026 https://t.co/n1571kDVQF""",b'1232008730767773707',b'Darshan Singh',b'Darshan210488',"b'Grimsby, England'",b'Religion Sikh\\nCulture Hindu\\nProud of Indian Origin',b'4',b'73',b'0',b'528',b'246',b'False',b'False',b'True',b'False',b'2017-12-23 14:12:15'
"b'CAA/NRC demonstrators clash in Delhi ahead of Trump visit\\n\\n""GO AHEAD and throw stones,"" one policeman told pro CAA\\u2026 https://t.co/7bR41w1oc2'",b'1232008630284824579',b'CJ Post',b'The_CJPost',b'Global',"b'CJ will bring those hot issues to you that are ignored in the main stream media, News that needs equal attention! Follow us for daily updates.'",b'283',b'32',b'0',b'184',b'2',b'False',b'False',b'True',b'False',b'2019-10-02 09:02:25'
"b'Cop Killed As Anti, Pro-CAA Protesters Clash In Delhi https://t.co/yqhtjWqgcv'",b'1232008609292156928',b'The Hawk',b'thehawk',b'India',"b""\\u258cStay UpToDate - The Hawk is One of India's topmost English Dailies. Latest news from India and around the world.""",b'2039',b'797',b'10',b'42502',b'14',b'False',b'False',b'False',b'False',b'2012-11-19 14:48:20'
b'Not a riot.\\nNot a clash.\\nAn anti-Muslim Pogrom and there is nothing called Pro CAA.\\nThey are Anti-Muslims.\\nPeriod..\\u2026 https://t.co/PwHVKAUFpm',b'1232008560717881356',b'arunanoop',b'arunanoop_',b'Kerala',b'Student | Professional Dreamer | Introvert',b'83',b'11',b'0',b'34',b'10',b'False',b'False',b'True',b'False',b'2015-04-25 04:58:42'
b'@Kritika_Kamra Cheap comment by cheap people! any sensible person who can read know true act of #CAA and saying pro\\u2026 https://t.co/8PQPxWcd7z',b'1232008542523031552',b'PRK',b'kossireddi',b'',"b""RT's are not endorsements. All tweets are personal opinions!""",b'196',b'658',b'24',b'12724',b'8486',b'False',b'False',b'False',b'False',b'2010-06-30 06:43:31'
b'https://t.co/4dFdCnxfBl\\n\\nWtf? @News18India \\nYour headline sounds like CAA protestors are squarely and completely re\\u2026 https://t.co/mavy7EWMIY',b'1232008491449176067',b'Mobeenrb',b'mobeenrb',b'Gunnergaon ',b'read. think. respond.',b'4',b'74',b'0',b'271',b'80',b'False',b'True',b'True',b'False',b'2019-12-14 16:48:01'
b'@vinodkapri Now who is torching these vehicles? Will any bills be sent ? Or Pro CAA have the right to do all this?',b'1232008297756155908',b'\\u2605My-O-logy\\u2605',b'My_o_logy',b'Aim:Right but kicks at Centre',"b'#AAM Mahila | Follows Back, no place for Haters/ Abusers (in short #Bhakts) | RTs are not endorsements'",b'2031',b'1239',b'10',b'11177',b'1084',b'False',b'False',b'True',b'False',b'2012-12-08 08:30:04'
b'Evil Forces Are Persecuting Indian Muslims In Delhi. Muslims Are Being Killed By Pro CAA Protesters With The Involv\\u2026 https://t.co/ZJv1uIai3f',b'1232008208832700416',b'Mohammed Faiz',b'MDFaiz45',b'',b'Student | Social Activist | Secular Minded | Save Our Constitution | Thoughts Are Personal',b'26',b'228',b'0',b'115',b'110',b'False',b'False',b'True',b'False',b'2017-04-17 20:52:21'
b'@rishiRiyushi @RoflGandhi_ Paidaishi chu h kya.. Wo aadmi pro caa supporter h',b'1232008184241381376',b'pita G',b'Abcd60655620',b'Har jagah',b'secular',b'29',b'49',b'0',b'1361',b'4521',b'False',b'False',b'True',b'False',b'2020-01-29 08:21:39'
"b""@laveesh_sharma @sarthakkashyap4 @gunjakapoor Pro CAA protesters?  \\nCAA ke liye konsa protest ? Isn't thats a law a\\u2026 https://t.co/4LQ47u1Nt4""",b'1232008173839618048',b'KesH',b'keshgoa',b'Goa',b'\\xa4Foodie\\xa4 | \\u2665Lover\\u2665 | @Learner@ | \\u2606Chocolatarian\\u2606 |\\u300b\\u300bFollower of Truth wisdom n knowledge',b'393',b'311',b'2',b'4047',b'4407',b'False',b'False',b'True',b'False',b'2013-08-18 06:18:44'
"b'This is how #Modi supporters celebrate #Trump\\u2019s #India visit: CAA supporters attack Muslims at Delhi protest, pelt\\u2026 https://t.co/AY4bQ6kkP9'",b'1232008074098925570',b'Riaz Haq',b'haqsmusings',"b'Silicon Valley, CA'",b'Riaz Haq writes this blog to express his opinions and make comments on wide ranging topics.The subjects include events in Pakistan and Silicon Valley.',b'2067',b'284',b'134',b'27478',b'10676',b'False',b'False',b'True',b'False',b'2009-01-19 04:00:06'
"b'More than two months of anti CAA protests in #Delhi and no major instances of violence from the protestors, One pro\\u2026 https://t.co/qavYNe3uFT'",b'1232007942867542016',b'Haseeb Siddiqui',b'mh_siddiquii',b'India',b'Adulting is soup and I\\u2019m a fork',b'23',b'43',b'0',b'1220',b'1532',b'False',b'False',b'True',b'False',b'2018-04-13 10:57:00'
b'@DarrKeAage Same WA group bhai. Pro CAA = anti Muzlim ka message propagate karne ka order mila hai next agenda ke liye.',b'1232007897594421251',b'Dr. (Major) Akhilesh Mishra',b'maverickilroy',"b'Navi Mumbai, India'",b'AFMC-Army Medical Corps-?? | NaMo Sachin Federer Vishy Messi| \\n\\u091c\\u0928\\u0928\\u0940 \\u091c\\u0928\\u094d\\u092e\\u092d\\u0942\\u092e\\u093f\\u0936\\u094d\\u091a \\u0938\\u094d\\u0935\\u0930\\u094d\\u0917\\u093e\\u0926\\u092a\\u093f \\u0917\\u0930\\u0940\\u092f\\u0938\\u0940\\u0964',b'884',b'353',b'25',b'25269',b'2803',b'False',b'False',b'True',b'False',b'2010-10-22 14:51:25'
b'#Bharat Delhi Violence: Flag March in Maujpur After Clashes Between Pro and Anti CAA Protestors https://t.co/auW8shPZjT',b'1232007876513878016',b'India News \\U0001f1ee\\U0001f1f3',b'bharatMeraki',b'www.SultanMeraki.com',b'A @SultanMeraki News Outlet https://t.co/3V8kbKOUx6\\nFacebook/Instagram/Tumblr - IndMeraki @httpsJamal',b'33',b'22',b'1',b'3217',b'0',b'False',b'False',b'True',b'False',b'2019-11-22 04:43:05'
"b'@Kritika_Kamra U think pro CAA people are rioting on the roads??  \\U0001f602\\U0001f602\\U0001f602 Ye to bollywoodiya bhi nahi, what shall we call her..'",b'1232007801011986435',b'$hilp_$aaz',b'ar_shilpz',b'',"b'An Awakened Indian, courtesy PM Modi Ji and his tireless service to the nation.\\nAn Architect  and a Vaastukaar.'",b'68',b'208',b'0',b'4188',b'7665',b'False',b'False',b'True',b'False',b'2015-06-04 20:25:55'
b'@noconversion @ArvindKejriwal Delhi people wanted Freebies so every thing Free- protest/Road block/ shooting and no\\u2026 https://t.co/4LFD3bQGrN',b'1232007763502325760',b'S.R.Srinivasa mur',b'SrSrinivasamu',b'',b'',b'20',b'95',b'0',b'6758',b'90',b'False',b'True',b'True',b'False',b'2012-02-29 11:03:33'
"b'In photos: CAA supporters attack Muslims at Delhi protest, hurl stones and petrol bombs  https://t.co/RCbEviwF5I via @scroll_in'",b'1232007516441038848',b'Ghalib ki saheli \\U0001f339',b'dervishdancing',b'',"b'the sovereign SOCIALIST SECULAR DEMOCRATIC republic of India\\n\\nwriter, journalist, editor, performance artist'",b'896',b'387',b'4',b'4906',b'4065',b'False',b'False',b'True',b'False',b'2019-08-23 08:24:17'
"b'""Go ahead and throw stones,"" one policeman shouted to pro CAA  protesters. Muslim man and woman were beaten with ir\\u2026 https://t.co/QkK6WYx4F9'",b'1232007508564135936',b'Raghav Chopra',b'RaghavChopra_',b'',"b'News, football, #mufc ,cricket, and #photography Tweets personal RTs not endorsement. Disclaimer: I say fuck a lot. \\n\\nhttps://t.co/SfhacTNaR1'",b'4415',b'961',b'93',b'68127',b'604',b'False',b'False',b'False',b'False',b'2009-08-21 06:23:34'
b'For all those saying it was a clash between pro caa and anti caa protestors: https://t.co/JvR9X4CEns',b'1232007463018233856',b'beerpizzaman',b'beerpizzaman',b'India',b'Sports management student. Manchester United fanatic.',b'220',b'930',b'8',b'2148',b'5023',b'False',b'False',b'False',b'False',b'2012-02-21 18:18:06'
b'#DelhiBurning #DelhiViolence In the capital of worlds largest democracy mob descends upon CAA protestors . There sh\\u2026 https://t.co/tfc4SkFtud',b'1232007446098518016',b'Rakshit Lakra',b'LakraRakshit',b'New Delhi',b'\\U0001f1ee\\U0001f1f3\\u092e\\u0947\\u0930\\u093e \\u092d\\u093e\\u0930\\u0924 \\u092e\\u0939\\u093e\\u0928\\U0001f1ee\\U0001f1f3\\u0938\\u0924\\u094d\\u092f\\u092e\\u0947\\u0935\\u091c\\u092f\\u0924\\u0947\\U0001f1ee\\U0001f1f3#SocialActivism   Public Awareness',b'360',b'130',b'0',b'41',b'1',b'False',b'False',b'True',b'False',b'2019-05-03 18:38:19'
b'Uneducated pseudo-liberal mediakarmi of India.\\n\\nCAA is an act now. \\nThere can be no such thing as \\u2018Pro CAA protesto\\u2026 https://t.co/1x0SUTAKQT',b'1232007324413263872',b'DEEPAK',b'IDeepakGusain',b'INDIA',b'I am as same as you are. Digital Ad sales | Photography | Thinker.',b'70',b'155',b'5',b'520',b'48',b'False',b'False',b'False',b'False',b'2009-08-10 14:55:15'
b'One thing is pretty clear about the Pro CAA rallies. It has the administrations backing. Go to any place where thes\\u2026 https://t.co/BzsPhuVfTr',b'1232007304007933954',b'Urban Jamieson',b'prafullsaraf',"b'Surat, Mumbai, Jainagar(Bihar)'",b'.',b'492',b'1830',b'5',b'16101',b'1',b'False',b'False',b'False',b'False',b'2009-07-12 14:09:17'
b'@iamVariable Probably anti caa had disruptive plans. So they used pro caa to disburse the crowd',b'1232007302711898112',b'Slinger_Tweets',b'slinger_tweets',b'unknown',b'life goes on',b'447',b'1026',b'12',b'9708',b'825',b'False',b'False',b'False',b'False',b'2010-08-29 07:04:23'
"b'Pro CAA, or Anti.\\nLike Trump, or Not. \\nSuch violence while a head of state visits, should be equally distressing fo\\u2026 https://t.co/PjQDj7aZB3'",b'1232007151364628480',b'Abbas Lim',b'AbbasLimadiya',"b'Ahmedabad, India'","b""Don't try to understand me, If you do then you'll start loving me.""",b'3',b'117',b'0',b'18',b'146',b'False',b'True',b'True',b'False',b'2012-05-05 04:37:00'
b'@TheDeshBhakt Anti caa protestors did these riots to get international coverage.\\nPro caa protestors to get local me\\u2026 https://t.co/75QbufVIwx',b'1232007032854605835',b'Arnob Gulgulswami',b'dalal_arnob',b'',b'2014 \\u0915\\u0947 \\u092c\\u093e\\u0926 \\u092e\\u0947\\u0930\\u0940 \\u0905\\u0902\\u0924\\u0930\\u093e\\u0924\\u094d\\u092e\\u093e \\u092e\\u0930 \\u0917\\u0908 \\u0932\\u094b\\u0917 \\u092e\\u0941\\u091d\\u0947 \\u092a\\u0924\\u093e \\u0928\\u0939\\u0940\\u0902 \\u0915\\u094d\\u092f\\u094b\\u0902 BJP  \\u0915\\u093e \\u0926\\u0932\\u093e\\u0932 \\u0915\\u0939\\u0924\\u0947 \\u0939\\u0948\\u0902\\u0964 \\u0905\\u0902\\u0927\\u092d\\u0915\\u094d\\u0924 \\u092e\\u0941\\u091d\\u0947 \\u092c\\u0939\\u0941\\u0924 \\u092a\\u0938\\u0902\\u0926 \\u0915\\u0930\\u0924\\u0947 \\u0939\\u0948\\u0902\\u0964 \\n\\nMy channel #RIP_PUBLICTV',b'59',b'39',b'0',b'228',b'17',b'False',b'False',b'True',b'False',b'2020-02-21 10:08:15'
b'https://t.co/M2keQBiPnh',b'1232007014043115524',b'\\u0644\\u0642\\u0645\\u0627\\u0646 \\u0644\\u0648\\u0627',b'Lukhmanwafy',b'',b'',b'16',b'25',b'0',b'237',b'0',b'False',b'False',b'True',b'False',b'2012-05-21 11:59:04'
b'@MalikZakir64 @SanjeevSanskrit @IITKanpur @DelhiPolice @VashiMant Ohh Muslims are pro CAA now... Great to know that\\u2026 https://t.co/MFmiS8efIH',b'1232006983789580288',b'Dishank',b'Dshank_',b'',b'',b'15',b'88',b'0',b'462',b'1118',b'False',b'False',b'True',b'False',b'2018-09-02 06:02:22'
b'Problem dono side se hai Pro CAA wale side se b aur Shaheen bagh protest ke side se bhi unfortunately dono logo ke\\u2026 https://t.co/u3lVs8q17O',b'1232006945642557442',b'Nitish Bharadwaj',b'Hello_Nitish',b'Jaunpur - Chandigarh -  Delhi',b'I joined Twitter in 2010 but not much active till 2017..',b'2214',b'569',b'10',b'27230',b'40171',b'False',b'False',b'True',b'False',b'2010-08-17 14:15:09'
b'@realDonaldTrump @narendramodi Welcome https://t.co/ZtRC8iyv1y',b'1232006861592743936',b'Mir Moosa Ali',b'cracker_reborn',"b'Hyderabad, India'",b'I am not Perfect \\U0001f60a \\nHyderabadi\\n\\U0001f1ee\\U0001f1f3',b'195',b'485',b'1',b'1586',b'18320',b'False',b'False',b'False',b'False',b'2010-07-20 17:45:03'
"b'Dear senior journalists, \\n\\nCAA is already an act. \\n\\nThere can be no such thing as \\u2018Pro CAA protestors\\u2019. \\n\\nThose who\\u2026 https://t.co/4bc6GGcpGg'",b'1232006528023945219',b'Shubham Lochib',b'farziism',b'Heart Belong To Rajasthan',b'HUMAN first INDIAN  next not much into rest\\U0001f3a4\\U0001f3b8\\U0001f4d6\\U0001f4f0|\\n  \\U0001f3cc\\ufe0fVigilant Citizen and Activists|\\n      |\\U0001f3d0\\U0001f3c5National player|\\n |Shaheeda nu salam  \\U0001f64fInquilab Zindabad\\U0001f44d',b'47',b'0',b'0',b'380',b'251',b'False',b'False',b'True',b'False',b'2017-01-11 04:24:26'
b'\\u0c88\\u0cb6\\u0cbe\\u0ca8\\u0ccd\\u0caf \\u0ca6\\u0cc6\\u0cb9\\u0cb2\\u0cbf\\u0caf\\u0cb2\\u0ccd\\u0cb2\\u0cbf \\u0caa\\u0ccc\\u0cb0\\u0ca4\\u0ccd\\u0cb5 \\u0ca4\\u0cbf\\u0ca6\\u0ccd\\u0ca6\\u0cc1\\u0caa\\u0ca1\\u0cbf \\u0c95\\u0cbe\\u0caf\\u0ccd\\u0ca6\\u0cc6 \\u0caa\\u0cb0-\\u0cb5\\u0cbf\\u0cb0\\u0ccb\\u0ca7\\u0cbf \\u0cb9\\u0ccb\\u0cb0\\u0cbe\\u0c9f \\u0cb9\\u0cbf\\u0c82\\u0cb8\\u0cbe\\u0c9a\\u0cbe\\u0cb0\\u0c95\\u0ccd\\u0c95\\u0cc6 \\u0ca4\\u0cbf\\u0cb0\\u0cc1\\u0c97\\u0cbf\\u0ca6\\u0cc6. \\u0c87\\u0cac\\u0ccd\\u0cac\\u0cb0\\u0cc1 \\u0caa\\u0cca\\u0cb2\\u0cc0\\u0cb8\\u0cb0\\u0cc1 \\u0cb8\\u0cc7\\u0cb0\\u0cbf\\u0ca6\\u0c82\\u0ca4\\u0cc6 \\u0c87\\u0ca6\\u0cc1\\u0cb5\\u0cb0\\u0cc6\\u0c97\\u0cc2\\u2026 https://t.co/54apho38Ln',b'1232006415075532808',b'Oneindia Kannada',b'OneindiaKannada',b'Bangalore',"b'News Plus. Comprehensive information in Kannada #\\u0c95\\u0ca8\\u0ccd\\u0ca8\\u0ca1, \\u0c95\\u0cb0\\u0ccd\\u0ca8\\u0cbe\\u0c9f\\u0c95\\u0ca6 \\u0c86\\u0c97\\u0cc1\\u0cb9\\u0ccb\\u0c97\\u0cc1\\u0c97\\u0cb3 \\u0cae\\u0cbe\\u0cb9\\u0cbf\\u0ca4\\u0cbf, \\u0ca4\\u0cbe\\u0c9c\\u0cbe \\u0cb8\\u0cc1\\u0ca6\\u0ccd\\u0ca6\\u0cbf\\u0c97\\u0cb3\\u0ca8\\u0ccd\\u0ca8\\u0cc1 \\u0ca8\\u0cc0\\u0ca1\\u0cc1\\u0cb5 \\u0ca8\\u0c82.1 \\u0caa\\u0ccb\\u0cb0\\u0ccd\\u0c9f\\u0cb2\\u0ccd \\u0c92\\u0ca8\\u0ccd\\u0c87\\u0c82\\u0ca1\\u0cbf\\u0caf\\u0cbe \\u0c95\\u0ca8\\u0ccd\\u0ca8\\u0ca1'",b'79522',b'2913',b'577',b'191585',b'5630',b'True',b'False',b'False',b'False',b'2008-12-17 08:05:06'
b'@itsallryt @rohini_sgh Were your eyes not able to see police standing shoulder to shoulder with pro CAA. May be the\\u2026 https://t.co/0wDySEmhRG',b'1232006381949145088',b'Ovi',b'ovi_s18',"b'New Delhi, India'","b""If You're Using Half of Your Concentration To Look Normal,\\nThen You're Only Half Paying Attention Whatever Else You Do.""",b'62',b'64',b'2',b'2748',b'8955',b'False',b'False',b'False',b'False',b'2011-07-23 14:18:11'
"b'CAA/NRC demonstrators clash in Delhi ahead of Trump visit\\n""GO AHEAD and throw stones,"" one policeman told pro CAA p\\u2026 https://t.co/C5YUmS9fGC'",b'1232006373166153728',b'AHMAD FARAZ',b'h4honour',b'',b'\\u06c1\\u0645\\u06cc\\u06ba \\u0645\\u0630\\u06c1\\u0628\\u06cc \\u0641\\u0631\\u0642\\u06c1 \\u0648\\u0627\\u0631\\u06cc\\u062a \\u0686\\u06be\\u0648\\u0691 \\u06a9\\u0631 \\u0635\\u0631\\u0641 \\u0627\\u0648\\u0631 \\u0635\\u0631\\u0641 \\u0645\\u0633\\u0644\\u0645\\u0627\\u0646 \\u0627\\u0648\\u0631 \\u0645\\u0648\\u0645\\u0646 \\u0628\\u0646\\u0646\\u0627 \\u06c1\\u06d2 \\u0627\\u0633 \\u06a9\\u06d2 \\u0628\\u063a\\u06cc\\u0631 \\u0646\\u06c1 \\u06c1\\u06cc \\u06c1\\u0645 \\u0627\\u0633\\u0644\\u0627\\u0645 \\u06a9\\u0627 \\u062f\\u0641\\u0627\\u0639 \\u06a9\\u0631\\u0633\\u06a9\\u062a\\u06d2 \\u06c1\\u06cc\\u06ba \\u0646\\u06c1 \\u06c1\\u06cc \\u0627\\u0633\\u0644\\u0627\\u0645 \\u06a9\\u0648 \\u062a\\u0631\\u0642\\u06cc \\u062f\\u06d2 \\u0633\\u06a9\\u062a\\u06d2 \\u06c1\\u06cc\\u06ba\\u06d4 \\u067e\\u0627\\u06a9\\u0633\\u062a\\u0627\\u0646 \\u0630\\u0646\\u062f\\u06c1 \\u0628\\u0627\\u062f',b'70',b'60',b'0',b'634',b'79',b'False',b'False',b'True',b'False',b'2012-04-23 15:29:00'
b'\\u092b\\u093f\\u0930\\u0924\\u094b Anti CAA \\u0915\\u093e \\u092e\\u0924\\u0932\\u092c \\u0939\\u0941\\u0906 PRO \\u0907\\u0938\\u094d\\u0932\\u093e\\u092e \\u092f\\u093e PRO \\u0917\\u091c\\u0935\\u093e-\\u090f-\\u0939\\u093f\\u0902\\u0926 \\u0915\\u094d\\u092f\\u0942\\u0901\\u0915\\u093f CAA \\u0915\\u093e \\u0935\\u093f\\u0930\\u094b\\u0927 \\u092c\\u0938 \\u092f\\u0939 \\u0926\\u0947\\u0916\\u0928\\u0947 \\u0915\\u0947 \\u0932\\u093f\\u090f \\u0939\\u0948 \\u0915\\u093f \\u0906\\u092a \\u0915\\u0941\\u091b \\u0909\\u0916\\u093e\\u0921\\u093c\\u2026 https://t.co/95NICPKNYr',b'1232006347035533314',b'Ankit Pandey',b'AnkitPandeyOfc',b'Noida',b'Digital JaanKaar I Part-Time Author I Full-Time Thinker I Political Analyst I Movie Critic I Ghumakkad I Philanthropist',b'110608',b'119855',b'60',b'823',b'655',b'False',b'False',b'True',b'False',b'2018-03-09 03:50:32'
b'@NetajiBond @desimojito Anti CAA mtlb Pro Terrorist. thats period',b'1232006345517412352',b'Sumit Jha',b'sprsumit15',b'',b'',b'9',b'64',b'0',b'293',b'268',b'False',b'False',b'True',b'False',b'2015-11-06 15:13:51'
"b""@Being_Sceptic @ritz_harish @AmitShah @PMOIndia You are right... But this time it's not ghara ..... It's a samundar\\u2026 https://t.co/lTrm5C6WCu""",b'1232006292337823748',b'indian@risk',b'iphonised',b'',b'socio politico intellectual response called Hindutva...... trouble for aggressors and intruders otherwise all for love and love for all ...',b'24',b'408',b'0',b'4597',b'1876',b'False',b'False',b'True',b'False',b'2014-05-21 12:39:13'
b'Instead of bringing the situation in control delhi police escalated more by supporting pro CAA to pelt stones which\\u2026 https://t.co/XcqsGWMkCK',b'1232006262675496964',b'RAHEEM \\xaf\\\\_(\\u30c4)_/\\xaf SHAIK',b'yoloviee',"b'Hyderabad, India'",b'G\\u0280\\u1d0f\\u1d21 \\u1d1b\\u029c\\u0280\\u1d0f\\u1d1c\\u0262\\u029c \\u1d21\\u029c\\u1d00\\u1d1b \\u028f\\u1d0f\\u1d1c \\u0262\\u1d0f \\u1d1b\\u029c\\u0280\\u1d0f\\u1d1c\\u0262\\u029c \\U0001f1ee\\U0001f1f3',b'125',b'29',b'6',b'13748',b'1297',b'False',b'False',b'False',b'False',b'2013-01-03 05:53:37'
b'In photos: Hindu terrorist that support CAA law( that gives citizenship on basis of religion) in India attack Musli\\u2026 https://t.co/AhKE9sHGnM',b'1232006243042185219',b'((((( Freedom )))))',b'Freedom4Jan',b'Earth ',b'RTs =/= views | Global Health | Passionate Humanitarian | Works for Humanity | Seeks Freedom | Explorer by Heart',b'247',b'1104',b'5',b'7192',b'5660',b'False',b'False',b'False',b'False',b'2010-08-27 06:44:24'
b'somebody plz tell me what is a pro #CAA protestors are. how do u exactly protect in favour of some bill that has be\\u2026 https://t.co/DZGk6urOT6',b'1232006221550510080',b'Kashif Ahsan',b'KashifAhsan15',b'',b'my life is in mah hand & there is space for more.\\nEngg. (like most of the indian\\U0001f92b).\\nFoodie\\U0001f35c',b'68',b'180',b'0',b'560',b'951',b'False',b'False',b'True',b'False',b'2020-01-04 04:36:55'
