b'@Pushpendrakuls0 Kejriwal ke muslim mla',b'1232226918965153792',b'Sudhir Jain',b'sj41151',"b'Dwarka, New Delhi'",b'Retired Inspector of Police in Transport Department Delhi Govt basically delhite  Like Modi and yogi',b'23',b'70',b'0',b'54',b'145',b'False',b'False',b'True',b'False',b'2014-06-03 15:32:47'
b'@Hafsey_1028 @HaroonTheGooner Root cause of the problem = misogynist entitlement\\n\\nThere is a reason why women  who\\u2026 https://t.co/f4pxPBE1WB',b'1232226918004666369',b'\\ua9c1\\u0f12\\u262c S\\u043d\\u0430dy [exam mode]',b'4shade17',b'Sri Lanka',"b'23 | Hard work, perseverance, intelligence, kindness, mercy, love are some of my favorite things  \\U0001f30c \\U0001f495 \\n\\n#INTJ #YNWA #lka \\U0001f1f1\\U0001f1f0'",b'1277',b'865',b'28',b'81101',b'70641',b'False',b'False',b'False',b'False',b'2012-12-25 05:44:04'
"b'With all that\\u2019s wrong in this country, apparent \\u2018sane\\u2019, grown up people are frothing at the mouth about\\u2026 https://t.co/msQ82FsxAe'",b'1232226916255649793',b'June',b'June24232123',"b'England, United Kingdom'",b'',b'48',b'64',b'0',b'190',b'509',b'False',b'False',b'True',b'False',b'2019-12-23 06:49:34'
"b""@sensumitmca @Parv05 @AdityaRajKaul Hindu Muslim agenda aur kya. Polarization. You're the naive one. Majority of th\\u2026 https://t.co/OSv79Heqrn""",b'1232226914858700801',b'southindian niqqa',b'pysgowindRagh1',"b'Kalyan Dombivali, India'",b'I am an indian and I am a Bakchodh',b'49',b'115',b'0',b'920',b'18084',b'False',b'False',b'False',b'False',b'2013-11-09 15:52:24'
"b'Kepada umat Islam galak, ketika muslim trus dihinakan hukum jadi tumpul\\n &gt;&gt; #SaveAdvokatPejuang &lt;&lt;\\u2026 https://t.co/IaC0Pt9MDg'",b'1232226913025814534',b'Abu Azzam',b'AbuAzzam1924',b'',b'Allah',b'20',b'69',b'0',b'32',b'8',b'False',b'False',b'True',b'False',b'2019-04-20 15:25:49'
"b""@MundaKoshur's account has been withheld in India in response to a legal demand. Learn more.""",b'1232226910375219200',b'',b'MundaKoshur',b'',"b""@MundaKoshur's account has been withheld in India in response to a legal demand. Learn more.""",b'247',b'459',b'0',b'7243',b'3349',b'False',b'False',b'True',b'False',b'2019-02-26 06:13:04'
b'@bhensaa Your news is fake. In India its the other way around. Muslim mobs are killing and rioting. Other communiti\\u2026 https://t.co/36Km7zS7eX',b'1232226910366654464',b'manoj',b'manoj_arora07',b'',b'',b'14',b'84',b'0',b'283',b'384',b'False',b'False',b'False',b'False',b'2012-05-26 11:13:04'
b'@AMISHDEVGAN Muslim bolne me sharm aata hai',b'1232226908093517824',b'GOVIND KUMAR',b'GOVINDK29967933',"b'Gujarat, India'",b'Trailer driver',b'37',b'264',b'0',b'164',b'2011',b'False',b'False',b'True',b'False',b'2019-02-07 14:14:19'
"b'Saudi Arabia is the best country, MBS is a true Muslim leader. Shaykh Rabea Al Madkhali is a legend. https://t.co/ruiim2tURl'",b'1232226907963392000',b'A \\U0001f1e8\\U0001f1e6',b'as__416',"b'Florida, USA'",b'\\U0001f608',b'454',b'1413',b'0',b'5035',b'3472',b'False',b'False',b'True',b'False',b'2019-07-11 15:51:01'
"b'""I Am Hijabi, Muslim, Black..."": Rep. Ilhan Omar Posts List Describing Herself to Troll Conservatives; Rival Candid\\u2026 https://t.co/EmEeWBvLDC'",b'1232226904096288768',b'Barbara',b'623Sis',b'',"b'Conservative, Christian, husband is (Viet Nam vet) & retired peace officer.  #MAGA #Trump #KAG'",b'16011',b'16677',b'168',b'213127',b'5904',b'False',b'False',b'False',b'False',b'2010-03-18 05:12:07'
b'A @Reuters picture of a Muslim human being brutally beaten up by fellow humans in Delhi today. Those who feel they\\u2026 https://t.co/ZKKIsfP0ky',b'1232226900048633857',b'Asim Raza',b'AsimRaz085',"b'Seoul, Republic of Korea'",b'#Student\\n#KoreaSouth\\n#Pakistan\\n#History',b'79',b'244',b'1',b'2321',b'10282',b'False',b'False',b'True',b'False',b'2018-09-08 11:30:25'
"b'Hukum sudah terbukti sangat tajam hanya kepada muslim dan yg kritis pd rezum. Sementara pada koruptor dan penista,\\u2026 https://t.co/9yuv5hWIm1'",b'1232226896517029893',b'Parma Zee',b'zee_4869',b'Indonesia',b'Twitter suspended my old acc. Rambling about whatever. Balancing between what I want & what I should. E La Vita',b'115',b'107',b'0',b'4562',b'10960',b'False',b'False',b'False',b'False',b'2018-10-03 04:14:18'
b'Good news: Muslim man to head Lingayat mutt in Karnataka https://t.co/Zsms7qEGsy via @indiatoday',b'1232226889143586816',b'Vinod Patil',b'VinodPa74741630',b'',b'be yourself',b'7',b'35',b'0',b'13',b'5',b'False',b'False',b'True',b'False',b'2019-05-09 07:21:48'
b'@RanaAyyub The man in this photo is a Muslim and his name is SHAHRUKH KHAN. They are unfit for this human society.\\u2026 https://t.co/tXfvNZO3CG',b'1232226889047171072',b'\\u0930\\u093e\\u0915\\u0947\\u0936 Rakesh',b'rakeshKharta',"b'Subtropics, \\u092d\\u093e\\u0930\\u0924 '",b'A responsible citizen \\U0001f1ee\\U0001f1f3',b'182',b'1263',b'5',b'15737',b'14177',b'False',b'False',b'False',b'False',b'2011-12-09 14:17:16'
"b'Gelombang persatuan umat Islam mereka sadari adalah nyata, maka setiap muslim yg vocal trhdp kedzaliman penguasa, s\\u2026 https://t.co/ytotFB7Suu'",b'1232226883611348993',b'BakulGamis',b'BakulGamis',b'',b'',b'80',b'362',b'0',b'2504',b'250',b'False',b'False',b'True',b'False',b'2019-04-16 17:30:04'
b'@indian_ronin Tere language dekh ke pata chalta hai tera bhagwan jo bhi hai wo tujhe narak se nahi bacha payega. Ja\\u2026 https://t.co/DsmTjd0PcT',b'1232226872584556544',b'Mahinsrk2',b'mahinsrk2',b'',b'',b'7',b'51',b'0',b'267',b'223',b'False',b'False',b'True',b'False',b'2018-06-13 19:41:27'
b'@ABPNews @DelhiPolice @KapilMishra_IND Intellectuals has opened or started saying for muslim boy named shahrukh has\\u2026 https://t.co/GRMU8IhjAt',b'1232226866209021952',b'Sai',b'Sai35417811',b'',"b'Never believe anyone blindly, may be he or she is not innocent'",b'2',b'21',b'0',b'689',b'168',b'False',b'False',b'True',b'False',b'2019-11-02 18:48:27'
b'@TajinderBagga @KapilMishra_IND 1984 me muslimo ne sikho ke hatya nhe ke h baagi ji... So we support muslim',b'1232226848639193088',b'Manjeet Singh Saini',b'ArroraSingh',b'',b'',b'2',b'47',b'0',b'338',b'160',b'False',b'False',b'True',b'False',b'2019-08-13 16:20:46'
"b'Distress call 4m colleagues of both side in #DelhiViolence affected area - ""Guys sb se request he ki social media p\\u2026 https://t.co/s2mmezjf2s'",b'1232226845665480704',b'Sachin Tiwary',b'SachinTiwary',b'New Delhi',b'',b'23',b'29',b'0',b'653',b'30',b'False',b'False',b'True',b'False',b'2011-01-16 17:29:38'
"b'What happened in Delhi on 24 Feb, is not protest against CAA, it\\u2019s #IslamicJehad and part #GHAZWAeHIND by Muslim wh\\u2026 https://t.co/rWJSPQYgP9'",b'1232226841756221445',b'Shailendra Upadhyay \\U0001f1ee\\U0001f1f3',b'uchandan16',"b'Noida, India'","b'\\u090f\\u0915 \\u0915\\u091f\\u094d\\u091f\\u0930 \\u0939\\u093f\\u0902\\u0926\\u0941\\u0938\\u094d\\u0924\\u093e\\u0928\\u0940 \\u0939\\u0942\\u0901 \\u092f\\u0939\\u0940 \\u092e\\u0947\\u0902\\u0930\\u0940 \\u092a\\u0939\\u091a\\u093e\\u0928 \\u0939\\u0948\\u0964\\u0964 \\u0935\\u0902\\u0926\\u0947 \\u092e\\u093e\\u0924\\u0930\\u092e , \\u092d\\u093e\\u0930\\u0924 \\u092e\\u093e\\u0924\\u093e \\u0915\\u0940 \\u091c\\u092f \\u0964\\u0964 \\u0928\\u092e\\u0938\\u094d\\u0924\\u0947 \\u0938\\u0926\\u093e \\u0935\\u0924\\u094d\\u0938\\u0932\\u0947 \\u092e\\u093e\\u0924\\u0943\\u092d\\u0942\\u092e\\u0947 \\u0964\\u0964'",b'271',b'137',b'0',b'18094',b'16742',b'False',b'False',b'True',b'False',b'2015-10-13 17:29:33'
b'https://t.co/WY29fI1sFB',b'1232226836979109888',b'UKOAP',b'UKOAP',b'Brigadoon - aka Govanhill',"b'I vow 2 thee my country.PC is killing UK culture and tradition.I abhor SNP, Muslim/Islam,EU,Halal,sexual deviants,LGBT groomers.United we stand,divided we fall.'",b'2014',b'2014',b'7',b'38025',b'19772',b'False',b'False',b'True',b'False',b'2009-08-30 19:16:06'
"b'A Muslim woman talks about ghettoisation, her experience of why it happens. The response is a nameless account aski\\u2026 https://t.co/9J7bRhnsGT'",b'1232226833417981952',b'NVM',b'rateUnrate',b'Earth',"b'Curious misanthrope, anti-MRA feminist, irrationally optimistic. Founder of an underground Lenny Kravitz face appreciation society. Look Left \\U0001f481\\U0001f3fb\\u200d\\u2640\\ufe0f She/her'",b'169',b'1016',b'4',b'3827',b'8829',b'False',b'False',b'True',b'False',b'2016-09-13 09:44:34'
b'#BJP #MusicBankinDubai #Muslims #islam #DonaldTrump #SaudiArabia  yeaster day 24feb 2020 RSS killing Muslim in Indi\\u2026 https://t.co/qz6fBqXtgy',b'1232226829915828224',b'TheTruthForMankind',b'Truth_4_Mankind',b'',b'',b'25',b'562',b'1',b'153',b'11',b'False',b'False',b'True',b'False',b'2012-01-08 11:47:27'
b'It is not about a Hindu or a Muslim.\\n\\nNo religion in the world preaches its followers to kill innocent people.\\n\\nA p\\u2026 https://t.co/qChDgvUDP5',b'1232226829207003136',b'The sensible Indian (\\u091c\\u093c\\u0930\\u093e \\u0939\\u091f \\u0915\\u0947)',b'Direct_Dil_se_',"b'Pune, India'","b'A Human Being first.\\nThan, a Thinker, Writer and Poet in English, Hindi and Gujarati languages.\\nSpecialising in Philosophy.\\U0001f64f'",b'52',b'15',b'0',b'1967',b'49',b'False',b'False',b'True',b'False',b'2012-02-15 13:55:38'
b'Kebenaran akan menang !! tolak kriminalisasi pada advokat Muslim Pembela Umat\\n &gt;&gt; #SaveAdvokatPejuang &lt;&lt;\\u2026 https://t.co/HC5rc4bTbn',b'1232226827025838081',b'Ratnaningsih21',b'Ratnaningsih211',b'',b'Ummu Malika kautsar ilmi',b'105',b'184',b'0',b'1092',b'576',b'False',b'False',b'True',b'False',b'2019-10-04 03:00:02'
b'@ReallySwara @DelhiPolice Ye bhi dekh lo #Andhbhakto https://t.co/PuaRugKU6C\\nGobar bhakt na dekhe please \\U0001f525\\U0001f64f',b'1232226823678726145',b'@Prince_Shaikh_Parvez',b'Im_A_Muslim__',"b'Ahmadabad City, India'",b'#broken_writer\\n#WWE\\n#FanOf @JohnCena \\U0001f4af\\U0001f451\\n#Marvel \\n#PostGraduate \\U0001f393 \\n#Alhamdulillah_For_Everything \\n#Proud_To_be_Muslim',b'128',b'162',b'0',b'3555',b'3148',b'False',b'False',b'True',b'False',b'2017-10-21 07:36:40'
"b'@EnigmaRuthless A lot of Muslim\\u2019s spiritual compositions are incorporated in the Guru Granth Sahib, such as the fam\\u2026 https://t.co/DhxycMN5ZM'",b'1232226813927051264',b'koena Mitra Army',b'KoenaMitraWorld',b'',b'This is a fan account for one of my fave celebs! She is strong and unbreakable!',b'1519',b'838',b'0',b'9103',b'15138',b'False',b'False',b'True',b'False',b'2018-01-24 18:37:28'
b'@KhonsaRini @FikrulIslam_ @AbaheAyman @ik4mawar3 @beylaspriana1 @rajawalimataram @petirman15 Jangan hanya karna akt\\u2026 https://t.co/EdCeQXyt3n',b'1232226809757913088',b'Abu Azzam',b'AbuAzzam1924',b'',b'Allah',b'20',b'69',b'0',b'32',b'8',b'False',b'False',b'True',b'False',b'2019-04-20 15:25:49'
b'@kavita_krishnan @cpimlliberation Clearly 99% of Indians rural poor non muslim is not in this March !',b'1232226807627337729',b'I am secular*',b'ODonSecularism',"b'Islamabad, Bharath'",b'Following an account is not an endorsement of that account. I follow all accounts (including those of #Hinduphobes)\\nRetweets are endorsements of that tweet only',b'29',b'475',b'0',b'1087',b'584',b'False',b'False',b'True',b'False',b'2020-01-01 23:20:40'
"b'Kenapa umat Muslim terus yg didzolimi? Apa karna umat muslim perilakunya jujur, adil, menegakkan kebenaran dan memb\\u2026 https://t.co/ILR8thJSat'",b'1232226801369247745',b'Ummu Rahman',b'UmmuRahman4',b'',b'Pustaka_Rahman',b'47',b'44',b'0',b'2427',b'11',b'False',b'False',b'True',b'False',b'2019-04-09 22:41:32'
b'Tuse bra India me Muslim ka dushman nhi koi ..\\n\\nBegerat dhaley https://t.co/HIKIzL0XQf',b'1232226794230685696',b'Alvina Fashion',b'FStodeo',"b'Punjab, Pakistan'",b'Fashion',b'80',b'512',b'0',b'1429',b'1396',b'False',b'False',b'True',b'False',b'2019-10-13 12:38:46'
"b'@Gadgetku5 Kepada umat Islam galak, ketika muslim trus dihinakan hukum jadi tumpul\\n &gt;&gt; #SaveAdvokatPejuang &lt;&lt;\\u2026 https://t.co/wRTS0YB8Gu'",b'1232226787595145219',b'Dini Nurfitriani',b'DiniNurfitria18',b'',b'Bahagia secukupnya | Sedih secukupnya | Bersyukur sebanyak-banyaknya',b'85',b'169',b'0',b'1196',b'163',b'False',b'False',b'True',b'False',b'2019-04-18 06:37:35'
"b""@BabuSaheb90 @DelhiPolice Taking pants off to check whether they're muslim or hindu and harshly beating them.""",b'1232226782692159490',b'Optimistic',b'Roflkhanh',b'india',b'Social Activist',b'172',b'214',b'0',b'21639',b'62170',b'False',b'False',b'True',b'False',b'2011-04-29 13:43:56'
"b'Kepada umat Islam galak, ketika muslim trus dihinakan hukum jadi tumpul\\n &gt;&gt; #SaveAdvokatPejuang &lt;&lt;\\u2026 https://t.co/6abd1dOlAq'",b'1232226777642090496',b'Yuni Kaisa',b'YuniKaisa',"b'Jawa Barat, Indonesia'","b'Pada akhirnya hasil dari kesabaran akan berbuah manis,begitupun sabar dalam meniti jalan dakwah\\U0001f33b'",b'43',b'81',b'0',b'71',b'73',b'False',b'False',b'True',b'False',b'2019-05-22 22:30:51'
"b'Sesama muslim adalah saudara, jika ada masalah maka beri dukungan agar tidak ada yang terdzolimi.\\n &gt;&gt;\\u2026 https://t.co/cPUlXOntTt'",b'1232226770956378112',b'toko_tq',b'TokoTq',b'',b'Jual yang halal dan thoyyib \\U0001f923',b'0',b'5',b'0',b'246',b'0',b'False',b'False',b'True',b'False',b'2019-09-03 14:42:37'
b'@Mansur803 @Muji_TabloidMU @Karima79830989 Jangan hanya karna aktifis muslim yang kritis hukim diarahkan kepadanya\\u2026 https://t.co/pJDlULWUKv',b'1232226756918050816',b'Si Idealis \\u261d',b'pejuangidealism',b'',"b'Hakikat manusia cendrung pada kebenaran, sampaikanlah islam karna sesunungguhnya islam adalah kebenaran.'",b'45',b'52',b'0',b'353',b'441',b'False',b'False',b'True',b'False',b'2019-08-24 08:37:45'
b'@HaniKhanPk Toh kya bc pure porkistan aur bangladesh mae suuar\\U0001f416\\U0001f416 ( muslim) ko citizenship dae daen\\U0001f602\\U0001f602 tum kaam karo\\u2026 https://t.co/tZbFPpZGLR',b'1232226743727030272',b'Harsh Shukla',b'harsh___shukla',"b'Lucknow, India'",b'',b'20',b'45',b'0',b'310',b'1404',b'False',b'False',b'True',b'False',b'2015-05-09 08:29:31'
"b""India has changed - if not forever - for a very long time. Read this friends. #CAAProtest\\n#CAA_NRCProtests\\n'Are you\\u2026 https://t.co/ZE3u2wcWjI""",b'1232226737116807173',b'Sajjan Singh Thakur',b'sthakurtweets',b'New Delhi',"b'Assistant editor, Times Internet, the digital arm of TOI. Views personal. Democracy, liberty and healthy debate complement each other.'",b'300',b'1010',b'19',b'18370',b'17785',b'False',b'False',b'False',b'False',b'2011-09-06 19:24:35'
"b""'Hindu and Muslim, we are all one' \\nAll one community, brothers and sisters.\\n\\n#DelhiBurning https://t.co/t4grFzIIT1""",b'1232226726278725632',b'Sofia Amina',b'SofiaAmina198',"b'England, United Kingdom'","b'Lancashire born and bred. Writer. Editor \\u0ae7\\u0ae6:\\u0ae7\\u0ae6 Press/@1010press.\\n1% \\u091c\\u094b\\u0936, 99% fumbling. \\U0001f1ec\\U0001f1e7\\U0001f1ee\\U0001f1f3\\U0001f1ea\\U0001f1fa'",b'274',b'261',b'3',b'2113',b'11901',b'False',b'False',b'False',b'False',b'2014-06-25 13:13:39'
b'@Javedakhtarjadu You have now shed your mask of pseudo liberal Muslim and have shown the real self of a die hard orthodox Muslim fanatic.',b'1232226723976138752',b'Pravin',b'UvachVichar',b'',b'',b'135',b'470',b'3',b'5505',b'348',b'False',b'False',b'True',b'False',b'2012-01-01 06:44:17'
b'Sampai kapan ketidakadilan pada Muslim berlangsung? Apakah menunggu ajal menjemput hai orang dzalim\\n &gt;&gt;\\u2026 https://t.co/0L7YQYVAcq',b'1232226718003253248',b'Abu_ishar',b'abu_ishar',b'',"b'Afwan, my account has been suspended'",b'185',b'203',b'0',b'1517',b'169',b'False',b'False',b'True',b'False',b'2019-11-18 11:40:09'
"b'@alghifariah Selama ini, kenapa penegakan hukum hanya berlaku kepada kaum Muslim yang justru vokal menyuarakan kead\\u2026 https://t.co/kxsQjYjwP1'",b'1232226711854432257',b'Sriono',b'Sriono19621194',b'',b'waktunya pembebasan',b'55',b'202',b'0',b'1408',b'749',b'False',b'False',b'True',b'False',b'2019-08-16 14:28:05'
"b'Saya muslim, saya bersama LBH Pelita Umat melibas ketidak adilan\\n &gt;&gt; #SaveAdvokatPejuang &lt;&lt;\\n #HukumTajamKeMuslim .\\u2026 https://t.co/FECM9Rrfc1'",b'1232226706108190720',b'Hefrida Ruslan',b'hefridaroeslan',"b'Parepare, SulSel'",b'Hidup itu bersyukur... | WA : 0853 9585 7852',b'51',b'90',b'0',b'750',b'16',b'False',b'False',b'False',b'False',b'2012-07-10 06:09:31'
b'@Fahruro86 Negeri muslim berisi penguasa munafik.\\n &gt;&gt; #SaveAdvokatPejuang &lt;&lt;\\n #TolakKriminalisasiKhozinudin .\\u2026 https://t.co/A7rrd59m6e',b'1232226704032026625',b'Dieya',b'AZahiduddin',b'Indonesia',b'',b'209',b'345',b'0',b'3257',b'973',b'False',b'False',b'True',b'False',b'2019-05-03 14:24:02'
b'LBH PU yg selama ini gigih membela kepentingan Islam &amp; kaum Muslim tengah alami kriminalisasi. Kami bersama LBH PU\\u2026 https://t.co/09v9KoYz8W',b'1232226703688122368',b'fauziah',b'myname_fauziah',"b'Malang, Jawa Timur'",b'Haarisan Aminaan Lil Islam \\n\\nEnjoy your life with Islam.. \\nAllah always listening and understanding',b'108',b'118',b'0',b'535',b'761',b'False',b'False',b'False',b'False',b'2019-02-16 15:17:46'
"b'Saya menolak segala bentuk kriminalisasi kepada saudara muslim, tak terkecuali pada Ahmad Khazinudin ketua LBH Peli\\u2026 https://t.co/WV9XUGoAQC'",b'1232226701330878464',b'Ummu NNN',b'UNashhah',b'',b'',b'36',b'46',b'0',b'615',b'1',b'False',b'False',b'True',b'False',b'2020-01-15 09:20:28'
b'Kami Bersamanya lebih dari seorang muslim sebab LBHPU setia membela agama dan para ulama.\\n &gt;&gt; #SaveAdvokatPejuang &lt;\\u2026 https://t.co/vsI4m0qFT9',b'1232226699640655873',b'Rurun Rumi',b'rurunrumi1',b'Malang-Sampang ',b'Khilafah Ajaran Islam.\\n.\\nPemilik akun ini masih fakir Ilmu',b'88',b'92',b'0',b'842',b'456',b'False',b'False',b'True',b'False',b'2018-12-16 13:06:41'
b'This is the #Godhra of North India you both are doing in Delhi...\\n.@narendramodi .@AmitShah .@PMOIndia .@HMOIndia\\u2026 https://t.co/XFBR3bobIA',b'1232226698491379713',b'313-Battle of Badr',b'The_Wa_Na',b'Vantage Point',b'The hottest places in Hell are reserved for those who in time of moral crisis preserve their neutrality. ~ Dante\\n              ...\\n@The_Wa_Na@Mastodon.social',b'718',b'970',b'21',b'40427',b'3964',b'False',b'False',b'False',b'False',b'2014-06-09 18:12:48'
b'Negeri muslim berisi penguasa munafik.\\n &gt;&gt; #SaveAdvokatPejuang &lt;&lt;\\n #TolakKriminalisasiKhozinudin . #LBHPelitaUmat\\n#BQK3\\n\\n@AbuAzza93186383',b'1232226694137696257',b'Ahmada Kamalia',b'Ukhtii_Lia',b'',b'berusaha | berdoa | berjuang | dakwah remaja | mahasiswi  | ekonomi syariah | stis sbi surabaya',b'174',b'170',b'0',b'2192',b'68',b'False',b'False',b'False',b'False',b'2013-07-02 05:04:26'
b'@ShekharGupta Toffee le lo. Media is co-accused. You don\\u2019t get any points for reporting the event for which you are\\u2026 https://t.co/BAitCgaQgh',b'1232226685388390403',b'cycling enthusiast',b'bullishness_',"b'New Delhi, India'",b'#Justice #Liberty #Equality #Secularism. Retweets are not endorsements. Likes = bookmarks',b'175',b'285',b'2',b'11727',b'3922',b'False',b'False',b'False',b'False',b'2011-08-21 10:13:38'
"b'@DCSSN @SethShruti that u need to tell Mr. Modi\\n\\nThat he wants to achieve\\n\\nwhy 25 crores Muslim only , there are Hi\\u2026 https://t.co/5nAImt8hEr'",b'1232226678035898368',b'fayzan',b'faizkhd',b'',b'',b'39',b'511',b'1',b'7186',b'279',b'False',b'True',b'True',b'False',b'2015-02-06 18:22:02'
b'Kebenaran akan menang !! tolak kriminalisasi pada advokat Muslim Pembela Umat\\n &gt;&gt; #SaveAdvokatPejuang &lt;&lt;\\u2026 https://t.co/Jz23RKWRPf',b'1232226677150953472',b'Aisyah Nur Rohmah',b'AisyahNurRohm14',b'',b'',b'34',b'95',b'1',b'620',b'43',b'False',b'False',b'True',b'False',b'2019-12-10 21:10:56'
"b'@Mahimnaa @GoneLiberal @Vaishna27305961 @MumbaiPolice @narendramodi People who want to know listen, you speak for y\\u2026 https://t.co/BnzoAMltDy'",b'1232226676081229824',b'Ayub Dawood',b'AyubDawood9',b'',"b""Previous account suspended because Twitter employees can't understand grammar. Far left, anti-state, better an anti-national than inhuman.""",b'13',b'59',b'0',b'476',b'8',b'False',b'False',b'True',b'False',b'2020-01-30 05:40:23'
"b'Gelombang persatuan umat Islam mereka sadari adalah nyata, maka setiap muslim yg vocal trhdp kedzaliman penguasa, s\\u2026 https://t.co/MCdvjntvec'",b'1232226673782857728',b'risalahperadaban',b'wironotonegoro',"b'Yogyakarta, Indonesia'",b'sang pembelajar \\U0001f4d6',b'86',b'214',b'0',b'591',b'528',b'False',b'False',b'True',b'False',b'2019-09-27 14:13:19'
b'#Gujarat2002  in #Delhi2020 \\nPolice as usual on \\nWrong Side its not a clash its a Anti Muslim burtal Attack. https://t.co/VblUppyz9I',b'1232226638156333056',b'haroon',b'hvision_2020',b'INDIA',b'\\U0001f30f\\nSTAY CONNECT WITH ME\\nMy Citiznshp  THE INTERNATIONALIST',b'137',b'741',b'2',b'936',b'28416',b'False',b'False',b'False',b'False',b'2009-12-18 21:13:02'
b'Umat Islam harus waspada terhadap  upaya kriminalisasi terhadap Muslim yang kritis dan vokal \\n &gt;&gt;\\u2026 https://t.co/Z9WoenbWc3',b'1232226631688675328',b'Nidahlan',b'nidahlan',b'',b'hamba yang lemah',b'7',b'5',b'0',b'322',b'12',b'False',b'False',b'True',b'False',b'2019-04-18 13:05:43'
"b'@tedcruz A little odd that you saying ""I\'m a Christian first, American second."" is ok but not ""I\'m a muslim first,\\u2026 https://t.co/JmmkwCRfiQ'",b'1232226619022073856',"b""Donald Trump's Mom \\u2744""",b'DonaldTrumpsMo1',"b'Bowling Green, OH'",b'Lord knows I did my very best with that malignant sack of orange puss I spawned.',b'367',b'221',b'2',b'1710',b'3437',b'False',b'False',b'True',b'False',b'2018-10-31 09:44:37'
b'@Nehr_who We thought that after Ram mandir Judgement govt and media will stop this hindu muslim propaganda but thie\\u2026 https://t.co/hRZxbrPFnv',b'1232226618321645573',b'indian\\U0001f1ee\\U0001f1f3',b'lovendtv',b'',b'be yourself',b'4',b'24',b'0',b'846',b'2123',b'False',b'True',b'True',b'False',b'2019-03-13 19:07:06'
b'Chronology ....\\n1. Announce elections\\n2. Build narrative around polls as Hindu-Muslim \\n3. Lose elections\\n4. Provoke\\u2026 https://t.co/FCpF5uBaY8',b'1232226614085218304',b'CAA/NPR/NRC \\U0001f519',b'appaism',b'',"b'A Nation means People, not division of People.'",b'104',b'248',b'1',b'11053',b'9835',b'False',b'False',b'False',b'False',b'2012-02-11 15:44:14'
"b'@tameemcollecti3 Like I said there\\u2019s no where in my tweet where I made reference of a Hadith, neither did I indicat\\u2026 https://t.co/LQRQSTMw2o'",b'1232226606455889922',b'Aisa\\U0001f338',b'aiishadahir',b'',b'|Advices to myself which you may relate| \\u201cIslamicmotivation\\u201d |\\U0001f4da\\U0001f30e|',b'33280',b'130',b'15',b'8342',b'177751',b'False',b'False',b'True',b'False',b'2019-01-12 16:48:42'
b'Kurang greget semestinya muslim pejuang\\n &gt;&gt; #SaveAdvokatPejuang &lt;&lt;\\n #HukumTajamKeMuslim . #KamiBersamaLBHPU\\n#B5AF\\n\\n@AlQadar6',b'1232226603553320961',b'Abu_ishar',b'abu_ishar',b'',"b'Afwan, my account has been suspended'",b'185',b'203',b'0',b'1517',b'169',b'False',b'False',b'True',b'False',b'2019-11-18 11:40:09'
"b""If Course! No matter how hard people  try but in the #Muslim vs #Nation War only Nation will win\\nThey'll(muslim) de\\u2026 https://t.co/iHoEujhyG4""",b'1232226598142840832',b'Peeyush Agnihotri',b'PeeyushAgnihot1',"b'Tum Jahan, Mai Wahan'","b'Bio\\U0001f644\\nAchhi nhi lagti thi, Isliye Maths le li\\u263a'",b'3',b'18',b'0',b'143',b'911',b'False',b'False',b'False',b'False',b'2015-06-18 02:57:17'
"b'@ZunaidJunaidi Umat muslim selalu di kanan, kiri, depan dan belakang bersama ketua LBH Pelita Umat\\n &gt;&gt;\\u2026 https://t.co/R7ujGNMFFk'",b'1232226595856760833',b'Margarini Saka W.S.',b'margarinisakaws',b'',b'',b'120',b'125',b'0',b'1391',b'37',b'False',b'False',b'True',b'False',b'2016-07-28 13:37:11'
"b'@taufikpramono11 Berulang kali kita saksikan, bagaimana penegakan hukum di negara mayoritas Muslim ini hanya menyas\\u2026 https://t.co/siZOsZtn30'",b'1232226592883003392',b'Lae',b'Lae64419626',b'',b'Pejuang islam',b'4',b'6',b'0',b'1411',b'15',b'False',b'True',b'True',b'False',b'2019-12-13 08:29:35'
b'The number of people killed in clashes &amp; violent incidents between protesters and supporters of the law has risen t\\u2026 https://t.co/Joy1yZ6uPM',b'1232226582661672963',b'Eng Ahmed\\U0001f1f8\\U0001f1e6',b'MAhmed73263003',b'\\u0628\\u062d\\u0631\\u064a\\u0646 ',b'Project Engineer #PakistanFirst Love Politics #Islam #Kashmir #Gaza #PakArmy #Aquarius #PSL5 #IU',b'684',b'177',b'0',b'8774',b'40544',b'False',b'False',b'True',b'False',b'2019-07-10 14:08:34'
"b""Those who don't have an idea how #KashmiriPandits were forced to leave their homes after severe tyranny of their Mu\\u2026 https://t.co/84KWBaPtuy""",b'1232226581806026752',b'Rudra Kr Thakur \\U0001f1ee\\U0001f1f3',b'rudrakumathakur',"b'Naihati, West Bengal'","b""I'm looking for my-self...""",b'401',b'1186',b'7',b'24657',b'53404',b'False',b'False',b'False',b'False',b'2010-04-06 19:56:12'
"b""@BeenHuman1 @bekaradmi007 @anuragkashyap72 I don't think you realize that #God doesn't exist either.. if he did.. h\\u2026 https://t.co/osp6kvAQQL""",b'1232226578786127874',b'Rohan \\xdfardeskar',b'RohanBardeskar',b'Kolhapur',"b""imp note:- please don't follow me, i am of no use for you!""",b'305',b'136',b'2',b'15430',b'519',b'False',b'False',b'False',b'False',b'2011-12-22 05:27:50'
b'Muslim properties are being torched by RSS terrorists in Delhi. They are killing people but as usual Modi is enjoyi\\u2026 https://t.co/4VTeP3BXTg',b'1232226573279014912',b'Nisar',b'NisarAkbar13',"b'Karachi, Sindh '",b'Human|Muslim|Pakistani|Sindhi|',b'52',b'258',b'1',b'1005',b'1904',b'False',b'False',b'True',b'False',b'2018-06-27 18:36:38'
b'@Real_Anuj Sala chutiya...dinbhar hindu Muslim karta h',b'1232226570539913217',b'zzzzzz',b'BharatB44825257',b'India',b'no comments',b'212',b'1106',b'0',b'3111',b'6001',b'False',b'False',b'True',b'False',b'2019-05-16 00:48:12'
