b'@Kritika_Kamra madam reality is indian muslim has no harm with CAA they are just opposing that how indian govt give\\u2026 https://t.co/nA3Q5vatPQ',b'1232146170232918016',b'ManushiChillarFan',b'ManushiChillar2',b'India',b'Miss world 2017 fan page',b'1122',b'44',b'0',b'637',b'43',b'False',b'False',b'True',b'False',b'2017-11-18 18:44:01'
b'Pic no.5\\nHelp to Catch these 4 Terrorists also.\\n#ShahMustResign #AmitShahResign #DelhiRiots #DelhiViolence\\u2026 https://t.co/gJ9NkexTv8',b'1232146164029513730',b'Eye Opener',b'amilxyz',b'Mumbai',b'Concern for Country. Hates Fake News. Respects Human Rights. \\nI follow nobody.',b'30',b'0',b'0',b'743',b'121',b'False',b'False',b'False',b'False',b'2017-08-09 05:15:42'
b'@pu_pu_putainzbi @bahjinane T pas un muslim toi sal zemel',b'1232146152679714817',b'Adel',b'darbeanc',b'Niger',b'',b'97',b'832',b'0',b'891',b'812',b'False',b'False',b'True',b'False',b'2015-10-16 20:04:39'
b'Every Muslim girl\\u2019s wish is a dua to lose weight\\U0001f62d',b'1232146128851746817',b'BREEZY ABBAS\\U0001f1e7\\U0001f1f7\\U0001f1f5\\U0001f1f8',b'AbbasBrzy',b'',"b""November's Very Own\\U0001f64f. RushGang. \\nPhoenix Arizona . Pali born #teambreezy""",b'77',b'189',b'0',b'645',b'736',b'False',b'False',b'True',b'False',b'2018-10-19 16:56:28'
"b'@srivatsayb @ArvindKejriwal All tweets from the BJP IT cel ,has no business other than to fuel the fire\\nkapil Mishr\\u2026 https://t.co/WEm1YjWyEm'",b'1232146101177856001',b'Bharataraju',b'krbharataraju',b'',b'',b'22',b'38',b'0',b'4386',b'2605',b'False',b'True',b'True',b'False',b'2017-02-28 14:50:38'
b'@abhisar_sharma @KapilMishra_IND @DelhiPolice Have some shame. While whole India is seeing the violence by muslim m\\u2026 https://t.co/mZHVLY3Pp1',b'1232146094630428672',b'MrGlassHalfEmpty',b'mrGlassHfEmpty',b'',b'Your average hard working salaried rat running the race.',b'64',b'388',b'0',b'8911',b'18595',b'False',b'False',b'True',b'False',b'2010-11-16 01:15:25'
b'@sakshijoshii Radical muslim terrorism.',b'1232146074984308736',b'Jaipal Baniwal',b'Jpbaniwal',b' India.',b'jai jawan jai kissan jai veegan.\\n\\u0928\\u0940\\u0932\\u093e\\u0902\\u092d\\u0941\\u091c \\u0936\\u094d\\u092f\\u093e\\u092e \\u0915\\u094b\\u0902\\u092e\\u0932\\u093e\\u0902\\u0917 \\u0938\\u0940\\u0924\\u093e \\u0938\\u092e\\u093e\\u0930\\u094b\\u0939 \\u092a\\u093f\\u0924\\u0935\\u093e\\u0902\\u092d\\u093e\\u0902\\u0917\\n\\u092a\\u093e\\u0923\\u094b\\u092e\\u0939\\u093e\\u0938\\u093e\\u092f\\u0915 \\u091a\\u093e\\u0930\\u0942\\u091a\\u093e\\u092a\\u092e \\u0928\\u092e\\u093e\\u092e\\u093f \\u0930\\u093e\\u092e\\u0902 \\u0930\\u0918\\u0941\\u0935\\u0902\\u0936 \\u0928\\u093e\\u0925\\u092e\\u0964',b'733',b'843',b'0',b'12865',b'15353',b'False',b'False',b'True',b'False',b'2018-06-05 06:57:47'
"b'@mehdirhasan @cjwerleman The state of Muslim neighborhood in Indian capital, Delhi.\\nVideo was shot last night. https://t.co/vP9xLQJy12'",b'1232146066797158401',b'Zeeshan Niazi',b'zniazi75',"b'Mianwali, Pakistan'","b'To survive in peace and harmony, united and strong, we must have one people, one nation, one flag\\n#Pakistan #Geopolitics #International_Relations #CPEC #OBOR'",b'396',b'1370',b'2',b'6429',b'30824',b'False',b'False',b'False',b'False',b'2014-05-18 03:56:32'
b'@samson07917 @patel4witham @ukhomeoffice Hindus will never interfare any religion see all over world wherever Musli\\u2026 https://t.co/9jINwMnoC6',b'1232146063517245441',b'ek rashtra shrestra rastra',b'jagoindia99',"b'Uttar Pradesh, India'",b'sachhi baat kahi thii maine',b'4',b'55',b'0',b'425',b'615',b'False',b'False',b'True',b'False',b'2019-05-19 13:50:36'
b'Congress never disappoints @RanaAyyub but irony that Kejriwal always inspires @RanaAyyub for maintaining his Anti-M\\u2026 https://t.co/vTBQaf0alp',b'1232146061470334981',b'Uday Shetty',b'uday_shetty1',b'Welcome',b'Bhagwan ka diya twitter hai.',b'324',b'320',b'1',b'1651',b'1421',b'False',b'False',b'True',b'False',b'2019-12-22 03:42:45'
b'@_sabanaqvi Yes complete panic in muslims area all are going for riots. \\nEvery muslim of the area is indulging in r\\u2026 https://t.co/fQp3eOS9SJ',b'1232146036933582848',b'\\u092c\\u0947\\u0916\\u094c\\u092b Hindu',b'Milans96973051',b'',"b""HINDUISM IS BEST EVER RELIGION ON EARTH\\n# TRAITORS LAY OFF\\n# HATE FRAUD BABA'S DESTROYERS OF HINDUS UNITY""",b'2489',b'2861',b'1',b'57536',b'50839',b'False',b'False',b'True',b'False',b'2019-01-15 13:17:34'
"b'*Keluarga Muslim Di 3 Bulan Tarbiyah*\\n(Rajab, Sya\\u2019ban &amp; Ramadhan)\\nOleh: Ustadz Budi Ashari, Lc\\n#DuniaParenting- Ram\\u2026 https://t.co/GBdCpKFWbd'",b'1232146021817303040',b'Dunia Parenting',b'dunia_parenting',b'Indonesia',"b'Dunia Parenting menyediakan beragam artikel, tips dan produk untuk keluarga.'",b'273',b'301',b'0',b'596',b'526',b'False',b'False',b'True',b'False',b'2019-04-12 15:39:59'
b'@FrustIndian Need free limelight wats better to talk against CAA do hindu Muslim',b'1232146005992230912',b'nia',b'nia96300580',b'',b'',b'8',b'724',b'0',b'4173',b'9640',b'False',b'True',b'True',b'False',b'2019-07-09 01:32:16'
b'If pro CAA is anti Muslim. \\n\\nAnti CAA is anti Hindu as well. https://t.co/3TKCOYfbXR',b'1232146005233004544',b'\\U0001f181\\U0001f174\\U0001f173\\U0001f17c\\U0001f170\\U0001f17d',b'Rdte09',b'India',b'Manchester United is Love.\\nManchester United is Life.\\nHMP.',b'1251',b'636',b'20',b'68928',b'32365',b'False',b'False',b'False',b'False',b'2013-01-21 13:39:02'
"b'Actually @ReallySwara ne jab kaha ki NRC me itne darwane provisions hai, tab muslim aur darr gaya, usne  pistol tan\\u2026 https://t.co/Kimasp5dNy'",b'1232145986325102601',b'Adv.Vivekanand Gupta \\U0001f1ee\\U0001f1f3',b'vivekanandg',"b'Mumbai, Ara, Bihar  \\U0001f1ee\\U0001f1f3'","b'\\u0965\\u0950\\u0965 Nation First, Secretary, BJP Mumbai. \\n\\n                              \\u0939\\u0930 \\u0915\\u0930\\u094d\\u092e \\u0905\\u092a\\u0928\\u093e \\u0915\\u0930\\u0947\\u0902\\u0917\\u0947 \\u092f\\u0947 \\u0935\\u0924\\u0928 \\u0924\\u0947\\u0930\\u0947 \\u0932\\u093f\\u090f\\u0964'",b'1787',b'1352',b'15',b'19280',b'23208',b'False',b'False',b'False',b'False',b'2010-02-06 12:28:52'
b'being muslim at an all christian school in Oklahoma https://t.co/G8aNJbmjh4',b'1232145976904777729',b'\\U0001f1f5\\U0001f1f8Janeen the Meme\\U0001f1f5\\U0001f1f8',b'JaneenAbdellat1',b'',"b""Free Palestine\\u270c\\U0001f1f5\\U0001f1f8\\nbro, I swear I'm Arab\\ncertified Chaotic Dumb Bitch fueled with pure bisexual crackhead vibes""",b'54',b'86',b'1',b'1104',b'7936',b'False',b'False',b'False',b'False',b'2018-12-25 14:27:11'
b'Shaheen Baugh is d symbol of joblessness among Muslim women. Wish cowards behind Shaheen Baugh showed similar inter\\u2026 https://t.co/p3adOL7F0G',b'1232145973155024896',b'Bipin',b'Bipinmm',b'',"b'Author, Statistician, Market & Media Research professional frm Lancaster Univ UK, Nationalist Hindu, Worshiping Tulsidas Ramayan'",b'4243',b'857',b'67',b'9314',b'24212',b'False',b'False',b'False',b'False',b'2012-04-16 04:57:53'
"b'""..Yg demikian itu adalah karena sesungguhnya mrk benci kpd apa yg diturunkan Allah (Al-Qur\\u2019an) lalu Allah menghapu\\u2026 https://t.co/MCjPHNtTyF'",b'1232145971032682496',b'Nhida',b'Nhidayat76',b'',"b'Mereka mengetahui yang lahir (tampak) dari kehidupan dunia,sedangkan terhadap (kehidupan) akhirat mereka lalai \\n(QS 30:7)'",b'1177',b'1042',b'0',b'4240',b'6355',b'False',b'False',b'True',b'False',b'2013-08-26 04:19:37'
b'Yuk belanja di tokoku banyak produk baru dan promo potongan harga dan ongkir. klik di sini https://t.co/m40wvk1guh\\u2026 https://t.co/H1AfwRhn6u',b'1232145970680320001',b'Ervan gunawan',b'ervangnwn',b'Tasikmalaya',b'',b'20',b'44',b'0',b'69',b'347',b'False',b'False',b'True',b'False',b'2016-05-02 18:17:59'
b'.\\u2066@GayleKing\\u2069 \\u2066@NorahODonnell\\u2069 please #AskBloomberg about this at the debate. Trump ran in \\u201816 saying he would \\u201cstr\\u2026 https://t.co/mRWhgWuXp8',b'1232145970412081152',b'Sarah Pearson',b'SarahPearr',"b'Milwaukee, WI'",b'she/her/hers now: @housingworks/@birddog_nation National Organizer then: @WomensMarchWI co-chair #BelieveSurvivors',b'750',b'738',b'4',b'2700',b'4460',b'False',b'False',b'True',b'False',b'2016-04-17 22:28:14'
"b""It can safely be assumed that most of the rioters from Delhi voted to elect AAP MLA's. Kejriwal has a lot to answer\\u2026 https://t.co/VFoF52rZxW""",b'1232145955677450240',b'Thought Value',b's_khushu',b'India.',b'nation first : dharma : bizman : infotech : law : lone ranger : vegan : saffron secular : \\u0938\\u093e\\u092e \\u0926\\u093e\\u092e \\u0926\\u0902\\u0921 \\u092d\\u0947\\u0926',b'1530',b'582',b'47',b'60465',b'47602',b'False',b'False',b'False',b'False',b'2009-06-08 10:54:11'
b'@MehreenFaruqi Yes nazis exists and yes muslim terrorists exist guess which one is responsible and more of a threat\\u2026 https://t.co/rp6TkSY1LV',b'1232145916615770112',b'vicki',b'vicki_happy',b'australia',"b'\\u201cI\\u2019m offended, so what be offended nothing will happen because you\\u2019re offended\\u201d I have no time or patience for PC & Identity Politics Bullshit.'",b'522',b'735',b'3',b'18536',b'22593',b'False',b'False',b'True',b'False',b'2011-06-17 09:09:22'
"b'@shenolonger @patrokhlus This is muslim country , if u dont like it just leave in peacefully ok ?'",b'1232145904250970112',b'Lampu Jalan\\U0001f1f2\\U0001f1fe',b'rosesrcryin',"b""Allah Land's""",b'So tell me where should I go ? To the left where noth is right or to the right where is noth left .',b'5',b'45',b'0',b'96',b'41',b'False',b'False',b'True',b'False',b'2019-07-25 14:30:38'
"b'@ShefVaidya @narendramodi Liberal logic :\\nShantipriya secular Muslim Mahilae nariyal fodti hui , yeh pathaar Nahi n\\u2026 https://t.co/lMIfKQ8dWl'",b'1232145902795550725',b'Mr. Anonymous Ji',b'MrAnonymousJi',b'',"b""Patriotic INDIAN, Neutral while Judging, Stand with what's Right.\\nFeel free to debate, bss harne k baad Bhakt mt kehna\\U0001f923""",b'10',b'67',b'0',b'1417',b'179',b'False',b'False',b'True',b'False',b'2019-12-11 05:44:05'
b'@SureshNakhua So every muslim is terrorist according to you!?',b'1232145900073517058',b'Shashant Shekhar',b'shashantshekhar',b'India',"b'Egalitarian. Core team member at I-PAC. IIT Delhi, IIM Calcutta alumnus.'",b'361',b'504',b'0',b'950',b'1270',b'False',b'False',b'False',b'False',b'2010-05-06 08:18:25'
b'@KBuzarg @dastgeerikariw @rajiv_pandit @annrosh_ @standwkashmir @KWomenresist This applies to you aptly. First kill\\u2026 https://t.co/f258EAQile',b'1232145898202976256',b'Ankur Barot',b'AnkurBarot7',b'Bharat',b'Master of none. Not sure of Jack though.',b'44',b'118',b'0',b'11079',b'2854',b'False',b'False',b'True',b'False',b'2018-08-05 18:23:09'
b'@anajlimishra Muslim ladke apna naam hindu batate hai starting me.. Ladki ko puri Tarah fassa kar Pura video pics c\\u2026 https://t.co/menZuTT38O',b'1232145893752737792',b'Aditya Sharma',b'Aditya_Adiiiii',b'India',b'Aditya_Adi',b'115',b'286',b'0',b'2036',b'1161',b'False',b'False',b'True',b'False',b'2020-01-15 11:55:53'
"b""@SonaliVaid Here also it's muslim n Hindu... Have u reached out to constable ratanlal family.... Bloody double stan\\u2026 https://t.co/Ipi8mtvkmX""",b'1232145892767076354',b'VS84',b'VS846',b'',b'Hate Sickulars',b'3',b'79',b'0',b'88',b'11',b'False',b'False',b'True',b'False',b'2020-01-08 16:45:26'
"b""@tedcruz How did you interpret that from what she said? Just because she's a Muslim does not make her un American!\\u2026 https://t.co/XQO3zLYRyJ""",b'1232145889008984064',b'Kathy Spiers',b'KathySpiers5',"b'Bella Vista, Arkansas'","b'retired teacher, married with two great daughters,lover of art and music!'",b'182',b'718',b'0',b'6541',b'3022',b'False',b'False',b'True',b'False',b'2019-06-26 15:43:53'
b'@ShashiTharoor Sharkukh jese Muslim is desh ko Syria banna chahgte h',b'1232145886920179712',b'Somraj Dhaka',b'dhaka_somraj',b'India',b'studying at lachoo memorial collage science & technology.\\nmy dream became a IAS officer',b'23',b'99',b'1',b'163',b'6999',b'False',b'False',b'True',b'False',b'2016-10-12 06:16:04'
b'\\u0627\\u0644\\u0644\\u064e\\u0651\\u0647\\u064f\\u0645\\u064e\\u0651 \\u0623\\u062c\\u0650\\u0631\\u0652\\u0646\\u0650\\u064a \\u0641\\u0650\\u064a \\u0645\\u064f\\u0635\\u0650\\u064a\\u0628\\u064e\\u062a\\u064a \\u0648\\u0623\\u064e\\u062e\\u0652\\u0644\\u0650\\u0641\\u0652 \\u0644\\u0650\\u064a \\u062e\\u064e\\u064a\\u0652\\u0631\\u0627\\u064b \\u0645\\u0650\\u0646\\u0652\\u0647\\u064e\\u0627\\nYa Allah berilah pahala atas musibahku ini &amp; gantik\\u2026 https://t.co/9Zl5uesets',b'1232145884407726081',b'iAmTaller',b'amsyarmalfoy',b'Makkah',b'',b'317',b'281',b'1',b'33787',b'17287',b'False',b'False',b'False',b'False',b'2016-12-30 15:23:27'
"b'@AsifAlv85991740 @Iqra_K_ We never discreminate ,believe me or not most of Muslim community is employed by majority\\u2026 https://t.co/N5Pz9VEYgf'",b'1232145857442537473',b'ashish mathur',b'ashishtex',b'',b'',b'7',b'31',b'0',b'633',b'819',b'False',b'True',b'True',b'False',b'2011-05-23 12:47:10'
b'#CAA has exposed Muslim extremism in our country.\\n#DelhiRiots \\n@ArvindKejriwal is inefficient to tackle this kind o\\u2026 https://t.co/O2xraT0Mx8',b'1232145854846337025',b'Jivendra Kumar_We SUPPORT #CAA \\U0001f1ee\\U0001f1f3',b'JK_theIndian',b'New Delhi',"b'An IT Professional,Proud To Be an https://t.co/Jta2U13tq0 my Country,Ready to Sacrifice my life for country. Disclaimer: My profile pic endorses nothing but the truth\\U0001f1ee\\U0001f1f3'",b'424',b'710',b'14',b'5710',b'336',b'False',b'False',b'False',b'False',b'2013-09-22 12:13:55'
"b'Designate the Muslim Brotherhood a ""TERRORIST ORGANIZATION"" and don\'t give him a VISA. Problem Solved https://t.co/xzTEEZdUXY'",b'1232145842447974402',"b'cbjoasurf \\U0001f449\\U0001f449\\U0001f449 text ""TRUMP"" to ""88022"" \\U0001f448\\U0001f448\\U0001f448'",b'cbjoasurf',b'United States',"b'Husband, Father, Proud Papaw,........ Avid: Fisherman, Hunter, Outdoorsman, 2A Advocate #MAGA #WWG1WGA #TRUMP2020 #KAG2020 #AmericaFirst #WeAreTheNewsNow'",b'57',b'92',b'1',b'3063',b'733',b'False',b'False',b'True',b'False',b'2010-02-13 16:53:45'
b'@zainabsikander Y dekh or bata y b indian muslim hi h naam h shahrukh https://t.co/V5rMxOXSSF',b'1232145836655529984',b'Mayank Nangalia',b'mayanknangaliya',"b'Mumbai, India'",b'Professional',b'18',b'232',b'0',b'1110',b'141',b'False',b'False',b'True',b'False',b'2016-10-19 11:41:39'
b'@_sabanaqvi What is Muslim areas ! Aren\\u2019t we sickular ??',b'1232145818976690176',b'Buzzer \\U0001f1ee\\U0001f1f3',b'vinodsharma2122',b'',b'RTs not necessarily Endorsements !',b'51',b'397',b'0',b'14679',b'13347',b'False',b'False',b'False',b'False',b'2010-01-30 10:18:30'
"b'In photos: #CAA supporters attack Muslims at Delhi protest, hurl stones and petrol bombs\\n\\n https://t.co/KqyYTkNGNb'",b'1232145813268312065',b'Mohammad Faizan Khan',b'khanfaizan08',b'',b'Hindustani Khan\\u261d\\ufe0f\\nThe Muslim Student\\n#FKR\\n#Khan',b'35',b'46',b'0',b'348',b'115',b'False',b'False',b'True',b'False',b'2016-02-24 09:44:01'
b'@yettiaka ini menunjukan kurang nya akal sehat anda.. berbahasa laksana intelek tapi tak berbobot.. di mana bumi di\\u2026 https://t.co/KAEepJ1rjp',b'1232145812299251712',b'hust-berisik\\U0001f92b',b'Bufazha',b'',b'',b'3',b'31',b'0',b'782',b'207',b'False',b'False',b'True',b'False',b'2014-09-16 23:13:25'
b'@jamz2x I\\u2019m about to follow a Muslim brother.',b'1232145806771261441',b'Zahin S.',b'ZahinisIchigo',"b'Ohio, USA'",b'Fan of anime and comics. Creator/founder of Project BX. Hive Leader of Super Sentai and Kamen Rider. Currently reading Supergirl (2005) #Omnitwitter',b'426',b'426',b'0',b'2429',b'4215',b'False',b'False',b'True',b'False',b'2017-08-18 02:21:28'
b'@aishe_ghosh The man came with gun is identified as #Shahrukh so this must be some Muslim atttacking people and police',b'1232145805018042368',b'Lakshay Vaid',b'lakshayvaid123',b'Jammu and Kashmir ',b'Law Student',b'14',b'47',b'0',b'567',b'485',b'False',b'False',b'True',b'False',b'2015-01-06 14:42:19'
b'#Bhajanpura hope sane voices come out from #Muslim community this madness called anti #CAA protests must stop bcoz\\u2026 https://t.co/xCdoPez6WP',b'1232145798479040516',b'K G Surendran',b'surendrankol',b'',"b""OLD body YOUNG mind active have great faith in India's younger generation they are the future of this beautiful world of ours - #VasudaivaKuttumbakam""",b'267',b'153',b'3',b'20309',b'3220',b'False',b'False',b'True',b'False',b'2013-09-18 09:18:10'
b'@devilson402 @AMISHDEVGAN Isse pahle kabhi dange bade astar pe Muslim kiya hai kya ye bata',b'1232145780707753985',b'Ultimate Revolution',b'UltimateRevolu1',b'',b'Inquilab Zindabad',b'1',b'74',b'0',b'232',b'124',b'False',b'False',b'True',b'False',b'2018-08-04 05:55:23'
"b'""Siapa memberi kelonggaran org yg susah,niscaya Allah akan memberi kelonggaran baginya di dunia &amp; akhirat."" (HR Muslim)'",b'1232145771937423360',b'\\u0493\\u03b9\\u044f\\u043c\\u03b1\\u0438\\u01a8\\u028f\\u03b1\\u043d',b'f1rmansyah1',b'\\u2606\\xba\\xb0\\u02da\\u02da\\u2606 batavia \\u2606\\xba\\xb0\\u02da*\\u2605',b'\\u03ba\\u028b \\u03b1\\u03c9\\u03b1\\u2113\\u03b9 \\u03b1\\u03ba\\u0442\\u03b9\\u028c\\u03b9\\u0442\\u03b1\\u01a8 \\u2202\\u03b1\\u0438o\\u0262\\u03b1\\u0438 \\u043c\\u025b\\u0438\\u0262\\u028bc\\u03b1\\u03c1\\u03ba\\u03b1\\u0438 \\u03ba\\u03b1\\u2113\\u03b9\\u043c\\u03b1\\u0442 \\u0432\\u03b9\\u01a8\\u043c\\u03b9\\u2113\\u2113\\u03b1\\u043d\\u03b9\\u044f\\u03c3\\u043d\\u03b9\\u043c | pin 517D83D3',b'79',b'25',b'2',b'118744',b'1',b'False',b'False',b'False',b'False',b'2013-03-28 13:50:12'
"b'@AcharyaPramodk @narendramodi @INCIndia He is taking Trump there to say, see we have kept the Muslim monument safe\\u2026 https://t.co/1VRZxUg1Je'",b'1232145769861246978',b'RaghuVanshi Nagaraj',b'Nagaraj2805',b'Bengaluru',b'',b'105',b'103',b'2',b'7012',b'30',b'False',b'False',b'True',b'False',b'2013-02-07 05:04:57'
"b""@ashleyblair21 @Hebrewsaurusre1 @TriciaG_Citizen @Angela_Lynnx3 @AngelicaKamen @Roni4488 It's complicated. The way\\u2026 https://t.co/3WA6YFudbn""",b'1232145760768208897',b'Matt Harris',b'_MattHarris_',"b'Kansas City, MO'","b'Husband, father, American \\U0001f1fa\\U0001f1f8, Zionist \\U0001f1ee\\U0001f1f1, Jew. Not right or left, just anti-authoritarian.\\n\\n\\u062a\\u062d\\u064a\\u0627 \\u062f\\u0648\\u0644\\u0629 \\u0625\\u0633\\u0631\\u0627\\u0626\\u064a\\u0644\\n\\nBlocked exclusively by Jew haters. \\U0001f973'",b'830',b'1453',b'0',b'10873',b'9205',b'False',b'False',b'False',b'False',b'2017-07-27 15:43:12'
b'Barangsiapa menzalimi orang lain terhadap sejengkal lahan maka kelak dia akan dililit dengan tujuh bumi. (HR. Bukhari dan Muslim)',b'1232145758205313024',b'Ayo',b'TebarKebaikan_',b'',b'\\u3164\\u3164\\u3164Akun pengingat',b'457',b'479',b'1',b'11065',b'25',b'False',b'False',b'True',b'False',b'2015-05-22 08:39:10'
b'@abhisar_sharma Aaj ek suar pakra gya naam sahrukh hai .goli chla raha tha . muslim atankwad',b'1232145754229215232',b'Manish Trivedi',b'tmanish32',"b'New Delhi, India'",b'\\u0915\\u094d\\u0930\\u093f\\u0915\\u0947\\u091f',b'8',b'42',b'0',b'414',b'20',b'False',b'False',b'True',b'False',b'2015-12-14 10:42:09'
b'@sagarikaghose Haha haha haha !!!!! You were tweeting the photographer of the Muslim terrorist carrying pistol and\\u2026 https://t.co/DD3iBevJkx',b'1232145753591541761',b'Munish Bhardwaj',b'bhamun',"b'Gurgaon, India'",b'',b'7',b'201',b'0',b'344',b'40',b'False',b'False',b'True',b'False',b'2011-03-10 19:59:08'
b'And they expect us to not make this issue  hindu-muslim. \\n\\nIdhar chacha full divide politics khel rahe. https://t.co/3TKCOYfbXR',b'1232145752144564224',b'\\U0001f181\\U0001f174\\U0001f173\\U0001f17c\\U0001f170\\U0001f17d',b'Rdte09',b'India',b'Manchester United is Love.\\nManchester United is Life.\\nHMP.',b'1251',b'636',b'20',b'68928',b'32365',b'False',b'False',b'False',b'False',b'2013-01-21 13:39:02'
b'@Pushpendrakuls0 @SushmaM92737927 Hme mja aa rha h Delhi ka ye hal dekh kr kyo ki Delhi ko free ka aadt h ye Muslim\\u2026 https://t.co/rGbCn0NL1I',b'1232145750378848256',b'Deep',b'Deep15822440',b'',b'',b'1',b'27',b'0',b'32',b'6',b'False',b'True',b'True',b'False',b'2020-02-15 12:48:22'
"b""You're also a complicit in all the hate we see today. You could have practiced better journalism but you indulged i\\u2026 https://t.co/pIYvb3bjhg""",b'1232145726458585088',b'IdlyVadaa',b'IdlyVadaa',b'India',b'I love Idly & Vadaa more than my name! \\n#BolnaHiHai #TheFreeVoice\\nViews are personal!',b'126',b'820',b'2',b'5526',b'60936',b'False',b'False',b'False',b'False',b'2014-10-19 06:50:58'
"b""Only the oppressed will understand the ongoing oppression on Muslim community, I'm numb and helpless that I once ac\\u2026 https://t.co/vfsJ5sbAUs""",b'1232145725233995776',b'Tonima',b'Aatish_mizaaj',"b'Delhi, India'","b'Psychology and Mental Health Researcher\\nEducate Agitate Organise /University of Delhi|Ambedkar University, New Delhi'",b'65',b'259',b'1',b'604',b'2546',b'False',b'False',b'True',b'False',b'2017-11-14 15:47:35'
b'Manner in Islam is repentance. A Muslim is expected to repent when we sin against God and changing our ways if we w\\u2026 https://t.co/p554g1uDO8',b'1232145723216494592',b'\\u0647\\u0648\\u0622\\u0622\\u0622\\u0622\\u0622\\u0632\\u0646 \\u060c\\u060c',b'brns_01',b'\\u062c\\u062f\\u06be  ..',b'\\u0644\\u0644\\u0623\\u062f\\u0628 \\u062f\\u0648\\u0644\\u0629 \\u0627\\u0644\\u0641\\u0644\\u0627\\u0633\\u0641\\u0629 \\u0645\\u0644\\u0648\\u0643\\u0647\\u0627 \\u0648\\u0627\\u0644\\u0634\\u0639\\u0631\\u0627\\u0621 \\u0623\\u0645\\u0631\\u0627\\u0624\\u0647\\u0627\\u060c \\u0648\\u0644\\u0644\\u0641\\u0643\\u0631 \\u0633\\u0644\\u0637\\u0627\\u0646 \\u0644\\u0627 \\u0642\\u064a\\u062f \\u0644\\u0635\\u0648\\u0644\\u062c\\u0627\\u0646\\u0647 \\u0648\\u0644\\u0627 \\u0644\\u0648\\u0646 \\u0644\\u0631\\u0627\\u064a\\u062a\\u0647 _ \\u0645\\u0631\\u062d\\u0628\\u0627 \\u0628\\u0643\\u0645',b'973',b'959',b'1',b'31208',b'1313',b'False',b'False',b'True',b'False',b'2012-05-11 23:37:11'
b'@SebastianStoker I used to work with many Hindu Indians and they openly admitted to their hatred of Pakistani Musli\\u2026 https://t.co/W3ySAWFtlb',b'1232145717138989056',b'Shuttem Downes',b'ShuttemD',b'OUTTAHERE! NO DMs. Morons!',b'IT IS WAR ME AMERICAN MATIES! \\nThat\\u2019s All!',b'1164',b'1842',b'0',b'20553',b'15074',b'False',b'False',b'True',b'False',b'2019-10-10 03:03:14'
b'@AMISHDEVGAN Amish isme tu bhi jimmedar he jo har sam ko machi market lagata he Hindu Muslim Karene k liye',b'1232145703914364930',b'bihari m. d',b'mujif7698',b'',b'M. D. Bihari\\n\\nA. P. J ABDUL KALAM   BHAGTSIH B. R AMBEDKAR \\U0001f60d \\U0001f60d\\U0001f60d\\U0001f970',b'30',b'204',b'0',b'741',b'1256',b'False',b'False',b'True',b'False',b'2017-08-18 10:20:04'
b'MUFFEST 2020: Siapkan Indonesia Jadi Kiblat Fashion Muslim Dunia https://t.co/c65l37k8zu',b'1232145700638429186',b'HijabKeren.com',b'hijabkerens',b'Jakarta',b'Feeling Better with Hijab',b'1965',b'4',b'9',b'99909',b'4',b'False',b'False',b'True',b'False',b'2012-10-24 16:16:08'
b'7. Steps Immediate Need Of the Nation\\n1. Abolition Of Indira Secularism\\n2. Conversion Of India Into Hindu Rashtra\\n3\\u2026 https://t.co/WJaIYjZ4qr',b'1232145694577676288',b'Pyare Lall',b'PyareLall1',"b'New Delhi, India'",b'BharatVarsha\\nHindu\\nRam Rajya\\nJai Bhawani\\nFollow Me \\nhttps://t.co/lrujX5PZQh \\n& Followed Back by Me.',b'753',b'4990',b'1',b'20844',b'25778',b'False',b'False',b'True',b'False',b'2018-12-17 18:47:06'
b'Allahabad HC has asked the UP police chief to identify and act against the policemen who had smashed motorcycles an\\u2026 https://t.co/W6WASYGKDu',b'1232145694158278658',b'The Telegraph',b'ttindia',"b'Kolkata, India'","b'The unputdownable English newspaper of the ABP group published from Calcutta, India. Retweets are not endorsements.'",b'150983',b'56',b'733',b'37193',b'130',b'True',b'False',b'True',b'False',b'2010-05-07 04:10:03'
b'#DelhiBurning - Inexplicable inaction of Delhi Police on Muslim rioters has led to deaths of their ranks. Commissio\\u2026 https://t.co/HdyZCaPhid',b'1232145691872497664',b'Shiva Mishra',b'ShivaMishra7',b'',b'',b'49',b'507',b'2',b'3183',b'1556',b'False',b'True',b'True',b'False',b'2012-06-17 13:20:25'
"b""@BorisJohnson_MP No wonder she's angry, apparently this Tommy guy has been locked up for exposing Muslim Groups. Po\\u2026 https://t.co/yl0allgPKx""",b'1232145687896305665',b'FlossingSea',b'FlossingSea',"b'England, United Kingdom'","b'I returned to a long strand,\\n\\nthe hammered curve of a bay,\\xa0\\xa0\\xa0\\n\\nand found only the secular\\n\\npowers of the Atlantic thundering'",b'0',b'30',b'0',b'33',b'145',b'False',b'False',b'True',b'False',b'2018-11-22 03:14:53'
"b'Peringatan harus berpakaian Muslim di lingkungan masjid emang ngga salah, tapi orang-orang yang non hijab jangan ju\\u2026 https://t.co/J3IMKlhwh0'",b'1232145681512464384',b'Lea',b'AlleanaHaritz',b'',b'Nderek Kersaning Gusti',b'32',b'139',b'0',b'1585',b'76',b'False',b'False',b'True',b'False',b'2017-12-25 13:18:48'
"b""@Fatima_Z0hra @kpsingh1966 @_YogendraYadav @warispathan Fatima.....\\nI didn't worried or felt wrong because of\\u2026 https://t.co/f1ZG4SzzWj""",b'1232145665632935936',b'dhirajzope',b'dhizo8673',b'Pune ',b'Truth-without formality',b'24',b'109',b'1',b'2167',b'4861',b'False',b'False',b'True',b'False',b'2012-12-04 08:27:27'
"b'Muslim Mob shot &amp; killed a lot of Hindus, Sikhs &amp; Non- Muslims a.k.a kafirs. Islam is terrorism, and Indians have l\\u2026 https://t.co/4J2QOZ0lDM'",b'1232145664911429632',b'Abhishek Raj \\U0001f1ee\\U0001f1f3',b'Abhshkraj',b'',b'\\U0001f1ee\\U0001f1f3\\n\\U0001f4af\\U0001f504',b'462',b'517',b'0',b'452',b'742',b'False',b'False',b'True',b'False',b'2016-02-05 15:40:07'
