b'@detikcom @20detik Kalau aku disitu itu aku tarik &amp; buka hijab nya. Tolong donk ustad2 dipengajian ibu2 model begin\\u2026 https://t.co/uqHticpezP',b'1232013045146083331',b'M Idham Rously',b'idhamrously',b'Jakarta',"b""I'm just FABULOUSY me who living with my own FREESIONARY!""",b'168',b'154',b'6',b'11655',b'503',b'False',b'False',b'True',b'False',b'2009-10-09 02:47:00'
"b'@conomcg16 @Kritika_Kamra Ok bhai , is bill mein jo log india me rah raha hai unko fayda milega ,bina kisi bhedbhav\\u2026 https://t.co/HoGUWmtY2B'",b'1232013038997233667',b'Jaipal singh',b'JP4RAJ',"b'Jaipur, rajasthan '",b'Ex.Voter',b'1498',b'927',b'9',b'55040',b'272864',b'False',b'False',b'True',b'False',b'2015-12-17 16:23:03'
b'It was always sumn about a pretty Muslim that always get me \\U0001f97a\\U0001f97a',b'1232013025831505923',b'Black',b'band0marc',b'',b'',b'72',b'55',b'0',b'46',b'62',b'False',b'False',b'True',b'False',b'2016-08-10 16:43:13'
b'@EttoreTreglia Ecco dopo(questo sgarbo) tornate a fare le vacanze in quel Paese(muslim)!!!',b'1232013002683097089',b'saving italians',b'savingitalians',b'',"b'Libero pensatore,tenace,avanguardista,'",b'251',b'746',b'0',b'8020',b'23788',b'False',b'True',b'True',b'False',b'2014-04-09 15:56:57'
"b""@IfNotNowOrg @GOP Just like the immigration ban is label as a muslim ban and is Islamophobic.\\n\\nLook like GOP ain't\\u2026 https://t.co/FKqOeiwdvi""",b'1232012987466207232',b'Stephane hus',b'StephaneHus',b'',b'',b'94',b'462',b'2',b'12345',b'24184',b'False',b'False',b'False',b'False',b'2018-02-21 23:33:42'
b'@RoflKamra @dhruv_rathee Waise Hindu Muslim me darar lagane ke liye Hindustan ke dogle Muslim hi kaafi hain',b'1232012984202825728',b'Siddhant Singh',b'iamsid100',b'',b'',b'12',b'108',b'0',b'310',b'500',b'False',b'True',b'True',b'False',b'2017-09-08 17:56:19'
"b""They're just so bloody frightened to call them exactly what they are, Muslim Pakistani grooming rapists ! \\U0001f92c\\U0001f92c https://t.co/IzKpoPDZif""",b'1232012977685094400',b'Bulldog',b'trev_bulldog',b'',"b'Ex Forces, working class,moved slowly \\u201cright\\u201d by the soft loony liberal leftie PC do gooders, who have ruined this great country of ours.I want my country back!'",b'665',b'170',b'1',b'10537',b'46302',b'False',b'False',b'True',b'False',b'2018-01-07 17:42:02'
"b'This is Maujpur, a predominately Hindu area, where people have gathered despite Sec. 144 in force. This is with the\\u2026 https://t.co/MvxnEWGqnR'",b'1232012976904794113',b'Ashlin Mathew',b'ashlinpmathew',b'',"b""Boring and centre-left procrastinator who has nothing better to do than stalk other people's thoughts. Currently News Editor @NH_India.""",b'862',b'500',b'3',b'3273',b'6372',b'False',b'False',b'False',b'False',b'2014-04-05 10:45:35'
b'@msisodia @AmitShah @PMOIndia @LtGovDelhi  @msisodia @ArvindKejriwal Muslim stone pelters were throwing stones on p\\u2026 https://t.co/B0RXICrdDS',b'1232012966129815553',b'ankit',b'ankisuperb',b'India',b'',b'0',b'30',b'0',b'10',b'1',b'False',b'False',b'True',b'False',b'2013-01-11 05:43:32'
"b'yesterday @RaisinaSeries was telling @ArvindKejriwal should not meet &amp; help Muslim protesters, because they were tr\\u2026 https://t.co/KxpTZO9fyW'",b'1232012923150561280',b'Sami',b'SAMI_hadyh',"b'Chennai, Tamilnadu, India'",b'Web Developer . Political Enthusiast\\n\\nInstagram: https://t.co/lXpysiBbVh\\nFacebook: https://t.co/UelP8TIk8l',b'2667',b'1425',b'62',b'75513',b'27503',b'False',b'False',b'False',b'False',b'2009-07-20 16:42:08'
b'@AMISHDEVGAN ka bacha hai kya Tu  sidha bol kyu nahi raha Tu Kapil Mishra k bare m nahi bola  kuch asli m sab wohi\\u2026 https://t.co/4VeDNmahPe',b'1232012921577910273',b'Anwar ali',b'anwar007bond',"b'New Delhi, India'",b'National Youth President. (national human rights &social justice commission.and general Sec garib nawaz foundation.',b'181',b'891',b'0',b'4333',b'39904',b'False',b'False',b'True',b'False',b'2011-02-26 22:14:52'
b'@pjmlocket wait ur muslim too\\U0001f97a?',b'1232012920478892032',b'\\U0001f483\\U0001f3fe\\u2077',b'stansjmin',b'h^^py',b'#BTS: \\u1d21\\u1d07 \\u1d21\\u026a\\u029f\\u029f \\u0262\\u1d0f \\u1d1b\\u029c\\u0280\\u1d0f\\u1d1c\\u0262\\u029c \\u026a\\u1d1b \\u1d1b\\u1d0f\\u0262\\u1d07\\u1d1b\\u029c\\u1d07\\u0280',b'6964',b'873',b'51',b'21769',b'26385',b'False',b'False',b'True',b'False',b'2019-07-12 18:20:41'
b'#Shoot_the_muslim_terrorists \\n\\u0926\\u093f\\u0932\\u094d\\u0932\\u0940 \\u092a\\u0941\\u0932\\u093f\\u0938 \\u0938\\u0947 \\u0928\\u093f\\u0935\\u0947\\u0926\\u0928 \\u0939\\u0948 \\u0907\\u0928 \\u0915\\u0941\\u0924\\u094d\\u0924\\u094b\\u0902 \\u0915\\u094b \\u0926\\u094c\\u0921\\u093c\\u093e\\u0915\\u0930 \\u0917\\u094b\\u0932\\u0940 \\u092e\\u093e\\u0930\\u094b \\U0001f621\\U0001f621\\U0001f621\\U0001f621',b'1232012919757574146',b'\\u0930\\u093e\\u092e \\u092d\\u0915\\u094d\\u0924',b'Shanu91006807',b'',b'nothing special',b'1',b'28',b'0',b'34',b'5',b'False',b'False',b'True',b'False',b'2019-11-17 17:52:54'
"b""@sakshijoshii Muslim killing constable and civillians and u r blaming kapil sharma for saying  don't  create more shaheeb baag .""",b'1232012914694873088',b'sadhuvaad',b'sadhuvaad',b'',"b'i m myself ,a women with no pretentions \\n\\u0907\\u092e\\u093e\\u0930\\u0924  \\u0924\\u094b \\u091d\\u0942\\u0920 \\u0915\\u0940 \\u092c\\u0928\\u0924\\u0940 \\u0939\\u0948,\\n\\u0938\\u091a \\u0915\\u0940 \\u0924\\u094b \\u0928\\u0940\\u0902\\u0935 \\u0939\\u0940 \\u0915\\u093e\\u092b\\u0940 \\u0939\\u0948..'",b'11737',b'756',b'151',b'288226',b'87311',b'False',b'False',b'True',b'False',b'2011-11-18 13:57:58'
"b'""I Am Hijabi, Muslim, Black..."": Rep. Ilhan Omar Posts List Describing Herself to Troll Conservatives; Rival Candid\\u2026 https://t.co/YUPHuMlry1'",b'1232012913206059010',b'FreedomLives \\u274c',b'shehar44',b'Home of the Brave',"b'Freedom advocate, Willing to fight for what I have.. Unashamed Capitalist, I always follow back  https://t.co/U5pMZJpYIQ'",b'4679',b'4473',b'36',b'42366',b'18487',b'False',b'False',b'False',b'False',b'2010-12-22 13:48:36'
b'@hannupandit @IshitaYadav Abay chutiya pandit ye bta krega goo saaf jb sbko nikaldega tho bol krega sale.. pehle mu\\u2026 https://t.co/BqmguZjwPy',b'1232012910827798530',b'kaan fadhu',b'KFadhu',b'India',b'I want to express myself in my words and my word is so painful for uneducated nonsense people.\\nNote:- Degree holder also can be uneducated.',b'4',b'69',b'0',b'310',b'522',b'False',b'False',b'True',b'False',b'2018-11-25 05:25:09'
"b""Y'all please please pray for the Muslim community of New Delhi right now.\\nNews coming from the other side of the bo\\u2026 https://t.co/F4ylzxmGuN""",b'1232012882193395717',b'hassan',b'hi__hassan',b'Pindi ',b'Ab jab aa he Gaye ho meri TL per toh follow bhi karlo shaabash.',b'339',b'191',b'4',b'14563',b'45514',b'False',b'False',b'False',b'False',b'2012-07-04 14:31:58'
"b'@DrKumarVishwas @DelhiPolice ek muslim ladka bhi mar gya delhi men, uske qatilon ke baare mn jo rai rakhte hon wo b\\u2026 https://t.co/uFJwEM6J51'",b'1232012878967799808',b'Shuza Moazzam',b'shuzamoazzam',"b'New Delhi, India'",b'Loading....\\nFacebook: https://t.co/j05zOLAkP6\\nInstagram: shuzamoazzam',b'127',b'280',b'2',b'1069',b'1646',b'False',b'False',b'False',b'False',b'2010-01-10 14:36:58'
b'Video coming in from Bhajanpura. Sanghi goons see a Muslim person with skill cap and pounce on him. Document each a\\u2026 https://t.co/V66qOfIWvO',b'1232012878313447424',b'Noushad Bakimar',b'NoushadBakimar',b'',b'',b'53',b'535',b'0',b'295',b'1197',b'False',b'False',b'True',b'False',b'2017-08-26 15:06:09'
"b""@LuzzzGomez My darker skin complexion and the fact that I'm Bengali.\\n\\nWas told I couldn't be Muslim because only Pakistanis are muslim \\U0001f602\\U0001f602\\U0001f602""",b'1232012877109907457',b'BroteinSheikh',b'shoobidi',b'Birmingham (mostly)',b'My tweets a beyond random (like my thoughts. One second its extremely religious; then im talking about stupid stuff) \\n\\n\\n\\nSenior Accountant/Also Superman',b'753',b'572',b'3',b'25310',b'3582',b'False',b'False',b'True',b'False',b'2009-09-11 09:54:11'
b'Nothing wrong with as long as he\\u2019s Muslim https://t.co/9wcj2qG4KS',b'1232012873888518144',b'N A',b'nbnt3_',b'LA/AD',b'\\u0627\\u0644\\u062d\\u0645\\u062f\\u0644\\u0644\\u0647\\U0001f1e6\\U0001f1ea\\U0001f1fa\\U0001f1f8',b'204',b'114',b'0',b'23688',b'20971',b'False',b'False',b'True',b'False',b'2019-01-29 00:06:05'
"b'@jek___ @rangerblek Rekomendasiin hadist yg isinya hadist shohih tad bukhori,muslim jga syukur2 isinya,soalnya beli\\u2026 https://t.co/Cqcf6o2571'",b'1232012868888997889',b'Zahra',b'Zahra_azahrara',"b'Jakarta Pusat, DKI Jakarta'",b'music in my life',b'15',b'126',b'0',b'860',b'8328',b'False',b'False',b'True',b'False',b'2019-01-24 10:55:26'
b'Pro CAA means anti Muslim..\\nIts clear today. https://t.co/1BvqxB6cey',b'1232012865705594880',b'\\u0938\\u094c\\u0928\\u091a\\u093f\\u0930\\u0948\\u092f\\u093e',b'littlebird121',"b'Uttar Pradesh, India'",b'My religion humanity.\\nMy caste Indian.',b'2005',b'461',b'4',b'17341',b'19599',b'False',b'False',b'True',b'False',b'2010-12-06 16:55:39'
b'\\u062f\\u0642\\u06cc\\u0642\\u0627 \\u0647\\u0645\\u06cc\\u0646 \\u0631\\u0641\\u062a\\u0627\\u0631\\u0647\\u0627 \\u0648 \\u062d\\u0631\\u0641 \\u0647\\u0627\\u06cc \\u0686\\u0631\\u062a \\u0628\\u0639\\u0636\\u06cc \\u0647\\u0627\\u0633\\u062a \\u06a9\\u0647 \\u0628\\u0627\\u0639\\u062b \\u0645\\u06cc\\u0634\\u0647 \\u0642\\u0634\\u0631\\u062e\\u0627\\u06a9\\u0633\\u062a\\u0631\\u06cc \\u0627\\u0632 #\\u0627\\u0646\\u0642\\u0644\\u0627\\u0628 \\u0645\\u062a\\u0646\\u0641\\u0631 \\u0634\\u0647.\\n\\u0645\\u0646 \\u062a\\u0627 \\u0647\\u0645\\u06cc\\u0646 \\u06cc\\u06a9\\u06cc \\u062f\\u0648\\u0633\\u0627\\u0644 \\u067e\\u06cc\\u0634 \\u0627\\u0632\\u2026 https://t.co/enjtUPKyFX',b'1232012860982792193',b'Muslim Girl',b'Muslim_Girl313',b'',b'\\u200f\\u06cc\\u0647 \\u062f\\u0647\\u0647 \\u0647\\u0634\\u062a\\u0627\\u062f\\u06cc \\u062c\\u0630\\u0627\\u0628\\U0001f609\\n\\u06cc\\u0647 \\u0622\\u062f\\u0645 \\u0645\\u0639\\u0645\\u0648\\u0644\\u06cc \\u0646\\u0647 \\u0642\\u062f\\u06cc\\u0633\\u0645 \\u0646\\u0647 \\u062a\\u0628\\u0647\\u06a9\\u0627\\u0631\\u060c \\u0647\\u0645 \\u06a9\\u0627\\u0631 \\u062e\\u0648\\u0628 \\u0645\\u06cc\\u06a9\\u0646\\u0645 \\u0647\\u0645\\u0645 \\u0645\\u0645\\u06a9\\u0646\\u0647 \\u0646\\u0627 \\u0622\\u06af\\u0627\\u0647\\u0627\\u0646\\u0647 \\u06a9\\u0627\\u0631 \\u0628\\u062f \\u06a9\\u0646\\u0645\\U0001f607\\n\\n\\nMuslim girl from Iran \\U0001f60a\\n\\nFallow=back \\U0001f609',b'157',b'203',b'1',b'155',b'1668',b'False',b'False',b'True',b'False',b'2020-01-13 18:57:50'
b'@iimzzi @zafarsareshwala \\xa4\\n\\nA Muslim is a Muslim is a Muslim\\n\\nHe will defend fellow Muslim irrespective of the grav\\u2026 https://t.co/DKuvHvJdPy',b'1232012860722642944',b'Ramakrishna',b'Ramakri69189438',b'',b'',b'78',b'654',b'0',b'7575',b'6745',b'False',b'True',b'True',b'False',b'2017-04-05 13:09:59'
b'@ArmaanGorsi @RealKrutika Hindu muslim karke Tu muslim ko or badnaam kar ra apne khuda se dar  nafarat paloge jitni\\u2026 https://t.co/8ym8luK71W',b'1232012856637501441',b'pratibha\\U0001f49e',b'Pratibh55516724',b'',b'i love my country and modi ji \\U0001f64f\\U0001f64f\\U0001f64f\\U0001f64f\\U0001f64f\\U0001f64f\\U0001f64f',b'230',b'202',b'0',b'16953',b'14825',b'False',b'False',b'True',b'False',b'2019-10-06 16:59:42'
b'@IlhanMN I have friends that are Muslim. They love this country and never talk about changing or destroying the US.\\u2026 https://t.co/vAsDvanXPf',b'1232012851566350336',b'H. Cole Bobbe',b'ColeBobbe',b'',"b'Retired Marine, full time patriot\\U0001f1fa\\U0001f1f8'",b'391',b'470',b'0',b'16200',b'819',b'False',b'False',b'True',b'False',b'2016-05-01 22:48:34'
b'@Defender_of_Pak @asadowaisi Prblm pta kha ram or allah ki yrr common baat h dil m rakho jubaan per mtt lao na pta\\u2026 https://t.co/BdShMpHKsk',b'1232012843030966272',b'Yug Verma',b'YugVerm55975953',b'',b'#Jai_Hind',b'3',b'106',b'0',b'74',b'122',b'False',b'False',b'True',b'False',b'2019-12-06 17:20:46'
b'@alaphiah @Rich_Dau @realDonaldTrump @POTUS Ahh from what i understand plenty people US Nationwide are long fed up\\u2026 https://t.co/ZSsbwKdlKA',b'1232012842695524352',b'\\U0001f1fa\\U0001f1f8 Shawn Travis',b'______X____',b'',"b'If Ur Racist Period especially toward Whites move on- US Patriot-Independent- God, Family, Country, p/t rib cookoff judge, occasional sommelier often Cicerone'",b'985',b'858',b'8',b'1034',b'3863',b'False',b'False',b'False',b'False',b'2012-03-21 02:55:58'
b'@ThePeopleOfIN Muslim want azaadi',b'1232012821908590592',b'Zoya',b'zoya_libra',b'Pakistan',b'\\u200f\\u200f\\u067e\\u06cc\\u0627\\u0631 \\u06a9\\u06d2 \\u0628\\u062f\\u0644\\u06d2 \\u067e\\u06cc\\u0627\\u0631 \\u060c\\u060cfollow \\u06a9\\u06d2 \\u0628\\u062f\\u0644\\u06d2 follow',b'423',b'248',b'0',b'931',b'370',b'False',b'False',b'True',b'False',b'2019-11-01 18:14:20'
b'@AskAnshul #Radical_Islamic_terrorism \\n#Muslim_are_not_Minority they are 2nd largest religion in India. @ZeeNews @aajtak',b'1232012815042478080',b'\\u09b8\\u09cc\\u09ae\\u09bf\\u09a4\\u09cd\\u09b0 \\u09ad\\u099f\\u09cd\\u099f\\u09be\\u099a\\u09be\\u09b0\\u09cd\\u09af\\u09cd\\u09af \\U0001f1ee\\U0001f1f3',b'soumitra_bhatt',"b'Agartala, India'",b'',b'10',b'237',b'0',b'322',b'308',b'False',b'False',b'True',b'False',b'2014-01-23 09:17:11'
"b""I bet they don't know the Taj Mahal was commissioned by a Muslim Indian. https://t.co/eCHscSEwPG""",b'1232012814778130432',b'Vetting Bernie',b'vetthebern',b'',"b'A project of @ThePeoplesView, Vetting Bernie will expose why Bernie Sanders is unfit to be the Democratic nominee or to serve as president.'",b'3244',b'257',b'21',b'3288',b'3129',b'False',b'False',b'True',b'False',b'2019-02-22 21:33:06'
"b""@ANAanD18 @zainabsikander Ya just because you ain't a Muslim very easy for you to  \\njust sweep it under the rug.""",b'1232012814375702528',b'Slurpycoke',b'slurpycoke',b'',b'',b'0',b'127',b'0',b'274',b'79',b'False',b'True',b'True',b'False',b'2019-11-23 20:38:07'
b'@Nspeaker95 @musab1 @AfreenFatima136 Is human life worth nothing? And how do u know it was his chacha who pelted st\\u2026 https://t.co/0lIcnRZsL4',b'1232012812374794243',b'Ambreen',b'Only_ambreen',"b'Kolkata, India'",b'Trying my best to Treat People With Kindness!',b'3690',b'1891',b'8',b'20575',b'25470',b'False',b'False',b'True',b'False',b'2014-06-12 07:01:55'
b'TOP MUSLIM GROUP......That says it all. Socialism = Communism which always have a dictatorship! https://t.co/E57W64hhnP',b'1232012808281362446',b'YOU KNEEL BEFORE GOD YOU CAN STAND BEFORE ANYONE',b'ermedic2007',"b'Kansas, USA'","b'GOD, FAMILY Trump 2020 \\U0001f436 \\U0001f1fa\\U0001f1f8 \\U0001f64fThe Truth Is Jesus Christ MAGA ARMY COMBAT MEDIC 70-73 OATH NEVER EXPIRES  PRO\\U0001f46e\\u200d\\u2642\\ufe0f\\U0001f1ee\\U0001f1f1 #STANDFORANTHEM #BUILDTHEWALL #DRAINTHESWAMP'",b'19291',b'19512',b'6',b'14374',b'8478',b'False',b'False',b'False',b'False',b'2011-03-03 04:55:48'
b'@MonstersAreBad Ms rana if you have so much problem better migrate to some better muslim country',b'1232012808268722176',b'Purana Monk',b'AshishV43833886',b'India',b'Hard Core Nationalist. Creative guy who takes life as it comes.',b'22',b'158',b'0',b'789',b'2175',b'False',b'False',b'True',b'False',b'2019-08-06 09:43:10'
"b'What is going on in Delhi right now is abhorrent. This is  fascism in action, blatantly in the open. I could cry wi\\u2026 https://t.co/HNBV3wC6pm'",b'1232012787024564230',b'Felix Rau',b'fxru',"b'Cologne, sometimes Odisha'","b'research data juggler, part-time archivist, linguistic fieldwork and data fancier, data whatchamacallit wannabe, ...'",b'443',b'1233',b'48',b'728',b'2945',b'False',b'False',b'False',b'False',b'2009-07-02 18:49:38'
b'@sah296 @PpollingNumbers @SienaResearch As a fellow Muslim I entreat you not to make wild accusations of antisemiti\\u2026 https://t.co/I8nmz329tI',b'1232012779026092032',b'finkelbuster',b'finkelbuster',b'',"b'dirty immigrant forever, pessimist since 2015. she/her. here to learn better.'",b'332',b'889',b'0',b'48543',b'128864',b'False',b'False',b'True',b'False',b'2018-10-09 18:53:14'
"b'@DeepStateExpose I know this is an old clip, but! Imagine a Muslim man voicing the words of the Koran! Imagine a po\\u2026 https://t.co/pfvHrIxZoG'",b'1232012772956950528',b'John Jennings',b'JohnJen10130249',"b'Grimsby, England'",b'Money and religion are the route of all evil. Although a lottery win would be nice. Amen \\U0001f64f\\U0001f3fb lol.',b'299',b'556',b'0',b'4606',b'4051',b'False',b'False',b'True',b'False',b'2018-03-06 22:10:50'
b'@ZeeNews 3 Muslim aur ek police wala mara  hai ye bhi bta do',b'1232012768364126208',b'\\U0001f1ee\\U0001f1f3\\U0001f1ee\\U0001f1f3Tauheed Mallick \\U0001f1ee\\U0001f1f3\\U0001f1ee\\U0001f1f3',b'mallick_tauheed',b'',b'\\U0001f1ee\\U0001f1f3\\U0001f1ee\\U0001f1f3sarfaroshi ki tamanna ab hamare dil me hai dekhna hai Zor kitna baazu_e_qatil me hai....sarfroshi ki tamanna ab hamare dil me hai...............\\U0001f1ee\\U0001f1f3\\U0001f1ee\\U0001f1f3',b'25',b'98',b'0',b'1545',b'3003',b'False',b'False',b'True',b'False',b'2016-12-19 10:04:36'
b'@Rainfal34200936 @AJEnglish @amnesty No. Check out the guy next to him in Muslim attire. Kurta pyjama. \\nIt\\u2019s from m\\u2026 https://t.co/5VctEnFmL0',b'1232012759874887680',b'Abdul Raoof Khan',b'abdul351_khan',b'Hyderabad',"b'Pharmacist, Cricketer, Hyderabadi, Doha- Qatar \\U0001f1f6\\U0001f1e6'",b'43',b'219',b'0',b'1308',b'2769',b'False',b'False',b'False',b'False',b'2010-03-28 18:15:59'
b'@GucciwaleBaba @Fekoslovakian @ANI He is shahruk and he is radical Muslim terrorist',b'1232012756947066891',b'I Support CAB & NRC Bill',b'sooriks',"b'Bengaluru, India'","b""That's it.""",b'476',b'68',b'19',b'21088',b'312',b'False',b'False',b'True',b'False',b'2010-05-08 02:08:49'
b'@vinodkapri @KapilMishra_IND Tu pagal ho Raha dange muslim Kar rahe giraftaar Kapil ji ko kyu',b'1232012754925473792',b'Anirudra Roy',b'Anirudr19116066',"b'\\u0926\\u0947\\u0939\\u0930\\u093e\\u0926\\u0942\\u0928, \\u092d\\u093e\\u0930\\u0924'",b'Indian .. being human .. proud Indian',b'334',b'861',b'0',b'8163',b'21262',b'False',b'False',b'True',b'False',b'2019-12-13 15:32:53'
b'Bharat me Muslim me kami nahi sarkar nikama hai ab sarkar ko thik karna hai to Muslim ko vote ka adikar nahi hona\\u2026 https://t.co/EL1wqquq3y',b'1232012750588645376',b'Brahman ekta manch jai ho Prabhakar Dubey',b'Prabhak89375613',"b'Patna, India'",b'Jai maa bharati',b'21',b'232',b'0',b'348',b'697',b'False',b'False',b'True',b'False',b'2018-09-20 17:19:03'
b'@sagarikaghose The clash was between pro-CAA and anti-CAA groups. Stop victimising only one side. How do you know that man is a Muslim?',b'1232012747098841089',b'Vishal \\u0916\\u094b\\u092a\\u0915\\u0930 (Khopkar) \\U0001f1ee\\U0001f1f3',b'vishal1296',"b'\\u0cac\\u0cc6\\u0c82\\u0c97\\u0cb3\\u0cc2\\u0cb0\\u0cc1, \\u0cad\\u0cbe\\u0cb0\\u0ca4'","b'(Non-pseudo) Liberal, Software Engineer, Capitalist, Anti-Socialist, Anti-reservationalist, Samsung Research and Development Institute, A lover of trains \\U0001f688'",b'276',b'400',b'6',b'2241',b'9046',b'False',b'False',b'False',b'False',b'2014-09-04 17:56:26'
"b'""I Am Hijabi, Muslim, Black..."": Rep. Ilhan Omar Posts List Describing Herself to Troll Conservatives; Rival Candid\\u2026 https://t.co/cOjWK4UShR'",b'1232012739310227460',b'\\U0001f1fa\\U0001f1f8Bat Miller\\U0001f1fa\\U0001f1f8\\u2b50\\u2b50\\u2b50',b'Deplorablehorde',b'',"b'We The People of the United States, in order to form a  more perfect union, establish justice, insure Two Scoops, Two Genders, Two Terms...\\nAmen'",b'7235',b'7286',b'8',b'30811',b'57541',b'False',b'False',b'True',b'False',b'2016-09-28 15:17:04'
b'A picture of a Muslim human being brutally beaten up by fellow humans of RSS in Delhi today. https://t.co/noFwpLgS2u',b'1232012736009244673',b'Farhan',b'Sheraza47405017',"b'\\u06af\\u0648\\u062c\\u0631\\u0627\\u0646\\u0648\\u0627\\u0644\\u06c1, \\u067e\\u0627\\u06a9\\u0633\\u062a\\u0627\\u0646'",b'',b'17',b'40',b'0',b'804',b'1038',b'False',b'False',b'True',b'False',b'2017-03-04 14:39:30'
"b""They say the gunman is a Muslim.\\nIt is condemnable &amp; whoever he is must be punished.\\nDon't let anyone guilt trip yo\\u2026 https://t.co/JNKrUkq0w2""",b'1232012731777265664',b'Iqra K',b'Iqra_K_',b'',b'Protest poet and witty-woke-insults enthusiast. \\nDisenchanted law student.',b'14416',b'323',b'24',b'3933',b'12462',b'False',b'False',b'True',b'False',b'2019-01-22 12:29:53'
"b""@dennisckurian I can't even fathom how people gets so blinded by hate in the name of religion.?!\\nHis son, also was\\u2026 https://t.co/sejLlhDqK7""",b'1232012720234364929',b'Jessen',b'iamjkv',b'\\u0d15\\u0d47\\u0d30\\u0d33\\u0d02',"b'Sometimes, An Anti-Villain. At times, a Dark Knight.!\\n\\nI am Not Fair; So Are My Tweets!\\n\\nIn The Field of Making Rich People Richer.'",b'506',b'274',b'7',b'24723',b'214438',b'False',b'False',b'False',b'False',b'2010-03-09 20:58:16'
"b'@IlhanMN I am, \\nWHITE\\nAMERICAN \\nVETERAN\\nFATHER\\nBROTHER \\nSON\\nDESCENDANT OF A PROUD, LEGAL IMMIGRANT\\n\\nEasily triggeri\\u2026 https://t.co/uQIVIKuljf'",b'1232012717071970304',b'Duffen Scooda',b'DScooda',b'',"b'Posts are MY OPINION ONLY. NO DMs! Proud White, Male, American, Veteran, and Parent! Support Diversity, but NEVER SOCIALISM! #TeamTrump2020 HE/SIR/CMSgt/MISTER!'",b'160',b'436',b'1',b'4020',b'1852',b'False',b'False',b'True',b'False',b'2016-02-04 14:23:39'
b'@muslim_ladki Dudan\\u0131 yeyeyim senin',b'1232012700705787905',b'Beyaz',b'Beyaz79170472',b'',b'',b'95',b'1495',b'0',b'52',b'947',b'False',b'False',b'True',b'False',b'2018-05-11 13:40:04'
b'@RanaAyyub His name is shahrukh. Naam se to muslim lagta hai. Haath me pichkari hai kya?? Shayad holi ki tayyari kar raha ho..',b'1232012687472758786',b'Akash Bhatia',b'akashjbhatia',"b'Gujarat, India'","b'Hindu, i believe in equality.'",b'36',b'139',b'0',b'8549',b'10845',b'False',b'False',b'True',b'False',b'2016-11-14 13:33:02'
"b""@WhiteHouse India's Muslim population is two-thirds of America's.""",b'1232012685912358912',b'HOSI',b'YoungDevil2019',b'',b'\\u4e0d\\u4ee5\\u7269\\u559c\\uff0c\\u4e0d\\u4ee5\\u5df1\\u60b2\\u3002',b'51',b'68',b'1',b'1530',b'120',b'False',b'False',b'True',b'False',b'2019-12-14 03:25:30'
"b""@DesiMogambo @Sootradhar @kawalpreetdu Sarcasm. Go through her TL she is AISA member hardcore Muslim supporter naxal. I'm ridiculing her.""",b'1232012685866196993',b'Ashok Hajeri',b'ashokhajeri',"b'Bijapur, India'","b'i  am  right,,., Army, politics,  news junkie,  kannadiga, #biggBoss, cricket'",b'1943',b'1836',b'31',b'85257',b'15839',b'False',b'False',b'True',b'False',b'2010-12-01 11:06:05'
b'@SamyGioia @iHrithik @sanjaykhan01 @FingerprintP Definitely.. I agree.. Whatever this guy above says... Irrespectiv\\u2026 https://t.co/tDqmw2b06m',b'1232012677074935810',b'Mavernik',b'Nikhithhm',b'',b'',b'0',b'49',b'0',b'621',b'283',b'False',b'False',b'False',b'False',b'2010-03-02 06:28:18'
b'@ShashiTharoor These all the fruits of Muslim appeasement by Congress during their tenure.',b'1232012675170873346',b'Anshu kumar',b'Anshusingh02',b'',"b'Full time humanitarian, Part time (financial enthusiast, poet,traveller).'",b'19',b'598',b'0',b'250',b'243',b'False',b'False',b'True',b'False',b'2012-05-13 11:11:00'
"b'@Tartine @StanleyCohenLaw Arab American of Lebanese, Syrian, and Yemeni descent who is also a Shia Muslim from a mi\\u2026 https://t.co/y2vn4cddkr'",b'1232012673400725505',b'Mouqawamah Mansour',b'AlaskaRams',b'',b'Sounders FC supporter. Team Melli supporter. Sevilla FC Supporter. Persepolis FC supporter. \\U0001f1f1\\U0001f1e7\\U0001f1f8\\U0001f1fe\\U0001f1fe\\U0001f1ea Dawoodi Bohra Ismaili Shi\\u2019a Muslim \\U0001f54bOpinions my own.',b'48',b'645',b'0',b'1160',b'1171',b'False',b'False',b'True',b'False',b'2019-11-04 09:25:26'
b'@zainabsikander Muslim have taken life of Head constable! https://t.co/853yO91wjM',b'1232012672754954240',b'Vishal Singh\\U0001f1ee\\U0001f1f3',b'star_vishal',b'Bharat ',b'#IndiaFirst || Right Wing Nationalist || Techie || #FoodLover & Traveller',b'969',b'2017',b'4',b'94519',b'252582',b'False',b'False',b'False',b'False',b'2010-07-17 07:13:49'
"b'@jihadwatchRS @katerobinson925 ""It\'s not connected with terrorism"" allows deflection from the possibility that it h\\u2026 https://t.co/1RegHHAiMl'",b'1232012672297775105',b'Ana',b'TellDramaUK',b'',b'#Secularealist Reclaiming sovereignty. True liberals support #FreeSpeech. U.K. hate crime and hate speech laws must be repealed. Amend Communications Act 2003',b'1354',b'788',b'4',b'71456',b'33945',b'False',b'False',b'False',b'False',b'2015-03-03 20:12:15'
b'Shahrukh Ki #Ammi_Jaan Kehti Thi Koi #Danga Chota Nahi Hota\\xa0\\U0001f644\\n\\nHIS Name Is #ShahRukh_Khan \\U0001f437\\n\\nAnd He Is A #Terrorist\\u2026 https://t.co/T5zPEvR04I',b'1232012656208424960',b'S\\u029c\\u1d07\\u1d0b\\u029c\\u1d00\\u0280 C\\u029c\\u1d00\\u029c\\u1d00\\u029f (B\\u029c\\u1d00\\u1d0b\\u1d1b) \\u2122',b'Shekhar_Chahal_',b'Hindustan ',b'\\u092d\\u093e\\u0930\\u0924 \\u0915\\u093e \\u0905\\u092d\\u093f\\u092e\\u093e\\u0928 \\u0939\\u093f\\u0928\\u094d\\u0926\\u0942 \\u092e\\u093e\\u0924\\u0943\\u092d\\u0942\\u092e\\u093f \\u0915\\u0940 \\u0936\\u093e\\u0928 \\u0939\\u093f\\u0928\\u094d\\u0926\\u0942\\U0001f6a9\\n ||Nationalist ||  || Social Worker || \\n\\n||Proud Indian|| #Modi_Bhakt \\U0001f6a9',b'26257',b'13053',b'5',b'2892',b'125590',b'False',b'False',b'True',b'False',b'2017-06-10 06:25:39'
b'WE WANT #muslim_free_India @AmitShah  @narendramodi  @BJP4India \\n.\\n.\\n#hate_Muslim #All_Muslim_terrorist',b'1232012649765822464',b'HatyaraTau',b'hatyara_tau',b'Delhi.',b'\\U0001f44ddO gOOd and gOOd will cOme tO yOu \\U0001f44d',b'8',b'32',b'0',b'47',b'50',b'False',b'False',b'True',b'False',b'2010-02-13 02:29:27'
