"b'@dhanyarajendran Yeah, Pro CAA protestors https://t.co/2VMcauwM47'",b'1231987264734892032',b'Anavaratha',b'Anavaratha5',b'',b'',b'2',b'165',b'0',b'213',b'996',b'False',b'False',b'True',b'False',b'2020-02-07 03:00:10'
"b'@idnani_nandini How do you know ? \\nAny source ,\\nHe is seems like Pro CAA protestor'",b'1231987261883011075',b'Ayaan Malik',b'Ayaanmalik102',b'living in lunar Time',b'Traveling lunar time to Cosmos time',b'73',b'213',b'0',b'810',b'2255',b'False',b'False',b'True',b'False',b'2019-09-17 09:11:35'
b'@AlJazeera_World @UN\\n@anuragkashyap72 @BBCWorld\\n@TheDeshBhakt @cnni\\nhttps://t.co/eWf7IuM5AD: In photos: CAA support\\u2026 https://t.co/2Em1LsrUbO',b'1231987243461550081',b'The Indian Manifesto',b'IndianManifesto',b'India',b'The Indian Manifesto is a Media house aiming to disseminate the truth.',b'14',b'1',b'0',b'74',b'16',b'False',b'False',b'True',b'False',b'2019-12-15 21:02:24'
b'Shame on u Modi and AmitShah\\n\\n#AmitShahMustResign\\n https://t.co/EdjCgXvBUu',b'1231987232006787086',b'GutsyThala',b'GutsyThala',"b'Bengaluru, India'",b'An Ardent ..AGGRESSIVE THALA & DADA Fan !! #StocksTrader #Nifty #BankNifty #Equity #FnO #OptionsTrader #HarmonicPatterns #CandleStick',b'1296',b'386',b'37',b'89733',b'97125',b'False',b'False',b'True',b'False',b'2010-06-29 07:21:13'
"b'@ArifCRafiq @Revenant2k12 ""Please let\\u2019s stop calling them pro CAA. Let\\u2019s call them what they are - Anti Muslim. The\\u2026 https://t.co/uiauiWkmSa'",b'1231987168056401921',b'Zubair Abdullah \\U0001f341',b'Kreeruk',"b'Delhi, India'","b""\\u201cThe worst part of having a mental illness is people expect you to behave as if you don't.""",b'782',b'720',b'1',b'10055',b'31631',b'False',b'False',b'True',b'False',b'2017-04-21 17:45:23'
"b""Former Uttar Pradesh Governor Aziz Qureshi alleged that govt was sending people to raise 'pro-#Pakistan' slogans du\\u2026 https://t.co/AjMUG1coXs""",b'1231987150784258048',b'Economic Times',b'EconomicTimes',b'',"b""India's No. 1 Business Daily that brings you the latest #news updates | A Times Internet Product\\nhttps://t.co/1XskCMZXK5""",b'3432369',b'43',b'7817',b'434232',b'395',b'True',b'False',b'False',b'False',b'2009-05-13 12:54:58'
"b'@GautamGambhir @DelhiPolice Boss, why selective words? Anti CAA bade asaani se use kar liya why not Pro CAA? Videos\\u2026 https://t.co/RQ6V9tPBLX'",b'1231987078285545478',b'Sadhvi Pragya ke Father',b'bhopdi',b'',b'Abhi apne ko Guru Ji jaisa banne ka hai ....',b'3',b'79',b'0',b'538',b'247',b'False',b'False',b'True',b'False',b'2019-02-18 18:50:57'
b'@sardesairajdeep Please let\\u2019s stop calling them pro CAA. Let\\u2019s call them what they are - Anti Muslim. They don\\u2019t gi\\u2026 https://t.co/UtzGxbmNx9',b'1231987033209540610',b'mohit arora',b'mohittara01',"b'New Delhi, India'",b'',b'13',b'44',b'0',b'42',b'461',b'False',b'False',b'False',b'False',b'2011-07-24 09:42:12'
b'Pro CAA Terrorists. https://t.co/CftPeLV6gv',b'1231986970370293760',b'Orwellian Bareillian \\U0001f1ee\\U0001f1f3',b'Blast_Famous',b'Mera Bharat Mahaan',b'Notionalist. Pseudo-fenimist. Right Wind. Dashbhakt. Ape-Political. Chowkidhani.',b'1743',b'1609',b'40',b'34792',b'23290',b'False',b'False',b'False',b'False',b'2012-02-17 11:33:38'
b'Pro CAA = anti Muslim.\\n#DelhiPolice #DelhiBurning #homeministry #statesponsoredterror https://t.co/6xHd9PQPlc',b'1231986945259180034',b'Varsha Agni',b'varshaagnihotri',b'mumbai',b'Patron saint of the Indian Singles! Yeh hum nahi kehte zamana kehta hai!\\nViews are personal.',b'1093',b'535',b'3',b'5851',b'229',b'False',b'False',b'False',b'False',b'2009-07-15 17:04:36'
"b'Yesterday Pro CAA gang lauded and praised terrorist Kapil Mishra.\\n\\nToday feel the outcome of it, that is\\u2026 https://t.co/e1bacXgsEa'",b'1231986858399158273',b'HumanLife',b'PeacefulHind',b'India',"b'Whoever saves the life of one person, is as if he had saved the life of all mankind;                    \\n\\n (Al Quran 5.32)'",b'51',b'1',b'0',b'4888',b'2313',b'False',b'False',b'True',b'False',b'2017-06-14 03:18:15'
b'@LoneWolf4568 @dimplejethani @icedtea28 @ippatel @DelhiPolice Obviously they should be punished. If that were my pr\\u2026 https://t.co/rt1Cempsjr',b'1231986803629936649',b'Rasha Fathima',b'rasha_fathima20',"b'Karnataka, India'",b'INDIAN\\U0001f1ee\\U0001f1f3  \\n#Writer @wordpress @quora',b'53',b'461',b'0',b'179',b'247',b'False',b'False',b'True',b'False',b'2015-09-06 19:10:53'
b'@ReutersIndia @husainhaqqani Delhi turned into battle zone between pro &amp; anti CAA. Shaheen Bagh ut zayo our kithna khuoon our chayiye',b'1231986758306287629',b'Vithesh Johnson',b'JohnsonVithesh',b'',b'Service Department',b'6',b'64',b'0',b'547',b'1763',b'False',b'False',b'True',b'False',b'2018-11-30 07:34:36'
b'Hmm even these guys felt safer with the pro CAA folks (mostly hindu) than to be with and shoot video from the anti\\u2026 https://t.co/Dscw2QZm5c',b'1231986745832398850',b'Ashish Gupta',b'GuptaAsh',b'India',"b""There's No Moderate M! their exclusivist religion does not allow atheism nor acceptance of another religion. Its either an Ex-M or practicing M. There i said it""",b'261',b'76',b'10',b'76595',b'443',b'False',b'False',b'True',b'False',b'2009-05-20 13:42:32'
b'Pro CAA = Pro Hindutva = Pro Terrorism',b'1231986715276922882',b'Sushovan Chaudhuri #DestroyTheAadhaar',b'mesushovan',b'India',"b'#Advertising, #Media, #Writing, #Designing, #Women, #Children, #Politics, #Economics, #Cricket, #Badminton, #Music, precisely #Singing, help me live.'",b'733',b'116',b'196',b'39282',b'223',b'False',b'False',b'False',b'False',b'2010-03-06 17:54:24'
b'@_YogendraYadav Right. Neither Pro CAA nor Anti CAA. People like you are responsible for these deaths.',b'1231986689515642880',b'Sunita singh',b'Sunitasingh2017',b'',b'Always on the right',b'25',b'118',b'0',b'758',b'989',b'False',b'False',b'True',b'False',b'2017-02-10 07:38:35'
"b'@anuragkashyap72 Pro CAA means Pro Humanity, Anti CAA is nothing but farce for religious bigotry'",b'1231986663183785984',b'vivek singh bhardwaj',b'vivekbhardwajv',b'',b'',b'48',b'1172',b'0',b'1255',b'16575',b'False',b'False',b'True',b'False',b'2016-12-04 10:35:29'
b'@PJkanojia Anti CAA YA pro CAA ki baat nahi hai baat hai 90 din se road block karna sahi hai ya galt https://t.co/ftiAAWHFvB',b'1231986601024217088',b'kaushal',b'kaushal______',b'',b'simply indian',b'255',b'1330',b'2',b'12687',b'18225',b'False',b'False',b'True',b'False',b'2016-03-12 18:19:01'
b'@anuragkashyap72 Pro CAA protestor SHAHRUKH https://t.co/cZg31rU3qM',b'1231986578777608198',b'Nicky \\u0fd7',b'Who_Is_Nicky',"b'Tora Bora, Eastern Afghanistan'","b'Lost my moral compass somewhere around here, have you seen it? Kaafi liberal! [He/him/bsdk] #ViratBullai'",b'1437',b'240',b'12',b'12012',b'14363',b'False',b'False',b'True',b'False',b'2017-03-24 12:50:53'
b'@anuragkashyap72 CAA jab anti Muslim h.. to pro CAA hua hi na.. yeh din Bina dekhe b smjh sakte h. You are late sirjee..',b'1231986564630241280',b'abdul qadir',b'aq_jeenwala',"b'Hyderabad, India'",b'just want to learn n understand',b'62',b'175',b'1',b'6786',b'23162',b'False',b'False',b'False',b'False',b'2009-09-26 04:25:46'
b'@Khushbookhan_ Acha aisa he Kya?? But didi ders no reason for Pro CAA protesters to get violent. As it has become a\\u2026 https://t.co/aaezQpRxLp',b'1231986450784116738',b'Siddhesh Ahirrao',b'AhirraoSiddhesh',b'',b'',b'0',b'3',b'0',b'27',b'75',b'False',b'False',b'True',b'False',b'2020-02-05 18:48:14'
b'@mufattgirl @AdvancedMaushi Speculative..\\nUnclear..\\n\\nBut well known fact that fight was between anti-caa &amp; pro caa\\u2026 https://t.co/ajVdVCcLdp',b'1231986363957948421',b'Philomath\\U0001f468\\U0001f3fb\\u200d\\U0001f4bb',b'Geekyphilomath',b'',b'J&K \\U0001f1ee\\U0001f1f3 Vegetarian\\u2618\\ufe0f Hotelier\\U0001f378\\U0001f37b Army brat\\U0001f4aa\\U0001f3fb Traveller\\U0001f3d5 Sports enthusiast\\u26bd\\ufe0f\\U0001f3cf Gamer\\U0001f3ae philomath \\U0001f4bb Pets\\U0001f43e novels \\U0001f4da Right wing \\u0950 \\U0001f1ee\\U0001f1f3\\U0001f6a9',b'120',b'1672',b'0',b'1521',b'10045',b'False',b'False',b'True',b'False',b'2019-06-19 18:18:13'
b'@rheakatta @Kiyaramalik12 @nazru97 @thewire_in @KapilMishra_IND @PMOIndia Kya kuch bhi bol rahe ho pro CAA wale nah\\u2026 https://t.co/2mecGL8QWy',b'1231986360162099200',b'Sarang98',b'Sarang984',b'',b'',b'17',b'129',b'0',b'363',b'1778',b'False',b'False',b'True',b'False',b'2020-02-10 05:26:06'
b'@imprernakumari @narendramodi @AmitShah @AmitShahOffice @ianuragthakur @ajayvats117 @rakeshpande_IND\\u2026 https://t.co/ekcKfzw2kA',b'1231986356261249024',b'shaik khaja',b'khajushaik',b'',b'',b'12',b'198',b'0',b'687',b'3210',b'False',b'True',b'True',b'False',b'2010-07-17 08:21:02'
"b'In photos: CAA supporters attack Muslims at Delhi protest, hurl stones and petrol bombs  https://t.co/XYC25JVcUv vi\\u2026 https://t.co/ILa5RRottV'",b'1231986333595394048',b'red3502508',b'red3502508',b'\\u2764\\ufe0fUAE\\U0001f31fPAK\\U0001f49aKSA\\U0001f31fTURKY\\u2764\\ufe0f',"b'If U\\u2019R struggling that means U\\u2019R progressing,to avoid criticism,SAY nothing, DO nothing, BE nothing'",b'1041',b'2684',b'4',b'36225',b'14799',b'False',b'False',b'False',b'False',b'2012-02-01 19:45:47'
b'RSS and pro CAA Sanghi goons are attacking Muslim homes and anti CAA protestors in NE Delhi. Various videos show De\\u2026 https://t.co/HZOnBfaDhX',b'1231986283683155968',b'ibrahim khan',b'ibrahimkhan599',b'',b'\\u200f\\u200f\\u200f\\u200f\\u062f\\u0641\\u0627\\u0639 \\u0635\\u062d\\u0627\\u0628\\u06c1 \\u06a9\\u06d2 \\u0644\\u06cc\\u06d2 \\u062c\\u0627\\u0646 \\u0628\\u06be\\u06cc \\u0642\\u0631\\u0628\\u0627\\u0646 \\u06be\\u06cc\\u06ba',b'256',b'393',b'0',b'633',b'7241',b'False',b'False',b'True',b'False',b'2017-01-29 15:38:51'
"b'In photos: CAA supporters attack Muslims at Delhi protest, pelt stones and petrol bombs https://t.co/JHHtV134r0'",b'1231986260543066114',b'Anas Wajid',b'anaswajid',b'New Delhi',b'Concerned',b'460',b'199',b'4',b'3330',b'1339',b'False',b'False',b'False',b'False',b'2009-03-14 10:30:36'
b'@anuragkashyap72 @DrHarjitBhatti \\u0906\\u0917\\u0947 \\u0938\\u0947 \\u0938\\u094b\\u091a \\u0938\\u092e\\u091d \\u0915\\u0947 \\u092c\\u093e\\u0939\\u0930 \\u0928\\u093f\\u0915\\u0932\\u0928\\u093e \\u0915\\u094d\\u092f\\u094b\\u0902\\u0915\\u093f 15 \\u0915\\u0930\\u094b\\u0921\\u093c \\u0915\\u094b \\u091b\\u094b\\u0921\\u093c \\u0915\\u0930 \\u092c\\u093e\\u0915\\u0940 \\u0938\\u092d\\u0940 PRO CAA \\u0935\\u093e\\u0932\\u0947 \\u0939\\u0948\\u2026 https://t.co/kzafNFpApX',b'1231986246186078208',b'AadiTya',b'imaadityasaini',b'India',b'kya kroge jankar',b'19',b'342',b'0',b'897',b'466',b'False',b'False',b'True',b'False',b'2017-08-17 08:42:23'
b'https://t.co/X2K3vJ07sq',b'1231986245259018241',b'shaik khaja',b'khajushaik',b'',b'',b'12',b'198',b'0',b'687',b'3210',b'False',b'True',b'True',b'False',b'2010-07-17 08:21:02'
"b'Pro CAA protestor- equivalent to calling terrorists, freedom fighters'",b'1231986197238616065',b'Ajith',b'ajith27',b'Mumbai',"b'There was a time when Twitter and I both were fun. Btw, Kagaz nahin dikhayenge'",b'6362',b'753',b'84',b'66061',b'9572',b'False',b'False',b'False',b'False',b'2008-09-01 15:43:46'
b'@Ankur90989077 https://t.co/X2K3vJ07sq',b'1231986143572320256',b'shaik khaja',b'khajushaik',b'',b'',b'12',b'198',b'0',b'687',b'3210',b'False',b'True',b'True',b'False',b'2010-07-17 08:21:02'
"b""Now they are pinning this pre planned violence on pro CAA protestors. This trend isn't new they have done it in the\\u2026 https://t.co/Gh3nKe71Dn""",b'1231986131517882368',b'Rakesh \\U0001f1ee\\U0001f1f3',b'Kumar_rakesh96',"b'Jalandhar,Punjab'",b'RTs are not endorsements. views are personal',b'34',b'125',b'0',b'10911',b'24520',b'False',b'False',b'True',b'False',b'2015-10-19 17:14:49'
b'@Crzygal_03 @hmzaffar @ReutersIndia He was killed by pro caa crowd',b'1231986092334710789',b'Joe',b'eldojk',b'',b'',b'1',b'95',b'0',b'37',b'675',b'False',b'False',b'True',b'False',b'2012-12-19 12:45:17'
"b'In photos: CAA supporters attack Muslims at Delhi protest, hurl stones and petrol bombs\\n\\nhttps://t.co/HNMMxNHRPi https://t.co/f7xSt8ONmP'",b'1231986064148946946',b'antokannan',b'antokannankt',b'',"b'\\u0d05\\u0d24\\u0d46, \\u0d1a\\u0d46\\u0d31\\u0d41\\u0d24\\u0d4d\\u0d24\\u0d41\\u0d28\\u0d3f\\u0d7d\\u0d2a\\u0d4d\\u0d2a\\u0d4d \\u0d38\\u0d3e\\u0d27\\u0d4d\\u0d2f\\u0d2e\\u0d3e\\u0d23\\u0d4d'",b'138',b'1476',b'1',b'14041',b'4466',b'False',b'False',b'False',b'False',b'2009-07-14 17:37:24'
b'Thoughts and prayers with Head Constable Ratan Lal\\u2019s family. He is survived by wife and three children. \\n\\nViolence\\u2026 https://t.co/5XzSN0V9xP',b'1231986047724081165',b'Ahad Zaidi',b'AhadZaidi3',b'',"b'Tweets are personal,  RT not endorsement'",b'277',b'581',b'0',b'11082',b'10930',b'False',b'False',b'True',b'False',b'2019-03-21 14:17:03'
b'@Kritika_Kamra So anti CAA are either against humanity or pro terrorist.',b'1231986045715206146',b'Anupam Singh',b'AnupamCrazyone',"b'Budapest, Hungary'",b'',b'6',b'99',b'0',b'844',b'352',b'False',b'False',b'True',b'False',b'2018-06-17 14:36:30'
b'@anuragkashyap72 Pro CAA mean terrorists and nothing else.',b'1231986003469979648',b'Ansari Association of Bihar\\u2122',b'AABBihar',b'Patna (Bihar)',"b'For Socio-economic & Educational Empowerment & For Equality of status and of opportunity (social Justice).\\u0905\\u092a\\u0928\\u0940 \\u090f\\u0915\\u0924\\u093e \\u092c\\u0928\\u093e\\u0928\\u093e \\u0939\\u0948, \\u0905\\u092a\\u0928\\u093e \\u0939\\u0915 \\u0914\\u0930 \\u0905\\u0927\\u093f\\u0915\\u093e\\u0930 \\u092a\\u093e\\u0928\\u093e \\u0939\\u0948\\u0964'",b'870',b'1550',b'1',b'6851',b'11274',b'False',b'False',b'False',b'False',b'2017-03-24 18:44:52'
"b""@sarcasticvoter1 @sakshijoshii I haven't disagreed about stone pelting from both sides. But @DelhiPolice stands wit\\u2026 https://t.co/DeU4GPaPii""",b'1231985996327079940',b'Syed Adnan Ali',b'TheAdnanKazmi',"b'Jaipur, India'",b'A .NET Software & Web Developer.',b'305',b'2077',b'1',b'2768',b'34228',b'False',b'False',b'False',b'False',b'2013-01-17 13:51:34'
"b'Both, anti and pro CAA protests are disgrace on our society. kudos to stupids who handed it easily to political vul\\u2026 https://t.co/rCBG3ERbJe'",b'1231985973484900355',b'Nikhil Chandra',b'anikhilchandra',b'India',b'Occasional Writer.',b'263',b'97',b'3',b'6394',b'9644',b'False',b'False',b'False',b'False',b'2009-10-20 05:30:27'
b'@DelhiPolice Shame on you.\\nAnti CAA protestors pe brutal lathi charge aur pro CAA gundas ke saath mil kar stone pelting.',b'1231985965868232704',b'Prateek Singh',b'psm_3005',b' New Delhi',"b""One day you'll all know who I am.                \\n\\nSabhi ka khoon hai shamil yaha ki mitti me, kisi ke baap ka hindustan thodi hai.""",b'73',b'368',b'1',b'1179',b'6908',b'False',b'False',b'False',b'False',b'2013-12-03 10:52:12'
b'@bhav2406 @Manesha76 @meghavi199 @SansLaVoix PFI is behind this. In KA they wanted to @Tejasvi_Surya and RW idealog\\u2026 https://t.co/ZdeiIH6ZxQ',b'1231985932544299012',b'\\U0001f981|Guruji Tweets|\\U0001f981',b'Guruji_speaks',b'Coastal Karnataka  Expressway',b'|18|  |Aeronautical Engg|\\u2708\\ufe0f | Member of Amruta Bhabhi Vahini| |Learning Photography\\U0001f4f8|IT Cell Member of HMP|',b'298',b'1458',b'0',b'6193',b'6591',b'False',b'False',b'True',b'False',b'2019-10-09 02:01:33'
b'@anuragkashyap72 @DrHarjitBhatti This is idiotism at best....Am pro -CAA...but not anti to anyone......and rule of law shud be enforced....',b'1231985925699194884',b'Dr. vikalp bhatia',b'vikalpbhatia1',"b'Rohtak, India'","b'\\U0001f6a9\\U0001f6a9doctor,nationalist,any view r just personal, just hate dynasty,\\U0001f6a9\\U0001f6a9 MEDEVISION,ABVPian ,\\u0930\\u094b\\u0939\\u0924\\u0915 \\u092e\\u0939\\u093e\\u0928\\u0917\\u0930 \\u0938\\u0939\\u092e\\u0902\\u0924\\u094d\\u0930\\u0940! @abvpvoice...'",b'162',b'886',b'0',b'1361',b'3429',b'False',b'False',b'True',b'False',b'2015-01-25 06:06:09'
b'https://t.co/ez1FqYBX2x',b'1231985922843037696',b'Herodote63',b'herodote63',b'',"b'Tech, Philosophy, Music, Swimming, Hiking and Pilates'",b'1',b'0',b'1',b'6017',b'0',b'False',b'False',b'True',b'False',b'2018-08-15 12:07:26'
b'@RanaAyyub @realDonaldTrump Boring.But good to see Pro CAA are fighting back.Anti- CAA for show case as if American\\u2026 https://t.co/Wbk0sNoXiW',b'1231985901699465216',b'Shree Gharudaazhvaan',b'Gharudan_2015',b'',b'',b'963',b'1817',b'2',b'28979',b'13056',b'False',b'False',b'False',b'False',b'2016-01-10 03:53:37'
b'Posampa bhai Posampa..\\nJamna Paar mai Kya hua..?\\nEk Ladka (Kapil Mishra) ne Apni marai..\\nAb to sab (Pro CAA) ko aan\\u2026 https://t.co/ypcLELxTCf',b'1231985880086327297',b'Oye Amaan',b'AmaanOye',b'',b'Log on Earth on 5th June\\n#17 teen\\n#Delhi se hu BC\\U0001f4aa\\n#Sarcastic Memer',b'18',b'60',b'0',b'67',b'228',b'False',b'False',b'True',b'False',b'2018-06-06 09:57:10'
b'#Shame on Delhi Police\\U0001f621\\n\\nPRO- #CAA supporters doing riots in front of delhi police.\\nthey are pelting stones and fir\\u2026 https://t.co/Uq5KqkJCAb',b'1231985877259149312',b'Azam Nawaz',b'azamnawaaz',b'Hyderabad',b'Strong Walls shake but Never Collapse | Socialist | Politics | & Tweets are personal.',b'916',b'298',b'0',b'17262',b'29695',b'False',b'False',b'True',b'False',b'2015-12-03 12:45:09'
b'#ShahMustResign\\n#ShahMustResign\\n*Right Now*There is widespread violence in many areas of Delhi right now and clashe\\u2026 https://t.co/S9L22Khbm3',b'1231985825916870657',b'Md Shahzad',b'MdShahz36495790',"b'New Delhi, India'",b'\\u092e\\u0947\\u0930\\u0940 \\u0935\\u093f\\u091a\\u093e\\u0930\\u0927\\u093e\\u0930\\u093e \\u0917\\u093e\\u0901\\u0927\\u0940 \\u091c\\u0940 \\u0915\\u0940 \\u092a\\u0930 \\u0924\\u0947\\u0935\\u0930 \\u092d\\u0917\\u0924 \\u0938\\u093f\\u0902\\u0939 \\u0935\\u093e\\u0932\\u093e',b'3',b'33',b'0',b'8',b'40',b'False',b'False',b'True',b'False',b'2020-02-08 10:22:24'
b'@ZLaTaNp1KacHu10 https://t.co/X2K3vJ07sq',b'1231985793041747968',b'shaik khaja',b'khajushaik',b'',b'',b'12',b'198',b'0',b'687',b'3210',b'False',b'True',b'True',b'False',b'2010-07-17 08:21:02'
b'And more likely killed by the pro CAA rioters themselves! https://t.co/DhqIBH8ixT',b'1231985740537450499',b'Sylvia Francis',b'sylviafrancis20',b'Trivandrum',"b'PG Eng Lit & HR. 35 years with CARE USA in India Somalia Moscow Tanzania Kosovo Tajikistan. Run Graceful Homestay,Trivandrum. Hobbies:teach French & tend garden'",b'1044',b'1598',b'11',b'27423',b'71408',b'False',b'False',b'True',b'False',b'2009-12-30 11:54:34'
b'Please let\\u2019s stop calling them pro CAA. Let\\u2019s call them what they are - Anti Muslim. They don\\u2019t give a damn about C\\u2026 https://t.co/j6LyPkOoUz',b'1231985708211900417',b'Syed Adnan Ali',b'TheAdnanKazmi',"b'Jaipur, India'",b'A .NET Software & Web Developer.',b'305',b'2077',b'1',b'2768',b'34228',b'False',b'False',b'False',b'False',b'2013-01-17 13:51:34'
"b'Dear senior journalists, \\n\\nCAA is already an act. \\n\\nThere can be no such thing as \\u2018Pro CAA protestors\\u2019. \\n\\nThose who\\u2026 https://t.co/9hZt8JDN7e'",b'1231985675802750976',b'Himanshu Agrawal',b'Himansh56735438',b'indore',"b""\\U0001f4b2ENTREPRENEUR \\n\\U0001f4d6AUTHOR\\n\\U0001f468\\u200d\\U0001f3a4PUBLIC SPEAKER\\n.\\nI'll let my actions speak\\nand ya! they are a little louder too.\\n.\\nINDORE| 20\\nCo-founder of @fibhub""",b'57',b'5',b'0',b'150',b'116',b'False',b'False',b'True',b'False',b'2018-08-17 16:41:19'
"b'The Telegraph Online was forced to... delete a video recorded on our reporter\'s phone. ""We will not allow anyone to\\u2026 https://t.co/75gVTL8VIF'",b'1231985636485234688',b'NMF',b'nmodifacts',b'India',"b'Mapping the rise of fascism in India. Non-partisan. New(ish) to twitter, but our website has been going for six years.'",b'69',b'322',b'0',b'818',b'2163',b'False',b'False',b'True',b'False',b'2019-12-18 11:29:25'
"b'@Scavino45 @realDonaldTrump Chandbagh: Continuous stone pelting is going, Cars and public properties set on fire by\\u2026 https://t.co/eY49Jg5tlZ'",b'1231985616252030977',b'Nobody',b'Nobody67860531',b'',b'bigtooth',b'1041',b'973',b'0',b'8706',b'6584',b'False',b'False',b'True',b'False',b'2019-08-17 20:51:01'
"b""CAA is already a law that is in effect. The so called 'Pro CAA Protest' is just a reason to collect BJP goons toget\\u2026 https://t.co/SGx8MC2Tyn""",b'1231985513512357897',b'Husbanding',b'tapanwaval',b'Singapore/ Pune',b'Wife thinks I need improvements...Tweets are personal (But owned by my wife like everything else)',b'329',b'1682',b'20',b'5892',b'29985',b'False',b'False',b'True',b'False',b'2014-04-12 06:06:13'
b'Courts of India; how long will you continue looking away?\\n\\nhttps://t.co/oDswt96TwK',b'1231985489751793665',b'Adhip',b'mad_adhip',"b'Bengaluru, India'",b'Physics Postdoc@ICTS. Also Mad :)',b'25',b'120',b'0',b'262',b'267',b'False',b'False',b'True',b'False',b'2017-08-20 04:31:10'
b'@Fatima_Z0hra @asadowaisi @_YogendraYadav I think this is disgusting. \\n@_YogendraYadav ideologically close to ANTI\\u2026 https://t.co/MZnwHSfo8P',b'1231985405395795969',b'\\u090f\\u0915 \\u092d\\u093e\\u0930\\u0924\\u0940\\u092f \\u0915\\u0940 \\u092d\\u0921\\u093c\\u093e\\u0938',b'bhadashindi',b'',b'',b'3',b'75',b'0',b'86',b'818',b'False',b'False',b'True',b'False',b'2020-01-28 17:59:42'
b'@satish_jnu @DelhiPolice @narendramodi @BBCNews Shocking pics coming from north east Delhi. Stone pelting and clash\\u2026 https://t.co/eL6kZTqAzt',b'1231985358381953027',b'Pawan Rai',b'PawanRa27933635',"b'New Delhi, India'",b'\\u092e\\u0948\\u0902 \\u0938\\u0935\\u093e\\u0932\\u094b\\u0902 \\u0938\\u0947 \\u092d\\u0940 \\u0938\\u0935\\u093e\\u0932 \\u092a\\u0942\\u091b\\u0924\\u093e \\u0939\\u0942\\u0901 \\n\\u0920\\u0939\\u0930\\u0928\\u093e \\u092e\\u0947\\u0930\\u0940 \\u092b\\u093c\\u093f\\u0924\\u0930\\u0924 \\u092e\\u0947\\u0902 \\u0928\\u0939\\u0940\\u0902 |',b'22',b'299',b'0',b'134',b'210',b'False',b'False',b'True',b'False',b'2019-09-19 05:01:16'
b'Pro NRC CAA Protestor leading a violent mob with alongwith bhagwa behind was identified by Godi Media as #shahrukh\\u2026 https://t.co/1jRXrMdkuS',b'1231985333819985921',b'\\U0001f941\\U0001f50a\\U0001f4c9 UnderStand Chronology & Ppl Sufferings',b'inti_i',"b'New Delhi, India'","b'MKTG Pro 15+ yrs in Service+Laid OFF Due to Modinomics, \\n\\u0905\\u095b\\u0932 \\u0938\\u0947 \\u092c\\u0938 \\u0917\\u0908 \\u0939\\u0948 \\u0938\\u0930 \\u092c\\u0932\\u0901\\u0926\\u0940 \\u0905\\u092a\\u0928\\u0940 \\u095e\\u093f\\u0924\\u0930\\u0924 \\u092e\\u0947\\n\\u0939\\u092e\\u0947 \\u091f\\u0942\\u091f \\u091c\\u093e\\u0928\\u093e \\u0906\\u0924\\u093e \\u0939\\u0948 \\u0938\\u0930 \\u091d\\u0941\\u0915\\u093e\\u0928\\u093e \\u0928\\u0939\\u0940 \\u0906\\u0924\\u093e'",b'8523',b'2337',b'58',b'93417',b'11125',b'False',b'False',b'False',b'False',b'2011-05-18 05:27:29'
"b'@Scavino45 @realDonaldTrump Chandbagh: Continuous stone pelting is going, Cars and public properties set on fire by\\u2026 https://t.co/a2png2B1b4'",b'1231985320205443072',b'Nobody',b'Nobody67860531',b'',b'bigtooth',b'1041',b'973',b'0',b'8706',b'6584',b'False',b'False',b'True',b'False',b'2019-08-17 20:51:01'
b'Please let\\u2019s stop calling them pro CAA. Let\\u2019s call them what they are - Anti Muslim. They don\\u2019t give a damn about C\\u2026 https://t.co/2mBRNq0zxF',b'1231985314605879298',b'Saddam Husen',b'SaddamH_92',b'',b'Just a poet...',b'111',b'197',b'0',b'3817',b'3852',b'False',b'False',b'True',b'False',b'2019-12-17 11:27:17'
"b""Nothing can be expected Logical from @republic journalist who don't even know that these are Pro CAA supporters who\\u2026 https://t.co/nHcShEreD7""",b'1231985270519730177',b'Doland Trumph (Best Friend Of Modiji)',b'indian_armada',b'Since 2010',"b""Parody Joker. Photoshop for Pun. Be an Unbiased Intellectual, Fandom won't feed ur family. Seems like you have seen my memes before. \\u0935\\u094d\\u092f\\u0902\\u0917\\u0936\\u093e\\u0938\\u094d\\u0924\\u094d\\u0930 to \\u0915\\u093e\\u092e\\u0936\\u093e\\u0938\\u094d\\u0924\\u094d\\u0930.""",b'4529',b'86',b'5',b'12312',b'18711',b'False',b'False',b'True',b'False',b'2019-10-11 17:30:17'
b'@Kritika_Kamra Another pro CAA protestor Shahrukh shooting at police. https://t.co/86EeHZujCh',b'1231985249913114624',b'Nicky \\u0fd7',b'Who_Is_Nicky',"b'Tora Bora, Eastern Afghanistan'","b'Lost my moral compass somewhere around here, have you seen it? Kaafi liberal! [He/him/bsdk] #ViratBullai'",b'1437',b'240',b'12',b'12012',b'14363',b'False',b'False',b'True',b'False',b'2017-03-24 12:50:53'
b'You are taking on largest political party of Bharat in national capital upon fomented by political party &amp; conseque\\u2026 https://t.co/Mtmi8zUni1',b'1231985241083895808',b'Nuclear Kaushal',b'NuclearKaushal',b'',"b'Born on Sun number who controls governance, fathers, egalitarian, pure, sweetness in grains but after roasting at 45 degrees, education & exempted from MISERIES'",b'221',b'172',b'1',b'10708',b'1626',b'False',b'False',b'True',b'False',b'2019-11-02 12:56:36'
b'@AdityaRajKaul Dumb so called journalist has no ethics.. Turns blind eye to pro CAA people.. \\nShame',b'1231985217881006080',b'Indianousaur',b'indianosaur',b'',"b'I pay tax, naturally I am a philanthropist. \\n Get \\U0001f514 from Govt.. \\n.... Believe Reservation = Terrorism'",b'71',b'179',b'7',b'11414',b'13698',b'False',b'False',b'True',b'False',b'2010-03-25 15:25:39'
b'@svaradarajan @narendramodi According to Conspiracy agent Siddharth. BJP brought out ppl from PRO and OPP CAA camps\\u2026 https://t.co/G1GU6Jvw9x',b'1231985186335854592',b'Aman Kashyap',b'AmanKashyap89',"b""Middle kingdom's neighbour""","b'Enthusiastic about military,strategic affairs, Futuristic technologies,Space.\\nFor me Twitter is a place to learn and have fun'",b'151',b'496',b'2',b'6433',b'22795',b'False',b'False',b'True',b'False',b'2017-02-01 18:38:22'
