b'LBH PU yg selama ini gigih membela kepentingan Islam &amp; kaum Muslim tengah alami kriminalisasi. Kami bersama LBH PU\\u2026 https://t.co/pAdlPDOqpD',b'1232226040740663296',b'Penjahit Yuni',b'PenjahitYuni',b'',b'Penjahit profesional',b'38',b'152',b'0',b'947',b'40',b'False',b'False',b'True',b'False',b'2019-12-13 02:46:02'
"b'@MonkeyD68239989 Kami, umat muslim bersatu siap mengawal dan membelanya.\\n &gt;&gt; #SaveAdvokatPejuang &lt;&lt;\\u2026 https://t.co/EjFXz3QExJ'",b'1232226040149229568',b'Hendi@78',b'Hendi71292865',b'',b'wirausaha',b'142',b'54',b'0',b'170',b'2',b'False',b'False',b'True',b'False',b'2019-02-21 14:37:34'
b'Umat bersama LBH PU membela perjuangan kaum Muslim utk melanjutkan kehidupan Islam.\\n &gt;&gt; #SaveAdvokatPejuang &lt;&lt;\\u2026 https://t.co/7YbmsX9zcM',b'1232226034554007553',b'fauziah',b'myname_fauziah',"b'Malang, Jawa Timur'",b'Haarisan Aminaan Lil Islam \\n\\nEnjoy your life with Islam.. \\nAllah always listening and understanding',b'108',b'118',b'0',b'535',b'761',b'False',b'False',b'False',b'False',b'2019-02-16 15:17:46'
b'@SmokingSkills_ Dekh kejruiddin Tere mulle @ArvindKejriwal @msisodia Arrest all them they all are Muslim. kyu\\u2026 https://t.co/Wsec5k8dJz',b'1232226031882338304',b'Dainik Prajapati',b'PrajapatiDainik',"b'Ahmadabad City, India'",b'\\u0ab9\\u0abf\\u0a82\\u0aa6\\u0ac1 \\u0aad\\u0abe\\u0ab0\\u0aa4\\u0ac0\\u0aaf',b'62',b'111',b'0',b'1941',b'5443',b'False',b'False',b'True',b'False',b'2015-12-09 12:23:59'
"b'@Fahruro86 Kami, umat muslim bersatu siap mengawal dan membelanya.\\n &gt;&gt; #SaveAdvokatPejuang &lt;&lt;\\u2026 https://t.co/O0f50TXE2m'",b'1232226023774674945',b'Kejorarindu',b'Ifa58867237',b'',b'Berjuang selelahnya',b'12',b'112',b'0',b'55',b'0',b'False',b'False',b'True',b'False',b'2020-02-23 14:13:00'
b'Hukum buatan manusia yg ada di negeri ini sangat lemah dan faktanya selalu digunakan untuk kepentingan penguasa men\\u2026 https://t.co/iqsg9Fdmp6',b'1232226006456365056',b'Anti Kegelapan',b'wahiki1',b'',b'',b'43',b'81',b'0',b'349',b'52',b'False',b'False',b'True',b'False',b'2020-02-22 14:57:35'
b'LBH PU yg selama ini gigih membela kepentingan Islam &amp; kaum Muslim tengah alami kriminalisasi. Kami bersama LBH PU\\u2026 https://t.co/h9Gz8Gocwf',b'1232226004074143744',b'Lifibhyka',b'lifibhyka',b'',b'smoga slalu istikhomah di jalan dakwah',b'73',b'98',b'0',b'487',b'119',b'False',b'False',b'True',b'False',b'2019-03-06 13:15:51'
b'@Furkan__Ali @RanaAyyub Aur muslim aatankee',b'1232226000550780928',b'ejkewk',b'aiahhg1',b'',b'',b'2',b'4',b'0',b'32',b'11',b'False',b'False',b'True',b'False',b'2019-10-10 08:51:58'
b'@AltNews pls see this is amazing video of peaceful muslim saving humanities \\U0001f493\\U0001f493\\n@Javedakhtarjadu @anuragkashyap72\\u2026 https://t.co/2FJ4ppLT3B',b'1232225982464970752',b'Chora-Harynavi\\U0001f4aa\\u270c\\ufe0f\\U0001f60e\\U0001f1ee\\U0001f1f3',b'rao_rajkr143',b'Gurgaon India',b'#NationFirst #ProudHindu #DieHardArmyFan #RespectForPMModi #FanOfAPJKalamSir #RespectForKakoriConsiracyBoys #AlwaysReadyToHelpWomen #LookingForJob JaiHind\\U0001f1ee\\U0001f1f3\\U0001f44d',b'179',b'880',b'0',b'13923',b'41569',b'False',b'False',b'True',b'False',b'2013-08-06 03:49:42'
"b'Saya menolak segala bentuk kriminalisasi kepada saudara muslim, tak terkecuali pada Ahmad Khazinudin ketua LBH Peli\\u2026 https://t.co/fdgqoUsBVc'",b'1232225981215035393',b'Kejorarindu',b'Ifa58867237',b'',b'Berjuang selelahnya',b'12',b'112',b'0',b'55',b'0',b'False',b'False',b'True',b'False',b'2020-02-23 14:13:00'
"b""@RealKrutika Make some other account for this political POV!U lost followers because Most of the people don't share\\u2026 https://t.co/7ghip82gSe""",b'1232225977985421312',b'Anoushka.S (AsimRiaz\\U0001f60d)',b'Anoushk15998363',b'',b'Hello all\\u2764\\ufe0f\\n19 y/o\\njoined Twitter for Asim!! \\nFan of #AsimRiaz \\u2764\\ufe0f\\U0001f60d',b'243',b'305',b'0',b'3922',b'10569',b'False',b'False',b'True',b'False',b'2019-12-07 12:47:57'
"b'@Ai14532 Saya muslim, saya bersama LBH Pelita Umat melibas ketidak adilan\\n &gt;&gt; #SaveAdvokatPejuang &lt;&lt;\\u2026 https://t.co/5jSpTrVwpZ'",b'1232225976815255552',b'SalmaSasa\\U0001f337',b'Salmasyihabudd1',b'Makassar',b'bikin akun lagi\\U0001f601',b'30',b'45',b'0',b'525',b'1169',b'False',b'False',b'True',b'False',b'2019-11-20 09:14:31'
b'@SalmanNizami_ @INCIndia ke chakkar me pichhle kai decades me aap jaise muslim Netao ne apni biradari ko dango ke h\\u2026 https://t.co/KHNq6tyUir',b'1232225975984775168',b'Sanjay Srivastava',b'SanjaySK2829',b'',b'',b'5',b'316',b'0',b'252',b'561',b'False',b'False',b'True',b'False',b'2019-12-15 09:38:10'
"b'Kepada umat Islam galak, ketika muslim trus dihinakan hukum jadi tumpul\\n &gt;&gt; #SaveAdvokatPejuang &lt;&lt;\\u2026 https://t.co/GMEEvorU2t'",b'1232225964249186304',b'Nurhayati',b'Nurhaya78420851',b'',b'',b'10',b'17',b'0',b'691',b'110',b'False',b'False',b'True',b'False',b'2018-05-06 10:49:47'
"b'@aim_revolt2 Selama ini, kenapa penegakan hukum hanya berlaku kepada kaum Muslim yang justru vokal menyuarakan kead\\u2026 https://t.co/ImkYHqwVYJ'",b'1232225960193183745',b'Bullthonk04',b'bullthonk04',b'',b'bergerak bekali-kali karna hidup hanya sekali\\nmanfaatkan hidup ini untuk menggapai ridho ilahi',b'139',b'289',b'0',b'190',b'115',b'False',b'False',b'True',b'False',b'2019-04-02 10:57:57'
b'Kami menolak semua upaya meng kriminalisasi semua para pejuang yang membela ulama dan Muslim termasuk ketua LBH pel\\u2026 https://t.co/B5JcLEtwQY',b'1232225954522513409',b'Rani Ruli Ashari',b'__ranira',b'',"b'\\U0001f3f3\\U0001f3f4\\nAllah dulu, Allah lagi, Allah terus.\\U0001f495\\n\\U0001f4cd Makassar'",b'138',b'107',b'0',b'440',b'914',b'False',b'False',b'False',b'False',b'2018-11-26 16:00:38'
b'You are not the muslim women you think you are sehun https://t.co/7yLzhEKY4b',b'1232225953671077889',b'Mahi',b'dilfexo_',b'nowhere ',b'#minseok : fu*k u bitch',b'1147',b'305',b'31',b'25847',b'45698',b'False',b'False',b'True',b'False',b'2019-03-17 10:50:30'
"b'Gelombang persatuan umat Islam mereka sadari adalah nyata, maka setiap muslim yg vocal trhdp kedzaliman penguasa, s\\u2026 https://t.co/gAdrMqErTa'",b'1232225951028670466',b'Sofyanbinimam@gmail.com',b'Sofyanbinimamg1',b'',b'',b'83',b'170',b'0',b'765',b'460',b'False',b'False',b'True',b'False',b'2019-03-30 02:45:46'
"b'Gelombang persatuan umat Islam mereka sadari adalah nyata, maka setiap muslim yg vocal trhdp kedzaliman penguasa, s\\u2026 https://t.co/0dGGJLQ3BR'",b'1232225949908918272',b'ikanhiu',b'ikanhiu20',b'',b'',b'185',b'470',b'0',b'5446',b'6534',b'False',b'False',b'True',b'False',b'2019-04-02 13:56:01'
"b'@TarjoSawud_Jady Saya muslim, saya bersama LBH Pelita Umat melibas ketidak adilan\\n &gt;&gt; #SaveAdvokatPejuang &lt;&lt;\\u2026 https://t.co/0z4CVmN5D6'",b'1232225934318723072',b'Nge_Bandrek',b'Royal_Bandrek01',b'Indonesia',b'Minuman bagi para Pejuang',b'314',b'525',b'0',b'2788',b'3836',b'False',b'False',b'True',b'False',b'2019-02-16 13:51:12'
b'Jangan hanya karna aktifis muslim yang kritis hukim diarahkan kepadanya\\n &gt;&gt; #SaveAdvokatPejuang &lt;&lt;\\u2026 https://t.co/H1XPc1qneF',b'1232225932603080704',b'Eleanor Humaira',b'humaira_eleanor',b'Indonesia',b'Menjadi cahaya diantara kegelapan',b'18',b'69',b'0',b'183',b'55',b'False',b'False',b'True',b'False',b'2019-08-12 10:35:11'
"b'@ZunaidJunaidi Umat muslim selalu di kanan, kiri, depan dan belakang bersama ketua LBH Pelita Umat\\n &gt;&gt;\\u2026 https://t.co/SStUnH1U2O'",b'1232225929738346496',b'Nurul Latifah',b'nurullatifah23',b'bandung',b'Syahidah~||\\nig : nurullatifah.23||\\nMom of 1_ummuLiwa\\U0001f49e',b'901',b'524',b'1',b'11969',b'95',b'False',b'False',b'False',b'False',b'2009-10-15 05:56:38'
b'@PanditDevendr19 @YOUSUF_CObRA @MD___hashim @kuchAlfaaz_0786 @Sir_ahmad0786 @akhterzaidi @ansari_sarif13\\u2026 https://t.co/OhvqvjKDOh',b'1232225928907853825',b'Sumra',b'Sumra31708269',"b'Mumbai, India'",b'@Parvez7Parvez has been suspended.. plz follow me on this account..\\nNo DM plz\\U0001f64f',b'98',b'114',b'0',b'88',b'177',b'False',b'False',b'True',b'False',b'2020-02-23 18:11:33'
b'@ZeeNewsHindi @TejpalRawat14 @DelhiPolice @ArvindKejriwal @HMOIndia Ac may baith ke twitt karo sirf aur police aur\\u2026 https://t.co/MOOmNnRkt9',b'1232225925984591872',b'RajkumarTapadia',b'TapadiaRajkumar',b'',b'',b'84',b'274',b'0',b'5146',b'7389',b'False',b'True',b'True',b'False',b'2020-01-19 04:48:41'
"b'Please don\'t come up with ""Oh they\'re so oppressed hence the goons HAVE no option left but to come out on roads and\\u2026 https://t.co/8NrAxa1bzt'",b'1232225925007388672',b'Aishwarya',b'AishIdiot',"b'New Delhi, India'",b'Working towards the GOAT version of me',b'61',b'107',b'6',b'1979',b'8052',b'False',b'False',b'False',b'False',b'2015-12-28 03:58:20'
b'Negeri muslim berisi penguasa munafik.\\n &gt;&gt; #SaveAdvokatPejuang &lt;&lt;\\n #KawalKetuaLBHPU - #TolakKriminalisasiKhozinudin\\n#DFQD\\n\\n@shafaa_nayla',b'1232225923497246720',b'Wardah Silwana H.',b'wardahsilwanah',b'',b'\\u200f\\u0644\\u0627 \\u0627\\u0644\\u0647 \\u0627\\u0644\\u0627 \\u0627\\u0644\\u0644\\u0647 \\u0645\\u062d\\u0645\\u062f \\u0631\\u0633\\u0648\\u0644 \\u0627\\u0644\\u0644\\u0647',b'34',b'45',b'0',b'322',b'12',b'False',b'False',b'False',b'False',b'2016-10-16 09:38:52'
b'Kami menolak semua upaya meng kriminalisasi semua para pejuang yang membela ulama dan Muslim termasuk ketua LBH pel\\u2026 https://t.co/B5gu4FJRHI',b'1232225923191099392',b'Abu_ishar',b'abu_ishar',b'',"b'Afwan, my account has been suspended'",b'185',b'203',b'0',b'1517',b'169',b'False',b'False',b'True',b'False',b'2019-11-18 11:40:09'
"b""@Nidhi @arvindgunasekar @saurabhshukla_s It's anti Muslim riot. No wonder BJP with hindutva ideology is xenophobic\\u2026 https://t.co/QCdxyklSps""",b'1232225922968883200',b'Tasneem Nisar',b'sul_acid',b'bagh azadkashmir',b'Dust speck',b'130',b'391',b'0',b'2753',b'4404',b'False',b'False',b'True',b'False',b'2014-02-03 18:09:39'
b'Umat bersama LBH PU membela perjuangan kaum Muslim utk melanjutkan kehidupan Islam.\\n &gt;&gt; #SaveAdvokatPejuang &lt;&lt;\\u2026 https://t.co/xSrPIKlT65',b'1232225918279544833',b'TaufikR05',b'R05Taufik',b'',b'akun baru pengganti @TaufikR03 yg telah tumbang',b'393',b'718',b'0',b'978',b'528',b'False',b'False',b'True',b'False',b'2020-01-17 03:56:51'
b'Why are Indian muslims using words like sangh terrorists and Hindu terrorists but are ignoring the crimes being don\\u2026 https://t.co/wvTH5VR99V',b'1232225913485611008',b'Akki',b'hereIcomeagain7',b'',b'',b'3',b'4',b'0',b'265',b'42',b'False',b'False',b'True',b'False',b'2020-02-20 18:38:02'
b'@OpusOfAli Muslim ladies blocked road following call by @BhimArmyChief on 23rd Feb for Bharat Band against govt tin\\u2026 https://t.co/r7JrzROxhU',b'1232225910478266368',b'Aamir',b'_besharm',b'Hell',b'Lost among hyperventilating crowd of nauseated chauvinists. Trying to re-discover self',b'98',b'390',b'0',b'5092',b'7418',b'False',b'False',b'True',b'False',b'2017-06-23 23:59:56'
"b'Pahamilah mana yang haram dan mana yang halal. Pahami bagaimana adab taat dan rasa malu, bukan setelahnya malah men\\u2026 https://t.co/jKngVaH2vj'",b'1232225909316280320',b'\\U0001f343 Inspiration To Hijrah Official \\U0001f343',b'InspirationToH1',b'',b'QS.At-Taubah : 20 \\U0001f49e\\n\\U0001f343Manhaj Salaf\\n\\U0001f343Motivasi Hijrah\\n\\U0001f343Hijrah fisabilillah\\n\\U0001f343Mempererat ukhuwah \\n\\U0001f343Merangkul dalam kebaikan\\n\\U0001f343Jangan menyerah menuju istiqamah',b'16',b'57',b'0',b'159',b'34',b'False',b'False',b'True',b'False',b'2019-12-30 11:54:22'
b'@RanaAyyub This is totally fake.  Biased and subverive reporting. Check and you will find many muslim mobs rioting.\\u2026 https://t.co/spzpYld414',b'1232225908632649728',b'Democracy Watch',b'DemocracyWatch7',b'',b'true democracy',b'37',b'389',b'0',b'1408',b'2445',b'False',b'True',b'True',b'False',b'2020-01-27 16:14:55'
"b'@Warkop_1453 Saya menolak segala bentuk kriminalisasi kepada saudara muslim, tak terkecuali pada Ahmad Khazinudin k\\u2026 https://t.co/AlgkJEokI2'",b'1232225907655315456',b'Ummu Hanum',b'UmmuHanum2',b'',b'',b'59',b'50',b'0',b'925',b'55',b'False',b'False',b'True',b'False',b'2019-05-30 12:41:58'
b'Umat Islam harus waspada terhadap  upaya kriminalisasi terhadap Muslim yang kritis dan vokal \\n &gt;&gt;\\u2026 https://t.co/tnsS7I19nV',b'1232225906933911553',b'Bullthonk04',b'bullthonk04',b'',b'bergerak bekali-kali karna hidup hanya sekali\\nmanfaatkan hidup ini untuk menggapai ridho ilahi',b'139',b'289',b'0',b'190',b'115',b'False',b'False',b'True',b'False',b'2019-04-02 10:57:57'
b'@AnjumQaisrani @CultOfEh Are you saying the Christian and non Ahmadinejad Muslim papers in India reported that only\\u2026 https://t.co/J5krnyqfvu',b'1232225898947985409',b'DLAFO',b'CARdinals_book',b'Adelaide South Australia ',"b'3 people, a book (if we remember it) a bottle of #wine or two discussing books, ranting, life, philosophy and... sod it, just pour the wine #Adelaide #BookClub'",b'778',b'427',b'43',b'65793',b'30817',b'False',b'False',b'True',b'False',b'2011-05-30 13:55:06'
"b'@damn_barbarian \\u0d07\\u0d2a\\u0d4d\\u0d2a\\u0d4b \\u0d28\\u0d1f\\u0d15\\u0d4d\\u0d15\\u0d41\\u0d28\\u0d4d\\u0d28\\u0d24\\u0d4d \\u0d2e\\u0d4a\\u0d24\\u0d4d\\u0d24\\u0d02 religious divide \\u0d06\\u0d23\\u0d4d. Riot \\u0d28\\u0d1f\\u0d15\\u0d4d\\u0d15\\u0d41\\u0d28\\u0d4d\\u0d28 maujpur, jaffrabad, okke muslim domin\\u2026 https://t.co/YYF6qZ39JD'",b'1232225895475302400',b'D Shaji.Dhas',b'DShajiDhas',b'',b'Not a fan of Right wing politics.',b'129',b'1676',b'0',b'2969',b'8362',b'False',b'False',b'True',b'False',b'2016-03-31 11:32:03'
b'@gelandang81 LBH PU yg selama ini gigih membela kepentingan Islam &amp; kaum Muslim tengah alami kriminalisasi. Kami be\\u2026 https://t.co/vrIsSnBjO5',b'1232225885513797632',b'Mulyo Fatih',b'Reepool1',b'',b'Melanjutkan kehidupan Islam kaffah',b'436',b'796',b'0',b'1453',b'112',b'False',b'False',b'True',b'False',b'2019-04-10 02:15:28'
b'@DelhiPolice Current Muslim reaction hasn\\u2019t erupted in isolation. The Modi government\\u2019s revocation of #Kashmir\\u2019s sp\\u2026 https://t.co/MH10jhcGSh',b'1232225884607741952',b'Farhan Qureshi',b'FMQureshiPK',"b'Rawalpindi, Pakistan'","b'A Proud #Pakistani, & Pure Insafian.\\nDirector Projects at #Softmetics.'",b'841',b'23',b'8',b'5491',b'2964',b'False',b'False',b'False',b'False',b'2009-05-22 16:49:03'
b'@KTHopkins muslim man blatantly  pointing gun at a policeman in streets of delhi. and he can not act. why? because\\u2026 https://t.co/cYt65cx7NB',b'1232225876969807878',b'jahanteriyehnazarhai',b'nainmattaka',b'',b'',b'6',b'40',b'0',b'655',b'1198',b'False',b'False',b'True',b'False',b'2015-09-15 11:21:20'
b'@rkhairu Aman lah. Manado tidak se-\\u2018primitif\\u2019 yang orang bilang kok. Di kota lu udah nemu banyak makanan halal. Bah\\u2026 https://t.co/jUrgag3vDb',b'1232225872666660865',b'Robert',b'extrvrtside',b'',b'',b'41',b'45',b'1',b'3149',b'87',b'False',b'False',b'True',b'False',b'2013-01-11 10:45:33'
b'@Javedakhtarjadu dekho darahuva Muslim. https://t.co/OWFaEeN1tH',b'1232225868967272448',b'IndrajitsinhD',b'indrajitsinhD',b'gujarat',b'Jay Hind...Vande Bharat Matram. Sanatani',b'546',b'683',b'1',b'36419',b'41960',b'False',b'False',b'True',b'False',b'2016-01-20 02:56:15'
b'@joe606 @SadiqKhan Such a good idea. Shut them all down and let them Worship in a Muslim Country',b'1232225863632146437',b'Barbara',b'Barbara90837142',b'',b'',b'3',b'38',b'0',b'795',b'458',b'False',b'True',b'True',b'False',b'2018-07-18 09:03:42'
b'@ajay_ind92 @GautamGambhir @KapilMishra_IND @AmitShah @ManojTiwariMP Ha Modi ji ka Muslim appeasement is not getting converted into votes',b'1232225859165016065',"b""Ram's Squirrel""",b'thewisemen5',b'',"b'Fix the imbalance between left and right, created by fake painted RW of BJP RSS'",b'54',b'245',b'0',b'5452',b'8527',b'False',b'False',b'True',b'False',b'2019-10-02 14:04:02'
b'@ReallySwara @DelhiPolice Ye bho Dekhlo Andhbhakto last tak pata chala jayega Terrorist kon hai #goberbhakt Na dekhe \\U0001f525\\U0001f64f',b'1232225856820535296',b'@Prince_Shaikh_Parvez',b'Im_A_Muslim__',"b'Ahmadabad City, India'",b'#broken_writer\\n#WWE\\n#FanOf @JohnCena \\U0001f4af\\U0001f451\\n#Marvel \\n#PostGraduate \\U0001f393 \\n#Alhamdulillah_For_Everything \\n#Proud_To_be_Muslim',b'128',b'162',b'0',b'3555',b'3148',b'False',b'False',b'True',b'False',b'2017-10-21 07:36:40'
"b'@DearthOfSid These are not clashes, how many videos we have got of Muslim mobs beating up innocent Hindus? These ar\\u2026 https://t.co/dNpngvQFkj'",b'1232225852638867456',b'M.Indian',b'Mohamma78154188',b'',b'',b'0',b'77',b'0',b'256',b'10',b'False',b'False',b'True',b'False',b'2019-10-09 20:05:44'
b'Sesama muslim bagai bangunan yang saling menguatkan\\n &gt;&gt; #SaveAdvokatPejuang &lt;&lt;\\n #DampingiKetuaLBHPU . #KawalKetuaLBHPU\\n#Z51F\\n\\n@AlQadar6',b'1232225845793550337',b'Alap-Alap Pantura',b'pantura_alap',b'',b'',b'73',b'174',b'0',b'1371',b'19',b'False',b'False',b'True',b'False',b'2018-08-26 12:58:49'
b'@AdvSanwar @ThePeopleOfIN Hindu Muslim ka danga nahi Hai Sanghi Muslim ka Hai Sanghi mader Cho Bhagva Atankwadi',b'1232225845131038720',b'Kabir Singh',b'BangingBongBoy',"b'Kolkata, India'","b""Sanghioun Se Sekhi Hoi Bhasa Ka Uchit Upyog Sanghioun Per Karta Hoon.\\nSANGHI MC BC BKL ( Parody Account )\\nDon't Follow IF YOUR From Political Party BLUE TICK.""",b'32',b'367',b'0',b'2261',b'3447',b'False',b'False',b'True',b'False',b'2019-07-17 14:49:55'
b'@kachorqueen Is it ?gt converted to muslim n thn tlk abt it',b'1232225839846219777',b'KM\\U0001f1ee\\U0001f1f3',b'KM7869',"b'Mumbai, India'",b'Movies',b'124',b'1239',b'0',b'8339',b'23717',b'False',b'False',b'True',b'False',b'2017-08-04 05:16:59'
b'@KhuranaRish @just_kashyap Bhai tu dubai mein hai . Kaise gaya passport se ya nahi. Muslim logo ki tu chinta kyu ka\\u2026 https://t.co/DACPTLZhdv',b'1232225836218167296',b'chirag modi\\U0001f1ee\\U0001f1f3',b'chiragm0808',b'',b'NATION FIRST. Jai MAHAKAL.\\n\\nUnapologetic  HINDU.',b'376',b'850',b'5',b'31658',b'33686',b'False',b'False',b'True',b'False',b'2014-01-21 11:11:38'
"b'@AJEnglish @amnesty ""Anti muslim CAA""!\\nAre you out of your minds! This law has nothing to do with indian muslims.\\nY\\u2026 https://t.co/B8D6t2h1JB'",b'1232225834452189184',b'Bhupendra',b'BhupTom',b'',"b'I.T. is where I earn, Nationalist is what I am and Hinduism is what I breathe \\U0001f6a9\\U0001f64f'",b'41',b'268',b'0',b'2309',b'5562',b'False',b'False',b'True',b'False',b'2018-03-14 12:12:16'
b'@Gadgetku5 Orang muslim selalu jadi incaran rezim komunis\\n &gt;&gt; #SaveAdvokatPejuang &lt;&lt;\\n #HukumTajamKeMuslim .\\u2026 https://t.co/oDzhNLZPSe',b'1232225832153706496',b'rini khonsa',b'KhonsaRini',b'',b'Akun ibu tangguh baru tetap berusaha melahirkan generasi Islam tangguh',b'477',b'529',b'0',b'3812',b'1879',b'False',b'False',b'True',b'False',b'2019-04-09 08:27:39'
b'Umat Islam harus waspada terhadap  upaya kriminalisasi terhadap Muslim yang kritis dan vokal \\n &gt;&gt;\\u2026 https://t.co/YAoSjdyvdJ',b'1232225822477438976',b'Annisa Saputri Utami',b'AnnisaSaputriU4',"b'Kota Palembang, Sumatera Selat'",b'CAMAT = Calon Mati\\n_______________________________\\nmenebar CINTA dengan DAKWAH \\U0001f449 DAKWAH itu CINTA',b'188',b'772',b'0',b'411',b'445',b'False',b'False',b'True',b'False',b'2019-03-16 13:15:14'
"b'Saya muslim, saya bersama LBH Pelita Umat melibas ketidak adilan\\n &gt;&gt; #SaveAdvokatPejuang &lt;&lt;\\n #KawalKetuaLBHPU .\\u2026 https://t.co/WFNUK9FHtH'",b'1232225810171322373',b'T@bayyun',b'Junaedi44985921',b'',b'KHIL4F4H',b'162',b'283',b'0',b'150',b'20',b'False',b'False',b'True',b'False',b'2020-01-17 05:36:05'
"b'Mr Trump,this is the Hindutva India that can\\u2019t be hidden behind walls! A Muslim man being beaten because of his fai\\u2026 https://t.co/mC93CNqSaU'",b'1232225810083467269',b'Malik Ibraheem',b'MalikIbraheem29',b'',b'Muslim~Proud Pakistani ~ Student ~ Cricket lover ~ Old Fashioned ~ Unpredictable ~ Chai aur biscuits',b'237',b'196',b'2',b'905',b'3676',b'False',b'False',b'True',b'False',b'2017-05-03 05:28:39'
"b'Hukum sudah terbukti sangat tajam hanya kepada muslim. Kepada para koruptor, kepada para penista Islam, tumpul luar\\u2026 https://t.co/ukTbhf86SE'",b'1232225809110163456',b'Budi Setianingsih',b'BudiSetianings5',b'',"b'akidah pemersatu umat,apapun harokahmu,mahdzabmu kita bersaudara ! yang ga mauq,teruslah cari ilmu, sampai engkau tahu'",b'86',b'245',b'0',b'2220',b'1229',b'False',b'False',b'True',b'False',b'2019-08-31 07:02:28'
b'@anuragkashyap72 Terroriist means only Muslim.',b'1232225805113200641',b'amit',b'amitjauhari24',b'',b'',b'14',b'69',b'0',b'510',b'635',b'False',b'False',b'True',b'False',b'2009-09-29 11:20:10'
b'If this was clash between pro CAA/NRC and anti CAA/NRC then why only Muslim properties and businesses were targeted\\u2026 https://t.co/rBVh265mpd',b'1232225804303642624',b'Md jamshed ahmed\\U0001f1ee\\U0001f1f3',b'Jamshed92',b'',b'',b'25',b'234',b'1',b'612',b'2135',b'False',b'False',b'True',b'False',b'2011-12-30 09:50:53'
b'LBH PU yg selama ini gigih membela kepentingan Islam &amp; kaum Muslim tengah alami kriminalisasi. Kami bersama LBH PU\\u2026 https://t.co/eGoFTNbVZd',b'1232225799102533634',b'Duwi Wahyutiyas',b'duwi_tiyas',b'',b'',b'107',b'94',b'0',b'2573',b'460',b'False',b'False',b'True',b'False',b'2018-05-07 07:24:47'
"b'Northern Nigeria is raid with POVERTY, it is the liability the rest of Nigeria has to carry and polygamy is a key f\\u2026 https://t.co/Gv7NTidUen'",b'1232225797525692428',b'Rebecca E. Roberts',b'enobong',b'Nigeria',b'Researching #policies making #minorities more vulnerable in #Nigeria \\U0001f1f3\\U0001f1ec #Urban #Sociology! Politically INCORRECT. All views are mine: RTs are NOT endorsement!',b'3432',b'987',b'108',b'96527',b'9236',b'False',b'False',b'False',b'False',b'2009-04-24 06:30:43'
b'Never though that NATION of Mahatma Ghandi will be like this\\n\\nHindu Muslim Christians SIKH \\nAaj ek Dusre se Nafrat\\u2026 https://t.co/phxdBnprVm',b'1232225795420016640',b'Mrityunjay Singh',b'Mrityun47915735',b'',b'I am Ex-PARAMILITARY Person',b'0',b'7',b'0',b'1',b'0',b'False',b'False',b'True',b'False',b'2020-02-25 08:37:33'
b'@Hindu_Mahakaal #Shoot_the_muslim_terrorist',b'1232225793629130752',b'Satyam sanodiya',b'sanodiya_satyam',b'',b'',b'12',b'24',b'0',b'42',b'1773',b'False',b'True',b'True',b'False',b'2016-10-05 07:18:42'
b'@KapilMishra_IND @ArvindKejriwal @ArvindKejriwal sabse pehley atankwadi @KapilMishra_IND ko @DelhiPolice arrest kar\\u2026 https://t.co/mQ4b08Plev',b'1232225793323012096',b'An Indian',b'ParvezAliShaik9',b'Abu dhabi',"b'Being optimistic...I am against fascist, hatred mongers, fanatics & extremist of any religion, community whoever try to disintegrate Secular fabric of India..'",b'68',b'121',b'0',b'9928',b'9631',b'False',b'False',b'True',b'False',b'2017-01-11 14:33:35'
"b""@johnstanly This is a violence to turn world attention to Indian Muslim's. Nothing else. The day when Trump leaves,\\u2026 https://t.co/LI16GPjxrY""",b'1232225790697230337',b'Vinod',b'vinod_g_n',"b'Chennai, India'","b""Casteless. Strongly believe religion's are for own empowerment & shouldn't be ever used as a tool for organizing, demanding, converting & dividing.""",b'85',b'27',b'1',b'6752',b'14011',b'False',b'False',b'True',b'False',b'2010-01-21 17:53:36'
b'Delhi walo aur vote do amanatulla ko jitne Bhi Muslim khade the sabhi ko jeetaya badhai ho abhi tho musalmano ka st\\u2026 https://t.co/AruTY3pFxU',b'1232225789715849216',b'Aman Kumar',b'AmanKum97181838',b'',b'',b'0',b'64',b'0',b'217',b'59',b'False',b'True',b'True',b'False',b'2020-02-24 03:41:31'
"b'@republic My foot. What did He communalize? He stated fact. It is the Murderous Muslim onslaught on Hindus, Sikhs,J\\u2026 https://t.co/HqZY6JiLeh'",b'1232225782560223232',b'Prabhudeva10687',b'PrabhuD41653306',b'',b'rightwing staunch nationalist.',b'31',b'542',b'0',b'3096',b'534',b'False',b'False',b'True',b'False',b'2019-02-14 16:34:39'
b'@adekdedees @mahyeldi_sp Ketauan miskin kuota... hahahaha.. BACAAAAAA...  udah jelas dia tulis setelah sholat Ashar\\u2026 https://t.co/ENiyTdkH5g',b'1232225781645860865',b'Pisceslla',b'pisceslla',b'Jakarta',"b""just ordinary people ..making lot mistakes but try hard to be the best and doing what's right. ALLOHUMMA INNI AS-ALUKAL HUDAA WAS SADAAD.. aamiin""",b'2797',b'1829',b'2',b'7441',b'37455',b'False',b'False',b'False',b'False',b'2010-01-07 23:14:59'
"b'@MuslimKampung Kenapa umat Muslim terus yg didzolimi? Apa karna umat muslim perilakunya jujur, adil, menegakkan keb\\u2026 https://t.co/ftJedkytdB'",b'1232225780546977793',b'AyahNisa',b'ayahnisa40',b'Semarang',b'untuk Islam',b'249',b'431',b'0',b'1288',b'194',b'False',b'False',b'True',b'False',b'2019-12-13 06:50:33'
b'Jangan hanya karna aktifis muslim yang kritis hukim diarahkan kepadanya\\n &gt;&gt; #SaveAdvokatPejuang &lt;&lt;\\u2026 https://t.co/QbDznRKoxs',b'1232225779653763072',b'Kekal',b'KhalidRabbaniy',"b'Probolinggo, Jawa Timur'",b'Bro Please \\nLangsung Di foll-back',b'72',b'148',b'0',b'680',b'249',b'False',b'False',b'True',b'False',b'2019-03-20 02:13:50'
b'@AJEnglish @amnesty These are muslim terrorist ... Hv a look .. https://t.co/LhkTtGctKo',b'1232225772661886976',b'\\u0915\\u0930\\u094d\\u0923 \\u0938\\u0928\\u093e\\u0924\\u0928 #I support CAA+NPR+NRC',b'KaranShuklaa',b'\\u092d\\u093e\\u0930\\u0924',"b'Bsc. (chem. & micro.), Artists (Actor) & Daimond merchant .hindu nationalist.. modi ji & amit shah ji fan .... \\u0928\\u0915\\u0932\\u0940 \\u0938\\u0947\\u0915\\u094d\\u092f\\u0941\\u0932\\u0930 \\u0926\\u0942\\u0930 \\u0930\\u0939\\u0947 ,\\u091a\\u092e\\u091a\\u0947 \\u0926\\u0942\\u0930 \\u0930\\u0939\\u0947 ....'",b'1332',b'1923',b'31',b'83351',b'57230',b'False',b'False',b'True',b'False',b'2015-02-07 18:46:20'
