"b'Saint Rampal Ji Maharaj says Humanity is the religion of all.\\n\\nOur race is living being, humanity is our religion.\\u2026 https://t.co/BbTkD5oUHP'",b'1232300292517040128',b'\\U0001f1ee\\U0001f1f3 Real God \\U0001f1ee\\U0001f1f3',b'MissonSatlok79',b'Bankhedi',b'\\U0001f64f\\U0001f33a\\U0001f337\\u0917\\u0941\\u0930\\u0941 \\u0915\\u094b \\u0915\\u093f\\u091c\\u0947 \\u0926\\u0902\\u0921\\u0935\\u0924 \\u0915\\u094b\\u091f\\u093f \\u0915\\u094b\\u091f\\u093f \\u092a\\u094d\\u0930\\u0923\\u093e\\u092e\\U0001f64f \\u0915\\u093f\\u091f \\u0928\\u093e \\u091c\\u093e\\u0928\\u0947 \\u092d\\u094d\\u0930\\u0902\\u0917 \\u0915\\u094b \\u0917\\u0941\\u0930\\u0941 \\u0915\\u0930\\u0932\\u0947 \\u0906\\u092a \\u0938\\u093e\\u092e\\u093e\\u0928 \\U0001f337\\U0001f64f.kabir is  god \\U0001f33a\\U0001f337\\U0001f64f\\U0001f607\\U0001f64f\\U0001f47c',b'8166',b'4965',b'0',b'9832',b'8765',b'False',b'False',b'True',b'False',b'2017-12-28 01:38:18'
b'Trump news \\u2013 live: President snubs vegetarian delicacies amid lavish treatment on India trip as p...\\u2026 https://t.co/gcyMu5wCDS',b'1232300291862691840',b'Munjal Japee',b'JapeeMunjal',b'',b'',b'0',b'1',b'0',b'249',b'279',b'False',b'True',b'True',b'False',b'2018-11-29 22:02:43'
"b'Gelombang persatuan umat Islam mereka sadari adalah nyata, maka setiap muslim yg vocal trhdp kedzaliman penguasa, s\\u2026 https://t.co/vSFaCk6hRT'",b'1232300289773801475',b'mulyadi al-klateni',b'abu_qosam',b'',b'198928',b'92',b'146',b'0',b'551',b'13',b'False',b'False',b'True',b'False',b'2015-04-20 15:01:59'
b'@BenafshaFaizy @FroghWazhma Ms.! About 99% of the population in Afghanistan is Muslim.\\nWhether there are women or m\\u2026 https://t.co/RXlbbr2od2',b'1232300289245503490',b'\\u0641\\u0627\\u062a\\u0640\\u0640\\u062d',b'FatiehAlp',b'Afghanistan',"b""Student of Sharia , Political, Social & peace activist, Teacher, /Human Rights / Defense of Islam/ Afghn culture, Fighter for Rights  & Truth, Nation's service""",b'404',b'205',b'0',b'251',b'395',b'False',b'False',b'True',b'False',b'2020-02-10 12:53:10'
b'#tagderatfal #HOF #MKAHOF #MAADHOF #AMJHOF #ATFALSCHULE #Buildung #wissen #sport #Ahmadiyya #Muslim https://t.co/G3toORz0My',b'1232300275567878153',b'MKAHOF',b'majlis_hof',"b'Hof, Deutschland'",b'Offizieller Twitter Account der Majlis Khuddam-ul-Ahmadiyya HOF Deutschland\\n#MKAHOF #Jugendorganisation der #Ahmadiyya #Muslim Jamaat #Deutschland K.d.\\xf6.R.\\U0001f1e9\\U0001f1ea',b'45',b'80',b'0',b'114',b'8',b'False',b'False',b'True',b'False',b'2017-11-02 11:55:26'
"b""@kort_rob @lathanrugham @WSJ I'm from Delhi, there are many Muslims who don't know about CAB they all are brainwashed by Muslim Imaam...""",b'1232300271801257991',b'Krishna Bhagat',b'Krishna_Bhagat_',b'New Delhi',b'IT Consultant | Runner| Dreamer| Innovation catalyst| Egalitarian| Proud Indian|',b'50',b'503',b'2',b'386',b'137',b'False',b'False',b'False',b'False',b'2012-01-23 13:44:13'
b'@Tor2oise Examples of communities that cannot even integrate with Indians be it a Hindu Sikh or Muslim: White Supremacists!',b'1232300269595189248',b'Allison Burgers',b'ablmir2',b'Wadiya',b'President Prime Minister Admiral General of the State of Wadiya\\u261d\\U0001f3fb   I\\u2019ve been replaced since my Supreme Beard was removed. Will make a come back soon IA!',b'800',b'230',b'1',b'6947',b'31669',b'False',b'False',b'True',b'False',b'2015-10-31 21:14:23'
"b'@Cold_Peace_ 1. Fact-check: Largest Muslim- majority country is, indeed, a democracy. But I think you are mistaken\\u2026 https://t.co/Wx8odhQGkR'",b'1232300265950154752',b'Marc Btc #BridgesNotWalls',b'marcbbatac',b'Mindanao / SEAAsia / Den Haag',"b'Student of power, conflict & social mvmts. Coordinator at @IIDonline & @GPPAC-SoutheastAsia.\\n\\nFaux millennial. Water creature. Living&dying. #Queer \\u2764\\ufe0f\\U0001f49c\\U0001f499'",b'498',b'326',b'11',b'6204',b'3257',b'False',b'False',b'False',b'False',b'2009-05-06 06:39:10'
"b'@chaitanyamurali Who the fuck cares about what Trump thinks? In any case, how would Muslim houses being burnt in In\\u2026 https://t.co/FtlrgQypvt'",b'1232300255204585474',b'Ankur Kumar',b'Ankurspurs9',"b'Navi Mumbai, India'",b'Dissent is patriotic.',b'58',b'318',b'0',b'262',b'4994',b'False',b'False',b'True',b'False',b'2016-10-11 18:04:28'
"b'Saint Rampal Ji Maharaj says Humanity is the religion of all.\\n\\nOur race is living being, humanity is our religion.\\u2026 https://t.co/bRv0ayeqlQ'",b'1232300253623259137',b'Mr. Rahul Kori',b'RahulKori_24',b'UMARIA MADHYAPRADESH INDIA',b'\\u0938\\u0924\\u094d \\u0938\\u093e\\u0939\\u0947\\u092c \\u091c\\u0940\\U0001f64f\\nhttps://t.co/9r3SHl6X9W\\n#KABIR_IS_REAL_GOD',b'1146',b'1313',b'0',b'15445',b'13961',b'False',b'False',b'True',b'False',b'2019-07-07 10:53:41'
b'@PatelLeader @anuragkashyap72 Kon bola ki NRC nahi hua kabhi? Assam me Kya hua tha.. 19 lakh log NRC list se Bahar\\u2026 https://t.co/k2m7ut2D3q',b'1232300251337326592',b'Rohan \\xdfardeskar',b'RohanBardeskar',b'Kolhapur',"b""imp note:- please don't follow me, i am of no use for you!""",b'305',b'136',b'2',b'15459',b'519',b'False',b'False',b'False',b'False',b'2011-12-22 05:27:50'
b'@prabhatkumar76 @ajitkld @ndtv @PrakashJavdekar How can there be a Muslim area ?',b'1232300247990374401',b'\\u0b05\\u0b16\\u0b3f\\u0b33 \\u0b2a\\u0b3e\\u0b22\\u0b40\\U0001f1ee\\U0001f1f3',b'AkhilaPadhi',b'Jeypore',"b'A CA by profession, A Vedic by Passion, A Bharatiya by Devotion, An Atheist by Religion.'",b'5142',b'2561',b'78',b'206430',b'88',b'False',b'False',b'False',b'False',b'2007-11-17 12:41:57'
b'@ZayedAmeen @AkshayKatariyaa Haha my ancestors are Hindu. I am Hindu . My great great grandfather is hindu I am Hin\\u2026 https://t.co/w13qOVPwRA',b'1232300247914708992',b'babai ni evaru champaru',b'Dhanu260891',b'Gartapuri',"b'Aim of India be clean Ganga, river linking, industrialization of barren lands not the one green,east west or South north is one especially north east.'",b'32',b'333',b'0',b'2615',b'1927',b'False',b'False',b'False',b'False',b'2017-04-08 05:24:59'
b'@OIC_OCI @AJEnglish @EU_Commission @UNHumanRights @antonioguterres see how Muslim mosque vandalised and local autho\\u2026 https://t.co/14g9C7g5Nr',b'1232300245188579328',"b'Dr.Faizan Azizi, PhD \\u0641\\u06cc\\u0636\\u0627\\u0646 \\u0639\\u0632\\u06cc\\u0632 \\u06cc'",b'Faizanazizi',b'Mumbai',"b'Author ,Entrepreneur, Social activist, President Human social care Foundation'",b'272',b'1346',b'1',b'5589',b'1982',b'False',b'False',b'True',b'False',b'2010-02-13 06:57:01'
b'@arjunhardas @RanaAyyub She sells a fake and coloured image of India and wins awards for that. She stokes Muslim se\\u2026 https://t.co/d5L7EafnMg',b'1232300240981487616',b'Kirti Phadtare Pandey',b'KirtiPandey',"b'New Delhi, India'","b'\\u0936\\u093e\\u0902\\u0924\\u093e\\u0915\\u093e\\u0930\\u0902 \\u092d\\u0941\\u091c\\u0917\\u0936\\u092f\\u0928\\u0902 \\u092a\\u0926\\u094d\\u092e\\u0928\\u093e\\u092d\\u0902 \\u0938\\u0941\\u0930\\u0947\\u0936\\u092e\\u094d , \\u0935\\u093f\\u0936\\u094d\\u0935\\u093e\\u0927\\u093e\\u0930\\u0902 \\u0917\\u0917\\u0928\\u0938\\u0926\\u0943\\u0936\\u0902 \\u092e\\u0947\\u0918\\u0935\\u0930\\u094d\\u0923\\u0902 \\u0936\\u0941\\u092d\\u093e\\u0919\\u094d\\u0917\\u092e\\u094d | \\u0932\\u0915\\u094d\\u0937\\u094d\\u092e\\u0940\\u0915\\u093e\\u0928\\u094d\\u0924\\u0902 \\u0915\\u092e\\u0932\\u0928\\u092f\\u0928\\u0902 \\u092f\\u094b\\u0917\\u093f\\u092d\\u093f\\u0930\\u094d\\u0927\\u094d\\u092f\\u093e\\u0928\\u0917\\u092e\\u094d\\u092f\\u092e\\u094d, \\u0935\\u0928\\u094d\\u0926\\u0947 \\u0935\\u093f\\u0937\\u094d\\u0923\\u0941\\u0902 \\u092d\\u0935\\u092d\\u092f\\u0939\\u0930\\u0902 \\u0938\\u0930\\u094d\\u0935\\u0932\\u094b\\u0915\\u0948\\u0915\\u0928\\u093e\\u0925\\u092e\\u094d |'",b'1016',b'4922',b'8',b'33820',b'25718',b'False',b'False',b'False',b'False',b'2009-05-23 12:23:36'
b'@TheRahulMehra @DelhiPolice But havent we seen Delhi Police supporting pro CAA protestors or should I say anti Musl\\u2026 https://t.co/0d1zNjfR7e',b'1232300239383597056',b'Sapna hariharan',b'chimni_sapna',b'',b'Just another Human Being.. SupportER of AAP.. proud to be not followed by PM Modi.. RTs are not endorsements.. Liked RTs are',b'1055',b'848',b'2',b'180917',b'194007',b'False',b'False',b'True',b'False',b'2017-05-02 12:01:44'
"b'@AhmedAb31834861 @Bhakt_Slayer_ @RanaAyyub @AmitShah @narendramodi Hahah why you guys reacting?? I said ""terrorist\\u2026 https://t.co/pjVPlIJ6YR'",b'1232300237105946625',b'Diclofenac\\u2728',b'TheSanghiDoctor',b'Jammu And Kashmir',b'Mbbs Student...Future Doctor...Animal Lover\\u2764\\u2764...\\nDie Hard Follower of Narendra Modi..Fan of Indian Army...\\nLove triggered insaan \\U0001f60d\\U0001f60d\\U0001f60d...\\nHindu Rashtriya \\U0001f1ee\\U0001f1f3',b'224',b'70',b'1',b'409',b'12181',b'False',b'False',b'True',b'False',b'2018-09-17 10:51:39'
b'@AbhinavAnandJh4 @Arwazkh04422241 @sangacious Little did you know Islam is the most peaceful religion in the world.\\u2026 https://t.co/16UyqSTgXE',b'1232300234232827904',b'Aamir Hami',b'Saiyajin1010',b'',b'',b'3',b'52',b'0',b'399',b'2715',b'False',b'True',b'True',b'False',b'2017-01-14 09:28:06'
b'@Nidhi Is bitch ka response dekho... Muslim word bhi use nhi Kiya',b'1232300231204769798',b'Dhruv',b'dhruvsharmaits1',b'India',b'',b'372',b'905',b'12',b'71894',b'64832',b'False',b'False',b'True',b'False',b'2015-05-03 14:25:18'
"b""That means he's probably a muslim https://t.co/jsSCfQEVp6""",b'1232300227685683201',b'74oldgal',b'74oldgal',"b'Stroud, England'",b'Great grandmother of 5 .Civil servant for 40 years and Magistrate for nearly 26. Passionate about Britain but hate EUSSR . Politically centre right',b'915',b'163',b'12',b'79697',b'256503',b'False',b'True',b'True',b'False',b'2015-12-04 08:43:41'
"b""I am hindu and I don't feel safe, I don't know when muslim mob will come and attack my home. And if i survived no o\\u2026 https://t.co/BK8UWt9gkq""",b'1232300225605144577',b'ADARSH PARIHAR',b'adarshpariharr',b'',"b'Learning, Analysing.'",b'148',b'851',b'0',b'2362',b'2244',b'False',b'False',b'True',b'False',b'2017-04-03 09:54:46'
b'@ReallySwara @DelhiPolice Arey  tujhe 10 Hindu margehe muslim dwara woh tujhi nahi dikta katweye.',b'1232300218772807681',b'Keshav yadav',b'Keshavy54863635',"b'Allahabad, India'","b'Advocate ,highcourt'",b'17',b'480',b'0',b'241',b'548',b'False',b'False',b'True',b'False',b'2018-04-26 18:27:44'
b'Hukum buatan manusia yg ada di negeri ini sangat lemah dan faktanya selalu digunakan untuk kepentingan penguasa men\\u2026 https://t.co/eVVTvpqtKE',b'1232300218063843329',b'akhirofi7878',b'akhirofi7878gm1',b'',b'',b'181',b'290',b'0',b'4574',b'0',b'False',b'False',b'True',b'False',b'2019-04-11 12:55:52'
b'@786__Zakia Mam you are true Indian and you are true Muslim also who loves their country . \\nBut some radical muslim\\u2026 https://t.co/1PUAPrPmXU',b'1232300217862627329',b'Anubhav',b'Anubhav95020225',"b'Gorakhpur, India'","b""Big fan of Modiji . Truely inspired by him .\\n\\U0001f64f\\U0001f64f\\U0001f64f\\U0001f64f\\U0001f64f\\U0001f64f\\U0001f64f\\nDon't think too much about what people say if it's not important.""",b'745',b'1544',b'0',b'7218',b'7916',b'False',b'False',b'True',b'False',b'2019-11-03 14:20:24'
"b""@oyevivekk But what's wrong in that?\\nAnyone who lives\\nin the vicinity of a masjid\\nin a Muslim majority locality\\ncan\\u2026 https://t.co/qOPXN83cSM""",b'1232300208488247302',b'\\u0915\\u094d\\u092f\\u093e \\u091a\\u0932\\u094d\\u0932\\u093e \\u0939\\u0948 !?!',b'ChallaHai',b'National Corrupt Region',"b'\\u091c\\u094d\\u091e\\u093e\\u0928\\u0940 \\u0938\\u0947 \\u091c\\u094d\\u091e\\u093e\\u0928\\u0940 \\u092e\\u093f\\u0932\\u0948\\u0902, \\u0915\\u0930\\u0948\\u0902 \\u091c\\u094d\\u091e\\u093e\\u0928 \\u0915\\u0940 \\u092c\\u093e\\u0924\\u0947\\u0902,\\n\\u0917\\u0927\\u0947  \\u0938\\u0947 \\u0917\\u0927\\u093e \\u092e\\u093f\\u0932\\u0948\\u0902, \\u0939\\u094b\\u0935\\u0948 \\u0932\\u093e\\u0924\\u0908 \\u0932\\u093e\\u0924\\u0947\\u0902..\\n\\n\\nReticent Tweeter \\u2206 Generous Re-Tweeter'",b'53',b'151',b'0',b'4437',b'2171',b'False',b'False',b'True',b'False',b'2019-02-23 10:27:04'
b'@ummyhaidar Kebenaran akan menang !! tolak kriminalisasi pada advokat Muslim Pembela Umat\\n &gt;&gt; #SaveAdvokatPejuang &lt;\\u2026 https://t.co/rPygIZ3JXC',b'1232300204335849474',b'Mujahidah Muda',b'mujahidah1717',b'',b'Pengemban Dakwah || Traveler || Writer || Hamba yang berharap ampunan dari Rabb nya..',b'68',b'183',b'0',b'376',b'59',b'False',b'False',b'True',b'False',b'2020-01-01 03:02:49'
b'@Muslim_Patrol_ @tomthegrinch @Granlovespizza @Tash_Hussain @_bunnybrowneyes @BillChristie15 @SilverS75855017\\u2026 https://t.co/4vUXfo7bVL',b'1232300200250814464',b'Bill Board',b'Billboard49',b'All over',b'A picture speaks a thousand words.',b'708',b'1163',b'1',b'19792',b'36159',b'False',b'False',b'True',b'False',b'2018-09-01 17:35:23'
b'Haaan!! Start off all fictitious Muslim boy and Hindu girl story!! Commie \\U0001f416\\U0001f416 https://t.co/6KbpxYzDaJ',b'1232300199986384902',b'Kishore C Iyer\\U0001f1ee\\U0001f1f3',b'Kishoreciyer1',b'My Town',"b'Dharmic, Investment Management professional, Culture Enthusiast, Indophile, Crossfitter, Guitar Junkie, Student & A Teacher! views are personal'",b'2635',b'2317',b'10',b'53875',b'183093',b'False',b'False',b'True',b'False',b'2018-05-09 03:04:50'
"b'@IlhanMN Hijabi ( Anti women, fake feminist)\\n\\nMuslim (anti religion other than Islam)\\n\\nBlack (Racist )\\n\\nForeign bor\\u2026 https://t.co/nSAcTjMicX'",b'1232300199558762496',b'Ashvini \\U0001f1ee\\U0001f1f3\\U0001f970\\U0001f1fa\\U0001f1f8',b'Ashvini_RC1',b'United States',"b'PhD holder in Agile software development,  Patriot Indian \\U0001f60a\\U0001f60a'",b'48',b'197',b'0',b'1035',b'1425',b'False',b'False',b'False',b'False',b'2014-11-26 04:35:20'
b'@_sabanaqvi Sada Naqli can only hear muslims crying for help and her community and civic duties areb by exclusively\\u2026 https://t.co/LPo60U1774',b'1232300190083600385',b'Medium Rare',b'rhinasaur',b'',b'Medium Man',b'2',b'209',b'0',b'85',b'115',b'False',b'False',b'True',b'False',b'2020-02-14 15:53:49'
"b'@ShreeFans Killing and raping Muslim women in Kashmir is a Tuesday for Modi. Extremism, using any religion, is alwa\\u2026 https://t.co/Czy79JnCeO'",b'1232300185994366979',b'Brian Bosworth',b'davwim',b'',b'Supporter of a bottom up approach. #DeathByPoverty #TalkIsCheap #SixDegrees',b'1313',b'1806',b'4',b'40157',b'48278',b'False',b'False',b'True',b'False',b'2018-05-11 13:33:05'
b'@mohammadqasim60 @DelhiPolice @ArvindKejriwal @aajtak @CNN @ReallySwara Are O bhosdiwale pokemon teri muslim commun\\u2026 https://t.co/42vav982bz',b'1232300185608388613',b'Proud Hindu \\U0001f1ee\\U0001f1f3',b'MrHandsomeJK',b'',b'#ProteaFire Proudly Human Being. Made in India \\U0001f1ee\\U0001f1f3',b'38',b'109',b'0',b'54',b'181',b'False',b'False',b'False',b'False',b'2014-10-04 19:07:37'
"b'@rubiaabrar Stupid fellows creating religious differences ,hope all muslim brothers are safe out there'",b'1232300179161853952',b'manikanta',b'manintr',b'united kingdom',b'',b'117',b'127',b'2',b'3097',b'4739',b'False',b'False',b'False',b'False',b'2010-05-24 10:44:25'
"b'Now enough is enough, delhi is now facing riots by anti CAA proteseter, who are basically from muslim community, no\\u2026 https://t.co/jeyf7fsiqT'",b'1232300175466680320',b'PARTHA SEN',b'partha2661',"b'Kolkata, India'",b'because am a nationalist and i want my country will be the best country of the world in every sector of life...i want my country will be the mostly developped.',b'2',b'100',b'0',b'322',b'108',b'False',b'False',b'True',b'False',b'2016-11-27 08:58:09'
"b'@sharmaAvl @Nidhi Gaandu, aag aur nafrat hi failana janta hai..Bhaduwe sudhar ja...Be a human saale Hindu-Muslim ka\\u2026 https://t.co/e5iRaVh6vJ'",b'1232300173864210434',b'Proud Indian\\U0001f1ee\\U0001f1f3',b'parvezda1',"b'Mumbai, India'",b'A proud educated Indian',b'10',b'165',b'0',b'1598',b'2651',b'False',b'False',b'True',b'False',b'2012-03-26 19:58:49'
b'@ashwanisharmaa1 @sardanarohit @KapilMishra_IND Radical muslim youth uses stones pistol acids to attack people of delhi...',b'1232300168009179139',b'Dr Shiv',b'shanksham',b'',b'',b'13',b'27',b'0',b'225',b'166',b'False',b'True',b'True',b'False',b'2010-12-20 01:19:08'
b'@NigudgiSumeet @indrxnil Abhi jisne bhi pathar maare...jo bhi kiya.\\nMuslim ho ya hindu saza do....( Law and order f\\u2026 https://t.co/B8Fe5LIxBT',b'1232300165899472897',b'Snorlax',b'VaibhavaSharma3',b'',b'MAZAAK.',b'36',b'217',b'0',b'421',b'227',b'False',b'False',b'True',b'False',b'2013-07-22 06:48:11'
b'Show love to C.E.O meat pie \\U0001f60b.\\nCome 1 come all..buy 2 and 1 is free https://t.co/XVs6FR2gT1 https://t.co/ddY4zXgDbB',b'1232300162959192064',b'Corner-Taken-Quickly',b'Puritan_Muslim',b'Nigeria',"b'Buhari is a humble muslim that has a Puritan ethics, Civil Servant, Mr. Right, Single & Searching, LFC Fan, and also a great football player.'",b'322',b'212',b'0',b'2872',b'4021',b'False',b'False',b'False',b'False',b'2016-01-07 20:48:14'
b'@calamur @NilimaSharma6 Delhi lutenys media trying hard to bring Muslim votes from AAP back to Cong ..',b'1232300162736951297',b'Anand',b'ANAanD18',"b'Bengaluru, India'",b'',b'54',b'1067',b'0',b'8725',b'2824',b'False',b'False',b'False',b'False',b'2016-08-15 00:15:14'
"b'@bepituLaz @leksa Ya ada rujukannya, kitab hadits. Tahu mustolahul hadits kan? Sudah yakin praktik muslim tahun 80-\\u2026 https://t.co/CYy9843if8'",b'1232300161734340608',b'\\u1b98\\u1ba4\\u1b87\\u1b96\\u1ba6\\u1b98\\u1baa',b'biofeb',b'\\u1b98\\u1b94\\u1baa\\u1b93\\u1ba5\\u1b80  [Bandung]',b'Penulis buku catatan amal diri sendiri. lagi belajar pakai bambu. Tetep lebih suka kunci minor daripada mayor.',b'132',b'543',b'0',b'9270',b'27545',b'False',b'False',b'False',b'False',b'2013-02-09 05:43:22'
b'Germany: Muslim migrant with four aliases admits sexual abuse of 11-year-old girl https://t.co/CpcPY6wo0o',b'1232300153928855552',b'jono',b'jonotabot_',b'Planet Earth',"b'\\U0001f939#Abstract #Impressionist, #Traveler, #MildMannered, #Patriot #Conservative, #Informed, #Tolerant, #Happy, #Single. #Newishhere. #MAGA #Criticism is not hate\\U0001f941'",b'2406',b'331',b'17',b'66020',b'52188',b'False',b'False',b'True',b'False',b'2015-11-17 22:29:08'
"b""@Nidhi Don't say Muslim extremist. Just find where is Hindu extremists.""",b'1232300142105112576',b'\\u091c\\u0917\\u0926\\u0940\\u0936',b'Jagdish3005',b'\\u0935\\u0938\\u0941\\u0927\\u0948\\u0935 \\u0915\\u0941\\u091f\\u0942\\u0902\\u092c\\u0915\\u092e !',b'\\u0939\\u0947 \\u0939\\u093f\\u0902\\u0926\\u0935\\u0940 \\u0938\\u094d\\u0935\\u0930\\u093e\\u091c\\u094d\\u092f \\u0935\\u094d\\u0939\\u093e\\u0935\\u0947 \\u0939\\u0940 \\u0924\\u094b \\u0936\\u094d\\u0930\\u0940\\u0902\\u091a\\u0940 \\u0907\\u091a\\u094d\\u091b\\u093e',b'1060',b'4829',b'2',b'37750',b'47511',b'False',b'False',b'True',b'False',b'2015-02-04 18:00:52'
b'@SbBansal86 @ethicalsid @PoonamV_ @DelhiPolice @AltNews Not everyone thinks like you Bansal gee. While true that Mu\\u2026 https://t.co/gXhZzdI0y5',b'1232300139622096902',b'babar',b'BabarBaAishKosh',"b'Islamabad, Pakistan'",b'\\U0001f610\\U0001f610',b'1308',b'93',b'0',b'4401',b'5178',b'False',b'False',b'False',b'False',b'2012-03-31 13:14:57'
b'Internet band karenge to Hindu bhai behno ko kese bachahyenge? Muslim log ghar ghar ghush ke petrol aur acid fek ra\\u2026 https://t.co/JsMgXwl3s3',b'1232300132739305472',b'\\u0d28\\u0d3e\\u0d02 \\u0d2d\\u0d3e\\u0d30\\u0d24\\u0d40\\u0d2f\\u0d7c BHARATAM B.Prasad.M',b'21stcenturyP',b'',b'GOOD POLICY MAKING IS NOT ENOUGH TO BUILD Sustainable Future!! Constructive POLICY IMPLEMENTATION is a way to ensure a better future for us & mother Nature!!',b'156',b'1571',b'1',b'13693',b'13765',b'False',b'False',b'True',b'False',b'2019-07-20 16:42:34'
"b""@Nidhi Muslim rioters are throwing acid on India's paramilitary forces.\\nWill you tweet on this? https://t.co/f574fMZmPE""",b'1232300125671821325',b'Hibernating.',b'HibernationON',b'',b'',b'138',b'1749',b'1',b'11137',b'15632',b'False',b'False',b'True',b'False',b'2018-03-25 11:12:29'
b'@ikua_peter @NationBreaking @dailynation So Americans helped the Muslim brotherhood in Egypt?get up to speed with your geopolitics.',b'1232300124145147904',b'Mark Muchai',b'Muchaiki',"b'Nairobi, Kenya'",b'Proud Kenyan#MUFC#Blues#Amerucan#FerrariF1#OracleApps',b'839',b'3221',b'5',b'5093',b'2728',b'False',b'False',b'False',b'False',b'2010-02-10 07:07:29'
"b'@nidhionline @dhanyarajendran @HouseOfBelongg I will tell you scenario. Owner is Hindu, Tenant Muslim. Owner doesnt\\u2026 https://t.co/CVb4nak2RW'",b'1232300119300562944',b'shivani bhatnager',b'shivanibhatnage',b'',b'',b'96',b'108',b'0',b'7805',b'11965',b'False',b'False',b'True',b'False',b'2013-09-30 09:53:20'
b'@carmindabrendel @BoondockCat When the Muslim brotherhood took over Egypt Obama had a private meeting with them the\\u2026 https://t.co/ezoyTHmrqe',b'1232300115529846784',b'Mike Graham',b'MikeGra26313065',b'',b'',b'87',b'152',b'0',b'990',b'1282',b'False',b'False',b'True',b'False',b'2019-02-05 18:27:30'
b'@ScoonTv I think they are just protesting their own President. Since he is about to make being a Muslim constitutionally illegal.',b'1232300114234007554',b'Gregory Crawford',b'Bereneolddog',b'United States',b'Foolish old man',b'5',b'131',b'0',b'5',b'266',b'False',b'False',b'True',b'False',b'2017-03-03 21:58:34'
"b'Saint Rampal Ji Maharaj says Humanity is the religion of all.\\n\\nOur race is living being, humanity is our religion.\\u2026 https://t.co/GvT161uXpj'",b'1232300113722302464',b'Ravikant Kuldeep',b'RavikantKuldeep',b'',"b'Our Race is Living being, humanity is our Religion | \\nHindu, Muslim, Sikh, Christian, there is no separate Religion ||'",b'36',b'71',b'0',b'718',b'533',b'False',b'False',b'True',b'False',b'2019-10-22 15:11:17'
"b'@JoeNBC you are aware that Modi is a bigot &amp; racist &amp;`anti-Muslim like Trump, right? That his plans are failing mor\\u2026 https://t.co/Vkb8Q0Yd7D'",b'1232300112833077251',b'Bonita K Ronay',b'BKKliberty',b'',b'',b'40',b'59',b'0',b'16302',b'300',b'False',b'True',b'True',b'False',b'2017-03-27 17:23:06'
"b'Inke jaisa bano, Kapil Mishra jaisa nehi\\n\\nhttps://t.co/DxySIP0mPd'",b'1232300111645929472',b'Rofl Politics',b'PoliticsRofl',b'',b'',b'4',b'98',b'0',b'547',b'250',b'False',b'False',b'True',b'False',b'2020-01-05 16:12:05'
"b'@i_am_asura @TheSanghiDoctor Well sir, only one policeman has died yet and several Muslim citizens have also been k\\u2026 https://t.co/Z0SPWFUBoP'",b'1232300111260086272',b'abhinav Banerjee',b'abhinav_2410',b'India',b'hate dies love arrives',b'2',b'63',b'0',b'102',b'104',b'False',b'False',b'True',b'False',b'2019-12-19 08:46:45'
"b'@ltlgcoach @JWH707 Our laws have no connection to the Muslim religion.... I care less about their religion, but lik\\u2026 https://t.co/98ntY6NNCL'",b'1232300107074330625',b'VaRebel2A',b'Rebel2Va',"b'SW Virginia, USA'","b'#Qanon, #RedNationRising, #GreatAwakening, #Constitution,#2ndAmendment, #MAGA, #WWG1WGA #ProLife\\n#Cult45 #Patriot #WakeUpAmerica\\n#RealDonaldTrump'",b'1102',b'1312',b'3',b'429',b'1066',b'False',b'False',b'True',b'False',b'2020-02-15 16:12:50'
"b""No.\\n\\nHe was removed through Barack Hussein Obama's dealing with Muslim Brothers, i.e. throwing an U.S traditional a\\u2026 https://t.co/1yoVIG9RYv""",b'1232300103806877698',b'(((dad_zibao)))',b'dad_zibao',"b'Nice, France'","b'Musique, Photographie, Politique, Intelligence Artificielle. Bien faire, mal faire : Mais faire avec \\xe9l\\xe9gance...'",b'2339',b'3430',b'92',b'69450',b'40244',b'False',b'False',b'False',b'False',b'2011-05-21 16:46:54'
"b'Saat kaum munafik nan dzalim dan kaum kafir mnjadi pmegang kendali, mka umat muslim jelas akn d pukul keras sesuka\\u2026 https://t.co/fG8MGudxKR'",b'1232300103295107072',b'Fitri Agustina',b'fitriag28',"b'Kota Palembang, Sumatera Selat'",b'Khilafah Ajaran Islam',b'296',b'114',b'0',b'521',b'127',b'False',b'False',b'True',b'False',b'2018-04-14 01:56:13'
"b'Saint Rampal Ji Maharaj says Humanity is the religion of all.\\n\\nOur race is living being, humanity is our religion.\\u2026 https://t.co/4SRwlv3lZo'",b'1232300100073840646',b'Anand Vishvakarma',b'anandvishvakar',"b'Shajapur, India'",b'I am always believe on true...',b'122',b'441',b'0',b'2400',b'1589',b'False',b'False',b'True',b'False',b'2014-07-23 15:56:52'
b'Kebenaran akan menang !! tolak kriminalisasi pada advokat Muslim Pembela Umat\\n &gt;&gt; #SaveAdvokatPejuang &lt;&lt;\\u2026 https://t.co/BpZUXgPq3V',b'1232300097959911424',b'shabira025',b'shabira025',b'',b'',b'3',b'22',b'0',b'566',b'357',b'False',b'True',b'True',b'False',b'2019-11-08 10:24:04'
"b'#DelhiBurns\\n\\n#Gujrat model being repeated in Delhi\\n\\nModel is this:\\n\\nCreate riots , create Hindu Muslim divide\\n\\nMake\\u2026 https://t.co/gv6cqVNgR7'",b'1232300095271514113',b'AK',b'Ffbhdgjjgfv',b'Kolkata',b'',b'1',b'0',b'0',b'7',b'17',b'False',b'True',b'True',b'False',b'2019-12-21 18:31:06'
b'@nahimrh Smah akhi muslim',b'1232300093421883393',b'iii_.na',b'Lxnaaaa_',b'France',b'',b'68',b'74',b'0',b'543',b'1466',b'False',b'False',b'True',b'False',b'2019-08-05 16:52:33'
"b'@realDonaldTrump As the defender of Christian faith, what is your opinion on Hindutva terrorism unleashed against m\\u2026 https://t.co/wclwOOm2rj'",b'1232300086421577728',b'Andez Raj A',b'Andezraj',"b""N 30\\xb021' 0'' / E 78\\xb01' 0''""","b'Dreamer,Thinker,Learner,Writer,Environmentalist,Political Analyst and a Lazy chap... Of course, a Mechanical Engineer! And a Humanist!!!'",b'620',b'3098',b'7',b'9736',b'550',b'False',b'False',b'False',b'False',b'2010-01-05 13:53:15'
