"b'Kenapa umat Muslim terus yg didzolimi? Apa karna umat muslim perilakunya jujur, adil, menegakkan kebenaran dan memb\\u2026 https://t.co/nsyGAt7p3o'",b'1232280080358862849',b'izza fajriyah',b'FajriyahIzza',b'Malang',b'A learner',b'16',b'51',b'0',b'763',b'0',b'False',b'False',b'True',b'False',b'2019-12-19 09:50:37'
b'#DelhiBurning\\nBjp Moodi terrorism in Delhi for Muslim at time Trump here',b'1232280080224784386',b'kashif nizam',b'NizamKashif',b'Pakistan ',b'',b'30',b'47',b'0',b'114',b'1228',b'False',b'False',b'True',b'False',b'2013-02-17 08:01:50'
"b'@shuklapinku I guess you are not understanding the main agenda. It is not #ANTICAA movements, it is an anti-India m\\u2026 https://t.co/FwY87triCX'",b'1232280079058776067',b'S G Bhartiya \\U0001f1ee\\U0001f1f3\\U0001f51d',b'aham_vritti',b'IT',"b'A simple and progressive Indian | PhD (Cyber Security) | BJP supporter | World with no boundaries, Faith with no obsession, Notions with no prejudice.'",b'73',b'110',b'0',b'1759',b'10115',b'False',b'False',b'True',b'False',b'2018-01-07 09:54:44'
"b'Sesama muslim adalah saudara, jika ada masalah maka beri dukungan agar tidak ada yang terdzolimi.\\n &gt;&gt;\\u2026 https://t.co/ZBIYIE1IHP'",b'1232280077238333440',b'Kucing.Kecil',b'ZakiraMama',b'',b'',b'35',b'75',b'0',b'453',b'3',b'False',b'False',b'True',b'False',b'2019-09-26 06:47:14'
b'Muslims save Hindu family in some Hanuman mandir area\\nMuslim brother Assuring ye aap ka mohalla he aap logo ko ghab\\u2026 https://t.co/MtMzsOxFGu',b'1232280065313927169',b'Ahbab Anwer\\U0001f1ee\\U0001f1f3\\u0627\\u062d\\u0628\\u0627\\u0628 \\u0627\\u0646\\u0648\\u0631',b'AhbabAnwer786',"b'Purnia,Bihar India'",b'\\u200f\\u200f\\u0627\\u0644\\u0641\\u0640\\u0640\\u0640\\u0640\\u0640\\u0640\\u0627\\u0638 \\u062a\\u0648 \\u0633\\u0628 \\u06c1\\u06cc \\u0633\\u0645\\u0640\\u0640\\u0640\\u0640\\u0640\\u0640\\u062c\\u06be \\u0644\\u06cc\\u062a\\u0640\\u0640\\u0640\\u0640\\u0640\\u0640\\u06d2 \\u06c1\\u06cc\\u06ba\\u06d4\\u06d4\\u06d4\\n\\n\\u0645\\u0640\\u0640\\u0640\\u0640\\u0640\\u0640\\u0632\\u06c1 \\u062a\\u0648 \\u062a\\u0628 \\u06c1\\u06d2 \\u06a9\\u06c1 \\u06a9\\u0648\\u0626\\u06cc \\u062e\\u0627\\u0645\\u0648\\u0634\\u0640\\u0640\\u0640\\u0640\\u0640\\u0640\\u06cc\\u0627\\u06ba \\u0628\\u06be\\u06cc \\u0633\\u0645\\u062c\\u06be\\u06d2 .\\U0001f1ee\\U0001f1f3\\U0001f1ee\\U0001f1f3\\U0001f1ee\\U0001f1f3\\U0001f1f9\\U0001f1f7\\U0001f1f9\\U0001f1f7\\nIslamic scholar.',b'199',b'172',b'0',b'3542',b'19323',b'False',b'False',b'True',b'False',b'2019-06-23 02:06:50'
b'@RanaAyyub Illegals and their supporters tantrum is like this only\\n\\nYou as muslim why not asking muslim majority na\\u2026 https://t.co/Q2SwbsiWLV',b'1232280061899763712',b'\\u0ba4\\u0bbe\\u0baf\\u0bcd\\u0bae\\u0ba9\\u0bae\\u0bcd',b'Thaaymanam',b'',b'\\u0ba8\\u0bbe\\u0ba9\\u0bcd \\u0baf\\u0bbe\\u0bb0\\u0bcd \\u0b8e\\u0ba9\\u0bcd\\u0bb1\\u0bc1 \\u0b85\\u0bb1\\u0bbf\\u0baf \\u0bb5\\u0bbf\\u0bb0\\u0bc1\\u0bae\\u0bcd\\u0baa\\u0bae\\u0bcd \\u0b85\\u0ba9\\u0bcd\\u0baa\\u0bc1 \\u0b89\\u0bb3\\u0bcd\\u0bb3\\u0b99\\u0bcd\\u0b95\\u0bb3\\u0bcd - http://t.co/dYgy8WJXgC -  \\u0b85\\u0bb5\\u0b9a\\u0bbf\\u0baf\\u0bae\\u0bcd \\u0baa\\u0b9f\\u0bbf\\u0b95\\u0bcd\\u0b95\\u0bb5\\u0bc1\\u0bae\\u0bcd...',b'146119',b'99888',b'57',b'173247',b'2935',b'False',b'False',b'False',b'False',b'2011-01-28 09:14:05'
b'@pokershash @desimojito @rohini_sgh @Nidhi Sablog inse bachne k liye ek ek muslim wali ID card banwa lo.. ya to pak\\u2026 https://t.co/rD3grPorlZ',b'1232280057915133952',b'Brown Coffee',b'BrownCofffee',b'\\u092d\\u093e\\u0930\\u0924\\u0935\\u0930\\u094d\\u0937 ',"b'\\U0001f1ee\\U0001f1f3Here to express my views on issues that I feel needs to be expressed,and to understand different perspectives! Not a blind follower of any political party.'",b'19',b'356',b'0',b'1684',b'1105',b'False',b'False',b'True',b'False',b'2019-08-28 19:55:08'
b'@JamaliNahela @im_MdAdnan @TalhaGulbargavi @SidrahDP Maine ye nai Kaha Islam Chor Dia Maine kaha Desh Ko ziyda Impo\\u2026 https://t.co/aa9T3ilQoC',b'1232280051946840071',b'Sayed Adnan Shah \\u0633\\u06cc\\u062f \\u0639\\u062f\\u0646\\u0627\\u0646 \\u0634\\u0627\\u06c1',b'SayedAdnanshah4',b'Zameen',b'\\u200fSilence is also an Expression\\n\\u062e\\u0627\\u0645\\u0648\\u0634\\u06cc \\u06a9\\u06cc \\u0628\\u06be\\u06cc \\u0627\\u06cc\\u06a9 \\u0632\\u0628\\u0627\\u0646 \\u06c1\\u0648\\u062a\\u06cc \\u06c1\\u06d2',b'36',b'1604',b'0',b'253',b'185',b'False',b'False',b'True',b'False',b'2018-08-21 18:33:18'
"b'As a muslim married to 2wives, is threesome a sin?\\U0001f412'",b'1232280050369802254',b'\\U0001f340\\U0001f47d\\U0001f340',b'ijebu_buoy',b'cloud9',b'Stoners are my favorite\\U0001f47d || weirdo\\U0001f577 || cat guy\\U0001f43e || \\na guy in his world\\U0001f464||',b'355',b'560',b'0',b'3803',b'9709',b'False',b'False',b'True',b'False',b'2019-03-12 14:50:31'
b'@servivigiledeus @Upyourjunker1 UK is not Europe. He is preaching the Gospel. And a Muslim guy pointed him out to the police',b'1232280048822112256',b'GAlexanderLucas',b'GAlexanderlucas',b'London.BREXIT \\U0001f1ec\\U0001f1e7\\U0001f1ec\\U0001f1e7\\U0001f1ec\\U0001f1e7 ',"b'Jesus said, Iam the Way the Truth and the Life, no one comes to the Father(Paradise) except through Me. John 14.6'",b'2713',b'4642',b'17',b'36146',b'20175',b'False',b'False',b'True',b'False',b'2017-04-08 02:29:27'
b'Sudah sangat nyata bahwa rezim sangat takut bangkitnya umat muslim\\n &gt;&gt; #SaveAdvokatPejuang &lt;&lt;\\n #KawalKetuaLBHPU .\\u2026 https://t.co/bscwZrZMgK',b'1232280048712941573',b'Ana ummu kholid',b'AnaKholid',b'',"b'Laa izzata illa bil islam, wa laa islama illa bis syariah, wa laa syariata illa bid daulah, daulah khilafah rosyidah'",b'223',b'284',b'0',b'2408',b'64',b'False',b'False',b'True',b'False',b'2019-02-16 22:54:18'
b'@PakRoaster99 @_saifalam @Kritika_Kamra @anuragkashyap72 No. All leftists do not spread that Propaganda. Agar kisi\\u2026 https://t.co/3LC1t35lMU',b'1232280047177883654',b'Amogh Vaishnav',b'AmoghVaishnav1',b'',b'',b'0',b'14',b'0',b'90',b'56',b'False',b'True',b'True',b'False',b'2018-01-25 02:39:10'
"b'Saya muslim, saya siap dampingi Ahmad Khazinudin\\n &gt;&gt; #SaveAdvokatPejuang &lt;&lt;\\n #KamiBersamaLBHPU - #DampingiKetuaLBHPU\\n#DCCT\\n\\n@Warkop_1453'",b'1232280044203999237',b'Nurida',b'Nurida58770961',b'',b'',b'80',b'111',b'0',b'2603',b'274',b'False',b'False',b'True',b'False',b'2017-07-15 11:00:55'
"b'@Nidhi \\u201cMera ID card dekh lo bhai, Muslim hi hu main\\u201d A journalist who was surrounded by violent muslim mob saved h\\u2026 https://t.co/CbnFQWRhsH'",b'1232280040324435969',b'Truth',b'scionearth',"b'Jharkhand, India'",b'truth',b'7',b'53',b'0',b'438',b'534',b'False',b'False',b'True',b'False',b'2018-01-29 17:57:11'
b'@RanaAyyub Who all the Muslim friends in Delhi u have? Pakistani / Bangladeshi\\nWhy I am not seeing anyone leaving?\\u2026 https://t.co/eYQ2QR1Rfp',b'1232280040240537601',b'@mit\\xa9\\xae\\u2122',b'gangal82',b'India',"b'More than an ape, less than a homosapien :)'",b'211',b'181',b'2',b'5435',b'8004',b'False',b'False',b'False',b'False',b'2009-06-21 10:24:54'
b'@Vaibhav01392706 @ReallySwara @DelhiPolice  this man is giving threatening to me he wants to kill all muslim .',b'1232280035597443072',b'Amra Azam',b'amy_farooqi',"b'Lucknow, India'",b'Stronger than anything\\n\\u0905\\u0902\\u0927\\u092e\\u094b\\u0926\\u0940 \\u092d\\u0915\\u094d\\u0924 \\u0926\\u0942\\u0930 \\u0930\\u0939\\u0947 \\u0928\\u0939\\u0940 \\u0924\\u094b \\u092c\\u091c\\u093e \\u0926\\u0947\\u0902\\u0917\\u0947 \\u0915\\u093e\\u090f\\u0926\\u0947 \\u0938\\u0947',b'315',b'128',b'0',b'422',b'798',b'False',b'False',b'True',b'False',b'2017-02-21 09:44:38'
b'Minyak yu ye around RM 11 plus. Minyak kononnya keluaran Muslim apa entah namanya RM29 exclude postage. Murah lagi minyak yu ye \\U0001f937\\U0001f3fb\\u200d\\u2640\\ufe0f',b'1232280034343178241',b'Nanaddd',b'diyynadyaa',b'Cyberjaya',b'wife and mummy',b'424',b'631',b'1',b'35548',b'2335',b'False',b'False',b'False',b'False',b'2014-03-10 01:13:38'
b'@Real_sanatani_ @Furkanjmm @HemantSorenJMM @DCEastSinghbhum @JharkhandPolice MUSLim petrol pe gari chlata h are Raa\\u2026 https://t.co/TtZTP1Xu5A',b'1232280032816631810',b'insaniyat',b'being_insaniyat',b'',b'ok',b'6',b'79',b'0',b'216',b'378',b'False',b'False',b'True',b'False',b'2018-11-20 07:56:16'
b'@MehrTarar Have you heard name of Kartarpur Sahib?\\nWhen Jihadi Pakistani Muslim Mob was attacking innocent Sikhs an\\u2026 https://t.co/wGM1flujJa',b'1232280024633561089',"b""THE CHILD'S DOCTOR""",b'DocDKGupta',b'',"b'MBBS(Gold Medalist),MD Pediatrics.\\n#Full_Time_Pediatrician\\n#Part_Time_Twitterician.\\nProud Indian,\\nBeliever, Dreamer & Achiever..\\n#Be the force to reckon with#'",b'225',b'2058',b'0',b'4120',b'7461',b'False',b'False',b'True',b'False',b'2016-09-12 09:51:02'
"b'@abekhaaamosh @Khushbookhan_ @narendramodi Yes, independence of #kashmir is very near #KhalistanIN2020 referendum w\\u2026 https://t.co/wssmlJHUtI'",b'1232280019650609152',b'Muhammad Jahanzaib',b'jahanzaibkalwa2',b'Pakistan',b'Seasoned Human Resources & Administration Professional \\nThe retweet\\x1b is not Endorsements.\\nPatriotic Pakistani \\nLife Devoted for Pakistan\\nI am #Insafian',b'72',b'316',b'1',b'4431',b'1181',b'False',b'False',b'True',b'False',b'2014-08-02 17:43:14'
"b'Seven killed, 150 injured in riots in New Delhi\\nIntinya:\\nMemudahkan orng diluar agama yg dianut mayoritas india, me\\u2026 https://t.co/ncFy5gq2Fc'",b'1232280013572935680',b'Yudha Darma Bangsa',b'somewhereserene',b'Indonesia',b'Atomic Heart',b'328',b'729',b'2',b'15543',b'3399',b'False',b'False',b'False',b'False',b'2013-08-01 14:36:53'
"b""Muslim Brotherhood\\nList of 'in the news now [names]' w/ known ties to Islam? \\nTHIS IS NOT ANOTHER 4-YEAR ELECTION.\\u2026 https://t.co/WujBhMp9Us""",b'1232280013166325766',b'Patricia \\U0001f31f\\U0001f31f\\U0001f31f',b'ugitsisgv',b'',"b'Grandmother, married, #MAGA, like dialog-block rudeness (my account, my right), block unseemly sites.'",b'13012',b'13342',b'0',b'90920',b'69761',b'False',b'False',b'True',b'False',b'2016-05-01 20:11:15'
b'Suka aja liat video orang - orang yg jadi mualaf. Barakallah. Bangga banget jadi muslim sejak pertama kali hadir di dunia:)',b'1232280006467837952',b'adel',b'adeliayln__',b'Tegal',b'alon - alon asal kelakon',b'13',b'118',b'0',b'433',b'573',b'False',b'False',b'True',b'False',b'2019-10-26 14:59:49'
b'@ELYm3aoK86pylfr @Arunan22 Same to BJP also.. ennadhan Muslim Muslims nu kalavarathai thoondinalum tamilnadukkul Or\\u2026 https://t.co/jLAJHGUgYY',b'1232280006430081024',b'Arunaru',b'Kingmaker_arun6',b'',b'',b'17',b'45',b'0',b'1100',b'1317',b'False',b'True',b'True',b'False',b'2014-08-31 09:52:31'
"b""@m_malyun Best to keep it halal if you're Muslim""",b'1232280000243683330',b'Mo',b'justmo12',b'Grand Line',b'the future is on Namek',b'771',b'831',b'4',b'14384',b'37776',b'False',b'False',b'False',b'False',b'2016-04-03 17:17:37'
b'Delhi violence: Mobs throw petrol bombs at Muslim homes in Kabir Nagar; toll rises to 9 https://t.co/zTO8pxz05d via @scroll_in',b'1232279999069196289',b'TrueMedia',b'Iamgandhiwadi',b'RU',"b'\\u201cYou must not lose faith in humanity. Humanity is an ocean; if a few drops of the ocean are dirty, the ocean does not become dirty.\\u201d \\u2013 Mahatma Gandhi'",b'2535',b'2532',b'51',b'22975',b'47446',b'False',b'False',b'True',b'False',b'2013-12-25 12:21:06'
b'Kami menolak semua upaya meng kriminalisasi semua para pejuang yang membela ulama dan Muslim termasuk ketua LBH pel\\u2026 https://t.co/qXI31fsDjy',b'1232279998712565765',b'Sambeltabur',b'sambeltabur',b'',b'Hanya biji cabe yg terselip di gigi',b'160',b'562',b'0',b'676',b'250',b'False',b'False',b'True',b'False',b'2020-01-02 09:59:07'
b'@BreitbartNews Muslim brotherhood.',b'1232279970807869441',b'Just mike.',b'Miked12511',b'',b'',b'36',b'146',b'0',b'2007',b'1681',b'False',b'False',b'True',b'False',b'2018-02-14 23:15:27'
b'Orang muslim selalu jadi incaran rezim komunis\\n &gt;&gt; #SaveAdvokatPejuang &lt;&lt;\\n #KawalKetuaLBHPU - #LBHPelitaUmat\\n#EB1B\\n\\n@Senopat36270472',b'1232279964143063040',b'Ayeesa Al Faruq',b'AyeesaF',b'',b'',b'78',b'284',b'0',b'1269',b'32',b'False',b'False',b'True',b'False',b'2019-09-26 11:47:05'
b'Kurang greget semestinya muslim pejuang\\n &gt;&gt; #SaveAdvokatPejuang &lt;&lt;\\n #KamiBersamaLBHPU . #LBHPelitaUmat\\n#CFS5\\n\\n@ArSyahruddin',b'1232279960984801286',b'Aki Artha',b'AkiArtha',b'',b'akiartha',b'116',b'201',b'0',b'1706',b'41',b'False',b'False',b'True',b'False',b'2018-05-06 09:19:01'
b'@PeterSweden7 @mariawirth1 Must be Muslim and Islam behind it due to Whoran and \\U0001f417\\U0001f4a9@ll@h',b'1232279957683961856',b'\\u0100\\u1e37\\u0101ra K\\u0101l\\u0101ma',b'KalamaAlara',b'',b'Truth and \\u0101ki\\xf1ca\\xf1\\xf1\\u0101yatana aniccha \\U0001f60a\\U0001f64f\\u2638\\ufe0f',b'106',b'1197',b'0',b'24941',b'23433',b'False',b'False',b'True',b'False',b'2019-11-06 12:48:21'
b'A Hindu like @ReallySwara standing for the Rights of the Minorities and a Muslim like @RubikaLiyaquat standing with\\u2026 https://t.co/LAJRj3NWvu',b'1232279957042343936',b'Hussain Ahmed Laskar',b'hussain_las',b'India',b'Student',b'31',b'116',b'0',b'1606',b'6109',b'False',b'False',b'True',b'False',b'2013-06-04 18:06:13'
b'LBH PU yg selama ini gigih membela kepentingan Islam &amp; kaum Muslim tengah alami kriminalisasi. Kami bersama LBH PU\\u2026 https://t.co/NfT4N0eHMm',b'1232279950243155969',b'Abah Nasrullah',b'AbahNasrullah',b'',b'Hanya mengharap ridho Allah',b'55',b'81',b'0',b'403',b'2',b'False',b'False',b'True',b'False',b'2020-02-10 04:31:28'
b'@Ckhera7 @vishnuraj0302 @Nehr_who Yaa. Those who believe that India was made for Hindus and Muslim are actually fol\\u2026 https://t.co/Sh9S1N8FBO',b'1232279947252846592',b'RJ',b'RJ59059777',b'',b'',b'4',b'257',b'0',b'603',b'697',b'False',b'False',b'True',b'False',b'2020-01-18 04:30:06'
"b'@LiberalMantri I would like to respectfully disagree here. The army may be many things, but it is certainly not com\\u2026 https://t.co/Vk5meU4Lhl'",b'1232279940877320198',b'asdfg',b'asdfg65828761',"b'""Khan Market Gang"" territory '","b'We shall fight these sanghis everywhere. We shall fight them on the streets, we shall fight them online, we shall fight them in the electoral booths.'",b'54',b'292',b'0',b'10997',b'13276',b'False',b'False',b'True',b'False',b'2020-01-07 19:17:36'
"b'Kenapa umat Muslim terus yg didzolimi? Apa karna umat muslim perilakunya jujur, adil, menegakkan kebenaran dan memb\\u2026 https://t.co/QhBZ5lVnqH'",b'1232279937744175104',b'Bunga Nirwana',b'bunganirwana_83',"b'DKI Jakarta, Indonesia'",b'Seorang pendosa yang senantiasa berharap ampunan dari Rabb nya',b'215',b'299',b'0',b'1480',b'523',b'False',b'False',b'True',b'False',b'2018-07-29 12:32:25'
b'Complete panic in muslim areas of northeast delhi #DelhiRiots',b'1232279933029879810',b'Junaid Quadir',b'junaid_quadir',b'Junaid quadir',"b'Proud Kashmiri,Business student, Interesting in politics and social human affairs, Capricorn'",b'150',b'1074',b'3',b'1134',b'174',b'False',b'False',b'False',b'False',b'2011-03-06 09:17:46'
b'This is not pro caa. This is anti Muslim. Anti national. Anti constitution. Anti humanity. Delhi burns because of t\\u2026 https://t.co/JLZF1DlALb',b'1232279930928615435',b'Junaid Quadir',b'junaid_quadir',b'Junaid quadir',"b'Proud Kashmiri,Business student, Interesting in politics and social human affairs, Capricorn'",b'150',b'1074',b'3',b'1134',b'174',b'False',b'False',b'False',b'False',b'2011-03-06 09:17:46'
"b'muslim leaders created GODRA 0.2 . Murdered Hindus, cops.blocked road,Metro...for GODs sake get new land and go.. v\\u2026 https://t.co/4ecuEqyKkm'",b'1232279927069667328',b'sadaadmi',b'farthepeople',b'',"b""Ask your MLA and MP  WHAT  have you   done to my village,NEXT gen..my .Farmer ..if he can't answer dont vote for his party.""",b'127',b'1074',b'2',b'35029',b'956',b'False',b'False',b'False',b'False',b'2011-04-07 18:27:39'
b'Karnataka Brace for more Hindu-Muslim Pakistan Zindabad stuff.. https://t.co/VWTLkCMaRG',b'1232279917452132354',b'\\u0cb8\\u0ccb\\u0cae\\u0cbe\\u0cb0\\u0cbf',b'SomaariSiddha',b'',"b'\\u0c95\\u0ca8\\u0ccd\\u0ca8\\u0ca1\\u0cb5\\u0cc6\\u0ca8\\u0cc6 \\u0cae\\u0cbe\\u0ca4\\u0ccd\\u0cb0 \\u0c95\\u0cbf\\u0cb5\\u0cbf \\u0ca8\\u0cbf\\u0cae\\u0cbf\\u0cb0\\u0cc1\\u0cb5\\u0cc1\\u0ca6\\u0cc1.. \\u0c87\\u0cb2\\u0ccd\\u0ca6\\u0cbf\\u0ca6\\u0ccd\\u0cb0\\u0cc6 \\u0ca8\\u0ca8\\u0ccd\\u0c95\\u0cc8\\u0cb2\\u0cbe\\u0c97\\u0ccb\\u0ca6\\u0cc1 \\u0c87\\u0cb2\\u0ccd\\u0cb2, \\u0ca8\\u0cbe\\u0ca8\\u0cc1 \\u0cac\\u0cb0\\u0ccb\\u0ca6\\u0cc1 \\u0c87\\u0cb2\\u0ccd\\u0cb2.'",b'233',b'216',b'0',b'3078',b'665',b'False',b'False',b'False',b'False',b'2017-03-29 08:08:05'
b'@Imamofpeace Sir tweet ...about. \\nCitizenship amendment act(CAA)\\nNational rigister of citizenship (NRC)\\nNational po\\u2026 https://t.co/wloUGME6JK',b'1232279909503946761',b'Ajay shetti \\U0001f1ee\\U0001f1f3',b'Ajayshettipspk',"b'Telangana, India'",b'interested in temples and ancestors...social activist.. Indian politics.. Modi fan... Proud to be Indian.. proud to be hindu \\U0001f6a9\\u091a\\u0925\\u094d\\u0930\\u092a\\u0925\\u093f \\u0936\\u093f\\u0935\\u093e\\u091c\\u0940 \\u092e\\u0939\\u093e\\u0930\\u093e\\u091c \\u0915\\u0940 \\u091c\\u092f\\U0001f6a9',b'153',b'237',b'0',b'1816',b'1499',b'False',b'False',b'True',b'False',b'2018-04-17 08:54:35'
b'@WordswithSteph @BarbLovesHawaii The prison warden simply MUST be a female person of color!\\n\\nPreferably an atheist\\u2026 https://t.co/NePDIwhKoM',b'1232279895327166465',b'Paul in AZ',b'AZ_progressive',b'PHX',"b""Please don't make eye contact with me.""",b'1066',b'2397',b'1',b'22563',b'38126',b'False',b'False',b'False',b'False',b'2013-04-27 16:22:18'
"b'@Cold_Peace_ Even if jihadis are 10-15% of muslim population, it is still a huge figure. Now seeing educated muslim\\u2026 https://t.co/SvwFpX4TGQ'",b'1232279890306617344',b'Main nahi hun iss duniya se',b'AMANMOD34401629',b'',b'BJP IT cell employee earning rs-2 per tweet',b'28',b'290',b'0',b'5787',b'2487',b'False',b'False',b'True',b'False',b'2019-07-14 12:12:40'
b'Hukum buatan manusia yg ada di negeri ini sangat lemah dan faktanya selalu digunakan untuk kepentingan penguasa men\\u2026 https://t.co/Ny2gUcplwA',b'1232279889488728070',b'KurniasihE',b'DianEncih',b'',"b""islam rahmatan lil'aalamiin""",b'5',b'1',b'0',b'803',b'35',b'False',b'False',b'True',b'False',b'2020-01-15 07:36:21'
b'Don\\u2019t use Amotekun to settle political scores \\u2014 Oyo Muslim community @tvnigerian https://t.co/wkJaNyP7Qk',b'1232279882438250496',b'M_I_C_H_\\xd8',b'MichoAgbese',b'Hungary',b'https://t.co/4XQ4YcHp8F',b'73',b'288',b'0',b'19636',b'206',b'False',b'False',b'True',b'False',b'2016-09-18 04:36:00'
b'@DrJamesKent3 What happened to free speech in this country!  He had every right to speak his mind!  Why do they nev\\u2026 https://t.co/4TmGwrjXHY',b'1232279880706002944',b'elite',b'elite46202580',b'',b'',b'591',b'266',b'7',b'38965',b'34483',b'False',b'True',b'True',b'False',b'2019-04-05 16:58:25'
b'I remember hiding under desks in the basement of grammar school because Fidel was that generations Muslim',b'1232279880554840064',b'Stanley Cohen',b'StanleyCohenLaw',"b'Marshall, MN'","b""Attorney. Activist. Freedom Fighter. 'Certified Selfloathing' Jew. AntiZionist. Prolific. Beard Aficionado. New Yorker. Unfortunately Tenacious Yankees Fan.""",b'26678',b'351',b'725',b'379024',b'73365',b'False',b'False',b'False',b'False',b'2012-06-14 21:21:16'
"b""@AmmU_MaanU @thewire_in This isn't entirely accurate. Even if you're not Muslim, to avail CAA you will be asked wha\\u2026 https://t.co/rnybedhpgL""",b'1232279879619661824',b'Kavita Krishnan',b'kavita_krishnan',b'Delhi',"b'Woman who misbehaves & rants on TV, Twitter, FB, YouTube! (Have had to be told to behave by one male star TV anchor, told I rant by another).'",b'624059',b'3104',b'669',b'59723',b'49426',b'True',b'False',b'False',b'False',b'2013-03-13 06:08:28'
"b'@cjwerleman you are one of the influencer fools who likes to twiddle thumbs sitting in some other country, talking\\u2026 https://t.co/tE17yEbwiA'",b'1232279879372009472',b'Siddhartha Sachan',b'SidSachan',b'new delhi',b'Traveller.....#craziestmufcfan...enthusiast....#foodlover...#mufc for life',b'74',b'152',b'0',b'545',b'113',b'False',b'False',b'True',b'False',b'2012-07-09 10:10:57'
"b'@AP88302159 @Bhabanprasad @bainjal Bro Mughals rules India overall 1300 years, English for 200 years... Still Hindu\\u2026 https://t.co/SxXlbXrEBO'",b'1232279875219869701',b'Ub',b'Ubbus85',b'',b'Analyze any information on your own before believing it...',b'1',b'18',b'0',b'476',b'288',b'False',b'False',b'True',b'False',b'2017-08-23 14:59:04'
"b""@jyotiyadaav I'm. Muslim and proud to Jay shree ram, but.   Ye aaj SE ghrnaa ho rahi hai.. shame hindu""",b'1232279872485109762',b'Aqil Bhati',b'AqilBhati3',b'',b'indian',b'5',b'233',b'0',b'83',b'119',b'False',b'False',b'True',b'False',b'2019-11-12 03:17:11'
"b'@0Parody @Nidhi Hindu muslim, pakistan, 370, pulwama. This is economy according to him \\U0001f61c'",b'1232279866336325633',b'ProudIndian',b'hkalal123',b'',b'Your voice can make a difference. An evid supporter of Priyanka gandhi. If speaking the truth makes me anti-national - so be it.',b'95',b'69',b'0',b'896',b'7529',b'False',b'False',b'True',b'False',b'2020-02-09 08:05:47'
b'Sesama muslim bagai bangunan yang saling menguatkan\\n &gt;&gt; #SaveAdvokatPejuang &lt;&lt;\\n #DampingiKetuaLBHPU . #KamiBersamaLBHPU\\n#EZQB\\n\\n@avcdo__',b'1232279864159326208',b'Ratna umaroh',b'RatnaUmaroh18',"b'Kota Tangerang, Banten'",b'Love allah swt',b'41',b'81',b'0',b'899',b'373',b'False',b'False',b'True',b'False',b'2018-09-30 11:20:03'
b'@Sobatdakwah1 @BwiDhira Kurang greget semestinya muslim pejuang\\n &gt;&gt; #SaveAdvokatPejuang &lt;&lt;\\u2026 https://t.co/f2MIrag2Jw',b'1232279852251664384',b'wahyoeceria',b'wahyoeceria1',b'',b'',b'35',b'49',b'0',b'231',b'47',b'False',b'False',b'True',b'False',b'2020-01-15 05:41:44'
"b'@loves__india @ArvindKejriwal Dhadkan sab mein hoti hai, hindu aur muslim mein koi alag-alag dard ya saansein nahin\\u2026 https://t.co/bRx8V182fC'",b'1232279847931645952',b'Abhimanyu Thakur',b'AbhiManThakur',"b'New Delhi, India'",b'Student of Masters.',b'29',b'847',b'0',b'1675',b'572',b'False',b'False',b'True',b'False',b'2020-01-18 18:58:43'
"b""Hukum Puasa Rajab Sunah atau Bid'ah? Yuk Simak Dalil-dalilnya | Tausyiah - https://t.co/9E7qi57ms9 - https://t.co/IutTjKqtTs""",b'1232279845209595904',b'NKRI HARGA MATI',b'nkriharga_mati',b'',b'Jargon memperjuangkan Islam sebenarnya adalah memperjuangkan suatu agenda politik tertentu',b'1734',b'1755',b'1',b'897',b'1392',b'False',b'False',b'True',b'False',b'2019-12-12 09:52:55'
"b'@dorsata_apis Sesama muslim adalah saudara, jika ada masalah maka beri dukungan agar tidak ada yang terdzolimi.\\n &gt;&gt;\\u2026 https://t.co/97DjWxuLP5'",b'1232279838364319744',b'rita lustianing',b'RLustianing',b'',b'',b'23',b'48',b'0',b'545',b'1',b'False',b'True',b'True',b'False',b'2019-12-08 04:48:06'
b'@iainmarlow @virsanghvi A riot is when #TwoSides clash violently. Painting it as Anti-Muslim is criminally wrong. I\\u2026 https://t.co/gCF5GPvU1k',b'1232279830445641728',b'Nish',b'mish_nish',"b'Mumbai, India'",b'Media enthusiast. Floating with life is a way to find happiness amidst of all that is nonsensical around me.',b'49',b'137',b'1',b'1447',b'10328',b'False',b'False',b'True',b'False',b'2012-05-07 11:40:07'
"b'Oh Muslim rulers! Refrain now, before doors of apology are closed for you.. \\n\\nSayings of Hafeez Jalandhari \\n\\nHD Vid\\u2026 https://t.co/YZmkfD5Yzj'",b'1232279829678043137',b'Khadim Hussain Rizvi',b'TLPChiefEng',"b'Lahore, Pakistan'","b'Official English Translation Twitter account of Great Islamic Scholar, Preacher & TLP Chief.'",b'5420',b'1',b'3',b'248',b'113',b'False',b'False',b'True',b'False',b'2019-11-04 10:14:44'
"b'Saya menolak segala bentuk kriminalisasi kepada saudara muslim, tak terkecuali pada Ahmad Khazinudin ketua LBH Peli\\u2026 https://t.co/XCyiiZ7sSW'",b'1232279827933061120',b'ulfifitriani_',b'ulfifitriani4',b'Indonesia',b'Islam is the way of life',b'127',b'67',b'0',b'215',b'24',b'False',b'False',b'True',b'False',b'2018-05-20 08:23:38'
b'Live | Rioters set fire to a shop identified as belonging to a member of the Muslim community\\n#DelhiRiots\\nhttps://t.co/x1q0UL55xT',b'1232279823189327878',b'The Hindu',b'the_hindu',"b'Chennai, India'","b""News feeds from India's National Newspaper""",b'5764794',b'201',b'6027',b'299464',b'142',b'True',b'False',b'False',b'False',b'2009-02-13 06:04:24'
"b""@DrunkAustrian Sweden Democrat kids are the same as Social Democrat kids, except they supposedly don't like muslim\\u2026 https://t.co/TDPHNdsUz9""",b'1232279821876695046',b'Christianus de Ursino',b'skaudrums',b'',b'VDMA/SDG',b'147',b'922',b'4',b'6106',b'11500',b'False',b'False',b'False',b'False',b'2015-05-16 16:08:26'
b'@Independent Meanwhile the far right continue to claim this only happens in northern towns with large Muslim commun\\u2026 https://t.co/itxNFJJLZF',b'1232279819255152641',b'Simon Haydon #FBPE',b'SimonHaydonx',b'',b'',b'40',b'645',b'0',b'12502',b'5402',b'False',b'False',b'False',b'False',b'2009-11-26 14:21:30'
b'@_sabanaqvi Why riots take place only in muslim localities? Women are not far behind men in rioting. https://t.co/V4RHroJcO3',b'1232279808609898496',b'Jitendra Prasad',b'Jprasad55',b'India',"b'Senior executive of petroleum industry, professor of petroleum engineering'",b'77',b'91',b'0',b'6341',b'12275',b'False',b'False',b'True',b'False',b'2017-10-04 14:06:13'
"b""'Are you Hindu or Muslim?\\u2019: TOI photojournalist recounts Maujpur horror https://t.co/YwTFHPnlR6 via @timesofindia""",b'1232279808127766529',b'Sucharita',b'malusssrd',b'',b'',b'44',b'81',b'0',b'37',b'41',b'False',b'False',b'True',b'False',b'2016-04-24 10:43:09'
