b'@aaliznat @shreemiverma Hum aise kanoon ke khilaf aapas mein ladd rahe hain jinka na indian hindu muslim se lena dena hai',b'1232015725675438081',b'Accidental Lawyer',b'glorifiedlawyer',b'',"b'NLU/Lawyer/Traveller/65+ countries/Delhi(Gurgaon)/ you busted a mirror and got seven years bad luck, as your lawyer i can get you five.'",b'84',b'675',b'0',b'2073',b'1652',b'False',b'False',b'True',b'False',b'2019-01-11 04:22:59'
b'#Jib : #Muslim Cleric Praises #NairaMarley \\u2019s \\u201c #Soapy\\u201d At An Event || Watch Video: https://t.co/EBlGCJre56',b'1232015723528105984',b'Jordan  Isoa',b'Jordan9ja',b'Earth. ',"b'#GodFirst, #JordanIsoa , #JIB , #J9ja ,  +2347056321972'",b'556',b'514',b'69',b'53882',b'468',b'False',b'False',b'False',b'False',b'2011-03-04 10:46:50'
b'@KRISHNA_DEOGHAR @PJkanojia @DelhiPolice @AmitShah @narendramodi @PMOIndia Gadhey maine Hindu Muslim ki baat kab ki\\u2026 https://t.co/tQ4Tavuuab',b'1232015714422312962',b'Amir Rehan',b'AmirReh26065394',b'India',b'My attitude will always be based on how you treat me.....',b'3',b'42',b'0',b'630',b'874',b'False',b'False',b'True',b'False',b'2019-09-20 15:38:30'
"b'China, a one-party authoritarian state that quashes free speech, is trampling \\u201cone country, two system\\u201d governance\\u2026 https://t.co/8Nw8O53F2Q'",b'1232015713805664262',b'Joseph Saltarelli',b'JoeJSaltarelli',b'',"b'Attorney and mediator with interest in history, politics and foreign affairs. Beauty is in the eye of the beholder, but truth must be held to a higher standard.'",b'2340',b'1041',b'9',b'15151',b'21983',b'False',b'False',b'True',b'False',b'2016-10-30 22:24:27'
b'@AliaChughtai @asadick hahaha perks of being muslim woman. n then muslim women say islam gives equal rights.',b'1232015712857796608',b'Sagan Carl',b'sagancarl33',b'',b'Not looking for followers. What i retweet is also for myself to read/watch later on or again.',b'34',b'48',b'0',b'248',b'4276',b'False',b'False',b'True',b'False',b'2019-03-17 19:11:26'
b'@abhisar_sharma @anuragkashyap72 @KapilMishra_IND #Shoot_the_muslim_terrorists\\n\\n#ShootTheRioters\\n\\n\\u091f\\u094d\\u0930\\u0947\\u0902\\u0921 \\u0915\\u0930\\u093f\\u090f \\u0907\\u0938\\u0947 \\u0938\\u2026 https://t.co/TCjli4GYKc',b'1232015697758302212',b'\\u092e\\u0943\\u0923\\u093e\\u0932 \\u0938\\u093f\\u0902\\u0939',b'MrinaalSingh',b'new delhi ',b'\\u092e\\u0947\\u0930\\u0947 \\u0939\\u0948\\u0902 \\u0932\\u093e\\u0916\\u094b\\u0902 \\u0930\\u0902\\u0917......................\\u092c\\u094b\\u0932\\u094b \\u0924\\u0941\\u092e \\u0915\\u094c\\u0928-\\u0938\\u093e \\u0926\\u0947\\u0916\\u094b\\u0917\\u0947 ?',b'14',b'111',b'0',b'57',b'34',b'False',b'False',b'False',b'False',b'2012-09-14 08:05:14'
"b'so a catholic, a hindu, and a muslim try to propose to an atheist....'",b'1232015696176898050',b'#\\u20ddrin\\u2077 \\u2606 CISHETS STFU',b'enbyvmon',b'19 | april \\u2661 | tjgbcgc',b'fan acc \\u273f THEY/HE \\u273f CARRD B4 U FOLLOW \\u2193',b'986',b'391',b'55',b'44803',b'33026',b'False',b'False',b'True',b'False',b'2019-07-24 05:21:44'
"b""@yeskaybe I am a Muslim , I can only imagine your struggle .\\nI hope you have like minded ppl in your life . Don't e\\u2026 https://t.co/KAexa0bYiu""",b'1232015694847303683',b'&hem',b'shembi79',b'',b'',b'68',b'339',b'0',b'6620',b'23920',b'False',b'False',b'True',b'False',b'2011-02-02 19:46:37'
b'first and foremost Khan is a Muslim he started his converting with banning biki adds which has always been liked by\\u2026 https://t.co/g2c5Pm1NqT',b'1232015689361346561',b'Fredricketts',b'fredricketts',b'London',b'',b'437',b'916',b'2',b'34224',b'6810',b'False',b'True',b'True',b'False',b'2011-01-25 19:30:57'
"b""@ggreenwald Thank you for responding.\\nI don't believe there is severe repression of Muslim minority by his governme\\u2026 https://t.co/qnyj6AhYAo""",b'1232015688702648326',b'Abhijit Kulkarni',b'mkabhijit2',b'Bangalore(previously Bay Area)',b'Main account : https://t.co/KGhNOms14o.\\nThis account is specifically for politics related stuff. #Tulsi2020(Dennis Kucinich for VP or SOS)',b'343',b'232',b'3',b'10585',b'16135',b'False',b'False',b'True',b'False',b'2019-11-19 18:24:43'
"b""i love all the muslims no cap\\U0001f4af but why does muslim girls don't love me back? \\U0001f614\\U0001f494""",b'1232015684177022976',b'Tharun Reddy',b'Akatsuki_323',b'kya ukhad loge jaankar bhi ?',b'sicko mode activated for 2020',b'106',b'481',b'6',b'9275',b'18929',b'False',b'False',b'False',b'False',b'2013-10-11 07:55:56'
"b""Jsui mort c'est juste pcquon est pas Muslim, il est a deux doigts de comprendre qu'en Afrique aussi y'a des gens pa\\u2026 https://t.co/3qjMsnoLsa""",b'1232015682864369672',"b""You'v \\U0001f30a""",b'iamdaddy_black',"b'Hauts-de-Seine, Ile-de-France'","b""C'est r\\xe9el pas de s\\xe9rie b \\U0001f4af""",b'778',b'345',b'54',b'170919',b'2858',b'False',b'False',b'False',b'False',b'2011-05-04 02:18:15'
"b'Anti-Islam intellectuals sometimes say ""Muslims should abandon Jihad"". The truth is we abandonded it a long time ag\\u2026 https://t.co/jVk7UgdJAA'",b'1232015664468107266',b'Hanad',b'SomaliHanad2020',"b'London, UK'",b'Computer programmer. Wannabe writer. Ideas guy.',b'828',b'1443',b'2',b'168',b'4006',b'False',b'False',b'True',b'False',b'2012-04-29 22:04:20'
b'@BDUTT @Kritika_Kamra Thumhra number bhi hai JAIL mai Jane ka bahut jalad kyoki thumhre jaise ghtiya patrkar Sara d\\u2026 https://t.co/kBgIX6EsCf',b'1232015652229021697',b'pratham kansal',b'prathamkansal',b'',b'',b'747',b'1108',b'0',b'23813',b'37391',b'False',b'False',b'True',b'False',b'2010-06-02 11:49:38'
b'@Nikkisoindi007 @Azeemsamajwadi1 @ReallySwara @DelhiPolice Iss bar kiya toh.. india me koi muslim nahi bachega',b'1232015647216951301',b'Sir Lundry',b'AawaaraHoon',"b'Mumbai, India'",b'',b'47',b'37',b'0',b'2028',b'1590',b'False',b'False',b'False',b'False',b'2013-05-04 07:52:40'
"b'This is Terrorism Instead of preventing this,coward #DelhiPolice provides security to rioters.\\n#NarendraModi a Musl\\u2026 https://t.co/AvH1myOWIG'",b'1232015644301963265',b'Usman Abdul Qayyum \\u2694\\U0001f1f5\\U0001f1f0',b'UsmanAQayyum',b'Pakistan',b'Researcher|Writer|Columnist at @BaaghiTV |Public Speaker|Promoting Peace & Saving Lives|Cyber Analyst |Muslim|Poetic|Married|Video Blogger| Green Blooded \\U0001f1f5\\U0001f1f0',b'3131',b'684',b'55',b'60099',b'1888',b'False',b'False',b'False',b'False',b'2015-05-16 17:53:16'
"b""@ragways @_sabanaqvi @realDonaldTrump bro, india's gov rn is very anti-muslim and you think they'll jail people for\\u2026 https://t.co/1f5cPyESH2""",b'1232015642024239104',b'Turtlemother',b'Turtlemother3',b'',b'Un Hija Purepecha',b'9',b'27',b'1',b'485',b'2200',b'False',b'False',b'True',b'False',b'2019-01-24 04:30:22'
b'@robertlargan Accusations of racism from a politician whose is happy to support a leader who thinks that black peop\\u2026 https://t.co/EgPEt3BADb',b'1232015629617684480',b'Peter Armstrong',b'PeterAr18228396',b'',"b'Prof. Emeritus. Leicester University School of Management. Industrial research engineer in former life. Rides one of 6 bikes most days, most weather.'",b'765',b'1133',b'4',b'2116',b'2018',b'False',b'False',b'True',b'False',b'2018-05-21 20:33:20'
b'Sir hindu goli mare to 3 din tak news par aata hai aur Muslim goli mare 4 lok mar gaye par koi news wala nahi dikha\\u2026 https://t.co/iHBk0zP0Zu',b'1232015620889141250',b'prabhash Mithlesh jha',b'iamcoolboy456',"b'New Delhi, India'",b'.',b'37',b'10',b'0',b'12',b'54',b'False',b'False',b'True',b'False',b'2010-08-18 11:37:34'
"b'@IvankaTrump Also, be sure to let your dad know it was built by the Muslim Mughal emperor Shah Jahan in memory of h\\u2026 https://t.co/dEyevQ4O28'",b'1232015615013072898',b'Nida Khan',b'NidaKhanNY',b'NYC & Worldwide',b'Independent journalist/analyst. Bylines: @HuffPost @usnews @Essence @NYDailyNews @i24NEWS_EN @CNN etc. \\nOpen Line Online @WBLS1075NYC Views expressed on purpose',b'9659',b'8893',b'280',b'148846',b'17291',b'False',b'False',b'False',b'False',b'2009-09-21 03:05:20'
"b'@Karimseizieme Par contre, \\xe9norm\\xe9ment d\\u2019hindou sont critiques pcq ils soutiennent les muslim, faut pas les n\\xe9gliger\\u2026 https://t.co/145k5fzjxK'",b'1232015614648164355',b'ilidan \\U0001f1ee\\U0001f1f3\\U0001f1eb\\U0001f1f7',b'Stormrage91',"b'Paris, France'",b'Parisien x Nerazzurri | Muslim par la gr\\xe2ce d\\u2019Allah | 91',b'245',b'411',b'0',b'343',b'3523',b'False',b'False',b'True',b'False',b'2019-12-04 23:52:29'
b'Homemade arab blowjob and saudi arab girl masturbating and muslim reality https://t.co/GksebKfLbV',b'1232015596138749952',b'Breann Minnier',b'BreannMinnier',b'',b'',b'0',b'0',b'0',b'87',b'0',b'False',b'False',b'True',b'False',b'2020-02-24 00:42:29'
b'@ValerieSaunder1 Compare and contrast the interest in Harvey Weinstein with the coverage of the rape of thousands o\\u2026 https://t.co/j0NWRM4Rv6',b'1232015589675282437',b'Paul Anderson',b'PaulAndersonNE6',"b'Morpeth, England'",b'West Ham supporter. Cricket lover. Fantasy Football fan. Low carber. Former Labour party supporter.  Pro Brexit.  Climate Change Sceptic.',b'3081',b'4998',b'3',b'10426',b'8963',b'False',b'False',b'True',b'False',b'2018-03-05 09:49:05'
b'@ketanvirani_ @sardanarohit Verry good....yeh kute dogle hindu hai jo SECULAR banke Muslim ki spot karte hai second\\u2026 https://t.co/GBoLW7jJDm',b'1232015586907099137',b'Vcc studios Hari vishnu',b'HariVcc',"b'Hyderabad, Chennai,Banglore '","b""I am film financier and film distributor south film industry's Hindi film industry's but only working with Hindustani Hindus..Muslim existed spotted CAA""",b'2',b'53',b'0',b'61',b'5',b'False',b'False',b'True',b'False',b'2020-02-11 08:21:18'
"b'@KapilMishra_IND at least you are coming forward to support #CAA_NRC_NPR , otherwise #DelhiBurning with the rumours\\u2026 https://t.co/OI73c5wGcL'",b'1232015586487656448',b'Shobha Vijender',b'ShobhaVijender2',"b'New Delhi, India'",b'Social activist',b'168',b'137',b'0',b'725',b'398',b'False',b'False',b'True',b'False',b'2019-06-26 18:49:15'
b'@Thefinalmessen2 @KieranPatricia @_IICS_ @MICLimerick @Islamireland I am afraid you are still confused about Islam\\u2026 https://t.co/Ny2bZ5uaZw',b'1232015582100361216',b'Dr Ali Selim',b'DrAliselim',"b'Dublin, Ireland'","b'Dr. Ali Selim, Muslim Irish Spokesperson and Muslim resident theologian'",b'269',b'76',b'4',b'185',b'13',b'False',b'False',b'True',b'False',b'2014-08-22 13:37:18'
"b'@jarariya91 @AmitShah Why? Who is responsible. Complete panic in Muslim areas like Pakistan, Afghanistan, Iran, Ira\\u2026 https://t.co/6benXYOWLw'",b'1232015577583104000',b'Ca Pankaj Sarawagi',b'pankajsarawagi',"b'Jhunjhunun, India'","b'Hindu, Modi supporter subject to development, supporter of patriotism. jai shree Ram \\U0001f4af, love & respect all religions,\\nCFO, tax consultant.\\n@pankaj_sarawagi'",b'2822',b'3027',b'3',b'1676',b'47971',b'False',b'False',b'False',b'False',b'2010-05-18 06:03:39'
"b'""I Am Hijabi, Muslim, Black..."": Rep. Ilhan Omar Posts List Describing Herself to Troll Conservatives; Rival Candid\\u2026 https://t.co/QItH2mG9vc'",b'1232015576027009032',b'Paul',b'robbipl',b'United States',b'God/Family/Country\\nUSArmy',b'10776',b'11053',b'83',b'149011',b'80184',b'False',b'False',b'False',b'False',b'2009-12-20 01:05:57'
"b'@_sabanaqvi Panic in Muslim areas? How come?\\U0001f631\\n\\n\\u0908\\u0902\\u091f \\u092a\\u0924\\u094d\\u0925\\u0930, \\u092c\\u0902\\u0926\\u0942\\u0915, \\u092a\\u094d\\u0930\\u0926\\u0930\\u094d\\u0936\\u0928 \\u0938\\u092c \\u0909\\u0928\\u0915\\u0947 \\u0939\\u093e\\u0925 \\u092e\\u0947\\u0902, \\u092b\\u093f\\u0930 \\u092d\\u0940?\\U0001f914'",b'1232015573166329856',b'Jayanti K Kesari \\U0001f1ee\\U0001f1f3',b'jayanti_kesari',b'',b'\\u091c\\u092f \\u0939\\u093f\\u0928\\u094d\\u0926 \\u270a\\U0001f1ee\\U0001f1f3\\U0001f64f',b'811',b'403',b'0',b'18974',b'28528',b'False',b'False',b'True',b'False',b'2017-04-17 08:54:08'
b'@_sabanaqvi Shahrukh is his name. Sharm aati hai kya naam lene main. Muslim hai.',b'1232015567583940610',b'Maneesh \\U0001f1ee\\U0001f1f3',b'winsplit',b'A tiny speck in the universe. ',b'',b'334',b'503',b'9',b'8909',b'7627',b'False',b'False',b'True',b'False',b'2017-03-21 12:32:27'
b'Assistant professor takes inspiration from Canadian intelligence officer to influence communities and reteach Musli\\u2026 https://t.co/Zoqai84Lz1',b'1232015560554274818',"b""Canada's Counter-Radicalization Industry""",b'CVECanada',"b'Toronto, ON'","b'A team of Torontonians focused on :\\n-Understanding how CVE shapes religious identities\\n-Facilitating workshops on organizational strategy, funding, and outreach'",b'11',b'88',b'0',b'90',b'4',b'False',b'False',b'True',b'False',b'2020-02-08 05:22:26'
"b""@HMOIndia Muslim 's want EQUALITY in India, they are protesting to prove this... Plz accept their request &amp; clear p\\u2026 https://t.co/eg9sB9VDxA""",b'1232015559497113607',b'Full Tension',b'fulltension',b'India',b'Do something you Loudmouth',b'0',b'29',b'0',b'30',b'2',b'False',b'False',b'True',b'False',b'2019-11-03 07:40:48'
"b""Neend hi Nahi aa rahi aaj. Hum to privileged Hain. Can't imagine the situation of Muslim families tonight.""",b'1232015556930396161',b'Lurker',b'Lurker22796228',b'New Delhi',b'Politics',b'25',b'38',b'1',b'1683',b'5',b'False',b'False',b'True',b'False',b'2019-08-02 07:35:16'
b'See this malicious act of this PoS @kawalpreetdu.\\nShe deliberately portrayed the shooter as an RSS member w/o any p\\u2026 https://t.co/EIoP6MhDgC',b'1232015548764098566',b'Lock Omoplata',b'LockOmoplata',b'Bharat/India',"b""India\\U0001f1ee\\U0001f1f3|\\U0001f549\\ufe0f Hindu/Sanatan Dharm\\U0001f6a9|\\nDelhi University | Islam Needs Reforms| If i Tag,Retweet & Reply someone's tweet it DOESN'T mean i support their EACH Tweet""",b'402',b'795',b'0',b'21856',b'31247',b'False',b'False',b'True',b'False',b'2016-01-02 18:17:39'
"b'@mixblood0000 The Hindu terrorists are burning muslim properties and shouting jai shree ram slogan , and police are silently watching'",b'1232015548483067906',b'saniyasnain khan',b'against_tyrant',b'Hind',"b'O lord, Owner of Sovereignty, You give sovereignty to whom You will and You take sovereignty away from whom You will .'",b'55',b'381',b'0',b'340',b'2234',b'False',b'False',b'True',b'False',b'2013-02-05 10:29:43'
b'@RahulGandhi @priyankagandhi @yadavakhilesh @yadavtejashwi @ArvindKejriwal sir aap log ke tweet se kuch nahi hone w\\u2026 https://t.co/gTuCFUkI25',b'1232015543122694144',b'Md Faisal',b'MohdFaisal147',"b'Riyadh, Kingdom of Saudi Arabi'","b'cricketer , twitter warrior.'",b'94',b'463',b'0',b'4919',b'7537',b'False',b'False',b'True',b'False',b'2017-01-23 09:49:56'
b'@4c7fb5b69b63482 @ABPNews Bhai muslim hi hai naam sharukh hai...',b'1232015526748139535',b'chowkidar vikash chauhan',b'f6c21f60a7a9409',"b'Bhiwani, India'",b'',b'392',b'740',b'0',b'8203',b'5017',b'False',b'False',b'True',b'False',b'2014-09-06 06:50:19'
b'Hindu extremist supporters of Mr. @narendramodi beats a #Muslim man opposing the new Citizenship amendment law duri\\u2026 https://t.co/kn7tqMlkJd',b'1232015524998963201',b'\\u25aa\\ufe0fAdam\\u25aa\\ufe0f',b'Adamiington',b'Maldives',"b'Blogger I Cinephile I Travel Enthusiast I Netizen I Fan of @deepikapadukone I \\u201cSomewhere in my mind I still wonder, whether everything happens for a reason\\u201d'",b'3074',b'4994',b'58',b'32905',b'11187',b'False',b'False',b'False',b'False',b'2012-06-27 15:19:41'
"b""@Reuters @zodi42130665 Any proof if the person being hit is a Muslim? I can't see any signs of him being a Muslim.\\u2026 https://t.co/DCoXHTDS62""",b'1232015514341343238',b'Saurabh Mhatre',b'SVM05091996',"b'Bhayander West, Mumbai'","b'Electronics Engineer,Aspiring Rapper, Songwriter Currently.'",b'36',b'403',b'0',b'3271',b'5494',b'False',b'False',b'True',b'False',b'2017-12-07 17:48:37'
b'@kottapuram @abidashah24 @omar_quraishi @Silent_deserts is k ilawa koi word ata ha 1971 71..\\nphr peeche jao tu apko\\u2026 https://t.co/dHZgz8k8gX',b'1232015503855624193',b'Fabiha Noor',b'FabihaSays',"b'Lahore, Pakistan'","b'When nothing is sure, Everything is possible.\\nPolitical Analyst & Human right worker.\\nImran Khan is my Ideal. \\U0001f54a\\ufe0f\\nFollowers will get follow back in 24 hours.'",b'14744',b'12523',b'9',b'22647',b'28412',b'False',b'False',b'False',b'False',b'2018-03-24 23:27:20'
"b'@lhfang Privatized Prisons, steadily growing poverty numbers, Jew baiting and Muslim slandering... US of A is right\\u2026 https://t.co/GQrKdw9QF8'",b'1232015498826506240',b'Bob Lount',b'bob_lount',"b'Oregon, US of A'","b""Regular person. Live in Oregon. I don't like pics of me so Rabbit Ears it is. I used to sling rigging, now I herd bits and leave :wq all over config files.""",b'5',b'30',b'0',b'359',b'374',b'False',b'False',b'True',b'False',b'2018-03-14 04:57:54'
b'This is the capital of India. Delhi.\\nA Muslim being beaten mercilessly..\\nOnly fault - he is Muslim..\\nWe live among\\u2026 https://t.co/PaPhDwrRqN',b'1232015484603621376',b'Dr Wasi',b'DrWasi10',b'',b'MBBS Doctor.\\nMuslim.\\nDelhi.\\n\\n\\nSpread Deen.',b'381',b'414',b'0',b'933',b'2819',b'False',b'False',b'True',b'False',b'2019-08-04 20:20:56'
b'This is how Muslims are being terrorised in India -   not just by the state but by the state backed majoritarian Hi\\u2026 https://t.co/CaWibcYXSu',b'1232015483379077120',b'\\u062e\\u0627\\u0646 \\u0631\\u06cc\\u0627\\u0636',b'KhaanRiyaaz',b'',b'Artificial Intelligence.',b'33',b'172',b'0',b'120',b'186',b'False',b'False',b'True',b'False',b'2019-09-25 14:29:25'
"b'@USALawyer_ @gatewaypundit The ""refugee"" status was used by Obama to infiltrate with non-vetted or even capable of\\u2026 https://t.co/5lOAJF2lZ2'",b'1232015456665362435',b'Anons Synonymous',b'AnonsSynonymous',b'',b'Heavily Censored. Only politics/news/2020. All followers wiped out by Twitter on this acct. 09/27/19 Only here for 2020...Proud to be followed by @GenFlynn',b'1405',b'1827',b'3',b'107942',b'17535',b'False',b'False',b'True',b'False',b'2019-09-07 03:40:07'
b'A @Reuters picture of a Muslim human being brutally beaten up by fellow humans in Delhi today. #DelhiBurning https://t.co/S4WC4wPMwW',b'1232015455319097345',b'Happening Now',b'HappeningNow__',b'World',"b'Breaking news happening now around the world, Retweets are not endorsements. PLZ FOLLOW, SHARE and SUPPORT!!'",b'1907',b'0',b'22',b'2178',b'936',b'False',b'False',b'True',b'False',b'2018-11-27 15:06:21'
b'@SalujaMah @rishav_sharma1 There r religious Prsnl laws fr muslim n other ..they hv more thn equal rights h dolt th\\u2026 https://t.co/JpM3OWrEga',b'1232015452248760322',b'Aloo_namkeen',b'NamkeenAloo',b'',b'',b'225',b'1994',b'0',b'12100',b'34247',b'False',b'False',b'True',b'False',b'2019-10-30 16:09:19'
b'@AJEnglish @amnesty ALWAYS FRAME AS ANTI-MUSLIM LAW TO SEEK ATTENTION\\n\\nSEE THE AL JAZEERA PREVIOUS ARTICLE: https://t.co/xi06FKGiP7',b'1232015449782509569',b'GoldenPhavil88',b'Phapha56553228',b'',b'NEVER FEAR TO SPEAK OUT!',b'0',b'0',b'0',b'124',b'1',b'False',b'False',b'True',b'False',b'2020-02-22 16:55:06'
b'This is not pro caa.\\n\\nThis is Anti Muslim.\\nThis is Anti national.\\nThis is Anti constitution.\\nThis is Anti humanity.\\u2026 https://t.co/LgqjOkRAMz',b'1232015443033911296',b'Ayaz Ahmad Qaasmi',b'Ayaz_Ind',b'New Delhi',"b'LLB - GST - FINANCE - Love to #JMI #JNU #AMU Students  \\u25aa\\ufe0fSTAND with Every #OPPRESSED HUMAN Being on #EARTH - KashmiriPandit, Dalits, Tribals, Minorities'",b'1355',b'352',b'12',b'1071',b'7353',b'False',b'False',b'True',b'False',b'2015-12-30 02:20:31'
"b""@NaimahNotNeymar @muzmatch I don't really believe that Muzmatch has an 'islamic/muslim' space due to the type of pe\\u2026 https://t.co/74kTnySaJv""",b'1232015441238937600',b'ladypoe ~',b'ladypoelondon',"b'London, United Kingdom'",b'\\U0001d40f\\U0001d428\\U0001d41et.\\n/linguist/\\n#MentalHealth #Pedagogy #Education #Neurodiversity\\n@poeverse an attempt to serve ~',b'3309',b'2636',b'95',b'28556',b'38859',b'False',b'False',b'False',b'False',b'2009-05-22 14:12:11'
"b""@_zaidi__ @khushikadri Yes, he's right.... because members of Hindu, Sikh, Christian, Buddhists, Paris, Jains, etc.\\u2026 https://t.co/aTSvniWD00""",b'1232015436088250368',b'\\U0001d578\\U0001d586\\U0001d598\\U0001d59a\\U0001d599\\U0001d58d\\U0001d58e\\U0001d59b\\U0001d586\\U0001d593\\u2122(\\u0bae\\u0b9a\\u0bc2\\u0ba4\\u0bbf\\u0bb5\\u0ba9\\u0bcd)',b'kumari_nadu',b'Kumari Nadu - 9000 BCE ',"b'Proud Bharatiya, Immortal, Kalapathi, Siddhar, Maruthuvar, Author.\\nDevotee of Lord Seyyan.\\nDisciple of Siruvani Adigal.\\nRead about me at -  https://t.co/RQGzt5NCOI'",b'303',b'998',b'4',b'12213',b'3032',b'False',b'False',b'False',b'False',b'2011-07-29 11:20:40'
"b'@el_noraGb @okdiario @eduardoinda Nora habibti, did you rehearse the \\u201cso so lovely\\u201d? U were going to say so so love\\u2026 https://t.co/ro05jYFrQo'",b'1232015416563769345',b'Lola',b'LolaMonstera',b'Spain',b'Desencantada. Disenfranchised. Lost and found to the right.',b'62',b'143',b'0',b'348',b'5870',b'False',b'False',b'True',b'False',b'2020-01-05 10:15:30'
b'@Railfandkg @_stay_away__ @KhanF_IRI @emteeyaz_ali @PiyushGoyal Bjp bhi ye chiz itna hide karne ki koshis  nahi kar\\u2026 https://t.co/1W4mahJjB9',b'1232015378575953924',b'My',b'My53061404',b'',b'',b'0',b'0',b'0',b'19',b'0',b'False',b'True',b'True',b'False',b'2019-07-26 15:34:04'
"b'4. THE RIGHT TO ""PRIVACY"" OF ALL CONFIDENTIAL MATTERS \\n\\n""A believing man does not despise a believing woman. If he\\u2026 https://t.co/isljilZVWD'",b'1232015376386531328',b'Fatima Machina',b'believingukhty',"b'Kano, Maiduguri '",b'/\\n\\nIG:Believing_ukhty\\n/\\n kanuri/\\n\\n\\U0001f339follow for Daily Reminders\\U0001f339',b'26107',b'1386',b'14',b'3999',b'15526',b'False',b'False',b'True',b'False',b'2018-03-02 17:35:53'
b'O #Allah Bless us in #Rajab and #Shabaan and allow us to reach #Ramadaan.  \\n\\n#Dua #Sunnah #Muslim #Zikr #Islam\\u2026 https://t.co/8hAYZTPiFY',b'1232015368790724610',b'taalib',b'Love4Sunnah',b'',b'knowledge-seeker for life',b'487',b'42',b'0',b'1415',b'1174',b'False',b'False',b'False',b'False',b'2014-04-28 16:24:50'
b'@ShashiTharoor \\u091c\\u0939\\u093e\\u0902 \\u0906\\u092a \\u091c\\u0948\\u0938\\u0940 \\u092a\\u093e\\u0930\\u094d\\u091f\\u0940 \\u0915\\u0947 \\u0932\\u094b\\u0917 \\u092e\\u0941\\u0938\\u0932\\u092e\\u093e\\u0928\\u094b\\u0902 \\u0915\\u0947 \\u0926\\u093f\\u0932\\u094b \\u092e\\u0947\\u0902 \\u0921\\u0930 \\u092a\\u0948\\u0926\\u093e \\u0915\\u0930\\u0947\\u0902\\u0917\\u0947 \\u0935\\u0939\\u093e \\u092f\\u0939\\u0940 \\u0939\\u094b\\u0917\\u093e\\u0964 You have created false\\u2026 https://t.co/jpLOvqyEL9',b'1232015364684275712',b'andy_vox',b'unintrupted',b'',"b'31, work in IT, Delhi NCR, proud citizen, avid reader, opiniated & open-minded'",b'39',b'151',b'0',b'615',b'505',b'False',b'False',b'True',b'False',b'2017-02-22 14:57:29'
"b'|SIX RIGHTS OF A MUSLIM WOMAN|\\n\\n1.RIGHT TO ACCEPT MARRIAGE PROPOSAL \\nThe Prophet #\\ufdfa said: ""If marriage comes to you\\u2026 https://t.co/kWFZUtPlHt'",b'1232015355188568065',b'Fatima Machina',b'believingukhty',"b'Kano, Maiduguri '",b'/\\n\\nIG:Believing_ukhty\\n/\\n kanuri/\\n\\n\\U0001f339follow for Daily Reminders\\U0001f339',b'26107',b'1386',b'14',b'3999',b'15526',b'False',b'False',b'True',b'False',b'2018-03-02 17:35:53'
b'@SypherPK Yea.... https://t.co/i7TksNY8nP',b'1232015354890719232',b'Muslim_Mamba',b'mamba_muslim',b'',b'https://t.co/ruQskMMrf7 \\U0001f4f8@MuslimMamba_ TikTok- @Muslim_Mamba \\U0001f4fa- https://t.co/5bAYANopgK.  #MFam',b'5',b'94',b'0',b'14',b'29',b'False',b'False',b'True',b'False',b'2020-02-19 06:03:58'
"b'@RanaAyyub Name him @RanaAyyub he is shahrukh\\nWrite an article in Washington post, call him a muslim radical. I dare you.'",b'1232015352114143232',b'Vikram Gadgil',b'VikramVG',b'',b'Aim to be the best version of yourself.',b'63',b'54',b'0',b'3872',b'1261',b'False',b'False',b'False',b'False',b'2009-12-30 17:33:55'
"b'""(...) Muslim academia in particular has had very little agency or influence in reflecting the Ottoman past from it\\u2026 https://t.co/eCyPHxYniU'",b'1232015349245149185',b'\\uc544\\uc77c\\ub77c \\U0001f359\\U0001f35c\\U0001f35b\\U0001f364\\U0001f363',b'ajlatweets',b'\\u9280\\u7259: \\u6d41\\u308c\\u661f \\u9280 - \\u5bae\\u5185 \\u30bf\\u30ab\\u30e6\\u30ad.mp3',"b""Tweets are personal. | I speak: \\U0001f1f8\\U0001f1ea\\U0001f1eb\\U0001f1ee\\U0001f1ec\\U0001f1e7\\U0001f1e9\\U0001f1ea\\U0001f1fd\\U0001f1f0 | Interested in: Int'l law, Balkans, Nordics | RT/likes \\u2260 endorsement""",b'114',b'69',b'5',b'4097',b'8975',b'False',b'False',b'False',b'False',b'2012-12-18 21:50:19'
b'Muslim rouge https://t.co/wtR1X2qEn5',b'1232015348842389505',b'Jonathon Penberthy',b'Gelfbride',b'',b'',b'1',b'2',b'0',b'8',b'1',b'False',b'False',b'True',b'False',b'2019-05-31 14:41:22'
"b""@yesihavereadit @MoTheAtheist I can read and understand the Classical Quranic Arabic. While I don't claim to be as\\u2026 https://t.co/j6tYBJde6B""",b'1232015330232406016',b'Po Lazarus - \\U0001f1f5\\U0001f1f8',b'IslamiSized',"b'Hopefully, Jannah. '","b""In this day and age I'm proud to call Allah my Lord, Muhammad (\\ufdfa) my prophet, Islam my religion. Don't like it? My pleasure.\\n:\\u0644\\u0627 \\u0625\\u0644\\u0647 \\u0627\\u0644\\u0627 \\u0627\\u0644\\u0644\\u0647 \\u0645\\u062d\\u0645\\u062f \\u0631\\u0633\\u0648\\u0644 \\u0627\\u0644\\u0644\\u0647""",b'57',b'0',b'2',b'9177',b'1877',b'False',b'False',b'True',b'False',b'2017-02-23 19:31:29'
