"b""@AbhayTL @Iyervval Why not? Did the protestors clear up the area and go to a ground where they wouldn't hurt traffi\\u2026 https://t.co/Z2rL7PlLo1""",b'1232204887426920449',b'\\u0906-Sindhu-Sindhu',b'proraas',"b'Heptanesia, Bh\\u0101rat Ga\\u1e47ar\\u0101jya'",b'politically incorrect; budh parast kafir; rajiv malhotra fan; anti dalit-muslim-breaking-india axis; illzam-0-phobhic; secular*\\n\\n*conditions apply',b'62',b'587',b'1',b'8374',b'16576',b'False',b'False',b'True',b'False',b'2009-09-13 22:01:04'
"b'@aamirwani88 @AltNews haha , Mohammad Shahrukh a pro CAA protester :)).. then why was the violence on first place :)'",b'1232204841574748160',b'meetkool',b'meetKool',"b'India, USA'","b'A Techie, Runner, Traveler, Religion agnostic,Centrist.Tweets Politics & Tech & anything that doesn\\u2019t spread hatred. Welcome logical discussions n arguments!'",b'144',b'851',b'143',b'28132',b'16517',b'False',b'False',b'False',b'False',b'2011-10-17 14:22:58'
"b""They blocked Metro that's when people from area asked Kapil. mishra to come and help they started a pro CAA rally a\\u2026 https://t.co/0U9cioO8fx""",b'1232204814161006592',b'SuperStar Raj \\U0001f1ee\\U0001f1f3',b'NagpurKaRajini',b'Tambram from #UttaraPrachand',"b""Life is a river let it flow accept the good,bad and the ugly. TamBram Born in MamajiRoxx's State, Brought up at Sanghi HQ, Worked In Mum,Hyd,Bangalore,Mad-Ras""",b'12196',b'2736',b'30',b'200335',b'64261',b'False',b'False',b'True',b'False',b'2013-09-05 01:40:23'
b'#Mumbai mai hua #Delhi #violation pai #protest\\n\\nKal der raat #Marinedrive pai logo ne kiya protest\\n\\nDelhi me 24/feb\\u2026 https://t.co/jRaigbcAZH',b'1232204744636194816',b'News 13 Jai Hind',b'News13JaiHind',b'',b'News 13 official Page',b'25',b'8',b'0',b'494',b'350',b'False',b'False',b'True',b'False',b'2019-03-29 09:48:26'
b'Protesters expressing their anger against pro CAA stand of @KeralaGovernor Arif Muhammed Khan by blockading Raj Bha\\u2026 https://t.co/rmYarv8xxT',b'1232204682040311808',b'SIRAJUDHEEN',b'SIRAJUD75168582',b'',b'',b'4',b'16',b'0',b'6',b'16',b'False',b'False',b'True',b'False',b'2020-02-25 07:20:30'
b'@akshay359 @sudhakarchopra @g_a_z_a_l_a @VijaytaL @zoo_bear Kapil mishra and his supporters and some hinduthva orga\\u2026 https://t.co/EqtX6lupuC',b'1232204678676402176',b'Kempe Gowda',b'bengaluruboy48',b'Bendakaluru',b'Not Secular || Typo Expert || Vocab murderer ||  Imperfectionist || Hypocrite || Male chauvinist on odd days|| Feminist on Even days || Nationalist',b'160',b'439',b'0',b'8946',b'9183',b'False',b'False',b'True',b'False',b'2019-07-22 19:11:44'
b'This thing started from kapil Mishra\\u2019s threat and  Pro CAA protestors started throwing stones with police.\\n\\nNote: T\\u2026 https://t.co/cmMMlPCv2t',b'1232204599865425920',b'Akif Mirza',b'akifmirza',"b'Hyderabad, India'",b'Social worker| Proud Indian| Politics| fight against corruption| Raising issues for Justice|',b'49',b'223',b'0',b'458',b'579',b'False',b'False',b'True',b'False',b'2010-01-24 16:44:12'
b'@XyzTweeter @ANI Please update yourself \\n\\nhttps://t.co/XOsgjSPknG',b'1232204502356246528',b'BHARATIYA JANATA PARTY (BJP)NEWS',b'BJPNEWS4U',b'INDIA ',"b'ALL BREAKING, LATEST AND UPDATED NEWS OF BJP \\U0001f64f'",b'721',b'348',b'0',b'96335',b'101481',b'False',b'False',b'True',b'False',b'2018-06-04 14:02:29'
b'Protesters expressing their anger against pro CAA stand of @KeralaGovernor Arif Muhammed Khan by blockading Raj Bha\\u2026 https://t.co/OepowbL8yq',b'1232204436879048704',b'Saidu',b'Saidu21741717',b'',b'',b'2',b'28',b'0',b'34',b'26',b'False',b'True',b'True',b'False',b'2020-02-11 14:30:07'
"b'@Kritika_Kamra @Kritika_Kamra \\u092e\\u0945\\u0921\\u092e, \\u0906\\u092a  \\u0915\\u0943\\u092a\\u092f\\u093e #Pro \\u0914\\u0930 #Anti #CAA \\u0915\\u0947 \\u0906\\u0927\\u093e\\u0930 \\u092a\\u0930 \\u0927\\u093e\\u0930\\u094d\\u092e\\u0940\\u0915 \\u0935\\u093f\\u092d\\u093e\\u091c\\u0928 \\u0928\\u093e \\u0915\\u0930\\u0947.\\n\\u0915\\u094d\\u092f\\u0941\\u0915\\u0940\\u0902 \\u0905\\u0917\\u0930 \\u0906\\u092a\\u0915\\u0947\\u2026 https://t.co/ykH6qlPByP'",b'1232204425093165056',b'Akshay Nigade Deshmukh',b'nigadeAK',"b'Pune, India'",b'',b'27',b'37',b'0',b'43',b'15377',b'False',b'False',b'True',b'False',b'2017-01-29 15:35:53'
"b""Why the fuck is Pro vs. Anti-CAA shifting from 'CAA' to 'Hindus vs. Muslims'?""",b'1232204373943447554',b'Abbas Naqvi',b'AbBasBhotHoGaya',"b'Mumbai ,Maharashtra ,India '","b'6\'3"" of bad jokes\\n\\nInstagram - abbas_naqvi_has_not'",b'19',b'54',b'0',b'277',b'403',b'False',b'False',b'False',b'False',b'2014-03-01 14:17:24'
b'@fayedsouza This\\nhttps://t.co/TJPLnPb50Y',b'1232204365315756033',b'pritam',b'JorgSnow',b'India',b'RW',b'131',b'1617',b'5',b'7630',b'20953',b'False',b'False',b'False',b'False',b'2010-03-17 12:49:13'
"b'Its not protest, \\n\\nIts not stone pelting, \\n\\nIts not against /pro CAA\\n\\nIts a war against Hindu !\\n\\nHope we are awaken\\u2026 https://t.co/2FSiHnMpWL'",b'1232204306088022016',"b""grandeur d'\\xe2me""",b'rohini_express',b'The land of Sanatan Dharma ',"b'Right winger, Design engineer, Truth seeker ! Use your words as might not as abuse \\n\\nWoman of few words .....\\n\\n\\nNO DM please \\U0001f64f'",b'1710',b'436',b'17',b'28316',b'22844',b'False',b'False',b'True',b'False',b'2014-03-06 04:49:28'
b'Protesters expressing their anger against pro CAA stand of @KeralaGovernor Arif Muhammed Khan by blockading Raj Bha\\u2026 https://t.co/UzulfYlRhP',b'1232204300409090048',b'Dr.Jousheed',b'DJousheed',b'India',b'Against religious discrimination',b'1',b'30',b'0',b'102',b'50',b'False',b'False',b'True',b'False',b'2020-02-22 08:40:22'
b'@anuragkashyap72 Anti CAA was what? Pro Hindu?',b'1232204272873459712',b'MuslimReformer',b'MuslimReformer',b'',"b'Reform Islam; Jihadists, ISI trolls can put their middle finger in their ass'",b'22',b'521',b'0',b'1058',b'3158',b'False',b'False',b'True',b'False',b'2020-01-16 03:26:20'
b'@Leaf_lover26 @sant_tiki @VishalDadlani How CAA is against Constitution Of India?\\n\\nDid I ever say Pro_CAA?',b'1232204243119067136',b'vineet vinoy',b'vvinoy',"b'Dauram Madhepura, India'","b'#rantsofarookie,  by a rookie.'",b'35',b'159',b'0',b'3534',b'1563',b'False',b'False',b'True',b'False',b'2009-11-12 11:09:56'
"b'Know from which party he belongs, he was Anti or Pro CAA. Just punish him because u cannot do anything to\\u2026 https://t.co/OxvQb5jhiL'",b'1232204201343647744',b'Nahela Jamali',b'JamaliNahela',"b'New Delhi, India'",b'Nahela: Pure Water',b'45',b'67',b'0',b'1137',b'465',b'False',b'False',b'True',b'False',b'2019-12-16 07:41:17'
b'@VishalDadlani To kya ye tamasha dekhte rehte agar unhe bat kehne ka haq hai to pro CAA walo ko kyu nahi aur road b\\u2026 https://t.co/V9SI06t5M1',b'1232204138878033921',b'TheITguy',b'TheITgu78240423',b'',"b""An It business man and want to conquer the world's all money \\U0001f602\\U0001f602\\U0001f602""",b'2',b'56',b'0',b'208',b'1213',b'False',b'False',b'True',b'False',b'2019-04-24 18:39:21'
b'There are no Pro CAA protestors! There are only violent anti-muslim fascists! #DelhiRiots #DelhiBurning',b'1232204134696120321',b'Asha Das',b'ashaharidas',b'Bangalore ',b'illustrator | Deer stuck in the headlights | Draws on any surface | Drowning in Peach Ice tea | Listening to music in moving vehicles | Dog Lover |',b'168',b'321',b'3',b'3862',b'999',b'False',b'False',b'False',b'False',b'2009-09-14 10:19:05'
b'@_sabanaqvi He is definitely not a pro CAA supporter. These Shaheen bagh rowdies need to be ejected forcefully and\\u2026 https://t.co/Nh12O5cNrc',b'1232204057017638912',b'Rajesh Ahluwalia',b'walia',b'Mumbai',b'\\U0001f642',b'129',b'475',b'1',b'4023',b'42',b'False',b'False',b'False',b'False',b'2010-04-16 14:17:32'
b'@how_do_u_cross Yesterday\\u2019s incident at Delhi is a combination of Islamic terrorism + urban naxalism. It wasn\\u2019t a s\\u2026 https://t.co/3DxQTvuH5a',b'1232203981063163904',b'TheOdiaNinja',b'TheOdiaNinja',b'India',"b'sorry, won\\u2019t let you judge me through my bio'",b'232',b'1578',b'2',b'2469',b'30854',b'False',b'False',b'False',b'False',b'2010-05-15 12:00:24'
b'Protesters expressing their anger against pro CAA stand of @KeralaGovernor Arif Muhammed Khan by blockading Raj Bha\\u2026 https://t.co/kFXLEEf5nt',b'1232203919490568192',b'Mohamed Sahir.T',b'SahirPonmundam',"b'Ponmundam, India'",b'thanks to Allah',b'13',b'42',b'0',b'146',b'274',b'False',b'False',b'True',b'False',b'2011-09-10 15:08:48'
"b""@PrabhjyotKaurr That's exactly what I keep asking... how is it a clash? The other day I read a report where one sai\\u2026 https://t.co/J8EBe4PRu2""",b'1232203899991470080',b'V',b'Was_iff',b'',b'',b'97',b'674',b'2',b'1676',b'8406',b'False',b'False',b'True',b'False',b'2013-03-21 08:16:56'
b'@VishalDadlani Where were PRO CAA people in jamia milia or aligarh and patna',b'1232203888008351744',b'INDIA_OBSEVER',b'Samir31605659',b'India',b'Indian Perspective',b'119',b'1896',b'0',b'12955',b'23322',b'False',b'False',b'True',b'False',b'2017-12-16 08:21:23'
"b'@ICLU_Ind Mustafabad ke aas pas bhi pro CAA ke supportro ne aag lagadi,pure mustafabad me har koi dara hua he'",b'1232203832752574464',b'shamim shaikh',b'sk838203',b'',b'',b'2',b'45',b'0',b'28',b'94',b'False',b'True',b'True',b'False',b'2015-01-03 15:17:10'
b'Protesters expressing their anger against pro CAA stand of @KeralaGovernor Arif Muhammed Khan by blockading Raj Bha\\u2026 https://t.co/m3N0LaJ0c9',b'1232203811873267713',b'Illyas Valiyakath',b'IllyasAT',"b'Dubai,  United Arab Emirates'",b'',b'7',b'57',b'0',b'6',b'0',b'False',b'False',b'True',b'False',b'2015-07-20 06:21:28'
b'Delhi is burning. Can we for once just wake up and stop pretending everything is fine. Those you are calling Anti C\\u2026 https://t.co/cUUwyibYNp',b'1232203783481937921',b'Ridhi Dogra',b'iRidhiDogra',b'India',"b'Learning, Living, Loving every bit of this glorious life \\U0001f388 Contact - ridhidogra.apple@gmail.com / teamridhidogra@gmail.com  https://t.co/jRZusFK5wM'",b'106879',b'182',b'102',b'15215',b'5063',b'True',b'False',b'False',b'False',b'2010-01-06 17:51:36'
b'What the hell is going in Delhi.\\nThis is not pro caa. This is Pure hatred against Muslims. Anti national. Anti cons\\u2026 https://t.co/Grlkq2HO61',b'1232203722308116480',b'Abdul Salam',b'i_am_abdul_1',"b'Jaipur, India'",b'A Human Being',b'16',b'63',b'0',b'43',b'18',b'False',b'False',b'True',b'False',b'2010-05-10 10:38:44'
b'@VishalDadlani Does it mean only Anti CAA protester can protest. If any pro CAA will come out they will kill them ?\\u2026 https://t.co/ihrjRzFI3v',b'1232203721875976192',b'Veerenddrra \\U0001f1ee\\U0001f1f3 \\u0935\\u0940\\u0930\\u0947\\u0902\\u0926\\u094d\\u0930',b'vksham',"b'New Delhi, India'","b'An IT professional, Nationalist, Proud Indian...'",b'223',b'364',b'6',b'20007',b'19990',b'False',b'False',b'False',b'False',b'2010-04-19 18:17:36'
"b'@anuragkashyap72 So true, Pro CAA is like a child who is asking for the lolly pop he is already sucking\\nCAA is a act then what is pro CAA ??'",b'1232203689470771200',b'Ali Khan',b'AliKhan10021993',"b'Mumbai, India'",b'Love Doing Everything In Life.',b'11',b'169',b'0',b'536',b'262',b'False',b'False',b'True',b'False',b'2017-10-29 06:38:05'
b'@adxdhiman @SanjayUkroond At first the Anti CAA were peaceful. Read about how Most people who are PRO CAA dont even\\u2026 https://t.co/JZ5ctYQ6ec',b'1232203669896081408',b'Benjamin Mathew',b'benjoesupreme',"b'Bengaluru, India'",b'An avid interest in Politics and Revolution.\\nChristian. Indian. Tactician',b'1',b'19',b'0',b'55',b'22',b'False',b'False',b'True',b'False',b'2019-10-04 06:29:27'
"b'@Vinay_Arsenal Hahhaha , was I there? lol. \\U0001f602\\U0001f602\\nMaga, now you are blatantly turning a blind eye.  Pro CAA guys went t\\u2026 https://t.co/XobA7Sq4e1'",b'1232203630834438144',b'Nischith',b'nischi87',b'Mysore',b'Football | Arsenal | Bengaluru FC | Beer | TV Series | 90\\u2019s Kid | Life',b'224',b'922',b'1',b'2369',b'13694',b'False',b'False',b'False',b'False',b'2010-05-05 07:37:16'
b'Protesters expressing their anger against pro CAA stand of @KeralaGovernor Arif Muhammed Khan by blockading Raj Bha\\u2026 https://t.co/ybSgcZU5ze',b'1232203604204965888',b'MUHAMED SAGEER',b'sageer_muhamed',b'',b'',b'4',b'7',b'0',b'17',b'1',b'False',b'False',b'True',b'False',b'2020-02-25 06:03:05'
b'Protesters expressing their anger against pro CAA stand of @KeralaGovernor Arif Muhammed Khan by blockading Raj Bha\\u2026 https://t.co/hqsSL17gDc',b'1232203549267853313',b'MOHAMMED SALEEM',b'saleempkm',"b'Dubai, United Arab Emirates'",b'Chavakkadan',b'10',b'7',b'0',b'22',b'1',b'False',b'False',b'True',b'False',b'2014-04-13 05:00:52'
b'@Amitver5149912 @abhisar_sharma @AmitShah All pro CAA supporter raste pe uttre bhi aur dange bhi kiya - they are th\\u2026 https://t.co/5VshoXPZIJ',b'1232203535930056709',b'Newyon Choudhary \\u25e2 \\u25e4',b'Dr_Newyon',b'',b'Studying pharmacy with the interest of music to create better Earth so I can live peacefully on Mars Just kidding\\nILikeTo.Explore infinity experience',b'48',b'340',b'0',b'2390',b'5032',b'False',b'False',b'True',b'False',b'2016-06-12 04:47:56'
"b'Cop to pro-CAA group: \\u2018Go ahead and throw stones\\u2019 \\nDear @DelhiPolice , if u have any type of soul then hang your he\\u2026 https://t.co/ZRnMORfRnE'",b'1232203529122611200',b'TAHIR QAMAR',b'tahirqamar222',"b'New Delhi, India'",b'|| Student of Nature || Political enthusiast especially in offline mode || Accidental Engineer || Alma matter- Jamia Millia Islamia ||',b'99',b'155',b'0',b'973',b'4670',b'False',b'False',b'True',b'False',b'2017-07-07 09:27:11'
b'Protesters expressing their anger against pro CAA stand of @KeralaGovernor Arif Muhammed Khan by blockading Raj Bha\\u2026 https://t.co/AYoy3ARO4o',b'1232203444074582016',b'Irshad PS',b'Irshad_Ps',b'Malappuram',b'',b'167',b'150',b'0',b'1999',b'43',b'False',b'False',b'False',b'False',b'2010-06-02 09:40:50'
b'So a pro CAA or anti CAA deserve to get kil*ed ? Death of constable is indeed unfortunate as are deaths of all the\\u2026 https://t.co/zhWD8iyfYr',b'1232203417772269568',b'Arsalan',b'Aris_total',"b'Delhi , India'",b'Retweets.',b'139',b'613',b'2',b'6885',b'2157',b'False',b'False',b'False',b'False',b'2011-01-17 16:33:52'
b'President Donald Trump landed in a Delhi whose peripheries smouldered with violent disorder on Monday. Narendra Mod\\u2026 https://t.co/hgEQrjQKKW',b'1232203393294225408',b'Mohamed Shibli',b'ShibliOfficial',"b'Chennai, India'",b'Welcome to My Official Twitter Account: Deputy General Secretary India Thowheed Jamaath(INTJ) | Journalist | Social Activist',b'1841',b'1749',b'3',b'4203',b'21854',b'False',b'False',b'True',b'False',b'2014-02-10 07:45:33'
b'@VishalDadlani So if pro CAA protest u will start the violence....n blame the pro CAA people. Where is ur tolerance  ???',b'1232203364521271296',b'Vinayan Govind',b'vinayan_govind',"b'Mumbai, India'",b'',b'98',b'340',b'0',b'5604',b'58185',b'False',b'False',b'True',b'False',b'2017-10-25 07:05:07'
b'@teasri Yeah they didnt open fire yesterday as instructed like they allowed JNU violence as mere spectators. Becaus\\u2026 https://t.co/qPF8HqCv8B',b'1232203320531415040',b'Anand R',b'sliceme',b'Inside my messedup little mind',b'My views are always official with green ink signature.',b'1730',b'2900',b'84',b'109272',b'8576',b'False',b'False',b'False',b'False',b'2009-06-23 08:03:56'
b'@itssinghswati @DelhiPolice Abhi koi muslim police walo ko pro caa mar deta tb kitna halla machati??\\nAbi b utna hi machao',b'1232203155389272064',b'shivangi sharma',b'shivangi21095',b'India',b'Food technologist',b'283',b'447',b'0',b'2251',b'2980',b'False',b'False',b'True',b'False',b'2017-03-04 05:34:20'
"b'@Keshavt95 We neither, the protests are going on from 64 days peacefully but violence only happened when Pro CAA protestors showed up...'",b'1232203111655063552',b'Curator',b'GHULAMY92592160',b'',b'Meri Nass Nass bahe tu watan\\nMeri Nass Nass kahe ae watan\\n\\n   Mera saara tujhpe waara',b'18',b'104',b'0',b'740',b'972',b'False',b'False',b'True',b'False',b'2019-06-09 06:46:41'
"b""@AbhayTL @Iyervval Dude don't blame Kapil. Pro CAA is right just like Anti CAA. If the two clash the civil war is c\\u2026 https://t.co/kdJYDN9qEj""",b'1232203092776505344',b'\\u0906-Sindhu-Sindhu',b'proraas',"b'Heptanesia, Bh\\u0101rat Ga\\u1e47ar\\u0101jya'",b'politically incorrect; budh parast kafir; rajiv malhotra fan; anti dalit-muslim-breaking-india axis; illzam-0-phobhic; secular*\\n\\n*conditions apply',b'62',b'587',b'1',b'8374',b'16576',b'False',b'False',b'True',b'False',b'2009-09-13 22:01:04'
"b'All of this is the result of unconstitutional protest held in delhi, people starts blaming pro or anti CAA people b\\u2026 https://t.co/aWiipaAEBh'",b'1232203073579298816',b'prateek raghav',b'teek_patty',"b'noida,india'","b""Proud Indian, Engineer. Issue based inclination and tweets please don't think of me as some party supporter.""",b'14',b'146',b'0',b'136',b'473',b'False',b'False',b'True',b'False',b'2010-08-29 17:30:23'
b'@MODIfiedVikas @ashokepandit Waris Pathan should be held accountable and arrested.\\nHe is a disease and more dangero\\u2026 https://t.co/z4bLRKyeZj',b'1232203063693176833',b'S S Singh',b'Singh2639',b'India',"b'INDIA FIRST. Loves reading, nature, humor, sports, travelling. I have no time to battle egos and small minds. No Hate/Abuse. OM. Waheguru.'",b'262',b'84',b'0',b'5382',b'1036',b'False',b'False',b'True',b'False',b'2013-06-12 09:41:00'
b'Protesters expressing their anger against pro CAA stand of @KeralaGovernor Arif Muhammed Khan by blockading Raj Bha\\u2026 https://t.co/YjnKBrviv8',b'1232203052880420864',b'Bu Zaki',b'BuZaki7',b'India',"b'Social Media Activist, Political Analyst'",b'10',b'53',b'0',b'18',b'3',b'False',b'False',b'True',b'False',b'2020-02-24 19:47:35'
"b'Pro and Anti CAA protestors ""clash"" - The apparent ""free press"" that would un-see evidence if it poked them in the\\u2026 https://t.co/i7NM4BUyrN'",b'1232203032403701762',b'Tejal Kanitkar',b'KanitkarT',b'',"b'Interested in Climate and Energy Studies, Science and Society'",b'1557',b'98',b'8',b'225',b'148',b'False',b'False',b'True',b'False',b'2017-11-18 05:23:53'
"b'@vvinoy @sant_tiki @VishalDadlani Sometimes I wonder if I should respect my elders. Becuase, clearly age and brains\\u2026 https://t.co/1P0M1AkslF'",b'1232203004842872832',b'Leaf_lover',b'Leaf_lover26',b'Kyu batau?',"b""Don't think about Pakistan. Think about solving our own problems first. Real problems like Unemployment, Economy, Healthcare, Sex Ratio, etc.""",b'369',b'653',b'0',b'9500',b'54353',b'False',b'False',b'True',b'False',b'2010-07-19 11:02:56'
b'@Chatterj1Asking Anti CAA means only Pro constitution @Chatterj1Asking they are not warned anyone on 23rd feb bt yo\\u2026 https://t.co/I8UveLIA8o',b'1232202990557319168',b'Aavez khan',b'Aavezkhan5',b'Kota',b'',b'16',b'266',b'0',b'1494',b'5798',b'False',b'True',b'True',b'False',b'2016-02-16 15:04:17'
b'Delhi violence: Jafrabad shooter falsely identified as part of pro-CAA mob \\nhttps://t.co/yjsMby03jC',b'1232202964799905794',b'Ved Nayak \\u0cb5\\u0cc7\\u0ca6\\u0ccd \\u0ca8\\u0cbe\\u0caf\\u0c95\\u0ccd \\u0648\\u06cc\\u062f \\u0646\\u0627\\u0626\\u06a9',b'catcheronthesly',"b'Bengaluru, India'",b'Not beHolden to anything..so far..',b'151',b'313',b'0',b'9645',b'1276',b'False',b'False',b'True',b'False',b'2009-11-28 08:45:56'
"b'@VishalDadlani @SonalMehra_ Stop taking stupid sides, no pro CAA put gun in hands of Shahrukh and asked him to shoo\\u2026 https://t.co/Iq8d8izios'",b'1232202953538392064',b'Prakhar Chauhan',b'p_chauhan1406',"b'Roorkee, Uttaranchal'",b'',b'3',b'71',b'0',b'38',b'295',b'False',b'False',b'False',b'False',b'2014-05-11 14:06:27'
"b""@RSSxve @ippatel @ANI @GautamGambhir Modi and Shah aren't speaking anything. Are media or people not ranting agains\\u2026 https://t.co/aKJG93qpRY""",b'1232202885871521792',b'Mahima Dhingra\\U0001f1ee\\U0001f1f3',b'dhingramahima9',b'',"b'Man is made by his belief. As he believes, so is he.'",b'1789',b'35',b'6',b'2128',b'10539',b'False',b'False',b'True',b'False',b'2019-03-06 22:19:34'
b'Protesters expressing their anger against pro CAA stand of @KeralaGovernor Arif Muhammed Khan by blockading Raj Bha\\u2026 https://t.co/HK5LXaTsw7',b'1232202804015620096',b'Fayas asd',b'Fayas_asd',b'',b'',b'3',b'42',b'0',b'108',b'63',b'False',b'True',b'True',b'False',b'2012-05-23 09:01:15'
b'Protesters expressing their anger against pro CAA stand of @KeralaGovernor Arif Muhammed Khan by blockading Raj Bha\\u2026 https://t.co/eYfymMh6RW',b'1232202802081873920',b'Firdaus Rasheed',b'RasheedFirdaus',b'',b'',b'0',b'5',b'0',b'9',b'0',b'False',b'True',b'True',b'False',b'2020-02-25 05:38:48'
b'@RoyalAnkush_ @ArvindKejriwal @narendramodi Read the news properly. Pro caa with the help of delhi police carried s\\u2026 https://t.co/a5KN3Rjbkn',b'1232202705076183040',b'clairchrist',b'christclair',b'',b'',b'39',b'266',b'0',b'3956',b'3170',b'False',b'True',b'True',b'False',b'2011-08-11 17:33:40'
b'@rose_k01 You keep blaming one group when all the the people knows the fact.\\n\\nThis thing started by kapil Mishra An\\u2026 https://t.co/REhUf3hyiz',b'1232202696666439683',b'Akif Mirza',b'akifmirza',"b'Hyderabad, India'",b'Social worker| Proud Indian| Politics| fight against corruption| Raising issues for Justice|',b'49',b'223',b'0',b'458',b'579',b'False',b'False',b'True',b'False',b'2010-01-24 16:44:12'
b'So this @free_thinker THINKS we are Ullloos- TO BELIEVE his \\u201cTrivedi\\u201d telling that the shooter guy came from anti C\\u2026 https://t.co/DfxZGbQoY5',b'1232202602101776389',b'Pari \\u0aaa\\u0ab0\\u0ac0 \\u092a\\u0930\\u0940 \\u067e\\u0631\\u06cc \\u0c2a\\u0c30\\u0c40',b'parzaneh',b'',"b'NOT Proud Indian Muslim w ZERO TOLERANCE-Hate,Racism,AntiSemitism,Islamophobia. No to Veiled AntiMuslim Hate Against Islam/Pak (w Nationalism Excuse). Anti-WAR!'",b'1596',b'830',b'25',b'175921',b'80294',b'False',b'False',b'False',b'False',b'2015-02-08 20:46:19'
b'Both happen bcos of @DelhiPolice inaction to arrest @KapilMishra_IND n pro caa terrorist. All those who support CAA\\u2026 https://t.co/0sXdQ0RYff',b'1232202543461044224',b'\\u0250\\u026f\\u0279\\u0250\\u0265s \\u0265ssu\\u0250',b'anshsharma',b'India',"b""Love | Passion | Life | Sarcastic | Scorpio | Music | Coffee | Not Highly Educated. | Autodidact | Gamer | co-creator | it's always better when we are together.""",b'656',b'489',b'5',b'119926',b'24612',b'False',b'False',b'False',b'False',b'2009-08-09 19:32:21'
"b'@ReallySwara @DelhiPolice Where were you  when they killed a police personel,you cry only when these shameless,uned\\u2026 https://t.co/0HGnUqt90f'",b'1232202407888617474',b'Dr.Ranganath m Dixit\\U0001f1ee\\U0001f1f3',b'ranganath_dixit',"b'Bengaluru South, India'","b'Doctor,   \\nRSSian, \\nkaryavaha in a shakha, udyogi pramukh.'",b'15',b'192',b'0',b'337',b'292',b'False',b'False',b'True',b'False',b'2019-12-05 13:58:58'
"b'English media like @ndtv @ttindia, @IndiaToday, @ZeeTV posting photos of anti #CAAProtesters throwing stones buy th\\u2026 https://t.co/J5um48O1Vr'",b'1232202356617404417',b'Abdul Sathar Uchil',b'asuchil2f',"b'Mangalore, Karnataka- India'","b'Proud Indian | Writer | Love to Read | Nature Lover | Humanity above Religion | I Don\\u2019t carry Patriotism on my shoulders, It\\u2019s in my blood.'",b'718',b'2415',b'20',b'47773',b'33363',b'False',b'False',b'False',b'False',b'2010-02-11 18:32:47'
b'Protesters expressing their anger against pro CAA stand of @KeralaGovernor Arif Muhammed Khan by blockading Raj Bha\\u2026 https://t.co/BUKF50jnVu',b'1232202310522212352',b'Shabas Ahammed',b'Shabz26908415',b'mannur',b'',b'31',b'211',b'0',b'75',b'184',b'False',b'False',b'True',b'False',b'2018-04-24 15:33:39'
b'@SushantSin Both anti CAA and pro CAA need to go home and take rest! CAA is no harm..Anti CAA group protested again\\u2026 https://t.co/PvAPb3FERK',b'1232202254184263682',b'anup manakeshwar',b'anupmanakeshwar',"b'Michigan, USA'",b'software consultant',b'66',b'611',b'1',b'2547',b'5734',b'False',b'False',b'True',b'False',b'2013-07-25 11:10:34'
"b'@ndtv These are not #CAA clashes , these are communal riots.. targeting only Muslims by VHP , bhajrandal and RSS ex\\u2026 https://t.co/mCVTzGO3zd'",b'1232202218503360512',b'Asad',b'asad_says',b'London',b'.',b'8',b'77',b'0',b'825',b'205',b'False',b'False',b'True',b'False',b'2010-03-14 07:17:52'
b'@ArvindKejriwal Police force bheji ja rahi hai... Taki aur pro CAA ke log bulvaye ja sake aur bheed badhai ja sake\\u2026 https://t.co/vfWYP8UTjn',b'1232202090115747841',b'Shahbaz Hasan',b'Shahbaz66146554',"b'Allahabad, India'","b""ravish kumar's fan , against sangh parivar's ideology""",b'19',b'23',b'0',b'1037',b'5897',b'False',b'False',b'True',b'False',b'2018-04-18 02:01:40'
b'Protesters expressing their anger against pro CAA stand of @KeralaGovernor Arif Muhammed Khan by blockading Raj Bha\\u2026 https://t.co/l3LRLBj8Rg',b'1232202077465665536',b'Rejula',b'Manooh123',b'Saudi Arabia ',b'',b'5',b'5',b'0',b'19',b'1',b'False',b'True',b'True',b'False',b'2011-05-09 12:46:53'
b'@Leaf_lover26 @sant_tiki @VishalDadlani By this logic Anti CAA protest is Pro_Muslim Protest. \\nThanks for the subtle acknowledgement.',b'1232202007622098944',b'vineet vinoy',b'vvinoy',"b'Dauram Madhepura, India'","b'#rantsofarookie,  by a rookie.'",b'35',b'159',b'0',b'3534',b'1563',b'False',b'False',b'True',b'False',b'2009-11-12 11:09:56'
"b'I doubt his name is shahrukh. He was coming frm side of pro caa group, holding saffron flag. It cud be planted to b\\u2026 https://t.co/RCF8x4MOdA'",b'1232201938722123776',b'\\u0250\\u026f\\u0279\\u0250\\u0265s \\u0265ssu\\u0250',b'anshsharma',b'India',"b""Love | Passion | Life | Sarcastic | Scorpio | Music | Coffee | Not Highly Educated. | Autodidact | Gamer | co-creator | it's always better when we are together.""",b'656',b'489',b'5',b'119926',b'24612',b'False',b'False',b'False',b'False',b'2009-08-09 19:32:21'
