b'@Real_Anuj Great. I ll keep an eye and choose shops taxis carefully.\\nWill surely say no to muslim taxiwalas and shopkeepers etc.',b'1232228048566538242',b'Priyanka',b'AlwaysonlyIndia',"b'Mumbai, India'",b'\\U0001f1ee\\U0001f1f3Proud Indian\\U0001f1ee\\U0001f1f3\\nMassive respect for Indian Army and ISRO',b'111',b'191',b'1',b'791',b'1392',b'False',b'False',b'True',b'False',b'2020-02-01 19:25:22'
"b'@gurpreetsab @indieanarch1 After they are done with Muslim they for sure with come for Christians and Sikhs, sequen\\u2026 https://t.co/LuOj6bkAzg'",b'1232228047425855489',b'Occupied_Kashmiri',b'v_win_or_v_die',b'Indian Occupied Kashmir',"b""We don't surrender. We win, or we die.\\nThe passion for freedom we possess will remain in us forever.""",b'163',b'762',b'2',b'3089',b'4115',b'False',b'False',b'False',b'False',b'2009-07-18 11:16:47'
b'SC to hear petition by MUSLIM and file FIR against Delhi Police !\\nSC has blood in their hands ! https://t.co/ktWGRsORtA',b'1232228045299175426',b'Ankur Agarwal',b'ankur0906',"b'Noida, India'","b'Business Consultant in Telecommunication firm. Smart City, Digital, Connected World. Nationalist and Hinduism core values.'",b'2063',b'598',b'84',b'94302',b'25274',b'False',b'False',b'False',b'False',b'2012-11-17 15:23:20'
b'@amasonic @abbasjaf India is secular.\\nhow is an act that removes special status of an area which has\\n59% Muslims\\n41\\u2026 https://t.co/3WBSuayORc',b'1232228039334993920',b'Winks',b'vineetkol68',"b'Kolkata, India'",b'A Modi Bhakt.\\nProud hindu.\\nWant a unified Hindu India.\\nRevere honesty of PM Modiji.\\nHate corrupt bribed LW media.\\nBhakt of lord Krishna.',b'442',b'550',b'8',b'41273',b'17365',b'False',b'False',b'True',b'False',b'2016-02-18 10:44:24'
b'Modi and Trump are propagating islamophobia \\nBJP is attacking most vulnerable Muslim community in the national capi\\u2026 https://t.co/LvQlfmt7S4',b'1232228039242678273',b'Thameem Yousuf',b'thameemyousuf',b'',b'',b'57',b'22',b'0',b'143',b'74',b'False',b'True',b'True',b'False',b'2010-01-24 18:23:53'
"b'@Nidhi @arvindgunasekar @saurabhshukla_s Absolute lies \\nThe muslim mob stopped beating ""so called hindus"", that thi\\u2026 https://t.co/0hgETX1z0W'",b'1232228038475239425',b'satyakaam',b'dubeybp1978',"b'Agra, India'","b'Sanghi , bhakt, watever....'",b'127',b'206',b'1',b'10323',b'15674',b'False',b'False',b'True',b'False',b'2009-10-12 18:18:23'
b'@amitmalviya What the F is wrong with this idiot? Why all his posts have either Hindu or Muslim in it? Pathetic!',b'1232228034696007683',b'Rahul kumar singh',b'asksinghrahul',"b'New Delhi, India'",b'Management Consultant | Political Observer | Sports enthusiast',b'5',b'386',b'0',b'139',b'145',b'False',b'False',b'True',b'False',b'2019-07-13 12:54:59'
b'Kurang greget semestinya muslim pejuang\\n &gt;&gt; #SaveAdvokatPejuang &lt;&lt;\\n #KamiBersamaLBHPU - #HukumTajamKeMuslim\\n#DTC9\\n\\n@AFatih85\\n@Abunuril4',b'1232228030870745088',b'Abunuril',b'Abunuril4',b'',b'Kembali Istiqomah Melanjutkan Dakwatul Islam',b'168',b'156',b'0',b'964',b'151',b'False',b'False',b'True',b'False',b'2019-04-17 04:42:11'
b'@abukhoir03 Kurang greget semestinya muslim pejuang\\n &gt;&gt; #SaveAdvokatPejuang &lt;&lt;\\n #LBHPelitaUmat - #KamiBersamaLBHPU\\n#DKAF\\n\\n@dorsata_apis',b'1232228027028754432',b'nopiyan',b'nopiyan12',b'',b'',b'34',b'130',b'0',b'409',b'3',b'False',b'False',b'True',b'False',b'2020-01-15 10:31:32'
b'@RanaAyyub Your Muslim non violent is safe here.',b'1232228022633132032',b'amitbhat',b'amitbhat25',b'Union territory of J & K',b'In Exile',b'121',b'82',b'3',b'7157',b'40155',b'False',b'False',b'True',b'False',b'2010-12-19 14:41:33'
b'\\u0646\\u0626\\u06cc \\u062f\\u06c1\\u0644\\u06cc:\\u200c \\u06c1\\u0646\\u062f\\u0648 \\u0627\\u0646\\u062a\\u06c1\\u0627 \\u067e\\u0633\\u0646\\u062f\\u0648\\u06ba \\u0627\\u0648\\u0631 \\u067e\\u0648\\u0644\\u06cc\\u0633 \\u06a9\\u0627 \\u0645\\u0633\\u0644\\u0645\\u0627\\u0646\\u0648\\u06ba \\u067e\\u0631 \\u062f\\u06be\\u0627\\u0648\\u0627\\u060c 5 \\u0627\\u0641\\u0631\\u0627\\u062f \\u062c\\u0627\\u06ba \\u0628\\u062d\\u0642\\u060c 30 \\u0632\\u062e\\u0645\\u06cc\\n#Dehli #Hindu #Muslim #India\\u2026 https://t.co/cyzfVPO1V4',b'1232228021609934848',b'Daily Aajkal',b'aajkalpk1',"b'Lahore, Pakistan'",b'#Aajkal is a daily #Newspaper owned by @dailytimespak under the editorship of renowned analyst @Chghulamhusain known for his probing criticism in desi style',b'904',b'286',b'4',b'21614',b'2771',b'False',b'False',b'False',b'False',b'2015-04-10 15:59:47'
b'Why are people using the term Pro-CAA protester when act is already pass. What are they protesting for...those are\\u2026 https://t.co/wRLmeJ7GQH',b'1232228020242583554',b'SavvyTomHardy',b'savvy_tom',b'Dhund k batata hun',b'find wit in your judgement \\U0001f60e',b'43',b'152',b'0',b'7616',b'34590',b'False',b'False',b'True',b'False',b'2019-10-09 10:34:49'
"b'@shitpostergaytu @ShreeShetty8 I mean to say that they belong to muslim community, and based upon that they can get\\u2026 https://t.co/rfpFp98OZb'",b'1232228015754694656',b'piyush',b'pg_talkies',b'New Delhi',b'#Freelance #Facebook #Ads #Specialist & #SocialMediaMarketing #Consultant #Facebookads',b'467',b'401',b'33',b'12219',b'10996',b'False',b'False',b'False',b'False',b'2012-02-02 04:54:48'
b'@Yoeznan77 @BJimbron Hukum buatan manusia yg ada di negeri ini sangat lemah dan faktanya selalu digunakan untuk kep\\u2026 https://t.co/9sNav4HWDB',b'1232227978693705728',b'Nurul Lailatul',b'NurulLailatul98',"b'Kediri, Jawa Timur'",b'',b'69',b'92',b'0',b'467',b'209',b'False',b'False',b'True',b'False',b'2019-04-11 11:02:33'
"b'@abhisar_sharma @KapilMishra_IND @DelhiPolice NSA , Sedition on Terrorist Kapil Mishra ........ Hindu-muslim riot ,\\u2026 https://t.co/7OWvNuPm1k'",b'1232227973899509760',b'Abhinav Raj',b'Abhinav39831045',"b'Patna, India'","b'Love , Affection, Truth , Justice , Discipline , pity are best tools,path for true human.'",b'37',b'166',b'0',b'1751',b'8577',b'False',b'False',b'True',b'False',b'2019-12-31 14:01:16'
b'Negeri muslim berisi penguasa munafik.\\n &gt;&gt; #SaveAdvokatPejuang &lt;&lt;\\n #TolakKriminalisasiKhozinudin - #LBHPelitaUmat\\n#FSTD\\n\\n@suwaririn',b'1232227969117999104',b'Roe',b'Ru_Ruwaidah',b'',b'Ga Ada',b'115',b'62',b'0',b'898',b'1161',b'False',b'False',b'True',b'False',b'2019-03-10 16:03:38'
b'@Coscares2 @EbukaKi18790659 @Kene_Nnewi He doesn\\u2019t ave Muslim people on his Twitter. There is a botton up to unfoll\\u2026 https://t.co/4bhZu5xrB2',b'1232227964273774593',b'Biafra boy Bratislava\\U0001f934\\U0001f3fe\\U0001f1f8\\U0001f1f0',b'BiafraSk',b'Slovak Republic',"b'I am special because am a Biafran and i like justice, my people must be https://t.co/aEhozhFSPt nation Biafra must be free\\u270a\\U0001f3fe'",b'990',b'1261',b'21',b'45819',b'41878',b'False',b'False',b'True',b'False',b'2015-06-23 07:54:24'
b'@dhruv_rathee @iamjohnoliver Thx for supporting our left gand who always hate hindu. In india for vote bank they al\\u2026 https://t.co/y2EzMBJ2LN',b'1232227948910055425',b'DEEPAK',b'rdeepak1416',b'',b'Believe in (\\u092d\\u093e\\u0930\\u0924 \\u0915\\u0940 \\u0938\\u0902\\u0938\\u094d\\u0915\\u0943\\u0924\\u093f)',b'71',b'264',b'0',b'8035',b'16654',b'False',b'False',b'True',b'False',b'2015-12-11 14:00:49'
"b""@MajorPoonia Well said. Don't know how pro CAA means anti-muslim. As per my understanding as a layman CAA is  exped\\u2026 https://t.co/pK1HxaGs6x""",b'1232227944082231296',b'DIPAK PANDA',b'DIPAKPANDA1969',b'',b'',b'6',b'24',b'0',b'349',b'76',b'False',b'True',b'True',b'False',b'2014-06-20 04:48:53'
b'@SidrahDP Ajse or abhi se apni dairy me likh lo\\n#NO_SHIA #NO_SUNNI #ONLY_MUSLIM \\n#No_POOR #NO_RICH #ONLY_MUSLIM\\nNOT\\u2026 https://t.co/B71ub6ixGP',b'1232227943151276033',b'Mohammad Ashraf Ali',b'ashrafali2314',"b'New Delhi, India'",b'KIRPAYA MUJHE GYAN NA DE....!!!\\U0001f64f \\nMERA APNA HI NHI SAMBHL RHA!!!\\U0001f60a',b'13',b'187',b'0',b'203',b'62',b'False',b'False',b'True',b'False',b'2017-04-22 05:22:08'
b'@Fahruro86 Sampai kapan ketidakadilan pada Muslim berlangsung? Apakah menunggu ajal menjemput hai orang dzalim\\n &gt;&gt;\\u2026 https://t.co/oHOwfpir9l',b'1232227940886179840',b'@mufiidahtanjung',b'mufiidahtanjung',b'',"b""Lecturer, Da'wah Carrier""",b'166',b'271',b'0',b'3166',b'667',b'False',b'False',b'True',b'False',b'2011-04-22 02:45:41'
"b""Incumbent #SaudiArabia's dynasty, from the very beginning, has never thought about #Muslim World.  Only does their\\u2026 https://t.co/DcHR304Zih""",b'1232227935190503426',b'Sagir Khan \\u267f\\ufe0f',b'sagir42',b'Dhaka',b'#Bangladesh \\U0001f1e7\\U0001f1e9\\nPerson with Physical #Disability. #WebDesign #Drupal #Volunteer  #FreeSoftware #Linux #HumanRights Activist',b'836',b'551',b'13',b'31133',b'38785',b'False',b'False',b'False',b'False',b'2010-10-20 04:58:40'
b'#\\u10d0\\u10da\\u10da\\u10d0\\u10f0\\u10d8 #\\u10d8\\u10e1\\u10da\\u10d0\\u10db\\u10d8 #\\u10e7\\u10e3\\u10e0\\u10d0\\u10dc\\u10d8 #\\u10db\\u10e3\\u10f0\\u10d0\\u10db\\u10db\\u10d4\\u10d3\\u10d8 #\\u10e7\\u10e3\\u10e0\\u10d0\\u10dc\\u10d8\\u10e1 #\\u10d7\\u10d0\\u10e0\\u10d2\\u10db\\u10d0\\u10dc\\u10d8 #\\u10f0\\u10d0\\u10d3\\u10d8\\u10e1\\u10d8 #\\u10db\\u10e3\\u10e1\\u10da\\u10d8\\u10db\\u10d8 #\\u10e1\\u10d0\\u10e5\\u10d0\\u10e0\\u10d7\\u10d5\\u10d4\\u10da\\u10dd #\\u10e0\\u10ec\\u10db\\u10d4\\u10dc\\u10d0 #\\u10e6\\u10d5\\u10d7\\u10d8\\u10e1\\u10db\\u10e1\\u10d0\\u10ee\\u10e3\\u10e0\\u10d4\\u10d1\\u10d0 #\\u10dc\\u10d0\\u10db\\u10d0\\u10d6\\u10d8\\u2026 https://t.co/qQptzoEYqr',b'1232227934418743297',b'muslimgeorgia',b'muslim_georgia',"b'\\u0130stanbul, T\\xfcrkiye'","b'Amac\\u0131m\\u0131z G\\xfcrcistan  vatanda\\u015flar\\u0131na ve G\\xfcrc\\xfc k\\xf6kenli T\\xfcrklere \\u0130slam\\u2019\\u0131n temel bilgileri,  d\\xfc\\u015f\\xfcncesi, k\\xfclt\\xfcr\\xfc, tarihi sanat\\u0131 ve e\\u011fitimini anlatmakt\\u0131r.'",b'9',b'8',b'1',b'1268',b'1',b'False',b'False',b'True',b'False',b'2017-06-05 08:07:04'
b'@RanaAyyub @PeacefulPakk Think if this happened in Pakistan r any Muslim country....... Hypocrite World....',b'1232227931612733442',b'Dr Imran Hameed',b'Vet_Dr_Imran',"b'Bahawalpur, Pakistan'",b'Vet Dr. Education activist.\\nik lover.',b'322',b'1067',b'0',b'2390',b'11771',b'False',b'False',b'True',b'False',b'2016-07-27 06:25:51'
b'Kebenaran akan menang !! tolak kriminalisasi pada advokat Muslim Pembela Umat\\n &gt;&gt; #SaveAdvokatPejuang &lt;&lt;\\u2026 https://t.co/MdlTEDsqcb',b'1232227931004395527',b'Khoirul Anas',b'Khoirul45182033',b'',b'ingin jadi bagian dari pejuangNya',b'16',b'32',b'0',b'349',b'8',b'False',b'False',b'True',b'False',b'2019-09-06 23:05:41'
"b'@ummyhaidar Hukum sudah terbukti sangat tajam hanya kepada muslim. Kepada para koruptor, kepada para penista Islam,\\u2026 https://t.co/waHsmGzzEp'",b'1232227926285750272',b'Yulinar',b'Yulinar40034014',"b'Lembang, Indonesia'",b'@hasnayuli29',b'51',b'22',b'0',b'295',b'34',b'False',b'False',b'True',b'False',b'2019-05-10 06:17:04'
b'LBH PU yg selama ini gigih membela kepentingan Islam &amp; kaum Muslim tengah alami kriminalisasi. Kami bersama LBH PU\\u2026 https://t.co/bbwvgbjOe0',b'1232227925086396420',b'Kekal',b'KhalidRabbaniy',"b'Probolinggo, Jawa Timur'",b'Bro Please \\nLangsung Di foll-back',b'72',b'148',b'0',b'680',b'249',b'False',b'False',b'True',b'False',b'2019-03-20 02:13:50'
"b'@BJimbron Hukum sudah terbukti sangat tajam hanya kepada muslim. Kepada para koruptor, kepada para penista Islam, t\\u2026 https://t.co/bHbzyrsMBp'",b'1232227916647292928',b'Asiyah',b'Asiyah_aljannah',b'',b'\\u2600\\ufe0fmuslimah\\u2600\\ufe0f',b'26',b'53',b'0',b'421',b'50',b'False',b'False',b'True',b'False',b'2019-08-30 22:02:13'
b'#\\u10d0\\u10da\\u10da\\u10d0\\u10f0\\u10d8 #\\u10d8\\u10e1\\u10da\\u10d0\\u10db\\u10d8 #\\u10e7\\u10e3\\u10e0\\u10d0\\u10dc\\u10d8 #\\u10db\\u10e3\\u10f0\\u10d0\\u10db\\u10db\\u10d4\\u10d3\\u10d8 #\\u10e7\\u10e3\\u10e0\\u10d0\\u10dc\\u10d8\\u10e1 #\\u10d7\\u10d0\\u10e0\\u10d2\\u10db\\u10d0\\u10dc\\u10d8 #\\u10f0\\u10d0\\u10d3\\u10d8\\u10e1\\u10d8 #\\u10db\\u10e3\\u10e1\\u10da\\u10d8\\u10db\\u10d8 #\\u10e1\\u10d0\\u10e5\\u10d0\\u10e0\\u10d7\\u10d5\\u10d4\\u10da\\u10dd #\\u10e0\\u10ec\\u10db\\u10d4\\u10dc\\u10d0 #\\u10e6\\u10d5\\u10d7\\u10d8\\u10e1\\u10db\\u10e1\\u10d0\\u10ee\\u10e3\\u10e0\\u10d4\\u10d1\\u10d0 #\\u10dc\\u10d0\\u10db\\u10d0\\u10d6\\u10d8\\u2026 https://t.co/Y2JIWVYsQH',b'1232227915196223488',b'muslimgeorgia',b'muslim_georgia',"b'\\u0130stanbul, T\\xfcrkiye'","b'Amac\\u0131m\\u0131z G\\xfcrcistan  vatanda\\u015flar\\u0131na ve G\\xfcrc\\xfc k\\xf6kenli T\\xfcrklere \\u0130slam\\u2019\\u0131n temel bilgileri,  d\\xfc\\u015f\\xfcncesi, k\\xfclt\\xfcr\\xfc, tarihi sanat\\u0131 ve e\\u011fitimini anlatmakt\\u0131r.'",b'9',b'8',b'1',b'1268',b'1',b'False',b'False',b'True',b'False',b'2017-06-05 08:07:04'
"b""'Are you Hindu or Muslim?\\u2019: TOI photojournalist recounts Maujpur horror https://t.co/vNvRuaOvAn via @timesofindia""",b'1232227910225887232',b'Yogita Sharma',b'_yogitasharma_',b'',b'',b'18',b'68',b'0',b'224',b'87',b'False',b'False',b'False',b'False',b'2009-02-25 02:44:29'
"b'@kecipireborn Hukum sudah terbukti sangat tajam hanya kepada muslim. Kepada para koruptor, kepada para penista Isla\\u2026 https://t.co/35eMTsvHIL'",b'1232227906279137280',b'drellen',b'dari_ellen',"b'Jawa Timur, Indonesia'",b'ig : @dari.ellen',b'40',b'46',b'0',b'1192',b'229',b'False',b'False',b'True',b'False',b'2019-11-29 12:19:24'
b'@StephenMerchant @MattChorley @BBCiPlayer @Baddiel and Pakistani muslim rape gang denial?',b'1232227904592977923',b'grandpasmurf : QC & senior downing street sauce',b'grandpasmurf6',b'',"b'Bad trader, great lover \\npronouns: donkey/hatstand/sulphur \\n""Activist"" (i.e. self-opinionated, woke, keyboard warrior without any self-awareness or a real job)'",b'325',b'1043',b'0',b'4894',b'7739',b'False',b'False',b'True',b'False',b'2019-12-04 13:53:24'
b'I am a human being neither Hindu nor Muslim nor any religion. Am fed up of these extreme followers. I do not want t\\u2026 https://t.co/L0ZW6ePSmk',b'1232227902046867456',b'Supriya Deverkonda',b'SUPRIYADEVERKON',b'Gurgaon',b'#Stories #Experiences Travelling and reading. Views expressed are my views and are not related to any organization. Volunteer for adoption groups',b'1090',b'313',b'4',b'42959',b'138699',b'False',b'False',b'True',b'False',b'2011-12-25 17:48:26'
b'This self proclaimed Muslim-Dalit Unity Icon will join Congress before 2024 elections. He has been Congress sent to\\u2026 https://t.co/fBPnbN6N2d',b'1232227897810702336',b'Nation First News',b'NationFirstNewz',b'India',"b'Nationalist Views. Staunchly support #MakeInIndia . Want to see a Shining India on ground, not on papers.'",b'9606',b'887',b'16',b'20034',b'9346',b'False',b'False',b'True',b'False',b'2014-03-24 13:17:39'
b'#\\u10d0\\u10da\\u10da\\u10d0\\u10f0\\u10d8 #\\u10d8\\u10e1\\u10da\\u10d0\\u10db\\u10d8 #\\u10e7\\u10e3\\u10e0\\u10d0\\u10dc\\u10d8 #\\u10db\\u10e3\\u10f0\\u10d0\\u10db\\u10db\\u10d4\\u10d3\\u10d8 #\\u10e7\\u10e3\\u10e0\\u10d0\\u10dc\\u10d8\\u10e1 #\\u10d7\\u10d0\\u10e0\\u10d2\\u10db\\u10d0\\u10dc\\u10d8 #\\u10f0\\u10d0\\u10d3\\u10d8\\u10e1\\u10d8 #\\u10db\\u10e3\\u10e1\\u10da\\u10d8\\u10db\\u10d8 #\\u10e1\\u10d0\\u10e5\\u10d0\\u10e0\\u10d7\\u10d5\\u10d4\\u10da\\u10dd #\\u10e0\\u10ec\\u10db\\u10d4\\u10dc\\u10d0 #\\u10e6\\u10d5\\u10d7\\u10d8\\u10e1\\u10db\\u10e1\\u10d0\\u10ee\\u10e3\\u10e0\\u10d4\\u10d1\\u10d0 #\\u10dc\\u10d0\\u10db\\u10d0\\u10d6\\u10d8\\u2026 https://t.co/djh0THxe0O',b'1232227888428134401',b'muslimgeorgia',b'muslim_georgia',"b'\\u0130stanbul, T\\xfcrkiye'","b'Amac\\u0131m\\u0131z G\\xfcrcistan  vatanda\\u015flar\\u0131na ve G\\xfcrc\\xfc k\\xf6kenli T\\xfcrklere \\u0130slam\\u2019\\u0131n temel bilgileri,  d\\xfc\\u015f\\xfcncesi, k\\xfclt\\xfcr\\xfc, tarihi sanat\\u0131 ve e\\u011fitimini anlatmakt\\u0131r.'",b'9',b'8',b'1',b'1268',b'1',b'False',b'False',b'True',b'False',b'2017-06-05 08:07:04'
b'@SushantBSinha @KapilMishra_IND Sahi kaha. They are not dare to say even a single words against Muslim terrorism',b'1232227886851149825',b'Ravindra Dubey',b'ravindraiiim1',b'Jammu',b'',b'7',b'74',b'0',b'45',b'433',b'False',b'False',b'True',b'False',b'2014-10-10 10:59:45'
b'Negeri muslim berisi penguasa munafik.\\n &gt;&gt; #SaveAdvokatPejuang &lt;&lt;\\n #TolakKriminalisasiKhozinudin . #KamiBersamaLBHPU\\n#D1SE\\n\\n@AbaheAyman',b'1232227885999480832',b'Duwi Wahyutiyas',b'duwi_tiyas',b'',b'',b'107',b'94',b'0',b'2573',b'460',b'False',b'False',b'True',b'False',b'2018-05-07 07:24:47'
b'Khan u have provided fk all the English tax payers provided the cash as usual all u have provided is a Muslim agend\\u2026 https://t.co/SSon2cbExL',b'1232227873232216065',b'D W Leathem',b'd_leathem',b'',b'',b'179',b'176',b'0',b'7843',b'1148',b'False',b'True',b'True',b'False',b'2018-06-21 12:25:20'
b'what the hell is this ignorant shit? the fact that i singled out pakistan as if terrorist organizations r only invo\\u2026 https://t.co/bh7cNesfcV',b'1232227866311413761',b'Amrita Kaur',b'AmritaPanglia',b'Bay Area ',b'\\U0001f30e\\u2600\\ufe0f\\U0001f54a\\U0001f33f\\U0001f595\\U0001f3fd',b'123',b'245',b'0',b'532',b'4287',b'False',b'False',b'True',b'False',b'2015-09-14 04:49:11'
"b'@Fazzanelli @yogital Any nation with more then 10% muslim will fail just see grooming gang, knife attack in bermingham, Manchester'",b'1232227865158131712',b'Raj Indian',b'RajIndi73502059',b'',b'',b'1',b'67',b'0',b'758',b'442',b'False',b'True',b'True',b'False',b'2019-12-16 03:39:42'
b'LBH PU yg selama ini gigih membela kepentingan Islam &amp; kaum Muslim tengah alami kriminalisasi. Kami bersama LBH PU\\u2026 https://t.co/WUXnjFPn5q',b'1232227861928407041',b'Atikah Qorriaina',b'AQorriaina',b'',b'belajar',b'119',b'148',b'0',b'2262',b'694',b'False',b'False',b'True',b'False',b'2019-03-10 07:32:50'
"b'Delhi anti-CAA riots: Amidst chants of \\u2018Allah Hu Akbar\\u2019 and \\u2018Nara e Taqbeer\\u2019, Hindu man killed by a Muslim mob in B\\u2026 https://t.co/ZdxNKpjYiw'",b'1232227840470528000',b'OpIndia.com',b'OpIndia_com',b'New Delhi',"b'News and opinions website, bringing the right side of India to you.'",b'237433',b'126',b'634',b'44116',b'73',b'True',b'False',b'False',b'False',b'2009-09-17 10:25:56'
b'@Mohdshaan52 @SwetaSinghAT Brother there is nothing like Hindu and Muslim terrorism .So stop saying this .No religi\\u2026 https://t.co/KtKtAkx9ST',b'1232227831381360640',b'Ajaysharma7',b'Ajaysharma713',b'',"b'Graduation in English literature .Home state Himachal Pradesh , chamba.Intrested in books and traveling.'",b'60',b'595',b'0',b'707',b'7045',b'False',b'False',b'True',b'False',b'2020-01-05 09:19:17'
b'@GAPUROOO1 Orang muslim selalu jadi incaran rezim komunis\\n &gt;&gt; #SaveAdvokatPejuang &lt;&lt;\\n #DampingiKetuaLBHPU - #LBHPelitaUmat\\n#FDF9\\n\\n@m_newsid',b'1232227826834632704',b'Lampu Led',b'LampuLed3',b'',b'',b'1',b'1',b'0',b'332',b'1',b'False',b'False',b'True',b'False',b'2019-03-10 05:12:38'
"b'They are pre planned Anti muslim rioters you are journalist u will be neutral.\\nI know,\\nI ill correct it. https://t.co/dAvXio47y4'",b'1232227826281132032',b'Majid Shaikh',b'Majidsk13',"b'Mumbai, India'","b'Bol k lab azaad hai tere,Rt no endorsement.'",b'106',b'208',b'0',b'1630',b'27368',b'False',b'True',b'True',b'False',b'2017-11-16 08:42:00'
"b'@imsudhanshu_ Bijli, paani, shiksha, swasth sab achha chal raha hai. Agla chunav Bihar mai hai. Nafrat ki aag jab f\\u2026 https://t.co/9CJjc0i4Lh'",b'1232227820631478275',b'\\u0926\\u093e\\u095d\\u0940_waala_\\u0910\\u0921\\u093e',b'DryNeer_',b'new delhi',"b'Indian by blood, Indian by nation.'",b'515',b'280',b'0',b'9784',b'24013',b'False',b'False',b'False',b'False',b'2011-05-11 13:13:33'
"b'Saat kaum munafik nan dzalim dan kaum kafir mnjadi pmegang kendali, mka umat muslim jelas akan dipukul keras sesuka\\u2026 https://t.co/6rKMAGzKWi'",b'1232227814713118720',b'@ws_harefa',b'ws_harefa',"b'Sumatera Utara, Indonesia'",b'Niat merupakan dasar dari semua perbuatan',b'110',b'304',b'0',b'320',b'249',b'False',b'False',b'True',b'False',b'2019-12-04 04:05:17'
b'@AJEnglish This Jihadi network .. terrorists owned channel @AJEnglish  says #CAA is anti muslim.... \\nshow us clause\\u2026 https://t.co/PO1cCBDPkT',b'1232227814163640320',b'NayaN',b'nayanchandra',b'Mumbai and mangaluru',"b'Born Techie,Politics,Start Ups,Entrepreneur,Director https://t.co/pEodJ3mC6i, Associate Zeus Holdings..Proud Hindu by Birth..Indian by Religion. Proud our PM is @narendramodi'",b'5032',b'787',b'125',b'294664',b'194561',b'False',b'False',b'False',b'False',b'2009-07-22 08:24:16'
"b'@carikebaikan Saat kaum munafik nan dzalim dan kaum kafir mnjadi pmegang kendali, mka umat muslim jelas akn d pukul\\u2026 https://t.co/ravNrxb92l'",b'1232227812657942528',b'Hanif Al Jawi',b'hanif_1453',"b'DKI Jakarta, Indonesia'",b'Waktu Tidak Akan Tunduk Kecuali Kepada Ia Yang Menantangnya #garisdepan',b'40',b'46',b'0',b'515',b'8',b'False',b'False',b'True',b'False',b'2019-04-11 07:12:49'
b'@ArvindKejriwal hindu hoke hinduon ko marba raha he  sirf kuchh swaarh keliye itihaas gawah he tere gharme bhi ghus\\u2026 https://t.co/acs7Blaagg',b'1232227806567903233',b'Badyanath Pollei',b'BadyanathP',b'',b'',b'5',b'95',b'0',b'24',b'17',b'False',b'False',b'True',b'False',b'2018-04-05 02:57:32'
"b'@dhume Live watching on television all Muslim gang Rioters and they are creating Havoc,pelting stone, arm shot, fir\\u2026 https://t.co/qFHJtVhd1J'",b'1232227803254415360',b'AbhishekSinghGyanu',b'GyanuAbhi',"b'Lucknow, India'",b'\\u0938\\u092c \\u0915\\u0943\\u092a\\u093e \\u0939\\u0948 \\u092d\\u094b\\u0932\\u0947\\u0928\\u093e\\u0925\\U0001f40d \\u0915\\u0940 \\u0939\\u0930\\U0001f64f\\U0001f3fb \\u0939\\u0930 \\u092e\\u0939\\u093e\\u0926\\u0947\\u0935',b'66',b'138',b'0',b'1581',b'5971',b'False',b'False',b'True',b'False',b'2019-10-31 14:16:16'
b'@m_newsid Rezim baperan. Jangan hanya karna aktifis muslim yang kritis hukum diarahkan kepadanya\\n &gt;&gt;\\u2026 https://t.co/gDrAwjmEn8',b'1232227799236251648',b'wingayo',b'wingayo64993297',b'',b'',b'39',b'133',b'0',b'201',b'16',b'False',b'False',b'True',b'False',b'2019-11-14 15:07:55'
b'@Adam56003347 we are witnessing turmoil in the muslim world. The dictators are being forced to become ever more hea\\u2026 https://t.co/BaCKETzFAi',b'1232227781137883137',b'NeutralObsrvr20',b'NObsrvr2020',b'',b'Analysis of strategies adopted by worldwide state & non-state actors',b'101',b'49',b'0',b'170',b'10',b'False',b'True',b'True',b'False',b'2020-02-11 19:20:52'
"b""Rioters and dignity....nice try at the sympathy part though- it's a clever ploy to shame anyone that isn't on their\\u2026 https://t.co/2J6u1o7E8h""",b'1232227780923777024',b'Mocha Roca',b'CaffeineBanter',b'',b'Commonly found with Caffeine but able to be just as energetic without the boost.\\nI\\u2019m just here for the comments ...',b'187',b'1368',b'3',b'19767',b'26900',b'False',b'False',b'True',b'False',b'2012-12-28 05:37:20'
b'@xJUSTBELIEVE @CharleaChaieb They are the delusional ones. The idea that you can de-radicalise Muslim fanatics prep\\u2026 https://t.co/eDoOODj8gU',b'1232227780508749825',b'Phillip Bradshaw',b'bristol_pjb',"b'Bristol, England'",b'Love irony and anything that raises a smile!',b'237',b'467',b'0',b'8844',b'6738',b'False',b'False',b'True',b'False',b'2017-01-19 23:30:46'
"b'@vivekagnihotri Irrespective of Hindu Muslim,whoever have destroyed the cars n public properties,their personal ass\\u2026 https://t.co/5yu3s19kDm'",b'1232227758950010881',b'Ranjita Agarwal',b'Ranjita1112',b'',b'',b'3',b'47',b'0',b'210',b'1079',b'False',b'True',b'True',b'False',b'2017-01-28 16:20:57'
b'Umat bersama LBH PU membela perjuangan kaum Muslim utk melanjutkan kehidupan Islam.\\n &gt;&gt; #SaveAdvokatPejuang &lt;&lt;\\u2026 https://t.co/XbarwzeqUJ',b'1232227757397987330',b'Si Idealis \\u261d',b'pejuangidealism',b'',"b'Hakikat manusia cendrung pada kebenaran, sampaikanlah islam karna sesunungguhnya islam adalah kebenaran.'",b'45',b'52',b'0',b'353',b'441',b'False',b'False',b'True',b'False',b'2019-08-24 08:37:45'
b'Sampai kapan ketidakadilan pada Muslim berlangsung? Apakah menunggu ajal menjemput hai orang dzalim\\n &gt;&gt;\\u2026 https://t.co/IbyVCNFZTd',b'1232227753031716864',b'fauziah',b'myname_fauziah',"b'Malang, Jawa Timur'",b'Haarisan Aminaan Lil Islam \\n\\nEnjoy your life with Islam.. \\nAllah always listening and understanding',b'108',b'118',b'0',b'535',b'761',b'False',b'False',b'False',b'False',b'2019-02-16 15:17:46'
b'Where is the Opposition?\\nWhere are the Opposition cadres?\\nWhere are the Left cadres?\\nWhere are the Dalit Muslim sol\\u2026 https://t.co/IE0IygKHOE',b'1232227752838758401',b'Sidrah',b'SidrahDP',b'',"b""Equality. Justice. Mirrors & Truth. I find magic and poetry in the littlest things. Zero bullshit tolerance. Don't mess with my chai & coffee.""",b'13870',b'1338',b'47',b'50091',b'38855',b'False',b'False',b'False',b'False',b'2011-10-30 17:41:27'
"b""@Timcast Aside from a wall that is not finished, has fallen over at least once, and it doesn't stop people flying i\\u2026 https://t.co/HcfA2MyEsF""",b'1232227751253487616',b'Ed Reid',b'EdwardReid_',"b'England, United Kingdom'","b'Villa fan. Used to be good at actual sports, now excel at pub sports. Retired powerlifter. Former civil servant. Please tell me Brexit will eventually end?'",b'43',b'279',b'1',b'12156',b'29779',b'False',b'False',b'True',b'False',b'2019-03-09 18:37:52'
"b'Saya menolak segala bentuk kriminalisasi kepada saudara muslim, tak terkecuali pada Ahmad Khazinudin ketua LBH Peli\\u2026 https://t.co/wTCEWdWxZD'",b'1232227745444220928',b'Ulil Aminudin',b'AminudinUlil',b'Indonesia',b'Hasbunallah wanikmawakil',b'150',b'135',b'0',b'1282',b'543',b'False',b'False',b'True',b'False',b'2019-02-15 12:37:12'
