b'What Muslim people did with Hindu person https://t.co/5g6FBP7cyN',b'1232229217233846272',b'The Drunken Dude',b'TheDrunkenDude',b'',"b'4 bottle vodka, kaam mere roj ka \\U0001f92b'",b'4',b'50',b'0',b'2220',b'356',b'False',b'False',b'True',b'False',b'2019-12-03 07:38:13'
b'@opiniofIslam Hukum buatan manusia yg ada di negeri ini sangat lemah dan faktanya selalu digunakan untuk kepentinga\\u2026 https://t.co/1TCsqqQDZ6',b'1232229209549860864',b'bergerak dan belajar',b'insansukses',b'Indonesia',b'',b'367',b'457',b'0',b'2641',b'1172',b'False',b'False',b'True',b'False',b'2018-03-31 06:16:49'
b'@TARUNspeakss Hope ise bhi qoute tweet krega aur muslim word use krega..',b'1232229209071931394',b'Nitin',b'Nitin49825883',b'',b'Hindu Nationalist',b'23',b'135',b'0',b'3396',b'1575',b'False',b'True',b'True',b'False',b'2019-12-18 06:25:33'
b'Catholic friend: Kaya pla kako napaka-conservative mo. Sorry nga pla pag nasasabihan kita nun na parang kiss lang.\\u2026 https://t.co/RZ6Vg7YsRU',b'1232229204378320896',b'JAIRAH DM \\U0001f495',b'jaidam0429',"b'Bulacan, Central Luzon'",b'Hindi ako mataba. Chubby lang. \\U0001f601\\u2764\\ufe0f',b'424',b'150',b'5',b'82073',b'34861',b'False',b'False',b'True',b'False',b'2016-05-19 16:35:16'
"b""@ANaayak_ @ArchitSRajput Sonam Mahajan is one islamophobe who brought hate through toxic rants, she's no Hindu. She\\u2026 https://t.co/KYlHnFs4tu""",b'1232229196446892032',b'Darth Kothi',b'DarthKothi',b'',b'Self thoughts Enlighten Me.\\nHoney badger is my inspiration.\\n\\xae\\ufe0f',b'5',b'28',b'0',b'1031',b'188',b'False',b'False',b'True',b'False',b'2019-12-16 14:07:01'
b'Umat Islam harus waspada terhadap  upaya kriminalisasi terhadap Muslim yang kritis dan vokal \\n &gt;&gt;\\u2026 https://t.co/iMuKe4cjOA',b'1232229196354768896',b'Budi Sarjono',b'BudiSarjono76',"b'Yogyakarta, Indonesia'",b'meraih ridlo ilahi',b'120',b'263',b'0',b'2508',b'1584',b'False',b'False',b'True',b'False',b'2019-03-16 15:33:44'
b'@ahussainwi @BhimArmyChief @akramtyagi Muslim should avoid Ravans appeal. He is not capable to help Muslim\\u2019s.',b'1232229193951346688',b'Er. MAHFOOZ',b'mahfoozee',b'India',b'ELECTRICAL ENGINEER',b'424',b'1560',b'21',b'31043',b'29430',b'False',b'False',b'False',b'False',b'2010-04-26 18:29:28'
b'@ashokepandit abe bhadwe pandit teri gand kitni bhi jale muslim se lekin ye yad rakh jhaant nahi ukhad payega tu au\\u2026 https://t.co/RFhdqvxTeP',b'1232229172258516992',b'INDIA KE PAPPA',b'pappa_ke',b'',b'i am bhakt.',b'70',b'103',b'0',b'70',b'9',b'False',b'False',b'True',b'False',b'2019-09-26 05:22:33'
"b'The second honoree includes a strong, nuanced, and authentic portrayal of a female Muslim superhero. These filmmake\\u2026 https://t.co/XI3BxWD1gx'",b'1232229171650154496',b'Hasnain Syed',b'hasnain22',b'City of Angels',"b'Pappi + daddy first. Experiences over things. In pursuit of less. Digital director @mpac_national. I \\u2764 innovation, creativity & humans.'",b'553',b'440',b'23',b'2170',b'625',b'False',b'False',b'False',b'False',b'2008-08-08 22:25:45'
b'@atlas47 @Abhina_Prakash Yes. Hindus are very safe. Like the Delhi police constable who lost his life yesterday. Li\\u2026 https://t.co/iFGSI0gh0T',b'1232229170689847296',b'Democracy Watch',b'DemocracyWatch7',b'',b'true democracy',b'37',b'389',b'0',b'1408',b'2445',b'False',b'True',b'True',b'False',b'2020-01-27 16:14:55'
"b'@mike9wood @Conserv30187675 Mike, you still shave your balls like a good Muslim? \\U0001f602\\U0001f602\\U0001f602'",b'1232229150162923520',b'David',b'Real_DaveLester',"b'Pennsylvania, USA'","b'IT guy, 40 years of working for large companies - conservative Christian, I believe in our kids and our constitutional rights. percussionist for 41 years, #KAG'",b'449',b'555',b'0',b'3204',b'4945',b'False',b'False',b'True',b'False',b'2013-11-18 15:48:17'
"b'@Fahruro86 Selama ini, kenapa penegakan hukum hanya berlaku kepada kaum Muslim yang justru vokal menyuarakan keadil\\u2026 https://t.co/uZZomQ9hmW'",b'1232229148606599168',b'Smartika',b'Smartika4',b'',b'hayya bil jihad',b'44',b'54',b'0',b'747',b'119',b'False',b'False',b'True',b'False',b'2019-08-29 11:51:45'
"b'Peristiwa penting selama bulan rajab, penting untuk di ketahui umat muslim. \\n\\n#SaveAdvokatPejuang\\u2026 https://t.co/62sgy3JOoP'",b'1232229140280905733',b'YUNG SYAHIDAH',b'yung_syahidah',b'',"b""^_^ La izzata illa bil islam | I'm Proud to be young Moeslem  and Strugle for Khilafah nan Syari'ah^_^""",b'655',b'1040',b'1',b'2229',b'1913',b'False',b'False',b'False',b'False',b'2013-06-20 21:48:13'
"b'Look at the scale of arson by Muslim mobs. Fueled by not just hate for Hindus but by jihadi media stars like Saba,\\u2026 https://t.co/K9SXNXGIjD'",b'1232229136011165696',b'Megonopsis',b'royally_fiery',b'Narendra Modi - Amit Shah Era',b'Business | Politics | Nature | Sensitive people should avoid this place.',b'8529',b'681',b'95',b'77132',b'40710',b'False',b'False',b'False',b'False',b'2013-04-22 18:31:33'
b'@mrsigh3 @dhruv_rathee Kuch muslim aur hindu b*nxchd ki wjh se aaj delhi ka yeh haal h sale  chutiye log ki wjh se aj jeena haram rh gya h',b'1232229135386214403',b'pj',b'pj01kr',b'purnea',b'sidpahira\\u2763\\ufe0f\\u2763\\ufe0f',b'14',b'166',b'0',b'666',b'206',b'False',b'False',b'True',b'False',b'2013-06-22 08:25:20'
b'How can someone ignore this? Do you have a soul? How can you sleep?  https://t.co/KSgH0i8Wi4',b'1232229129635844097',b'Nausheen',b'nausheen08',b'Kota | Mumbai | New Delhi ',b'Photography \\u2022 Politics \\u2022 Peace \\u2022 Pasta',b'60',b'345',b'0',b'743',b'2154',b'False',b'False',b'False',b'False',b'2016-04-24 06:29:56'
"b'@Hafidz_AR1924 Berulang kali kita saksikan, bagaimana penegakan hukum di negara mayoritas Muslim ini hanya menyasar\\u2026 https://t.co/r74GsRVZSI'",b'1232229121347837952',b'Handoko',b'Handoko1939',"b'Bogor Timur, Indonesia'",b'Lanjutkan perjuangan..',b'60',b'79',b'0',b'1130',b'267',b'False',b'False',b'True',b'False',b'2015-10-01 03:20:23'
b'Kami menolak semua upaya meng kriminalisasi semua para pejuang yang membela ulama dan Muslim termasuk ketua LBH pel\\u2026 https://t.co/GhbBf0IDQE',b'1232229116604121088',b'Pemuda Pembebasan #reborn',b'ironhide_id',"b'Tanjungpinang, Kepulauan Riau'",b'',b'245',b'311',b'0',b'1751',b'90',b'False',b'False',b'True',b'False',b'2013-12-08 13:30:51'
b'@Real_Anuj mai kisi bhi muslim se saman ghar ka nahi khareedta...na kabhi khareedunga!',b'1232229116243533824',b'Hindu RamVansh @Devash92 Ram bhakt!',b'devash92',b'\\U0001f6a9Hindu Rashtra Bharat\\U0001f6a9',b'Bharat Mata Ki Jai\\nKothari Brothers Are my idls\\U0001f531!\\nModi Ji is my hero!\\nJihadi door rahen nahi to...\\U0001f92c\\U0001f92c',b'1272',b'1474',b'0',b'20023',b'18998',b'False',b'False',b'True',b'False',b'2012-11-25 19:23:19'
b'Ge\\xe7enlerde ona yalan s\\xf6yledim. Sen iyi bir insans\\u0131n diye. Halbuki benim g\\xf6z\\xfcmde de\\u011fersiz biri olmu\\u015ftu. Son s\\xf6zlerim\\u2026 https://t.co/OW3EaBj7QF',b'1232229115949932550',b'm\\xfcslim uygun',b'muslim_uygn',"b'Karasu, T\\xfcrkiye'",b'koy g.g.\\nBe\\u015fikta\\u015f\\nKarasu\\nYenge\\xe7',b'887',b'202',b'0',b'1126',b'2807',b'False',b'False',b'False',b'False',b'2014-04-04 19:16:26'
"b""No need to be more pleased with Trump's statement, Trump is an enemy of Islam, remember that no Muslim country can\\u2026 https://t.co/8KR3eYYuGh""",b'1232229109922660352',b'Zohaib Niazi Draz Khel',b'zohaib_niazi6',"b'Sawanse,Mianwali'",b'The Prophet PBUH is the one who showed us the path of guidance and morals!',b'127',b'322',b'1',b'6342',b'18054',b'False',b'False',b'True',b'False',b'2017-02-01 02:20:32'
b'@RanaAyyub This Muslim guy....',b'1232229101999656961',b'Madhusudan Kisan',b'ms2geet',b'',"b""Stupid...Don't know why I am a paid subscriber of Communist trade Union since last 22 years..""",b'70',b'161',b'0',b'3376',b'11951',b'False',b'False',b'True',b'False',b'2010-10-26 16:44:38'
"b'@m_newsid Selama ini, kenapa penegakan hukum hanya berlaku kepada kaum Muslim yang justru vokal menyuarakan keadila\\u2026 https://t.co/P2tJonmTnm'",b'1232229101861163011',b'abine HamZAh',b'Very86954243',"b'Tuban, Indonesia'",b'berat badan',b'64',b'97',b'0',b'1842',b'183',b'False',b'False',b'True',b'False',b'2019-03-16 17:42:52'
b'@KuserSidra @majorgauravarya @SAfridiOfficial @carin__fischer @tonyashai @cjwerleman @FriedrichPieter\\u2026 https://t.co/xXSjTFINtr',b'1232229101563334657',b'Rajneesh \\U0001f1ee\\U0001f1f3',b'Rajnees98531092',b'',"b'Men do not attract that which they want, but that which they are.\\n !!\\u0926\\u0947\\u0936 \\u0915\\u0947 \\u0932\\u093f\\u090f \\u092a\\u094d\\u092f\\u093e\\u0930 \\u0939\\u0948 \\u0924\\u094b \\u091c\\u0924\\u093e\\u092f\\u093e \\u0915\\u0930\\u094b, \\u0915\\u093f\\u0938\\u0940 \\u0915\\u093e \\u0907\\u0902\\u091c\\u0924\\u093e\\u0930 \\u092e\\u0924 \\u0915\\u0930\\u094b\\u2026 \\u0917\\u0930\\u094d\\u0935 \\u0938\\u0947 \\u092c\\u094b\\u0932\\u094b \\u201d \\u091c\\u092f \\u0939\\u093f\\u0928\\u094d\\u0926 \\u201c !!'",b'3',b'90',b'0',b'847',b'178',b'False',b'False',b'True',b'False',b'2019-12-09 11:54:28'
b'@anita_sari067 Negeri muslim berisi penguasa munafik.\\n &gt;&gt; #SaveAdvokatPejuang &lt;&lt;\\n #HukumTajamKeMuslim .\\u2026 https://t.co/b6bNcDFoCh',b'1232229097595473920',b'Pemuda Pembebasan #reborn',b'ironhide_id',"b'Tanjungpinang, Kepulauan Riau'",b'',b'245',b'311',b'0',b'1751',b'90',b'False',b'False',b'True',b'False',b'2013-12-08 13:30:51'
b'And then i saw some malay girls passing by. Lawa memang lawa i gotta admit esp yg btudung lpastu putih melepak but\\u2026 https://t.co/ijFAXwZTDg',b'1232229093405413377',b'\\U0001d500 \\U0001d4f2 \\U0001d4f7 \\U0001d4fc \\U0001d4f5 \\U0001d4ee \\U0001d502 \\U0001f36d',b'_winsleywinston',b'di antara syurga dan neraka',"b'Hello, im still healing. thanks'",b'1309',b'603',b'1',b'5869',b'14789',b'False',b'False',b'True',b'False',b'2016-01-29 23:04:27'
"b'Berulang kali kita saksikan, bagaimana penegakan hukum di negara mayoritas Muslim ini hanya menyasar pada umat Isla\\u2026 https://t.co/aryfnKQbUa'",b'1232229058563338242',b'Ummu zaenab',b'IArsyad80',"b'Kota Makassar, Sulawesi Selata'",b'',b'144',b'280',b'0',b'945',b'1203',b'False',b'False',b'True',b'False',b'2019-06-26 19:21:06'
b'@MdSAJId44149 @AkshayConnect19 @RahulSi94672264 @AcharyaPramodk @narendramodi @INCIndia India aaj isss position pe\\u2026 https://t.co/XmXE7FkVBc',b'1232229052490158080',b'\\U0001f1ee\\U0001f1f3\\u0905\\u0928\\u093f\\u0915\\u0947\\u0924 \\u0906\\u0928\\u0902\\u0926 (Aniket Anand)\\U0001f1ee\\U0001f1f3',b'imaniketstyles',b'',"b'\\u092e\\u094b\\u0926\\u0940 \\u092d\\u0915\\u094d\\u0924 \\u0939\\u0942\\u0901 \\u0936\\u093e\\u0928 \\u0938\\u0947 \\U0001f1ee\\U0001f1f3, \\u0926\\u0947\\u0936\\u092d\\u0915\\u094d\\u0924 \\u0914\\u0930 \\u0930\\u093e\\u0937\\u094d\\u091f\\u094d\\u0930\\u0935\\u093e\\u0926\\u0940 \\u092e\\u0947\\u0902 \\u092b\\u0930\\u094d\\u0915 \\u0939\\u0948, \\u092e\\u0948\\u0902 \\u091c\\u094d\\u092f\\u093e\\u0926\\u093e \\u0930\\u093e\\u0937\\u094d\\u091f\\u094d\\u0930\\u0935\\u093e\\u0926\\u0940 \\u0939\\u0942\\u0901 \\U0001f1ee\\U0001f1f3 :) \\U0001f48c Tweets Personal, Need followers..\\n\\u2022Insta@ iamaniketstyles'",b'209',b'1015',b'2',b'5872',b'13765',b'False',b'False',b'False',b'False',b'2011-08-27 11:25:00'
b'Negeri muslim berisi penguasa munafik.\\n &gt;&gt; #SaveAdvokatPejuang &lt;&lt;\\n #DampingiKetuaLBHPU . #HukumTajamKeMuslim',b'1232229051722391552',b'Sulis Setyawati',b'suliswarlan1010',b'',b'',b'44',b'51',b'0',b'757',b'44',b'False',b'False',b'True',b'False',b'2018-05-06 13:27:18'
b'@HDNER And how ALLAH exposes Satan worshiping beast Erdogan ?\\n\\nNot #Gaza not #Palestine but more deadly than Corono\\u2026 https://t.co/i3hRUYSVYS',b'1232229049315053569',b'Sayyid Imam',b'imamgardezi',b'',"b'Unless we Honour Freedom of Fellow Humans, we will never be Free.'",b'530',b'185',b'40',b'26953',b'2616',b'False',b'False',b'False',b'False',b'2009-03-10 16:04:00'
b'@divya_16_ Jaise door desh ke tower me ghus jaye re airoplane\\n kyu ji ranaji @anuragkashyap72 \\nBtw pro muslim is on\\u2026 https://t.co/X7T1iVbYEz',b'1232229042549657601',b'CHAMAR',b'Liberal51601607',b'',b'Lost family on direct action day in 1947 in 1972 and in marichjhapi and in moplah.',b'13',b'15',b'0',b'2324',b'165',b'False',b'False',b'True',b'False',b'2019-03-23 14:14:48'
"b'@patrickmkcirtap @bhweingarten @IngrahamAngle Should female, black Muslims be free from criticism automatically bec\\u2026 https://t.co/kW4kuReGO9'",b'1232229041941303297',b'Mark Jardine',b'markbjardine',"b'Perth, Western Australia'",b'Facts and evidence are the essence of debate.\\nInsults are not arguments.\\nEquality of opportunity is vital. Equality of outcomes impossible.',b'3616',b'4828',b'28',b'125077',b'147699',b'False',b'False',b'False',b'False',b'2017-01-05 04:56:55'
"b""@MinavaMohammed @Tutsy22 @PSJUK_Official As a muslim, i am willing to give my own little token (patching up, but I'll try).""",b'1232229041803010048',b'shekoni taofeek',b'shekonitaofeek',b'',b'',b'79',b'308',b'0',b'741',b'1909',b'False',b'False',b'True',b'False',b'2012-11-27 12:52:01'
"b""@ananavarro @BernieSanders Lady.. put down the tweeter. Save some dignity. Smearing won't help. We are a movement a\\u2026 https://t.co/gnwqmLgw3U""",b'1232229035742244864',b'\\U0001f525Reid Anderson\\U0001f525\\U0001f308',b'reiddoggy105',"b'Behind You, USA'",b'#Bernie2020\\n#UsNotMe\\nLINK #CentristToxicity\\n#MSMinistryOfPropaganda\\n#DNCRigged\\n#MayorCheat \\n#OnlyBernieBeatsOligarchy \\n#OnlyBernieBeatsTrump \\n#3rdWayFearsBernie',b'612',b'1683',b'14',b'17918',b'28463',b'False',b'False',b'False',b'False',b'2010-10-20 22:59:48'
b'@ashutosh83B ye tere gar me bhi aye ga gun leke hindu samj sakta hai muslim kabhi samje ga nai aman ki bat',b'1232229034622251008',b'PRAFUL MISTRY',b'PNMST',b'',b'',b'0',b'569',b'0',b'87',b'170',b'False',b'True',b'True',b'False',b'2016-10-08 05:33:04'
b'@barandbench @harsh_mander @KapilMishra_IND @ianuragthakur @p_sahibsingh Muslim crowd holding saffron trays to carr\\u2026 https://t.co/v4sK4m6LeZ',b'1232229034248957959',b'Old Monk',b'OldMonk1954',b'',"b'One individual may die for an idea, but that idea will incarnate itself in a thousand lives.\\n\\n\\u0950\\xa0\\u0938\\u0930\\u094d\\u0935\\u0947 \\u092d\\u0926\\u094d\\u0930\\u093e\\u0923\\u093f \\u092a\\u0936\\u094d\\u092f\\u0928\\u094d\\u0924\\u0941\\u0964'",b'88',b'483',b'0',b'3935',b'6210',b'False',b'False',b'True',b'False',b'2019-08-03 05:37:09'
b'Pro-CAA Sangh Terrorists conducting an Anti-Muslim progrom in Delhi. Delhi Police stand as Mute spectators.\\u2026 https://t.co/ygpyuLTuwe',b'1232229028406407168',b'OMAR FAROOK',b'nofarook',b'Al Khobar',"b'A Keralaite living in Al Khobar,  a large city located in the Eastern Province of the Kingdom of Saudi Arabia'",b'32',b'28',b'0',b'37',b'28',b'False',b'False',b'True',b'False',b'2013-07-07 12:22:41'
"b'@RajIndi73502059 @yogital what they should do is divide India into a muslim state, Hindu state and a secular state.'",b'1232229025558519809',b'Ustad Fazzanelli',b'Fazzanelli',b'Europe',b'Health Champion. PR/Media/Design/Photography. Tribal Leader. All views own (subject to personal growth and development).   RT \\u2260 endorsement.',b'347',b'487',b'21',b'15975',b'9267',b'False',b'False',b'False',b'False',b'2010-11-24 21:52:38'
"b'Hindu Muslim\\nHindu Muslim\\nHindu Muslim\\nHindu Muslim\\n\\nAur aata hi kya hai right wing ko?!\\n\\nChalo, jeet gaye aap log.\\u2026 https://t.co/lhKEbePxe8'",b'1232229004788293632',b'Anish Bhalerao',b'anishbhalerao',b'Oxford of the East',"b'MBA, Engineer, United Fan.\\nMumbaikar in Pune.\\n@ManUtd turned the optimist in me into a pessimist in the December of 2018.\\n#AttackAttackAttack #TeamPixel'",b'296',b'482',b'20',b'13062',b'30642',b'False',b'False',b'False',b'False',b'2010-02-12 04:15:03'
b'\\u201cWe will remove you pants to see if you are Hindu or Muslim\\u201d This is what was told to a journalist yesterday by a m\\u2026 https://t.co/8PIjMIG0fb',b'1232229003525787648',b'\\U0001f1ee\\U0001f1f3Mohammed Choudhary',b'AntiAndhbhakts',b'\\u0905\\u0902\\u0927\\u0947\\u0930 \\u0928\\u0917\\u0930\\u0940',"b'First Be Human, Then Religious.\\n                            SECULARISM ZINDABAD'",b'270',b'653',b'0',b'4897',b'14402',b'False',b'False',b'True',b'False',b'2019-01-24 02:32:56'
b'Repression conducted under the guise of \\u201canti-separatism\\u201d is particularly severe in the Xinjiang Uighur Autonomous\\u2026 https://t.co/RgdHiVyvS0',b'1232229003135680512',b'\\U0001d46d\\U0001d493\\U0001d482\\U0001d48f\\U0001d48c\\U0001d48d\\U0001d49a \\xaf\\\\_(\\u30c4)_/\\xaf  \\U0001f1ee\\U0001f1ea',b'FrankOKelly',b'Between-locations',"b'Acts of kindness, are never wasted, unless dealing with a moron #resist #infantry #Autisimdad. #MartialArts.\\U0001f479will only argue face to face...mostly'",b'20742',b'19207',b'34',b'24130',b'18862',b'False',b'False',b'False',b'False',b'2012-05-24 14:47:32'
b'@iamabdullaahsan @Ravans1 @MMif7 @SalafiShield No.. all u need to do is get on with your life... knock yourself out\\u2026 https://t.co/2hWIpzEwRt',b'1232229002888138752',b'Mixaan',b'MixaanFaqih',b'Dhivehi Raajje (Maldives)',b'Humanist',b'534',b'1147',b'4',b'22715',b'39703',b'False',b'False',b'True',b'False',b'2018-04-29 18:02:05'
b'\\u0907\\u0924\\u0928\\u093e \\u0924\\u094b \\u0906\\u091c \\u0938\\u093e\\u092b \\u0939\\u0948 \\u0915\\u093f PRO-CAA \\u0915\\u093e \\u092e\\u0924\\u0932\\u092c Anti-Muslim \\u0939\\u0948 \\u092c\\u0938 \\u0914\\u0930 \\u0915\\u0941\\u091b \\u0928\\u0939\\u0940\\u0902 \\u0964#DelhiViolence\\n#HindutvaTerrorists\\u2026 https://t.co/NU1AK63w9g',b'1232229002506620933',b'kashif ahmad',b'kashifka29',"b'Jamshedpur, India'","b'fun loving, helpful, love to travel and love to take photos\\n\\nStudent of 3D Animation at MAAC Jamshedpur'",b'116',b'561',b'0',b'896',b'570',b'False',b'False',b'True',b'False',b'2010-12-07 10:46:44'
"b'@AyahBersahaja Saya menolak segala bentuk kriminalisasi kepada saudara muslim, tak terkecuali pada Ahmad Khazinudin\\u2026 https://t.co/p7jJdCIL4P'",b'1232229002007310337',b'Handoko',b'Handoko1939',"b'Bogor Timur, Indonesia'",b'Lanjutkan perjuangan..',b'60',b'79',b'0',b'1130',b'267',b'False',b'False',b'True',b'False',b'2015-10-01 03:20:23'
"b'@BJimbron Saya muslim, saya siap dampingi Ahmad Khazinudin\\n &gt;&gt; #SaveAdvokatPejuang &lt;&lt;\\n #LBHPelitaUmat .\\u2026 https://t.co/1rOAWtEXY8'",b'1232228987876859904',b'Sinta92',b'Sinta922',b'',b'',b'5',b'8',b'0',b'132',b'31',b'False',b'False',b'True',b'False',b'2020-01-20 12:37:55'
b'@umeshshan2 @dipaksub @Kumar_go @sumanthraman @AamAadmiParty @PMOIndia CAA is a very narrow bill to help persecuted\\u2026 https://t.co/KvwclnLM9o',b'1232228986174025729',b'Shootingstar',b'Bhaktdesi1',b'',b'\\U0001f917',b'24',b'65',b'0',b'3431',b'4778',b'False',b'False',b'False',b'False',b'2018-12-23 18:08:48'
"b'@kecipireborn Saya menolak segala bentuk kriminalisasi kepada saudara muslim, tak terkecuali pada Ahmad Khazinudin\\u2026 https://t.co/ibIu2msZD5'",b'1232228985653719046',b'abdul',b'abdul0820',b'',b'',b'227',b'550',b'0',b'3138',b'8',b'False',b'False',b'True',b'False',b'2012-08-28 03:39:56'
"b""Barangsiapa yang mempermudah kesulitan orang lain, maka Allah Ta'ala akan mempermudah urusannya di dunia dan akhirat.(HR.Muslim)""",b'1232228977386782720',b'FAMOUS 2012',b'12FAMOUS',b'Jakarta',b'Forever ALLAH and MUHAMMAD in Our Soul :D\\n| Forum Angkatan 2012 LDK @fajrulislamug | Allahuakbar!',b'206',b'106',b'1',b'46169',b'5',b'False',b'False',b'False',b'False',b'2012-10-24 05:16:40'
"b'The word `if\' opens the gates of satanic thoughts"". \\n[Muslim].\\n\\nMay Allah SWT help, guide, protect, bless us, have\\u2026 https://t.co/5JaqiQdqji'",b'1232228975084265472',b'Mr. Boss Alkali.',b'Boss_Alkali',b'Here.',b'PhD in Minding My Business With Specialization in Relationships Affairs.',b'7417',b'3894',b'3',b'61870',b'72075',b'False',b'False',b'True',b'False',b'2012-04-08 22:40:07'
b'Hukum buatan manusia yg ada di negeri ini sangat lemah dan faktanya selalu digunakan untuk kepentingan penguasa men\\u2026 https://t.co/FqDMzySLSF',b'1232228971200204800',b'YOUnME',b'Yesyounme',b'This Earth',b'GoToHeavenWithISLAM',b'122',b'134',b'0',b'5263',b'3451',b'False',b'False',b'True',b'False',b'2018-10-14 07:16:26'
b'@shwetapriya_ @_sabanaqvi For all intents &amp; purposes India has been a Hindu Rashtra since independence. A perpetual\\u2026 https://t.co/YAn4VZCQ0i',b'1232228971116400641',b'Zahid',b'MeHateBigots',b'',b'Human first. I stand for Justice & fairness. I hate HATE and hate Bigotry.\\n\\nRTs are not endorsements. just to get to the truth.',b'68',b'822',b'0',b'5726',b'6691',b'False',b'False',b'False',b'False',b'2014-07-13 15:51:47'
"b'Kami, umat muslim bersatu siap mengawal dan membelanya.\\n &gt;&gt; #SaveAdvokatPejuang &lt;&lt;\\n #LBHPelitaUmat . #HukumTajamKeMuslim\\n#E9TD\\n\\n@kiarahma4'",b'1232228969522614272',b'Kekal',b'KhalidRabbaniy',"b'Probolinggo, Jawa Timur'",b'Bro Please \\nLangsung Di foll-back',b'72',b'148',b'0',b'680',b'249',b'False',b'False',b'True',b'False',b'2019-03-20 02:13:50'
b'@Husamahmoud Why would I ask myself? You called me out! You think I was lacking knowledge of Islam. If you read som\\u2026 https://t.co/z956VvlgWe',b'1232228965286281218',b'exo',b'mazarashsha',b'The Netherlands',b'#bernie2020 and chill... #exmuslim #Atheist #BJJ brown belt Muay Thai and MMA sparring...#dyslexic (English is my 4th language)',b'1571',b'44',b'21',b'8923',b'3899',b'False',b'False',b'False',b'False',b'2009-06-05 20:27:50'
b'@YRadianto @HendarwatiH Aku ini muslim malu lihat saudaraku yang katanya mayoritas terkadang sifatnya kayak minorit\\u2026 https://t.co/aRDDLfixmC',b'1232228965143629824',b'Hanto Suwono',b'HantoSuwono',b'',b'',b'314',b'711',b'0',b'5663',b'4021',b'False',b'False',b'True',b'False',b'2019-04-03 13:01:10'
"b'@NYDailyNews Offending customs, traditions &amp; values  is one of the reasonsHowever, she made a mistake by not inform\\u2026 https://t.co/1QEEQov3eC'",b'1232228958063734784',b'Rolla Karime',b'rolla_karime',b'',b'',b'796',b'1098',b'2',b'4853',b'29',b'False',b'False',b'True',b'False',b'2015-04-30 00:23:37'
b'True face of Congress and Rahul Gandhi. Watch the video carefully.  Muslims are taking an oath with Ghulam Nabi Aza\\u2026 https://t.co/4XxmU1PhVr',b'1232228955886891008',b'Dr.BIPLAB S.BOSE',b'biplabirabose',"b'Kolkata, India'","b'Whole time Director in corporate, author, visiting faculty & community service, enviornmentalist & wild life lover,engineer from IITD, MBA & Ph.D in management'",b'378',b'780',b'8',b'4896',b'13',b'False',b'False',b'True',b'False',b'2013-10-17 06:53:22'
b'@Beingzeeshan786 aapney west bengal k videos dekhey??\\n\\nbangladeshi muslims burnt down public property. u r saying a\\u2026 https://t.co/NZMJxXqkqm',b'1232228955848970241',b'Mishti',b'Mishti67234159',b'',b'new to twitter.. Hello everyone',b'81',b'152',b'0',b'2168',b'449',b'False',b'False',b'True',b'False',b'2020-01-06 07:22:39'
b'@alhalf3life A certain Muslim company came to us and ask us to do equity crowdfunding. We said ok but then they had\\u2026 https://t.co/mbuVAnMsIl',b'1232228954993381376',b'emyhr',b'notamir_',b'Shah Alam',b'\\U0001f1f2\\U0001f1fe',b'414',b'492',b'9',b'37009',b'43330',b'False',b'False',b'False',b'False',b'2013-12-10 01:56:26'
b'Najane haramkhor hinduo ko kab akal aayegi aaj ye log rod par hai kal yehi log tumare ghar me ghus kar Teri ma bahn\\u2026 https://t.co/0QzIsD7vRv',b'1232228952825094144',b'Dk',b'Dk56285825',"b'Gorakhpur, India'",b'singh',b'5',b'144',b'0',b'108',b'69',b'False',b'False',b'True',b'False',b'2020-01-02 06:54:31'
"b'Hukum sudah terbukti sangat tajam hanya kepada muslim. Kepada para koruptor, kepada para penista Islam, tumpul luar\\u2026 https://t.co/4101mqAaak'",b'1232228949649842177',b'Handoko',b'Handoko1939',"b'Bogor Timur, Indonesia'",b'Lanjutkan perjuangan..',b'60',b'79',b'0',b'1130',b'267',b'False',b'False',b'True',b'False',b'2015-10-01 03:20:23'
b'@Rangoli_A @GarimaSinghBJP Face \\u2620\\ufe0fbadsurat h bol to sahi Hindu Muslim karrahe h thoooo \\U0001f4a6\\U0001f4a6\\U0001f4a6\\U0001f4a6',b'1232228945556312064',b'Ravi.G',b'RaviG72465523',b'',b'samvidhan ki jay\\U0001f64f',b'29',b'444',b'0',b'3974',b'3930',b'False',b'False',b'True',b'False',b'2020-02-04 13:25:30'
"b'@Imhiteshbanjare @bhupeshbaghel Waah re dhurt aadmi , 100 crore tere baap ka hi burmaari ke berojgaar lavde , hindu\\u2026 https://t.co/2rs4cTqP2Q'",b'1232228944780447754',b'\\u0913\\u0932\\u093e \\u0921\\u094d\\u0930\\u093e\\u0907\\u0935\\u0930 \\u0907\\u092e\\u094d\\u0930\\u093e\\u0902\\u0921 \\u0916\\u093e\\u0928',b'driver_imran_',b'Pkmkb',"b'\\u0924\\u0941\\u092e \\u0915\\u093f\\u0924\\u0928\\u0947 \\u0905\\u0915\\u093e\\u0909\\u0902\\u091f \\u0909\\u0921\\u093c\\u093e\\u0913\\u0917\\u0947 ,\\u0939\\u0930 \\u0918\\u0930 \\u0938\\u0947 \\u0905\\u0915\\u093e\\u0909\\u0902\\u091f \\u0928\\u093f\\u0915\\u0932\\u0947\\u0917\\u093e ,OTP BATAO\\nBhikari in cheif\\U0001f34cpaxtaan\\U0001f34c\\n\\U0001f696Part time diver saudi king\\n\\u270d\\ufe0fBajwa rubber stamp \\nAfter 7pm\\U0001f33fin\\U0001f31bmars'",b'166',b'163',b'0',b'8630',b'16757',b'False',b'False',b'True',b'False',b'2016-10-14 14:00:26'
b'@AfifahTsuroya Sudah sangat nyata bahwa rezim sangat takut bangkitnya umat muslim\\n &gt;&gt; #SaveAdvokatPejuang &lt;&lt;\\u2026 https://t.co/fALCGqtccU',b'1232228938237140993',b'Rachmawati Mallafi',b'RachmawatiMall2',b'',b'',b'12',b'4',b'0',b'509',b'0',b'False',b'False',b'True',b'False',b'2019-11-07 06:27:19'
b'@iArmySupporter Aligarh main virodh ki aad main hindu mandiro per Pather vaji kerte hai muslim log aur ager hindu v\\u2026 https://t.co/8qB6zVkouc',b'1232228936324722689',b'Manoj Gupta',b'ManojGu10585076',"b'Chharra Rafatpur, India'",b'samaj seva I like BJP',b'7',b'60',b'0',b'61',b'120',b'False',b'False',b'True',b'False',b'2019-08-13 06:47:58'
