"b'@Kris_Sacrebleu I mean, they spent 8 years trying to convince their viewers that Obama was a secret Muslim Marxist from Kenya, so....'",b'1232127781238079488',b'Roddie Hasan - \\u0631\\u0627\\u0636\\u064a',b'eiddor',"b'Dallas, TX'","b""CCIE #7472 - Solutions Architect @Cisco. A mish-mash of \\U0001f1f5\\U0001f1f8\\U0001f1f1\\U0001f1e7\\U0001f1f8\\U0001f1fe Don't follow me if you don't use Oxford commas. Drummer, pilot, terrible hockey player.""",b'1237',b'2864',b'33',b'11920',b'18204',b'False',b'False',b'False',b'False',b'2008-11-16 23:45:46'
b'majority begitu ya Ilahi! minority saja yang mengingatimu. benci mezun taknak dah duduk bumi lama lama. mezun nak m\\u2026 https://t.co/08U94ALHFg',b'1232127779749056513',b'\\U0001f337',b'MaizunMuhaiedin',b'jannah',"b'No matter who is against you, if Allah is with you no one can harm you. No one. Strictly no boys are allowed\\U0001f44a\\U0001f645\\u200d\\u2640\\ufe0fNurin is my one & only b\\xe6\\U0001f49c\\U0001f496\\U0001f499'",b'30',b'20',b'0',b'9733',b'963',b'False',b'False',b'True',b'False',b'2018-11-04 12:17:49'
b'This radicalisation of the youth in the name of religion must stop. No one is born as a Hindu or a Muslim. There is\\u2026 https://t.co/d6HIAQzFmr',b'1232127768466542592',b'AJ',b'amjndl',b'London',"b'Explore, Experiment & Execute. Contrarian, Philosophy Geek.'",b'72',b'488',b'8',b'113',b'61',b'False',b'False',b'False',b'False',b'2009-01-14 18:41:42'
b'@Kritika_Kamra @ChakraNews Are you really that dumb?  Did you even know what is Citizenship act and what amendment\\u2026 https://t.co/uE7jaGFfuS',b'1232127765966508032',b'A Broken Sole',b'sole_is_broken',b'',b'',b'1',b'22',b'0',b'102',b'11',b'False',b'False',b'True',b'False',b'2020-01-14 13:43:45'
b'You were raised an Ismaili muslim and now you lick the boots of those who want to ban those who raised you from Ame\\u2026 https://t.co/EqosEu5A6D',b'1232127729962831874',b'Bishop Talbert Swan',b'TalbertSwan',b'Global',b'Pastor l Prelate l Activist l Author l Radio Host l Chaplain \\u0399\\u03a6\\u0398 l NAACP President l FB/IG/SC/YouTube @talbertswan l #TruthIsNotHate',b'138745',b'5267',b'1324',b'63372',b'61075',b'True',b'False',b'False',b'False',b'2008-10-20 19:45:56'
"b'What is happening in Delhi, let it happen for few more days\\n\\nPhir sab apni aukaat pe aa jayenge phir protest nahi h\\u2026 https://t.co/Ur1oFPjlmO'",b'1232127726837829632',b'Toshi',b'ToshiTushar1',b'FreeLoaders',b'\\u092c\\u093e\\u092a \\u0914\\u0930 \\u0926\\u093e\\u0926\\u093e \\u0906\\u0930\\u090f\\u0938\\u090f\\u0938 \\u092e\\u093e\\u0901 \\u0914\\u0930 \\u0928\\u093e\\u0928\\u0940 vhp \\u0915\\u0947 \\u0924\\u094b \\u0916\\u0942\\u0928 \\u092e\\u0947\\u0902 \\u0939\\u0940 \\u0939\\u093f\\u0928\\u094d\\u0926\\u0941\\u0924\\u094d\\u0935 \\u0918\\u0941\\u0938\\u093e \\u0939\\u0941\\u0906 \\u0939\\u0948',b'84',b'176',b'0',b'2819',b'4410',b'False',b'False',b'True',b'False',b'2019-09-06 20:23:01'
"b'@DPbleats 6. Every non mumslims is guaranteed to get citizenship under CAA, every muslim have to roam around courts\\u2026 https://t.co/5BpsMmXYYx'",b'1232127726082871296',b'Why So Serious !',b'SurrealZak',b'Inside The Dark Matter',b'Food . Science . Sex . SRK',b'3598',b'327',b'15',b'114916',b'5360',b'False',b'False',b'True',b'False',b'2017-10-27 13:27:33'
b'@SalmanNizami_ @ImranARaja1 Agar etna Kuch horaha Hai\\nTo indian muslim apna alag mulk banayen \\nYe hindo ab kisi ko\\u2026 https://t.co/zWr1KVzLvf',b'1232127709024792577',b'Z........Bhatti \\U0001f1f5\\U0001f1f0',b'ZamanBh60513139',b'\\u067e\\u0627\\u06a9\\u0633\\u062a\\u0627\\u0646 ',b'\\u200f\\u200f\\u200f\\u200f\\u200f\\u200f\\u200f\\u200f\\u200f\\u0645\\u06cc\\u0631\\u06cc \\u067e\\u06c1\\u0686\\u0627\\u0646 \\u067e\\u0627\\u06a9\\u0633\\u062a\\u0627\\u0646  \\u200e\\u200e\\u200e\\u200e@TeamIK_worr \\n\\u062f\\u0634\\u0645\\u0646 \\u06c1\\u0648\\u06ba \\u0645\\u06cc\\u06ba \\u06c1\\u0631 \\u0627\\u0633 \\u06a9\\u0645\\u06cc\\u0646\\u06d2 \\u0627\\u0646\\u0633\\u0627\\u0646 \\u06a9\\u0627 \\u062c\\u0648 \\u0645\\u06cc\\u0631\\u06d2 \\u0645\\u0644\\u06a9 \\u06a9\\u06d2 \\u062e\\u0644\\u0627\\u0641 \\u062c\\u06be\\u0648\\u0679\\u0627 \\u067e\\u0631\\u0648\\u067e\\u06af\\u06cc\\u0646\\u0688\\u0627 \\u06a9\\u0631\\u062a\\u0627 \\u06c1\\u06d2 \\n\\u067e\\u0627\\u06a9\\u0633\\u062a\\u0627\\u0646 \\u0632\\u0646\\u062f\\u06c1 \\n\\U0001f1f5\\U0001f1f0\\U0001f1f5\\U0001f1f0\\U0001f4aa',b'1112',b'1041',b'1',b'14352',b'9602',b'False',b'False',b'True',b'False',b'2019-08-31 05:58:05'
"b'It is simply  ""ANTI Muslim"" protest (riot). https://t.co/ZST4ne4z0o'",b'1232127701412175872',b'Nadeem',b'ITrueNAS',b'Mumbai-Lucknow ',b'Entrepreneur-Social Worker-Research Scholar. Interest in Hygiene & Cleaning and Renewable. https://t.co/McIc7lgnT1 not endorsement. Jai Hind.',b'9620',b'4379',b'33',b'24677',b'59664',b'False',b'False',b'False',b'False',b'2009-11-28 08:09:06'
b'@yadav_devan And Hindus burnt and beat up Muslim students earlier and now today. I am curious do you think the CAA is fair?',b'1232127695992979456',b'Namee Baijal',b'NameeBaijal',"b'Los Angeles, CA'",b'Curious.',b'40',b'28',b'3',b'480',b'245',b'False',b'False',b'False',b'False',b'2014-03-17 02:13:30'
b'[10/24/16] The newest batch of John Podesta\\u2019s hacked emails released by Wikileaks shows Obama\\u2019s transition team kep\\u2026 https://t.co/CimCuRIBci',b'1232127681744994304',b'Lola Netty',b'TXTrumpette89',"b'Texas, USA'","b""NO DMs!  Facts don't care about your feelings, & neither do I \\U0001f618 \\U0001f1fa\\U0001f1f8 #MAGA! #KAG #thegreatawakening #WWG1WGA #deplorable #thestormishere""",b'17115',b'18254',b'21',b'76027',b'47976',b'False',b'False',b'False',b'False',b'2017-03-11 03:55:57'
"b""@scroll_in why are you making such a false/misleading headline? Don't make it one side. Shows the realities of Isla\\u2026 https://t.co/6QHFCv1ixT""",b'1232127676187496448',b'No 2 violence',b'2_violence',b'',b'Love for All',b'0',b'61',b'0',b'13',b'1',b'False',b'False',b'True',b'False',b'2020-02-24 22:14:11'
b'@abhisar_sharma @KapilMishra_IND @DelhiPolice Abhisar Bhai  abhi toh patrakarita Kar rahe ho bura mat manana humare\\u2026 https://t.co/1eTU1JrhQK',b'1232127672286773249',b'Neeraj',b'Neeraj92876956',b'',b'Is duniya me sabse badi yodha #Maa hoti hai\\U0001f1ee\\U0001f1f3',b'1',b'34',b'0',b'32',b'1223',b'False',b'False',b'True',b'False',b'2019-10-22 12:30:56'
b'\\u201cAllah telah mencatat takdir setiap makhluk sebelum 50.000 tahun sebelum penciptaan langit dan bumi.\\u201d (HR. Muslim n\\u2026 https://t.co/UnCy8GSUEx',b'1232127657262796800',b'\\u0394\\u03c5\\u03b7G\\u30b7',b'aimwafa_',"b'Kemayoran, Indonesia'",b'Gamer ClashOfClans | PUBG MOBILE  | iG : aimwafa_ | Dari kampung menuju ibukota | ora ngapak ora kepenak |\\n#PURWOKERTO',b'1405',b'556',b'1',b'14534',b'460',b'False',b'False',b'True',b'False',b'2013-11-15 14:46:23'
"b'@MogliTadipar You bring in unrelated topics like economy, Expenses on NRC AND Detention centers\\nBut not answered ho\\u2026 https://t.co/qdFOUgFynt'",b'1232127655794724864',b'Unspoken',b'Unspoke08658020',b'India',"b'Nothing special,\\nJust unspoken opinions.'",b'0',b'16',b'0',b'298',b'48',b'False',b'False',b'True',b'False',b'2019-08-01 09:34:47'
b'@DrRakeshKRatho1 Bas tum jaise kuch seculars ke ilaaj ki hi jarurat hai jab jinda rahoge tabhi insan banoge aur wo\\u2026 https://t.co/eYrTeIXxOc',b'1232127655115448322',b'Bellatrix \\U0001f377',b'Takenbywineee',b'',b'A cricket freak chick bitching about her effed up life and stuff\\u2026',b'3210',b'104',b'6',b'3606',b'1740',b'False',b'False',b'True',b'False',b'2019-11-20 13:01:29'
b'@AJGaza @TalbertSwan Define Anti Muslim',b'1232127612903993346',b'mitchellmojo',b'mitchellmojo',b'United Kingdom',b'Deez Nuts',b'36',b'250',b'0',b'1229',b'3767',b'False',b'False',b'True',b'False',b'2019-12-02 19:36:34'
"b'During Gujarat riots Hindu terrorists knew exactly where to hit. Hindu houses had ""JSR"" inscribed on doors &amp; Hindu\\u2026 https://t.co/jgLqZw5lFo'",b'1232127602963300355',b'Nik',b'niksydn',b'',b'Dissent is patriotic.',b'280',b'127',b'1',b'102',b'96',b'False',b'False',b'True',b'False',b'2019-09-21 12:03:11'
b'@19JB60 @Dalia4Congress @davereaboi Seriously - READ WHAT HER TWEET IS QUITE OBVIOUSLY ADDRESSING... she is highlig\\u2026 https://t.co/U05t8t0ELc',b'1232127598534119425',b'Cranium',b'CraniumSpeaks',b'',b'Progressive Liberal American who\\u2019s not afraid of Keynesian Democratic Socialist Capitalism... basically what the rest of the industrialized world has. Be kind.',b'174',b'1396',b'0',b'1303',b'115',b'False',b'False',b'True',b'False',b'2020-01-21 23:34:55'
b'@yettiaka @faridmohmdMF Tafsir seperti apa yg kau harapkan untuk jd pembenar dr ingkarmu akan kewajiban berhijab?\\nA\\u2026 https://t.co/7NaivI8pOE',b'1232127578191716352',b'Rhageel',b'Rohmadirhageel',b'bekasi',b'hijrah',b'157',b'254',b'0',b'218',b'425',b'False',b'False',b'True',b'False',b'2013-05-27 10:52:29'
b'@HogLife4all @DazConlon @prodda @RichWithers3 @Granlovespizza @BillChristie15 @afa_queer @Real_Macca_0161\\u2026 https://t.co/omIhU2g8Ew',b'1232127566942699520',b'The #Disciple Dave Platinum',b'THEONEPLATINUM',"b'Middlesbrough, England'",b'Dave Platinum\\nThe #Disciple of Matt Hardy my Idol & Sensei.\\nHuge Boro Fan #UTB\\n11x DWF Champion. \\nIG: dave.platinum1\\n\\nHalf English Half Irish & Proud',b'772',b'1099',b'13',b'36340',b'92167',b'False',b'False',b'True',b'False',b'2012-04-03 12:23:51'
"b'@abhisar_sharma @KapilMishra_IND Delhi goli kaand ki charcha nahi ho rahi \\nKahi bhi, saayad goli chalane waala muslim hoga...'",b'1232127562777858048',b'Raju Kashyap',b'RajuKas29030068',b'',b'',b'12',b'189',b'0',b'225',b'3475',b'False',b'False',b'True',b'False',b'2019-08-25 21:30:19'
b'@digitalboysx @kismin666oys Yen be gen muslim pasti jawe kaukne padahal belum tentu nakne uling jawe keto sih biasane blik',b'1232127556263936000',b'Gede Fajar',b'bastardboyyyyyy',b'',b'pecinta gratisan',b'1',b'3',b'0',b'4',b'11',b'False',b'False',b'True',b'False',b'2019-05-02 02:12:19'
b'@tk97275 @Dalia4Congress @davereaboi Seriously - READ WHAT HER TWEET IS QUITE OBVIOUSLY ADDRESSING... she is highli\\u2026 https://t.co/ogvlQ7mx6g',b'1232127544419205121',b'Cranium',b'CraniumSpeaks',b'',b'Progressive Liberal American who\\u2019s not afraid of Keynesian Democratic Socialist Capitalism... basically what the rest of the industrialized world has. Be kind.',b'174',b'1396',b'0',b'1303',b'115',b'False',b'False',b'True',b'False',b'2020-01-21 23:34:55'
b'@narendramodi @ShahnawazBJP @POTUS @realDonaldTrump @FLOTUS @MELANIATRUMP People supporting the new citizenship law\\u2026 https://t.co/KEW2aWPioh',b'1232127531941273600',b'Wasif Iqbal',b'Wasifiqbalbutt',"b'Glasgow, Scotland'",b'Music News History UK Top 40 Football Football',b'40',b'351',b'0',b'906',b'1200',b'False',b'False',b'True',b'False',b'2016-12-29 06:17:55'
"b'@anuragkashyap72 Ye kaun hai, anti muslim ya anti India ? Jahil insaan, ye sb yaad rkha jaa rha h, itihaas likha ja\\u2026 https://t.co/jMBqQx2OVA'",b'1232127520310464512',b'DEVASHISH PANDEY\\U0001f1ee\\U0001f1f3',b'DevashishUP78',"b'\\u0915\\u093e\\u0928\\u092a\\u0941\\u0930, \\u092d\\u093e\\u0930\\u0924'","b""I still don't understand twitter, but here I am \\U0001f928""",b'26',b'20',b'0',b'1755',b'7065',b'False',b'False',b'True',b'False',b'2012-10-16 05:18:00'
b'They claim that they believe in Constitution and yet they called thier area as Muslim area.\\nWhat a hypocrite person\\u2026 https://t.co/QGAo9pdGvm',b'1232127508495175681',b'ANKIT JAIN #ReclaimGirnarJi',b'akj224',b'',b'proud jain.\\ndeeply involved in #SaveShikharJi movement.\\nand love to collect knowledge about Jainism online/offline.',b'247',b'951',b'0',b'10353',b'3131',b'False',b'False',b'False',b'False',b'2010-07-30 15:45:42'
b'@HuntCongressAz @BiggsDCat @LauraDiebra @wdunlap @tedcruz Hindus hate muslims and love Trump. Hindus have lived wit\\u2026 https://t.co/dZyg1oQlsy',b'1232127507123654662',b'Jaysock',b'Jaysock2',b'South Texas',b'Not looking for a date!',b'2353',b'2953',b'0',b'42854',b'39803',b'False',b'False',b'True',b'False',b'2018-12-14 05:06:04'
"b""It's so India can protect themselves from muslim invaders. https://t.co/bN8y08mqsC""",b'1232127490535153664',b'Karl Asbj\\xf8rn',b'Chuck85096594',"b'North Eagle Butte, SD'",b'Asatru. Reader of the Great Sagas! Pro 2nd Amendment. Veteran.',b'90',b'141',b'1',b'2631',b'8285',b'False',b'False',b'True',b'False',b'2018-04-06 20:39:14'
"b""No, you moron.\\n\\nHe saying that you don't identify as American and THAT'S what's triggering.\\n\\nAlso, I don't know why\\u2026 https://t.co/NsJTHGx3Pv""",b'1232127489402712065',b'Joe Dolio',b'DolioJ',"b'Michigan, USA'",b'NRA Instructor/Tang Soo Do KyoSaNim/Krav Maga Instructor. Certified Fraud Examiner and Certified Forensic Interviewer.',b'4652',b'5100',b'5',b'63572',b'90905',b'False',b'False',b'False',b'False',b'2015-10-07 11:26:27'
b'irani boy fuck nayra muslim arab girl https://t.co/zS9NnHlmCA',b'1232127479994814464',b'Arsalan Akhtar',b'ArsalanAkhtar16',b'',b'',b'92',b'30',b'1',b'1651',b'334',b'False',b'True',b'True',b'False',b'2016-04-27 19:17:02'
b'@WinkWino @Polytikle They r born terrorist. Every single muslim is born with hatred agnst Hindus',b'1232127476652003331',b'patriot Indian',b'MeenuAg29681615',b'',b'',b'19',b'207',b'0',b'1891',b'1206',b'False',b'False',b'True',b'False',b'2019-05-23 05:22:52'
b'@Rangoli_A Muslim believe \\nthat if a country is not declared Islamic State and is not governed by the laws of \\nShar\\u2026 https://t.co/Yb3f2OjD6O',b'1232127476291129344',b'Ranjeet Singh',b'Ranjeet00066937',"b'Rajasthan, India'",b'Phantom',b'25',b'580',b'0',b'2673',b'12656',b'False',b'False',b'True',b'False',b'2019-02-12 12:38:53'
b'@DelhiPolice tera sa ghatiya police wala kabhi ni dekha dil kar raha hai tum police walo ko kat da ... jo tum logo\\u2026 https://t.co/JFylnDHGwS',b'1232127457253261312',b'Lovepreet',b'Lovepreet05S',b'',b'Oneplus is the best device in the world i wish i have one oneplus latest device in my hand i just i can hope for this',b'11',b'57',b'0',b'671',b'746',b'False',b'False',b'True',b'False',b'2017-11-23 21:14:23'
b'@Imamofpeace Ha ha haa.The man who abandoned his wife will give justice to muslim women\\n\\nThe man who killed thousan\\u2026 https://t.co/RFmtrTZlQ6',b'1232127441889611776',b'El Kashmiri',b'AgentSm37204231',b'kashmir',"b'Pan-Islamist,the Anti-nationalist,Fundamentalist Muslim\\n\\n(Hasbun Allah W Nyamul Wakeel)\\n\\nin this messy world only khilafat is the solution'",b'39',b'1160',b'0',b'1146',b'63',b'False',b'False',b'True',b'False',b'2019-02-17 02:04:40'
b'Barangsiapa berwudhu dengan baik keluarlah dosa-dosanya dari jasadnya sampaipun dari bawah kuku-kukunya(HR. Muslim)',b'1232127402777595904',b'Al-Fikri',b'Al_Fikri2208',b'Jakarta',"b""Melayani : Hypnotherapy, Mentoring/Liqo, Bimbel Privat, Dakwah on the road, Wakaf Al-Qur'an. Hubungi : 089604465871 atau alfikri2208@gmail.com""",b'1131',b'168',b'6',b'91995',b'7',b'False',b'False',b'True',b'False',b'2014-08-22 06:23:29'
b'@wsbtv Muslim?',b'1232127394519093248',"b""De'Antre Jackson""",b'deantreeee23',"b'Georgia, USA'",b'Calling out people who think insults are valid arguments.',b'217',b'574',b'3',b'14016',b'32023',b'False',b'False',b'True',b'False',b'2014-09-03 00:53:51'
b'@ReallySwara ye kon sa atankwaad he us nasdi anuraag se jarure puch lana jise hindu atankwaad pata he muslim atankw\\u2026 https://t.co/gchlFimYOD',b'1232127380849717249',b'Neeraj Kumar',b'NeerajK41497296',b'',b'',b'2',b'11',b'0',b'169',b'41',b'False',b'False',b'True',b'False',b'2019-03-14 03:43:04'
b'Temukan Renata Dress Muslim Cantik seharga Rp Rp55000.00 hanya di Tokopedia!\\nhttps://t.co/0XRw5GwL5a https://t.co/0V54ra5rYW',b'1232127369743233024',b'Diary Keren',b'diaryikeren',b' Indonesia',b'',b'1012',b'1819',b'2',b'1480',b'137',b'False',b'False',b'True',b'False',b'2013-06-17 06:12:18'
"b""@saidevarakonda2 Yess he's a terrorist but he's not sharukh brother. \\nAnd also he's not a Muslim or hindu terrorist\\u2026 https://t.co/viH8YwQj1p""",b'1232127360792530944',b'Chaudhary Vasi',b'chaudharyVasi_',b'India',b'Medical Student \\U0001f468\\u200d\\u2695\\ufe0f',b'52',b'505',b'0',b'6708',b'4040',b'False',b'False',b'True',b'False',b'2019-09-28 06:50:09'
"b'Istrinya obamanya gak protes masuk istiqlal pake hijab padahal non muslim, situ muslim tapi tidak lebih menghargai\\u2026 https://t.co/og9k1SyweF'",b'1232127359769169921',b'Hardimas Hutama P',b'HardimasHP',b'surabaya',"b'Founder Handamade ""Kulit Kayu"" Aksesoris PritoriArt IG:@pritoriad & Pritori EO IG :@pritori.eo  \\u25aa Microwave & BTS Engineer\\u25aaPenulis Karbitan \\u25aaI\'m conservative'",b'366',b'365',b'0',b'7537',b'409',b'False',b'False',b'False',b'False',b'2009-06-05 19:00:26'
"b""@raszsai Coz a Muslim is news worthy when he is villan only. Thats the mentality indian people got. I guess that's\\u2026 https://t.co/F6zwFmFVxq""",b'1232127331961053185',b'Baig of Hunza',b'SajidullahBaig',b'Hunza',b'Advertising Manager @mountaincup1\\nTour Operator @tourdehunza \\nFrom Land of Mountains #Hunza\\nRock Climber: #EcoAdventureClub \\nhttps://t.co/lKTFqI89Nq',b'175',b'145',b'0',b'782',b'1062',b'False',b'False',b'False',b'False',b'2013-09-01 19:38:22'
b'Okechuku DINAR Baju Gamis Wanita Terb... https://t.co/Dzp6h87cRL',b'1232127329431801856',b'millyati erinah',b'mill_erinah',b'',"b'Jesus follower, Simple woman & Beach lover'",b'61',b'39',b'1',b'1403',b'0',b'False',b'False',b'True',b'False',b'2011-04-09 00:43:02'
b'@pinkucommander When partion was done on the bases of religion as jinna said muslim can no co exist with Hindus the\\u2026 https://t.co/0WvZpa7zXF',b'1232127312335921152',b'PRACHEE ADHIKARI',b'PRACHEEADHIKARI',"b'Hyderabad, India'",b'\\u090a\\u0901National President International Mission Of HumanRights Women Cell.Brand Ambassdor Ekal Vidhyalay Samiti https://t.co/zerE1yFRad And stand for all livingBei',b'526',b'78',b'0',b'2842',b'5206',b'False',b'False',b'True',b'False',b'2010-07-01 06:49:39'
b'@Payal_Rohatgi Hindu is not terrorist he is victim only  poor thing muslim being terrorist',b'1232127304660287488',b'Manish',b'Manish91111961',b'',b'',b'1',b'152',b'0',b'73',b'6',b'False',b'True',b'True',b'False',b'2018-02-18 08:40:16'
b'@tedcruz I was a muslim for 20 years and can not believe that any devout muslim can truly love America and American\\u2026 https://t.co/AGTSjznECZ',b'1232127298297618432',b'Arash Parsi',b'ParsiClassicLib',"b'Los Angeles, CA'","b'Iranian-American, physician, free market, proud capitalist, lover of \\U0001f1fa\\U0001f1f8\\U0001f5fd\\U0001f6941st and 2nd amendments'",b'9',b'11',b'1',b'157',b'2624',b'False',b'False',b'True',b'False',b'2019-01-05 16:59:28'
"b'\\u092f\\u0947 \\u0939\\u0948 \\u0915\\u091f\\u094d\\u091f\\u0930\\u092a\\u0902\\u0925\\u0940 \\u092e\\u0941\\u0938\\u094d\\u0932\\u093f\\u092e \\u0906\\u0924\\u0902\\u0915\\u0935\\u093e\\u0926\\u0940, \\u091c\\u093f\\u0938\\u0928\\u0947 \\u092a\\u0941\\u0932\\u093f\\u0938 \\u0915\\u094b \\u0917\\u094b\\u0932\\u0940 \\u092e\\u093e\\u0930\\u0915\\u0930 \\u0939\\u0924\\u094d\\u092f\\u093e \\u0915\\u0930 \\u0926\\u0940\\u0964\\n#Islamic_terrorism \\n#IslamicTerror\\u2026 https://t.co/cwk7bsUyqB'",b'1232127297932660738',b'Gabbar Is Back',b'SunnyDeolDeol',b'',"b'\\u091c\\u092f \\u0939\\u093f\\u0928\\u094d\\u0926, \\u0935\\u0902\\u0926\\u0947 \\u092e\\u093e\\u0924\\u0930\\u092e,\\n\\u091c\\u092f \\u0936\\u094d\\u0930\\u0940 \\u0930\\u093e\\u092e, \\u0939\\u0930 \\u0939\\u0930 \\u092e\\u0939\\u093e\\u0926\\u0947\\u0935\\n\\nfollow back \\u092a\\u093e\\u0928\\u0947 \\u0915\\u0947 \\u0932\\u093f\\u090f follow \\u0928\\u093e \\u0915\\u0930\\u0947\\u0902'",b'94',b'85',b'0',b'3830',b'4407',b'False',b'False',b'True',b'False',b'2016-11-03 06:14:36'
b'@Aabhas24 @anuragkashyap72 CAA has everything to do with every Muslim in the world\\nCAA is necessitated because of I\\u2026 https://t.co/eDNOV6kIcw',b'1232127295512555526',b'Khwang Xie Ming',b'Mengalingam',b'',b'',b'99',b'96',b'2',b'12504',b'3183',b'False',b'False',b'True',b'False',b'2014-10-20 15:20:37'
"b""Muslim Brotherhood\\nList of 'in the news now [names]' w/ known ties to Islam? \\nTHIS IS NOT ANOTHER 4-YEAR ELECTION.\\u2026 https://t.co/JZqL07rbS1""",b'1232127294984073216',b'G American Girl',b'gretchenbarton',b'USA',"b""I'm a American girl  -   4 Awesome Children 7 Grandbabies My Afghan Hounds, Oceans, Sunshine. #GoodLife""",b'4245',b'4769',b'10',b'148148',b'116842',b'False',b'False',b'False',b'False',b'2009-09-29 14:48:36'
"b'Terima kasih atas kedatangannya, Bapak Sekjen Liga Dunia Muslim di UIN Malang, \\nBerkat kedatangan bapak, kelas di g\\u2026 https://t.co/txyu0ITa3F'",b'1232127293033574400',b'Rahmat Zaki',b'OneParcFive',b'',b'There is always something....\\n______________________________\\n______________________________\\n\\n*Beranda Penuangan Kata-Kata*',b'41',b'1115',b'0',b'85',b'451',b'False',b'False',b'False',b'False',b'2018-11-20 13:00:19'
b'Your a Muslim and your voting for a Jew.\\nShut the fuck up https://t.co/4Hs6MinTX8',b'1232127288675794944',b'AncapGroyper',b'AncapGroyper7',b'Nice try Fed',b'Jesus is King',b'57',b'120',b'0',b'83',b'131',b'False',b'False',b'True',b'False',b'2020-01-04 06:52:41'
b'@frustrated_pj @Afreena021 @Imamofpeace Oh? you really think so? Why can\\u2019t a Muslim have such a thought? well looks\\u2026 https://t.co/I08ijsJ8Ks',b'1232127283718238213',b'\\u043c\\u03b1\\u044f\\u03b9\\u043d\\u03b1 \\u044f\\u03c3z\\u0454\\u03b7',b'mariharoz',b'Planet Earth ',"b'Coffeeholic\\u2615\\ufe0f | All about fun until it\\u2019s a matter of politics, joke. | Positive soul | Meme lover | 21 \\u264b\\ufe0f'",b'26',b'109',b'0',b'776',b'398',b'False',b'False',b'False',b'False',b'2013-04-22 23:40:20'
"b""@MohitGa75043418 @RaveenKr Yemen is a Muslim country and he isn't a minority.\\nAnd India is not extraordinary rich t\\u2026 https://t.co/ETMdxrIGJY""",b'1232127272389242880',b'Alter Ego',b'protimdas',b'\\u092d\\u093e\\u0930\\u0924',b'Indian | Nationalist | Athiest | #TravDrag |',b'71',b'81',b'0',b'4331',b'7467',b'False',b'False',b'True',b'False',b'2010-02-21 09:33:00'
"b'In which Scott implies that it you are Muslim, wear a hijab or are black then you are not an American.\\n\\nScott is a\\u2026 https://t.co/e0QqdDyc1o'",b'1232127254957830145',b'\\u05dc\\u05d5\\u05b9\\u05d7\\u05b0\\u05de\\u05b8\\u05e0\\u05b4\\u05d9',b'alders_ledge',b'',b'If you are here because (((David Lange))) sent you: Fuck Off.',b'1646',b'284',b'128',b'109207',b'21547',b'False',b'False',b'False',b'False',b'2010-04-26 18:07:19'
"b""@Daniel_Samee_ @krish2637068 @ANI Why are you trying to club dalit community in this? Aren't they hindus too? And i\\u2026 https://t.co/VrhaxyKMFU""",b'1232127240466382853',b'Crackati',b'Crackati',b'Gurugram ',"b'If you think about it, a sketchy Italian neighborhood should be called spaghetto'",b'62',b'155',b'2',b'3532',b'2362',b'False',b'False',b'False',b'False',b'2013-09-26 12:54:51'
b'#DelhiBurning\\n#DelhiPolice\\n#DelhiCAAClashes\\n#Islamic_terrorism\\nA statement coming from a sensible Muslim for Muslim\\u2026 https://t.co/oljJBdMM6N',b'1232127237639622656',b'Mohita',b'itsmohitahere',"b'Malwa, Punjab, India'","b""An Engineer | An Atheist |\\nInterests: Politics, Technology, Literature, Environment and SARCASM| I am Brown and I don't find it racist. My DM is broken.\\U0001f937""",b'309',b'488',b'0',b'2516',b'1807',b'False',b'False',b'False',b'False',b'2015-08-04 04:50:52'
b'@realDonaldTrump Oh no the president is a Muslim!',b'1232127229250998272',b'AMERICAN DUMPSTER FIRE (podcast)',b'fire_american',b'U.S.A.',"b'3 friends discus politics, civil and social issues while trying to figure out how to fix the world\\nhttps://t.co/d4c7p7BaSf'",b'10009',b'10331',b'6',b'21061',b'16784',b'False',b'False',b'True',b'False',b'2018-05-29 02:13:59'
b'@MustafaBatnain You have the right to defend yourself.....with force and weapons......as a Muslim....',b'1232127213669097472',b'Palwasha Wardak',b'WardakPalwasha',"b'London, England'",b'Rose',b'26',b'23',b'0',b'120',b'18',b'False',b'False',b'True',b'False',b'2019-10-14 00:57:45'
b'@VickyKedia @DelhiPolice Only one reason \\nHe is not muslim',b'1232127213480243201',b'Muhammad Aarif',b'Mohamme07426945',"b'Jodhpur, India'",b'\\U0001f54b',b'105',b'137',b'0',b'8802',b'4430',b'False',b'False',b'False',b'False',b'2017-07-01 07:05:03'
b'@TippingOddsLV @jaketapper Whereas your totally rational conclusion here is that Modi must NOT be bad at all; CNN j\\u2026 https://t.co/OvAhox9iVv',b'1232127204965801984',b'Sean Wissing',b'seantothenext1',"b'Denver, CO'",b'Beer and cheese drinker & GERD survivor. I live in Denver. I am from Denver.',b'70',b'160',b'0',b'138',b'806',b'False',b'False',b'True',b'False',b'2016-08-01 00:16:54'
b'Only moron Muslim @JustinTrudeau would be that stupid! https://t.co/HguzG3W69l',b'1232127201392373761',b'22Northrd',b'2Northrd',b'',b'Liberalism is a society in decay. . .\\nNo Democrats Commies Socialists Liberals and Globalists. MAGA KAG\\nMoulin Rouge 8th life',b'3799',b'3996',b'2',b'6131',b'4026',b'False',b'False',b'True',b'False',b'2019-11-03 14:38:35'
b'@asadowaisi Tom Koch bi nhi krskty just playing with Muslim of India u r hide enemy',b'1232127199819550722',b'\\U0001f1f5\\U0001f1f0Naik Zada\\U0001f1f5\\U0001f1f0\\u0646\\u06cc\\u06a9 \\u0632\\u0627\\u062f\\u06c1',b'NaikZada17',b'\\u0645\\u0644\\u0627\\u06a9\\u0646\\u0688 \\u067e\\u0644\\u0678',b'\\u200f\\u200f\\u200f\\u200f\\U0001f4a5\\U0001f525\\U0001f4a5\\u0627\\u06af\\u0631 \\u0641\\u0627\\u0644\\u0648 \\u0646\\u06c1\\u06cc \\u06a9\\u0631 \\u0633\\u06a9\\u062a\\u06d2 \\u06c1\\u0648 \\u062a\\u0648 \\u0679\\u0648\\u0678\\u06cc\\u0679 \\u062a\\u0648 \\u0644\\u0627\\u06cc\\u06a9 \\u06a9\\u0631\\u0648\\u06d4\\u06a9\\u0646\\u062c\\u0648\\u0633\\u06cc \\u0627\\u0686\\u06be\\u06cc \\u0686\\u06cc\\u0632 \\u0646\\u06c1\\u06cc \\u06c1\\u06d2\\U0001f31f\\U0001f31f',b'94',b'234',b'1',b'4614',b'10060',b'False',b'False',b'True',b'False',b'2015-09-20 18:29:00'
