"b""@sandymridul Absolutely there's nothing like Pro CAA at best one can term it as anti anti CAA.""",b'1232110412402790402',b'India First',b'sharimohan121',"b'New Delhi, India'","b""RT doesn't mean endorsement of views""",b'425',b'2446',b'3',b'42419',b'37712',b'False',b'False',b'False',b'False',b'2010-02-14 12:05:30'
b'@SreenivasanJain Hello terorrist lover . I said only when their protest was pelted with stone . Was shaeen bauh pro\\u2026 https://t.co/drfKUfrVSS',b'1232110271705047041',b'Amit Prasad',b'AmitChowkidar',b'Aao kabhi haveli par ..',b'Hate hypocrites and liar',b'243',b'80',b'0',b'28231',b'35129',b'False',b'False',b'True',b'False',b'2013-04-15 01:54:42'
b'WHAT. THE. FUCK. IS A PRO CAA PROTEST????  \\nThese idiotic sanghis don\\u2019t understand that it\\u2019s already an act?? What\\u2026 https://t.co/hqShslfjPd',b'1232109840375406593',b'dhoklahomie',b'dumplinghoee',"b'Boston, MA'",b'fobby af | Jmdlr',b'3077',b'409',b'9',b'31979',b'76160',b'False',b'False',b'False',b'False',b'2010-06-29 05:49:18'
"b""@kapskom Playing with words. The anti CAA protest isn't a protest. It's a riot. The pro CAA rioters are also that.\\u2026 https://t.co/p9xLzpgvVP""",b'1232109804308463617',b'The_Albatross',b'TheAlbatross15',b'',"b""history, strategy, defence, aerospace, maritime, yeah I'm 'The Albatross' for a reason!""",b'241',b'169',b'1',b'10640',b'11659',b'False',b'False',b'True',b'False',b'2019-04-26 15:40:55'
b'@anuragkashyap72 Anti caa is pro hindus is that what you are trying to say son of the bitch',b'1232109781793550341',b'\\u092c\\u093e\\u092c\\u093e\\u0913 \\u0915\\u093e  \\u092c\\u093e\\u092c\\u093e',b'TheUpadhyaya',b'India',b'',b'1026',b'746',b'30',b'66568',b'26397',b'False',b'False',b'True',b'False',b'2013-08-25 10:01:07'
"b'@vaishnavi_mish @jyotitiwari05 U r sure , he is anti caa or pro caa protestor? \\n\\nThE handle which circulates this i\\u2026 https://t.co/3KIX8O1gjE'",b'1232109661316190213',b'Amit Beniwal B+',b'meetbeniwal',"b'Karnal (Haryana),N.Delhi'",b'#Atalbiharivajpayee #DigitalHry @CtwaOfficial #BJP U-turn in Haryana https://t.co/dmGIlp5Vpf\\u2026',b'824',b'2266',b'6',b'44224',b'9944',b'False',b'False',b'False',b'False',b'2009-07-22 17:16:00'
b'This was not a clash between Pro and Anti CAA. It was only Anti-CAA jihadis who were showing their muscles. This is\\u2026 https://t.co/8ssKysTJOu',b'1232109578289942530',b'Mahendra \\U0001f1ee\\U0001f1f3',b'MhndrP',b'',"b'Too much noise, too little substance on Twitter lately.'",b'1018',b'614',b'81',b'144029',b'291',b'False',b'False',b'True',b'False',b'2009-12-11 15:35:42'
b'@jigneshmevani80 @ReallySwara ye Shahrukh kabse RSS ya pro CAA Sanghi ho gaya bhai? Stop this Chutzpa of first inst\\u2026 https://t.co/TeB7z8Hk5r',b'1232109381573136384',b'Asim Kulshrestha',b'asimk5',"b'New Delhi, Delhi'","b'Chora ganga kinaare waala with a passion for food,music and travel...'",b'78',b'139',b'2',b'8436',b'2356',b'False',b'False',b'True',b'False',b'2011-02-15 12:36:42'
"b'@MirchiSayema One more Pro CAA for blinds ,the so called peace full Grand mother with stone in hand pose ,just for\\u2026 https://t.co/xSVWQhldim'",b'1232109158029238272',b'Annapurna ...',b'ManyaPande',b'',"b""TRUTH PREVAILS /\\u090f\\u0915\\u0932\\u093e \\u091a\\u0932\\u094b \\u0930\\u0947 //Don't expect Follow backs   \\U0001f64f\\U0001f64f INDIA FIRST\\U0001f1ee\\U0001f1f3\\U0001f1ee\\U0001f1f3\\U0001f1ee\\U0001f1f3""",b'26858',b'4877',b'126',b'166832',b'124812',b'False',b'False',b'True',b'False',b'2013-08-23 12:56:49'
"b'@anuragkashyap72 Strange logic. You meant that while anti CAA has right to protest, pro CAA has no right to show th\\u2026 https://t.co/7xfuH5MM2r'",b'1232108748585357312',"b'\\u0627\\u062c\\u06d2 \\u06a9\\u0645\\u0627\\u0631 \\u200fAjay kumar , Army Veteran'",b'67AjayK',b'India',"b'blocked by MSDE.                   The best lack all conviction, while the worst are full of passionate intensity. Yeats.'",b'156',b'149',b'3',b'14821',b'2863',b'False',b'False',b'False',b'False',b'2015-02-18 01:30:20'
b'@pbhushan1 @DelhiPolice Rioters and pro CAA activists are paid by the same agencies.',b'1232108738615615494',b'Ramesh Babu',b'RameshB66838693',b'',"b'Social worker, working among tribal people. Worked in Nagaland, Assam and Arunachal Pradesh. A native of Kannur district of Kerala. A proud Hindu.'",b'34',b'139',b'0',b'3158',b'42',b'False',b'False',b'True',b'False',b'2013-10-17 13:48:26'
b'@hafeezkv @AJEnglish The firing goon has been identified as Shahrukh. He is not a pro CAA protestor.',b'1232108686484492288',b'Michael Fernandes \\U0001f1ee\\U0001f1f3',b'MiFe007',b'',"b'Hate religious hate-mongers, pseudoseculars, leftists, fundamentalists. A proud Indian.'",b'42',b'63',b'1',b'4446',b'1724',b'False',b'False',b'True',b'False',b'2017-01-03 08:58:05'
"b'@VishalDadlani @VikramMotwane Yes, you right. The pro CAA groups forced the anti CAA protesters to stone head const\\u2026 https://t.co/xr2vio3VG3'",b'1232108623909638144',b'Samar Verma',b'SamarVe84429586',b'',"b""I don't endorse how you interpret my tweets. Not here for followers nor to win any popularity contests. Expect sarcasm and lots of criticism. And its personal.""",b'1',b'123',b'0',b'109',b'175',b'False',b'False',b'True',b'False',b'2020-02-10 10:11:52'
"b""@swati_gs I don't see any difference in approach of Pakistan and its agencies when they spread morphed videos of at\\u2026 https://t.co/W5w4xDnUZT""",b'1232107945623556096',b'Ashish Gupta',b'GuptaAsh',b'India',"b""There's No Moderate M! their exclusivist religion does not allow atheism nor acceptance of another religion. Its either an Ex-M or practicing M. There i said it""",b'261',b'76',b'10',b'76622',b'443',b'False',b'False',b'True',b'False',b'2009-05-20 13:42:32'
b'#ICYMI: Three civilians and a #DelhiPolice head constable were killed and a deputy commissioner of police was among\\u2026 https://t.co/0Oz4nJ6LtP',b'1232107945430700032',b'Firstpost',b'firstpost',"b'Mumbai, India'","b'Incisive opinions, in-depth analysis and views that matter. Read the last word in news on https://t.co/yXH6L1LeiM.'",b'2043024',b'996',b'4028',b'580525',b'365',b'True',b'False',b'False',b'False',b'2011-02-23 13:09:22'
"b'Police Constable, Three Civilians Killed in Clashes during Violent CAA Protests in Northeast Delhi https://t.co/0yS71HabRe'",b'1232107851729993729',b'Ravi Moore',b'ravi_moore',b'Pune ',b'Cartoonist and Writer',b'6',b'6',b'0',b'874',b'379',b'False',b'False',b'True',b'False',b'2020-01-12 00:49:33'
b'@paragp @shammybaweja Anti CAA protests have been going on for a long time. There is no violence.\\nViolence only occ\\u2026 https://t.co/fiVKT8PAWc',b'1232107775389421568',b'Dr.Thameemul Ansari Nizami',b't3OonHPt5UXpbGW',b'\\u0b9a\\u0bc6\\u0ba9\\u0bcd\\u0ba9\\u0bc8 ',"b'organising secretary, samajwadi party \\n\\u0906\\u092f\\u094b\\u091c\\u0928 \\u0938\\u091a\\u093f\\u0935&\\u092a\\u094d\\u0930\\u0935\\u0915\\u094d\\u0924\\u093e\\n\\u0924\\u092e\\u093f\\u0932\\u0928\\u093e\\u0921\\u0941 \\u0938\\u092e\\u093e\\u091c\\u0935\\u093e\\u0926\\u0940 \\u092a\\u093e\\u0930\\u094d\\u091f\\u0940\\nspokesperson \\ndr.kalam foundation \\nwritter,,Film Director,political analyst'",b'131',b'473',b'0',b'995',b'5581',b'False',b'False',b'True',b'False',b'2019-08-01 15:28:10'
b'Ironically now people will go for a sit in PROTEST against government inaction to maintain law and order when viole\\u2026 https://t.co/2C8OtwBQI2',b'1232107513790623745',b'Rafale~ STARK!',b'staribo',b'HEART',b'FIGHT even when you are ONE!',b'788',b'967',b'0',b'3379',b'3475',b'False',b'False',b'True',b'False',b'2010-07-05 15:01:31'
b'@_YogendraYadav @POTUS No appeal to the pro CAA state sponsored goons who are actually rioting? Or the Delhi Police\\u2026 https://t.co/Qf0vxaW1sX',b'1232107275960999937',b'Sangita',b'Sanginamby',b'',b'Writer. And part time Goddess.',b'7104',b'197',b'64',b'39732',b'32351',b'False',b'False',b'False',b'False',b'2010-03-17 12:06:56'
b'@RanaAyyub @realDonaldTrump I think the Pro CAA are also your plants pretending to be pro and inciting violence. \\nW\\u2026 https://t.co/XqxLvFwoVJ',b'1232106958930554880',b'Blisteringbarnacles',b'Blizbarnacles',"b'Mumbai, India'","b'I believe in Non Violence, Gender Equality and Congress-mukt Bharat! Jai Hind!'",b'35',b'545',b'1',b'671',b'1760',b'False',b'False',b'True',b'False',b'2017-03-29 16:19:35'
"b'#SOS Chandbagh: Contin\\xfaa la incrustaci\\xf3n de piedra continua, coches y propiedades p\\xfablicas incendiadas por Pro CAA,\\u2026 https://t.co/p6PUJIxvxD'",b'1232106877409992711',b'\\xa9 2017\\xaeLa sal de la tierra',b'Juanvanguardia',b'Los 916.445 km\\xb2 de Venezuela ',b'\\u201cRevoluci\\xf3n es sentido del momento hist\\xf3rico; es cambiar todo lo que debe ser cambiado\\u2026; es emanciparnos por nosotros mismos y con nuestros propios esfuerzos\\u2026',b'903',b'1435',b'6',b'17121',b'519',b'False',b'False',b'False',b'False',b'2011-07-19 17:04:24'
"b'Pardon my french and my ignorance - wtf is a ""pro CAA protest""? The bill has been passed. What is the protest against?'",b'1232106826994348032',b'Neelakshi Tewari',b'nixtewari',"b'Tempe, AZ'","b'Work in progress | PhD student @asueducation | Indian higher ed, internationalization, methodologies | Systems junkie | Dilliwali'",b'638',b'479',b'22',b'22317',b'5752',b'False',b'False',b'False',b'False',b'2009-07-02 12:46:51'
"b""This very much remind us of Gujarat riot 2002. Don't know whether we will ever become a country once we dreamt of,\\u2026 https://t.co/X3Zt1Qns0b""",b'1232106272851419136',b'Pasupathi',b'impasu',b'',b'Movies\\U0001f3a5 Books\\U0001f4da Android\\U0001f4f1 P.S: Tweets are just my personal view. No offence \\U0001f60e',b'352',b'473',b'12',b'8528',b'4219',b'False',b'False',b'False',b'False',b'2010-11-03 09:37:43'
b'@globalhlthtwit There is no pro CAA - only anti-Muslim',b'1232106192656195584',b'Devanshi Chanchani',b'DChanchani',b'London/India',"b'Global Challenges Research Fellow, Brunel University'",b'100',b'639',b'0',b'298',b'2532',b'False',b'False',b'False',b'False',b'2015-02-02 23:55:47'
b'exactly....this is not pro caa....this is anti national..... anti constitution...anti humanity and Delhi burns beca\\u2026 https://t.co/H4bkxSsKav',b'1232105486306041856',b'Gandalf The Grey',b'istariElf',b'Middle Earth',b'Right Wing Nationalist  | You shall not pass..',b'1',b'166',b'0',b'65',b'51',b'False',b'False',b'True',b'False',b'2020-02-11 08:04:49'
"b""There is no pro CAA or Anti CAA. This is pure fasicsm. This is not Gandhi's India. This is Godse's India. Shame on\\u2026 https://t.co/OekXtOTiMO""",b'1232105294156660736',b'Samjad',b'samsha22',b'',"b'Sports lover, Anti Fascist.\\n*AC Milan, Steelers, Penguins, Pirates, Lakers*'",b'77',b'98',b'0',b'1716',b'5857',b'False',b'False',b'True',b'False',b'2009-09-12 00:19:56'
b'that pic is horrifying...but your kind of journalism is horrible too. You are legitimizing mis-guided protest. You\\u2026 https://t.co/eY1QKkHg8G',b'1232105230562553857',b'Bikash Agarwal',b'BikeeAgarwal',b'',b'',b'9',b'102',b'0',b'225',b'961',b'False',b'False',b'True',b'False',b'2017-05-07 06:11:55'
b'@MSNBC @MaddowBlog According to a news reporter miss @VijaytaL \\nThings are extremely tense in Maujpur-Jaffrabad.\\u2026 https://t.co/GeJBzLrYB3',b'1232104777623969794',b'kunnu',b'k60959787',b'',b'pastry chef \\nAmerican cuisine',b'20',b'146',b'0',b'1600',b'520',b'False',b'False',b'True',b'False',b'2020-01-12 21:45:02'
b'#DelhiBurning\\n\\u0906\\u092a \\u0915\\u0930\\u094b\\u0928\\u0949\\u0932\\u091c\\u0940 \\u0938\\u092e\\u091d\\u093f\\u090f\\n\\u0967) \\u0909\\u0928\\u094d\\u0939\\u094b\\u0902\\u0928\\u0947 \\u092a\\u0939\\u0932\\u0947 \\u091c\\u0932\\u093e\\u092f\\u093e \\u092e\\u0930\\u093e \\u0915\\u093e\\u091f\\u093e\\n\\u0968) \\u091c\\u092c #\\u0939\\u093f\\u0902\\u0926\\u0941\\u0913\\u0902 \\u0915\\u0940 \\u092c\\u093e\\u0930\\u0940 \\u0906\\u0908 \\u0924\\u094b \\u092c\\u0941\\u0926\\u094d\\u0927\\u093f\\u091c\\u0940\\u0935\\u0940 \\u092a\\u0924\\u094d\\u0930\\u0915\\u093e\\u0930\\u094b\\u0902\\u2026 https://t.co/I9qE6Gr3as',b'1232104473977290763',b'sanket',b'sanketraj',b'Canada',"b'\\u0a9c\\u0aaf \\u0ab6\\u0acd\\u0ab0\\u0ac0 \\u0ab0\\u0abe\\u0aae ..... \\n\\n\\n\\u092e\\u094b\\u091f\\u093e\\u092d\\u093e\\u0908 \\u0915\\u0947 \\u0930\\u093e\\u091c\\u094d\\u092f \\u0938\\u0947 \\u0939\\u0942\\u0902\\u0964 \\u0917\\u0930\\u094d\\u0935 \\u0938\\u0947 \\u0915\\u0939\\u0924\\u0947 \\u0939\\u0948 \\u0939\\u092e \\u0964\\n,\\U0001f64f\\U0001f64f\\U0001f64f\\U0001f64f'",b'250',b'1132',b'0',b'12197',b'39892',b'False',b'False',b'False',b'False',b'2009-03-12 21:26:49'
b'Off course There is nothing called Pro CAA . They are just Anti Muslims BJP AND State sponsored Goons !! https://t.co/hH5VNqsAAF',b'1232104055507431426',b'arshi khan',b'arshiazizkhan',"b'Uttar Pradesh, India'","b'ophthalmic surgeon,YouTuber,studied from J.N.MEDICAL COLLEGE AMU,writer,social worker,political ideal Gandhi,Dr Lohia. https://t.co/l087Kiijg9'",b'14517',b'1026',b'24',b'7848',b'7585',b'False',b'False',b'True',b'False',b'2016-05-15 14:00:57'
b'My question to my friends both in #IndianModia &amp; #IndianMedia has been for last 1 month as how and why should one p\\u2026 https://t.co/lpp1R5c9X3',b'1232104050574778369',b'EC Editor \\u0628\\u0631\\u06c1\\u0627\\u0646 \\u0627\\u0644\\u062f\\u06cc\\u0646',b'MBQasmi',"b'Mumbai, India'","b""MB Qasmi is Editor, Eastern Crescent - Alternative Media: Peoples' Choice:\\n\\n'Be a human not man or woman,\\nBe like earth in every one's heart'\\n-- my own.""",b'1396',b'433',b'11',b'13699',b'6841',b'False',b'False',b'False',b'False',b'2008-09-30 16:42:11'
"b'Btw, regarding pic that you shared, if ppl from one protest group shoots and pelt stones, what do you expect the ot\\u2026 https://t.co/8yJkd29TKf'",b'1232103927341932545',b'Bikash Agarwal',b'BikeeAgarwal',b'',b'',b'9',b'102',b'0',b'225',b'961',b'False',b'False',b'True',b'False',b'2017-05-07 06:11:55'
"b'ongoing for over 2 months,   but there is violence ONLY when the pro CAA group comes in..why? Think..my India.THINK\\u2026 https://t.co/T5KNFv6JjO'",b'1232103910418124802',b'Hamid Sultan',b'rhamidsultan',b'',b'',b'85',b'681',b'4',b'15268',b'16015',b'False',b'False',b'False',b'False',b'2009-10-06 17:59:26'
b'@anuragkashyap72 I am also from Hansraj!!!\\u2019 But I am ashamed of Anurag Kashyap who is trying for cheap popularity b\\u2026 https://t.co/HreOhFaTHt',b'1232103450176970752',b'VIJOY KUMAR SINHA',b'kumarvijoy',b'DELHI',"b'Director,at VIJANI EXIM PVT LTD.alumnus of SAINIK SCHOOL TILAIYA,HANSRAJ COLLEGE,INDIAN INSTITUTE OF PACKAGING,NMIMS,IIFT &IIMM.'",b'143',b'172',b'1',b'660',b'249',b'False',b'False',b'True',b'False',b'2012-03-27 12:32:36'
b'@RramachandranR No need for Pro CAA meetings. Only police action required.',b'1232103429268525058',b'\\u0c15\\u0c2e\\u0c32\\u0c4d \\u0caa\\u0ccd\\u0cb0\\u0cc7\\u0cae\\u0cbf',b'KamalPremi2',"b'Chicagoland, USA'","b'\\u092f\\u0924\\u094b \\u0927\\u0930\\u094d\\u092e\\u0938\\u094d\\u0924\\u0924\\u094b \\u091c\\u092f\\u0903 Where there is a #Dharma, there is Victory'",b'1648',b'913',b'19',b'41570',b'92347',b'False',b'False',b'False',b'False',b'2013-04-09 13:14:22'
"b""Fresh clashes between Pro and anti-CAA-NRC-NPR in Delhi's Maujpur https://t.co/pT7s8oOo5c""",b'1232102946835439616',b'ummid.com',b'ummid',b'Malegaon',b'Not a usual website offering the news pertaining to Indian Muslims. https://t.co/RftroSJiD9 is a platform to discover Indian Muslims in totally a new form.',b'1841',b'280',b'48',b'52845',b'1',b'False',b'False',b'False',b'False',b'2009-06-04 05:21:13'
b'Kaunsa byan amantullah de rha tha....anit CAA protest ho rha hai kuchh nhi hua jaise hi pro CAA wale pahuchte h dan\\u2026 https://t.co/f7iiqRP7SL',b'1232102815675191296',b'Mohd. Faraz Ansari',b'FarazAns786',"b'Bhiwadi, India'",b'Proud to be an Indian Muslim\\U0001f1ee\\U0001f1f3\\U0001f1ee\\U0001f1f3\\n\\U0001f4af% follow back\\nNot andhbhakt\\U0001f60e',b'68',b'323',b'0',b'3340',b'6526',b'False',b'False',b'True',b'False',b'2017-08-15 14:17:59'
b'@SanjayAzadSln @AmitShah Why would he stop this carnage since Pro CAA protests is his idea. His henchmen along with\\u2026 https://t.co/pBIBB5CGni',b'1232102335121199104',b'tsar D terrible',b'TsarTerrible',b'',b'Honest',b'3',b'30',b'0',b'243',b'616',b'False',b'True',b'True',b'False',b'2019-12-21 06:41:43'
b'@Kritika_Kamra So pro CAA guys are anti Hindu. \\U0001f44f\\U0001f44f\\U0001f44f',b'1232102078719438849',b'Vishwanath',b'vishwanathtk',b'Bharat',b'RTs do not imply endorsement.',b'179',b'620',b'18',b'70684',b'7414',b'False',b'True',b'True',b'False',b'2009-02-13 07:59:16'
b'@VijaytaL @ReallySwara Yeah you will only see the \\u201cPro CAA\\u201d.  Blind to see the other side. Stupid leftist.',b'1232101820706648064',b'\\u0938\\u0941\\u092d\\u093e\\u0937 \\u091a\\u0902\\u0926\\u094d\\u0930 \\u092c\\u094b\\u0938',b'SubhasChBose',"b'New Delhi, India'",b'\\U0001f1ee\\U0001f1f3',b'0',b'64',b'0',b'8',b'7',b'False',b'False',b'True',b'False',b'2020-02-25 00:24:59'
b'This man has been identified as an anti-CAA protester. The same people who were in a hurry to declare previous shoo\\u2026 https://t.co/kZAUSuPTnD',b'1232101772782497792',b'Akshita Nandagopal',b'Akshita_N',"b'New Delhi, India'","b'Anchor, India Today- all tweets/retweets personal'",b'2074',b'278',b'15',b'1291',b'3935',b'False',b'False',b'True',b'False',b'2015-09-10 11:58:19'
"b'@pankajjha_ You all promoted pro muslim anti caa media to be blamed ,president rule in delhi.Caa,,, never questione\\u2026 https://t.co/RVBKn2UhO3'",b'1232101711923175425',b'ajay misra',b'virjuna',b'england',"b'Iam retired and humble doctor of humanity, but now a couch potato'",b'62',b'96',b'5',b'10794',b'328',b'False',b'False',b'True',b'False',b'2010-05-10 23:41:31'
b'\\u0907\\u0938 \\u0924\\u0930\\u0939 \\u0935\\u093f\\u0930\\u094b\\u0927 \\u0926\\u092c\\u093e \\u0915\\u0930 \\u0915\\u093f\\u0938\\u0940 \\u0905\\u0938\\u0902\\u0935\\u0948\\u0927\\u093e\\u0928\\u093f\\u0915 \\u0915\\u093e\\u0928\\u0942\\u0928 \\u0915\\u094b \\u0932\\u093e\\u0917\\u0942 \\u0915\\u0930\\u094b\\u0917\\u0947 ? \\n\\n\\u0935\\u093f\\u0930\\u094b\\u0927 \\u0915\\u094b \\u0938\\u092e\\u091d\\u093e \\u092c\\u0941\\u091d\\u093e \\u0915\\u0930 \\u0938\\u092e\\u093e\\u092a\\u094d\\u0924 \\u0915\\u0930\\u0928\\u093e \\u0938\\u0930\\u0915\\u093e\\u0930 \\u0915\\u093e \\u0926\\u093e\\u092f\\u093f\\u0924\\u094d\\u0935 \\u0939\\u0948\\u2026 https://t.co/0LvI7FWTqU',b'1232101532142899200',b'Akhilendra  Raghav',b'AkhilendraRagh1',"b'Houston, TX'",b'General News Politics Health History World News',b'513',b'1183',b'0',b'6910',b'5662',b'False',b'False',b'True',b'False',b'2018-05-13 02:15:28'
b'@dograjournalist Dono hi dange karne waale hain. Kapil Mishra ko nahi dekha kya aapne bhai ? Wo anti CAA me tha ya Pro CAA me ?',b'1232101296418643969',b'Ajay Kumar Bhagat',b'AjayBhagatAB',b'jammu',b'Firstly And Lastly We are Indians. Jai Hind.',b'106',b'259',b'2',b'1421',b'1139',b'False',b'False',b'False',b'False',b'2012-03-19 11:34:39'
"b'Flag marches at northeast Delhi\\u2019s Maujpur after pro, anti-CAA groups clash https://t.co/9QzdISSZ0w'",b'1232100864053125120',b'Ola Coola',b'o422coola',b'',b'',b'2',b'11',b'0',b'909',b'0',b'False',b'True',b'True',b'False',b'2013-09-10 15:06:46'
"b""@SalvadoreTorre2 @Chinmay_2001 @iamjohnoliver See here's the thing: you made it very clear that you hate nationalis\\u2026 https://t.co/NqoigECe1C""",b'1232100638219210758',b'siddharth kashinath',b'sidgreatjoe',b'',b'Student',b'4',b'114',b'0',b'231',b'1121',b'False',b'False',b'True',b'False',b'2010-05-06 15:19:55'
"b'@TanushreePande Tanushree please be specific , the one who held you where pro or anti CAA \\u201c protestors \\u201c .'",b'1232100209032777728',b'Ashish Dhariwal',b'ashishdhariwal',b'',"b'Live as a champion , die as a legend 4give & 4get,Love one & all, Always be happy .secular in reality,hate pseudo seculars, fanatics,proud martinian, pro Dalit'",b'204',b'857',b'1',b'16827',b'22300',b'False',b'False',b'True',b'False',b'2009-11-22 04:49:06'
b'@aishe_ghosh Beta hawa mei na udo. The guy who was shooting is an anti CAA protestor and also a Muslim. Is that the\\u2026 https://t.co/Zb9PCSrRXH',b'1232100002857504768',b'thespadeoftruth',b'thespadeoftruth',b'',"b'\\u201cIt digs the truth out even if it may hurt you.\\u201d\\nFree-bird, Thinker, Philosopher, Rebel, Provocateur'",b'2',b'289',b'0',b'1818',b'51',b'False',b'False',b'True',b'False',b'2019-11-02 03:31:13'
"b'@vikasbhaABP Aapne interview bhi Karli. Say, you are blaming only one community while it could do peaceful protest\\u2026 https://t.co/42E9parfes'",b'1232099894187393024',b'Harkanwal Singh',b'Harkanwal911',b'Mohali',b'An Indian standing for democracy. India is not any political party but a concept of communal harmony.',b'99',b'330',b'1',b'6397',b'3150',b'False',b'False',b'False',b'False',b'2009-12-28 15:27:43'
b'@crazypooja78 @sakshijoshii @MirchiSayema Are you mentally unstable? Do you have so much hate for Muslims that you\\u2026 https://t.co/SOEQu16wD9',b'1232099004386861057',b'Sartaaj',b'sartaajsiddiqui',b'India',b'Its you and will always be.',b'70',b'69',b'0',b'1329',b'20',b'False',b'False',b'False',b'False',b'2011-02-06 12:58:14'
b'@Manesha76 I felt both pro &amp; Anti CAA protests are well paid ...they are members of same group..they only aim Anarc\\u2026 https://t.co/Wv30H6sY2V',b'1232098539217412096',b'Tirath Nagvekar',b'NagvekarTirath',"b'Corlim, Panaji'","b'Shayar,\\nSon of Goldsmith Artisan, \\nVande Mataram,\\nDesign/Develop/Mfg Electronics Scientific Instruments.\\nMade in India,\\nMember of CII Goa'",b'342',b'578',b'0',b'11728',b'6411',b'False',b'False',b'True',b'False',b'2017-02-27 16:08:43'
b'@TamilLovINDIA @varunvrai @AJEnglish @amnesty This  is the Maujpur Chowk where the pro CAA protest is taking place.\\u2026 https://t.co/aszOBFuh4J',b'1232098416760672256',b'kunnu',b'k60959787',b'',b'pastry chef \\nAmerican cuisine',b'20',b'146',b'0',b'1600',b'520',b'False',b'False',b'True',b'False',b'2020-01-12 21:45:02'
b'@anuragkashyap72 Teri ...tu bhosdike Pakistan tukde pe palne waala bhadwa ...\\nSaale ...hizade ki aulaad ..saala Roz\\u2026 https://t.co/3xsMO8XKwU',b'1232098035108339713',b'\\u0938\\u093f\\u0902\\u0927\\u0941',b'ImKrSindhu',b'',b'\\u0906\\u0924\\u094d\\u092e\\u093e \\u092d\\u093e\\u0930\\u0924 \\u092e\\u0947\\u0902 \\u092c\\u0938\\u0924\\u0940 \\u0939\\u0948\\u0964\\u0964 \\u0939\\u093f\\u0902\\u0926\\u0941 \\u0924\\u0928 \\u092e\\u0928 \\u0939\\u093f\\u0902\\u0926\\u0941 \\u091c\\u0940\\u0935\\u0928 \\u0930\\u0917 \\u0930\\u0917 \\u0939\\u093f\\u0902\\u0926\\u0941 \\u092e\\u0947\\u0930\\u093e \\u092a\\u0930\\u093f\\u091a\\u092f\\u0964\\u0964',b'77',b'273',b'0',b'15912',b'19353',b'False',b'False',b'True',b'False',b'2014-03-28 09:52:45'
b'International Association of Fire Fighters Local S-15 is ashamed to see CAA Executive Director Kevin Dillon continu\\u2026 https://t.co/Ks94KZByv7',b'1232097661899149312',b'IAFF Local S15',b'IaffS15',"b'Hartford, CT'","b'Fire Fighter labor union comprised of state employees protecting Bradley Airport, CT Air Guard base, UCONN, Southbury Training School, CT Fire Academy, and CCSU'",b'272',b'16',b'6',b'202',b'124',b'False',b'False',b'True',b'False',b'2018-08-12 17:47:48'
b'Pro-CAA rioters go on a rampage\\nhttps://t.co/8NG5a4O4h8',b'1232097627258253312',b'Hindustan Times',b'HindustanTimes',"b'New Delhi, India'","b""One of India's largest media companies. Latest news from around the world. Retweets are not endorsements.""",b'9235',b'65',b'61',b'97366',b'5',b'True',b'False',b'True',b'False',b'2018-11-26 08:30:58'
b'@wethepeopleof14 @Bihar2delhi @manakgupta @news24tvchannel Beta constable ki baat thi ya bhulne ki bimari hain.\\n\\nCo\\u2026 https://t.co/4Bw4FVTgDc',b'1232097058036813824',b'V_i_h_l_ T_a_i\\U0001f3d6\\ufe0f\\U0001f3d5\\ufe0f',b'Unnni_Kuttan',b'',b'Shuno.. Shuno.. Tumhara naam kya hain?',b'34',b'1',b'1',b'615',b'2568',b'False',b'False',b'True',b'False',b'2020-02-10 18:32:04'
b'@anuragkashyap72 \\u0938\\u0930 \\u0907\\u0938\\u0915\\u093e \\u0928\\u093e\\u092e \\u0936\\u093e\\u0939\\u0930\\u0941\\u0916\\u093c \\u0939\\u0948 \\u0905\\u092c \\u0906\\u092a \\u0907\\u0938 \\u0938\\u0947 \\u0939\\u093f \\u092a\\u0942\\u091b\\u0928\\u093e \\u0915\\u093f \\u092f\\u0947 anti CAA \\u0939\\u0948 \\u092f\\u093e pro \\u0935\\u093e\\u0932\\u093e \\u0964 \\u0935\\u0948\\u0938\\u0947 \\u0906\\u092e \\u0924\\u094c\\u0930 \\u092a\\u0947 \\u0907\\u0928\\u094d\\u0939\\u0947\\u0902\\u2026 https://t.co/xmEyDwfxuu',b'1232096386298122240',b'\\u092d\\u093e\\u0930\\u0924\\u0940\\u092f\\U0001f1ee\\U0001f1f3',b'mask_why',b'',b'World \\U0001f30e is beautiful....Do not ruin it be negativity. We all are Humans & Humanity is our priority. Love \\U0001f497 & Peace \\u270c\\U0001f3fb is My motto .',b'40',b'212',b'0',b'7576',b'8757',b'False',b'False',b'False',b'False',b'2009-12-22 23:39:08'
b'@Manikaiyer @BDUTT @Kritika_Kamra Barkhq\\nSorry your agenda misfired. Death of One men in Uniform is enough for\\u2026 https://t.co/MQNFNFEtYs',b'1232095982902489089',b'Sanjeev Chadha',b'sanjeevchadha8',"b'New Delhi, India'",b'Modi Version 2.0 begin.  We will get everything but Not an ACTION ON CORRUPT . This is my India and I Love My India. Ex Banker',b'935',b'419',b'7',b'100870',b'35542',b'False',b'False',b'False',b'False',b'2013-07-21 06:51:16'
b'@Abhishek_Singh8 the police is impressive. Making half dead people prove their patriotism. \\n\\nNot sure if they were\\u2026 https://t.co/dfNRcozHCK',b'1232094720173559808',b'Abhik Sen',b'sen_abhik',b'Goa',b'No particular interests but BJP sucks ass! Sanghis are not funny. Food addict. Punjabi MC is bomb!',b'187',b'201',b'1',b'9507',b'8558',b'False',b'False',b'False',b'False',b'2009-06-06 19:06:43'
"b'@sagarikaghose Ask ur Muslim friend who started it. Gunman arrested name shahrukh. I doubt, picture seems anti CAA\\u2026 https://t.co/JzQxmr3fCR'",b'1232094158484987904',b'Souman Chanda',b'soumanchanda',b'Delhi',b'',b'36',b'186',b'0',b'1649',b'983',b'False',b'False',b'False',b'False',b'2010-09-04 03:41:32'
