"b'In photos: CAA supporters attack Muslims at Delhi protest, hurl stones and petrol bombs  https://t.co/EN5uLuawnR vi\\u2026 https://t.co/J3GGF1kpGY'",b'1232213834099650560',b'Mohd. faizan',b'Mohdfai66536701',b'',b'',b'0',b'1',b'0',b'92',b'2',b'False',b'False',b'True',b'False',b'2019-01-23 09:10:01'
b'@abbas_nighat There will be massive hue and cry from anti #CAA supporters once the pro #CAA supporters come to the\\u2026 https://t.co/2jO9ogbJao',b'1232213796271378433',b'brij bagri',b'bmbagri',b'India',b'Tweets are personal views. Truth hurts only in the short term so be upfront and forthright. RT not an endorsement',b'201',b'268',b'21',b'9960',b'372',b'False',b'False',b'True',b'False',b'2009-11-23 06:51:32'
b'Protesters expressing their anger against pro CAA stand of @KeralaGovernor Arif Muhammed Khan by blockading Raj Bha\\u2026 https://t.co/8tva2bYUFu',b'1232213749169258496',b'labeeba A Raheem',b'labeeba_a',b'',b'Mamma of Twins\\U0001f469\\u200d\\U0001f467\\u200d\\U0001f467 The vibrant Girl..',b'16',b'21',b'0',b'101',b'0',b'False',b'False',b'True',b'False',b'2020-01-06 06:43:01'
b'@Javedakhtarjadu the level of violence is being increased in Delhi. All the Waris pathans are being unleashed. An a\\u2026 https://t.co/ca8PPtYRZw',b'1232213534085394433',b'\\u0939\\u093f\\u0928\\u094d\\u0926\\u0942 \\u0905\\u092e\\u093f\\u0924 \\u0917\\u094c\\u0930',b'AmitGau46923925',b'',"b'\\u092d\\u094b\\u0932\\u0947 \\u0938\\u093e \\u092d\\u094b\\u0932\\u093e, \\u0930\\u0941\\u0926\\u094d\\u0930 \\u0938\\u093e \\u092a\\u094d\\u0930\\u091a\\u0902\\u0921'",b'624',b'958',b'0',b'22943',b'17345',b'False',b'False',b'True',b'False',b'2018-10-09 09:47:04'
b'@MyPoint0fView_ Main chalne ko tyaar hu Pro CAA protest ho ya inse badla lene ke liye.\\n\\nAap kahan Milengi ye bataiy\\u2026 https://t.co/l7xxg7ZtFv',b'1232213504599478272',b'Hindustani (Deepen Rawat)',b'Hindust31431835',b'',b'Not required',b'0',b'8',b'0',b'48',b'1',b'False',b'False',b'True',b'False',b'2020-02-24 15:46:51'
b'Protesters expressing their anger against pro CAA stand of @KeralaGovernor Arif Muhammed Khan by blockading Raj Bha\\u2026 https://t.co/MTyGTXlw79',b'1232213459707654145',b'Fact Alive',b'FactAlive',b'',b'',b'3',b'1',b'0',b'94',b'5',b'False',b'False',b'True',b'False',b'2018-11-04 20:04:56'
b'@VishalDadlani You gotta be crazy to spread this lie ! Voilence happened in WB where no Pro CAA group was present .\\u2026 https://t.co/ZeCAdJbr0a',b'1232213439336067073',b'dennis  \\U0001f1ee\\U0001f1f3',b'dennis19308226',b'',b'Zero Bullshit - I take on anyone who faffs',b'128',b'577',b'2',b'37454',b'49572',b'False',b'False',b'True',b'False',b'2018-08-12 12:00:52'
b'It\\u2019s unfortunate that while @realDonaldTrump is in India for bilateral talks with @narendramodi both the anti and p\\u2026 https://t.co/C2lZDWXRqU',b'1232213347753512968',b'Lalit Mohan Joshi',b'Lalitmohanjoshi',b'London',"b'Writer, Journalist, Documentary Filmmaker & Film Historian. Former BBC World Service Producer & Founder Director/ Editor, SACF, London (2000 till present).'",b'276',b'98',b'19',b'2400',b'130',b'False',b'False',b'False',b'False',b'2009-06-21 07:05:43'
"b'@VishalDadlani Shitholes like u seem 2 forget that anti CAA started with violence, u might have forgotten, remember\\u2026 https://t.co/yqyDGoUmcC'",b'1232213307672727553',b'praveen pai \\U0001f1ee\\U0001f1f3',b'nppassociates',"b'Ashok Nagar, Bengaluru'","b'self made man, interested in Aromatic & flavor chemicals and essential oils.RT not endorsement.'",b'182',b'283',b'0',b'5832',b'187143',b'False',b'False',b'True',b'False',b'2014-08-02 04:37:19'
"b'Amit Shah holds late-night meeting to review situation in Delhi after anti-, pro-CAA groups clash in National Capit\\u2026 https://t.co/ACIl6PGtSm'",b'1232213301972684801',b'News8Plus',b'news8_plus',b'',b'News8Plus collects news from various trusted sources & publish in a single platform. News8Plus for realtime news updates.\\n\\nFacebook Page- https://t.co/wndV7TZYNv',b'17',b'0',b'0',b'18164',b'0',b'False',b'False',b'True',b'False',b'2020-01-13 20:48:18'
b'@Swamy39 It is so called pro CAA protest which has caused violence so call them anti National .',b'1232213273443000320',b'Satyendra',b'Satyend03590026',"b'Ghaziabad, India'",b'humour',b'599',b'938',b'1',b'5431',b'4952',b'False',b'False',b'True',b'False',b'2019-09-17 03:39:24'
"b'@Javedakhtarjadu You don\\u2019t have a clue of your contribution to this violence, you have instigated people continuous\\u2026 https://t.co/mUAoeVtSz2'",b'1232213227846561792',b'Piyush Saxena \\U0001f1ee\\U0001f1f3',b'piyushsaxena79',"b'Gurgaon, India'","b""Single father of a lovely daughter, Robotic Process Automation, Program Management, Sanatan Dharm, RT's not endorsement, IT & SM, BJP Gurugram""",b'951',b'1381',b'7',b'15860',b'5044',b'False',b'False',b'True',b'False',b'2010-12-25 06:24:29'
b'@DChaurasia2312 Ab police ne bata dia.. ni to pro caa hi batate tum bhadwe patrakar',b'1232213182183284741',b'ShianShaw',b'Kundan72200798',b'',b'I believe in love and brotherhood...',b'0',b'84',b'0',b'153',b'25',b'False',b'False',b'True',b'False',b'2020-02-07 13:10:49'
b'Protesters expressing their anger against pro CAA stand of \\n@KeralaGovernor\\n Arif Muhammed Khan by blockading Raj B\\u2026 https://t.co/JHaEeWWwz0',b'1232213148234584064',b'yasir arafath',b'yaar76',"b'Doha, Qatar'",b'',b'91',b'336',b'0',b'60',b'80',b'False',b'False',b'True',b'False',b'2010-01-15 02:29:49'
b'@ramprasad_c Waris nei gya tha pro caa protestor ke paas Kapil gya anti caa protestor ke paas aag lagane btw both should be put behind bars',b'1232213064805703680',b'$halu Singhaniya',b'Singhaniyaaaaa',b'',b'',b'48',b'579',b'0',b'918',b'138',b'False',b'False',b'True',b'False',b'2017-12-01 06:50:14'
b'@Samir11676453 @nuts2406 And what is the serious offence of Dr Kafeel. \\n\\nHours after Kapil Mishras poisonous speech\\u2026 https://t.co/mehVL2SNKs',b'1232213059160010752',b'Jasmine S',b'urban_lens',b'India',b'Urbanist and design professional. Passionate about sustainability and creating walkable and inclusive cities.',b'457',b'196',b'3',b'3622',b'9842',b'False',b'False',b'True',b'False',b'2017-12-18 06:37:38'
"b""\\u09b8\\u09bf\\u098f\\u098f \\u09aa\\u09a8\\u09cd\\u09a5\\u09c0 \\u09ae\\u09be\\u09a8\\u09c7 \\u09ae\\u09c1\\u09b8\\u09b2\\u09bf\\u09ae \\u09ac\\u09bf\\u09b0\\u09cb\\u09a7\\u09c0, \\u098f\\u099f\\u09be \\u09ac\\u09c1\\u099d\\u09c7 \\u0997\\u09bf\\u09af\\u09bc\\u09c7\\u099b\\u09bf!' \\u099f\\u09c1\\u0987\\u099f \\u09a4\\u09cb\\u09aa \\u0985\\u09a8\\u09c1\\u09b0\\u09be\\u0997 \\u0995\\u09be\\u09b6\\u09cd\\u09af\\u09aa\\u09c7\\u09b0 \\nhttps://t.co/V9ildoGCIr""",b'1232213027409125376',b'Oneindia Bengali',b'OneindiaBengali',b'India',"b'A Bengali news portal brings news in Bengali from India and international news headlines, top stories on business, politics, sports and entertainment news.'",b'2235',b'1271',b'130',b'64963',b'94',b'False',b'False',b'False',b'False',b'2013-10-08 05:20:00'
b'@sadhavi @AmitShah @HMOIndia @PMOIndia Equating Pro and anti caa in one form  is not right',b'1232212879459307521',b'YASHWANTH',b'Yash2090',b'',b'BHARATHIYA \\nHINDU\\nTAMIL\\nKSHATRIYA\\nJAI BHAVANI \\U0001f6a9\\U0001f6a9',b'4',b'157',b'0',b'111',b'428',b'False',b'False',b'True',b'False',b'2020-01-23 01:58:29'
"b'In Pics | Violence rages for the second day in Delhi, pro and anti-CAA protesters clash, seven killed\\n#DelhiRiots\\nhttps://t.co/53mrRbNif7'",b'1232212762220253184',b'Outlook Magazine',b'Outlookindia',"b'New Delhi, India'",b'The fully loaded news magazine from India',b'212386',b'52',b'1542',b'353083',b'173',b'True',b'False',b'False',b'False',b'2009-03-04 12:45:00'
"b""This isn't a clash between Anti CAA and Pro CAA protestors.\\nIt's a pre-planned state sponsored communal violence.\\u2026 https://t.co/xjS38nnV0T""",b'1232212718649626625',b'Shawaiz Seth',b'shawaizseth',b'New Delhi',b'Student.\\nJamia Millia Islamia University\\nNew Delhi.',b'87',b'169',b'1',b'430',b'686',b'False',b'False',b'True',b'False',b'2011-02-22 13:08:38'
b'@hafeezkv @sumitadc @AdityaRajKaul @UAH_India @saahilmenghani @India_Resists @ThePeopleOfIN @_YogendraYadav\\u2026 https://t.co/Pv3cavU7ks',b'1232212715399237632',b'Indian @ heart',b'srs14756',b'Mumbai',"b'IIT BHU Alumni, committed to Technology & Development; A Modi fan;  Commerce, Culture, Current affairs, and Corruption free progressive INDIA.'",b'520',b'2535',b'19',b'20268',b'10101',b'False',b'False',b'False',b'False',b'2010-01-28 14:13:32'
"b'World players are fighting #cronavirus, worried about global growth, climate change..\\nWorld players are working har\\u2026 https://t.co/mstUKCYSTi'",b'1232212673904939009',b'Mohammed Khan',b'4minar1',b'',"b'What Islamic traits are the best? The Prophet (PBUH) said, Feed the people, and greet those whom you know and those whom you do not know. #Peace'",b'111',b'419',b'0',b'15541',b'36085',b'False',b'False',b'True',b'False',b'2017-03-04 16:43:55'
b'#DelhiPolice hand in gloves with hindu nationalists #DelhiViolence \\n\\nhttps://t.co/2Am5V0R67f',b'1232212603281301504',b'Dibyesh Anand \\U0001f3f3\\ufe0f\\u200d\\U0001f308',b'dibyeshanand',b'London',"b'Cat-loving/Professor/Queer/Facebooker accepting flags that don\\u2019t have nation-states to anchor them & hence solidarity with Tibet, Kashmir....(views my own).'",b'4466',b'819',b'46',b'5561',b'4574',b'False',b'False',b'False',b'False',b'2009-11-06 15:30:14'
b'@majorgauravarya @SAfridiOfficial This is how Muslims are being terrorised in India -   not just by the state but b\\u2026 https://t.co/4u7X6A6rjn',b'1232212585900015616',b'Asad Ali',b'AsadAliRamay',"b'Punjab, Pakistan'",b'',b'261',b'482',b'0',b'1276',b'8349',b'False',b'False',b'True',b'False',b'2019-06-08 18:01:46'
b'@AJEnglish Pro CAA protesters turn violent',b'1232212556066050048',b'Suman Sk',b'iam_suman_sk',b'',b'Big Fan Of SRK',b'76',b'260',b'0',b'381',b'8168',b'False',b'False',b'True',b'False',b'2018-10-19 17:51:39'
b'@rupasubramanya Wah amanatullah kahe kuch nahi waris pathan kahe kuch nahi kapil mishra ne aggression dikha diya to\\u2026 https://t.co/NJBrs7zjNs',b'1232212518120153089',b'zero cool',b'rajeshratawal',"b'New Delhi, India'",b'simple patriotic bhakt',b'45',b'605',b'1',b'392',b'52',b'False',b'False',b'True',b'False',b'2011-07-28 09:40:26'
b'@Kritika_Kamra So pro CAA \\u0905\\u0930\\u0947 muslims?',b'1232212371399233538',b'JITENDRA PRASAD',b'jprasad1955',b'India',b'',b'87',b'81',b'0',b'5064',b'8022',b'False',b'False',b'True',b'False',b'2015-08-13 23:52:56'
b'@dr_raghib Pro CAA rally',b'1232212284690165763',b'KASHIF | \\u06a9\\u0627\\u0634\\u0641\\u200e',b'KashifSRKian',b'INDIA',b'SRKian | Moody | Fan Account                                             Tweets par dhyaan dene se accha apni zindagi par dhyaan dein..',b'4357',b'464',b'31',b'125953',b'27074',b'False',b'False',b'True',b'False',b'2010-02-13 04:04:29'
"b""@Swamy39 It's pro CAA voilence""",b'1232212239039500290',b'Vineet Bhatt',b'vineetbhatt5',b'India',"b'Engineer,Cricket lover,liberal,Secular fundamentalist,waiting for the best thing in life.'",b'133',b'634',b'0',b'5131',b'18377',b'False',b'False',b'False',b'False',b'2009-09-20 09:45:24'
b'@WHSCI @funder https://t.co/8VdWTY9xRR',b'1232212158621990914',b'Lies Trump Told Us',b'LiesTrumpToldUs',"b'Washington, DC'",b'#LiesTrumpToldUs #AlternativeFacts  Subscribe on Reddit. Facebook or Tumblr. #TrumpLies #TrumpLiesMatter',b'99',b'263',b'0',b'3296',b'2616',b'False',b'False',b'False',b'False',b'2017-01-24 07:54:40'
b'Protesters expressing their anger against pro CAA stand of @KeralaGovernor Arif Muhammed Khan by blockading Raj Bha\\u2026 https://t.co/G7stH4P4XS',b'1232212143480680448',b'RS Rashida',b'RSRashida2',b'',b'',b'12',b'39',b'0',b'264',b'193',b'False',b'False',b'True',b'False',b'2020-02-13 16:11:19'
b'There\\u2019s nothing like \\u2018pro CAA\\u2019... there can never b... it\\u2019s terrorism incited by @KapilMishra_IND https://t.co/d9Uz8gljLv',b'1232212088518369281',b'M Arshad Qureshi',b'naziarshad',b'Mumbai',"b'Alive, Author of Stop Managing Sales, Proud father of a son who\\u2019s proud of my work, In love with my wife, Prefer to be uninformed than misinformed..'",b'409',b'164',b'16',b'29500',b'16393',b'False',b'False',b'True',b'False',b'2014-01-11 06:03:02'
"b'@VishalDadlani It was pro CAA  guys who burnt Delhi, Kolkata,malda, basirhat, Patna, Lucknow etc in the name of pro\\u2026 https://t.co/jBlmDAxa3K'",b'1232212086345871360',b'Ricky Ferries',b'yoak765',b'',b'',b'8',b'79',b'0',b'1131',b'3587',b'False',b'False',b'True',b'False',b'2016-08-10 18:52:31'
"b""@Tanvi61024483 @Rohithutiya @narendramodi @realDonaldTrump And I freaking know it's a damn serious situation jaha e\\u2026 https://t.co/dLt4kUZNK6""",b'1232212040720142337',b'Anshu Sharma',b'ansh30sharma',"b'\\u0928\\u0908 \\u0926\\u093f\\u0932\\u094d\\u0932\\u0940, \\u092d\\u093e\\u0930\\u0924'",b'digital marketing expert \\nsmm \\nseo \\ndil se dilli wali \\u2764 \\nreal madrid forever \\U0001f49e\\n#PublicKaWinnerAsim \\n#AsimRiaz',b'108',b'39',b'0',b'7976',b'6554',b'False',b'False',b'True',b'False',b'2015-07-27 07:03:12'
"b""@Swamy39 Your views are anti national. If CAA is already notified, then what's need of pro CAA activists on street.\\u2026 https://t.co/p8FEaSUwUz""",b'1232211942623739904',b'Shivam',b'Shivam39761854',b'India',b'Be with correct',b'37',b'829',b'0',b'1042',b'12540',b'False',b'False',b'True',b'False',b'2019-11-14 12:05:47'
b'@Kritika_Kamra If pro caa is anti-Muslim then you all are anti-Hindu....\\U0001f595\\U0001f595\\U0001f595',b'1232211929088876544',b'Bhabesh_Kumar',b'Bhabesh74937721',b'',b'',b'38',b'631',b'0',b'1606',b'7212',b'False',b'False',b'True',b'False',b'2018-05-15 05:02:03'
b'@Swamy39 Yeah uncle we can see what Pro CAA people have done \\n\\nhttps://t.co/McedKxsGeN',b'1232211921111109632',b'$@M\\xb6 \\u0633\\u0645\\u064a\\u0639\\u200e',b'1234517sami',b'',"b'Bandein Hain Hum Uske, Ham Pe Kiska Zor, Ummidoun Ke Soraj, Nikle Chaaroun Aur'",b'25',b'361',b'0',b'2025',b'3463',b'False',b'False',b'True',b'False',b'2019-05-13 08:05:57'
b'Protesters expressing their anger against pro CAA stand of @KeralaGovernor Arif Muhammed Khan by blockading Raj Bha\\u2026 https://t.co/4PWoxTvyL6',b'1232211868623745026',b'thanseer thanseer.L',b'ThanseerL',b'',b'love to all',b'1',b'26',b'0',b'2',b'0',b'False',b'False',b'True',b'False',b'2020-02-09 15:05:32'
b'Shaheen Bagh protest is going on for 2 months:\\n\\nNo of Riots- 0\\nNo of person injured- 0\\nNo of Houses burnt- 0\\nNo of\\u2026 https://t.co/4UacNPskQX',b'1232211843285831680',b'R-A-G-H-I-B\\U0001f489\\U0001f48a\\U0001f52c',b'dr_raghib',b'India',b'#SANKI #FAN OF #KINGKHAN\\u300aADDICTION\\u300b\\n#MEDICO BY\\u300aPROFESSION\\u300b#CRICKETKEEDA #POLITICAL #PROUD OF #UNITY IN #DIVERSITY \\u2661DREAM  OF #INDIA BECOMING A #SUPERPOWER\\u2661',b'1172',b'735',b'23',b'38426',b'6937',b'False',b'False',b'True',b'False',b'2012-03-22 09:13:37'
b'Protesters expressing their anger against pro CAA stand of @KeralaGovernor Arif Muhammed Khan by blockading Raj Bha\\u2026 https://t.co/fQS3dYskOF',b'1232211774100983809',b'ajmalkotta',b'ajmalkotta',"b'Kondotty, Kerala'",b'Ajmal Hussain K N\\r\\nEngineer- Machinery Health Management\\r\\nAsset Optimization \\r\\nEmerson Process Management (India) Pvt Ltd',b'99',b'134',b'0',b'183',b'165',b'False',b'False',b'False',b'False',b'2010-02-14 15:08:58'
b'@Swamy39 Non sense! If pro CAA protest what do you call??',b'1232211766177718272',b'\\u0b95\\u0bc1\\u0b9f\\u0ba8\\u0bcd\\u0ba4\\u0bc8 \\u0bae\\u0ba3\\u0bbf',b'ManikandanQA',b'Bangalore / \\u0b95\\u0bc1\\u0bae\\u0bcd\\u0baa\\u0b95\\u0bcb\\u0ba3\\u0bae\\u0bcd',b'\\u0baa\\u0ba3\\u0bbf : \\u0bae\\u0bc1\\u0b95\\u0bcd\\u0b95\\u0bcb\\u0ba3 \\u0b9a\\u0bc6\\u0baf\\u0bb2\\u0bbe\\u0bb3\\u0bb0\\u0bcd ..\\u0baa\\u0bc6\\u0b99\\u0bcd\\u0b95\\u0bb3\\u0bc1\\u0bb0\\u0bc1',b'626',b'641',b'5',b'10337',b'4538',b'False',b'False',b'False',b'False',b'2011-04-12 08:49:14'
b'@GautamGambhir shame on u targeting @KapilMishra_IND tab tum log kaha the jab amantullah khan waris pathan ovaisi b\\u2026 https://t.co/djfYGJ3OVx',b'1232211728160526336',b'deshbhakt',b'gusaindeshbhakt',b'',b'',b'53',b'248',b'0',b'887',b'595',b'False',b'True',b'True',b'False',b'2020-01-23 17:30:16'
b'Delhi Violence: Asaduddin Owaisi Condemns Riots And Clashes Between Pro And Anti-CAA Groups\\nhttps://t.co/HVBrrgfx5z\\u2026 https://t.co/Bff1SjlQ3V',b'1232211652545859584',b'LatestLY',b'latestly',"b'Mumbai, India'","b'https://t.co/U4rHOvnjZj focuses on the What, When, Who and How of a trending story, and helps readers with analyses that go beyond the domain of news.'",b'54596',b'339',b'82',b'96240',b'68',b'True',b'False',b'False',b'False',b'2017-02-07 05:41:28'
b'@ShayarImran @DelhiPolice @LtGovDelhi sir could you please explain what action you are going to take against your p\\u2026 https://t.co/kuzgShAhGw',b'1232211650826186752',b'MD Juanid Khan',b'juanid_md',b'',b'',b'0',b'143',b'0',b'9',b'1',b'False',b'False',b'True',b'False',b'2020-01-07 16:46:42'
b'@TiwariNivedita Everyone including the Pro and Anti CAA folks are part of this voilence are to be blamed. The Home\\u2026 https://t.co/apYN1bMc3O',b'1232211614071283712',b'Ram S',b'Raam_Sundara',b'Hyderabad',b'Reality is a Spectrum | Politics | Stories | Music | Society | Ideas | Logic |',b'53',b'356',b'0',b'2186',b'8067',b'False',b'False',b'False',b'False',b'2013-10-04 17:23:08'
"b'Dear senior journalists, \\n\\nCAA is already an act. \\n\\nThere can be no such thing as \\u2018Pro CAA protestors\\u2019. \\n\\nThose who\\u2026 https://t.co/sxsWCbZ09J'",b'1232211575332839429',b'Badr Legal Services\\xa9\\ufe0f',b'BlessPvtLtd',b'Kolkata',b'BADR LEGAL SERVICES or BLESS as it is popularly known is a law firm which deals with all types of legal matters under the sun. BLESS has highly eminent lawyers',b'16',b'90',b'0',b'648',b'72',b'False',b'False',b'False',b'False',b'2015-03-07 16:19:44'
b'@Swamy39 Anti #CAA_NRC_Protests were going peace &amp; these riots &amp; arson came only when the Pro #CAAProtest came in !',b'1232211501806522368',b'Shalini\\U0001f380',b'Shaline2ee',b'Sarcastic World',"b""I'm Hindu but not BJP, Of course not Congress, then Obviously Not Communist, definitely not Centric+\\n\\nCommon Girl \\U0001f646\\U0001f64b\\U0001f481\\U0001f486\\U0001f937+\\n\\nBengali Marathi Urdu French Tamil""",b'2059',b'290',b'4',b'9388',b'5945',b'False',b'False',b'True',b'False',b'2018-04-19 03:54:29'
"b'@Swamy39 First time in history, Pro CAA supporting protestors are protesting to impose a law passed by both the hou\\u2026 https://t.co/IW3HiXUk6E'",b'1232211449692344320',b'The-Ly-Mama',b'Sanjay_0112',b'searching... ',b'',b'669',b'162',b'0',b'38328',b'16991',b'False',b'False',b'True',b'False',b'2017-11-09 15:37:33'
b'@VishalDadlani Shut up @VishalDadlani where were the pro CAA protestors when they pelted stones and sprayed khilafa\\u2026 https://t.co/TfxliMPsu3',b'1232211432671825921',b'Rami Niranjan Desai',b'ramindesai',"b'New Delhi, India'",b'Anthropologist / Theologian / North East India Analyst / Writer / Amateur Indology Enthusiast / Co Ed- Rajarshi Bhagyachandra and the Bhakti Movement',b'107',b'271',b'0',b'340',b'471',b'False',b'False',b'True',b'False',b'2018-05-26 09:41:43'
b'\\u0905\\u092c\\u0947 2 \\u092e\\u0939\\u0940\\u0928\\u0947 \\u0938\\u0947 \\u091c\\u094d\\u092f\\u093e\\u0926\\u093e \\u0938\\u0947 CAA \\u0915\\u093e \\u0935\\u093f\\u0930\\u094b\\u0927 \\u0936\\u093e\\u0902\\u0924\\u093f\\u092a\\u0942\\u0930\\u094d\\u0923 \\u0922\\u0902\\u0917 \\u0938\\u0947 \\u091a\\u0932 \\u0930\\u0939\\u093e \\u0932\\u0947\\u0915\\u093f\\u0928 \\u091c\\u092c-\\u091c\\u092c \\u0924\\u0947\\u0930\\u0947 \\u091c\\u0948\\u0938\\u094b\\u0902 \\u0928\\u0947 \\u092d\\u0921\\u093c\\u0915\\u093e\\u090a \\u092c\\u092f\\u093e\\u0928 \\u0926\\u0947\\u0924\\u093e \\u0930\\u0939\\u093e \\u0924\\u094b \\u0939\\u0930\\u2026 https://t.co/VbyfRvkdBC',b'1232211313637478400',b'Angad Singh Kaler',b'Angad93265439',"b'Ludhiana, India'","b'\\u091c\\u092c \\u0924\\u0915 \\u0939\\u093f\\u0928\\u094d\\u0926\\u0942-\\u092e\\u0941\\u0938\\u094d\\u0932\\u093f\\u092e, \\u0915\\u093e\\u0932\\u093e-\\u0917\\u094b\\u0930\\u093e, \\u0938\\u092d\\u094d\\u092f-\\u0905\\u0938\\u092d\\u094d\\u092f, \\u091b\\u0942\\u0924-\\u0905\\u091b\\u0942\\u0924, \\u0927\\u0928\\u0940-\\u0928\\u093f\\u0930\\u094d\\u0927\\u0928 \\u0906\\u0926\\u093f \\u0936\\u092c\\u094d\\u0926\\u094b\\u0902 \\u0915\\u093e \\u092a\\u094d\\u0930\\u092f\\u094b\\u0917 \\u0939\\u094b\\u0924\\u093e \\u0939\\u0948 \\u0924\\u092c \\u0924\\u0915 \\u0915\\u0939\\u093e\\u0901 \\u0915\\u0940 \\u0935\\u093f\\u0936\\u094d\\u0935\\u092c\\u0928\\u094d\\u0927\\u0941\\u0924\\u093e \\u0914\\u0930 \\u0915\\u0939\\u093e\\u0901 \\u0915\\u093e \\u0935\\u093f\\u0936\\u094d\\u0935\\u092a\\u094d\\u0930\\u0947\\u092e?:- \\u092d\\u0917\\u0924 \\u0938\\u093f\\u0902\\u0939'",b'114',b'311',b'1',b'1551',b'9129',b'False',b'False',b'True',b'False',b'2020-01-04 06:34:33'
b'Protesters expressing their anger against pro CAA stand of @KeralaGovernor Arif Muhammed Khan by blockading Raj Bha\\u2026 https://t.co/E4jrOZ4FJW',b'1232211249238245377',b'Mohamed Nihas',b'Nihas79',b'',b'',b'5',b'124',b'0',b'8',b'6',b'False',b'True',b'True',b'False',b'2016-08-15 09:21:09'
"b'@5trillion_jumle ghazab hai bsdk, pehle 15cr wala bhsan do, phir jafrabad me road block karo aur uske baad Kapil mi\\u2026 https://t.co/NHl79FDfQl'",b'1232211221342040065',b'The Last Superstar',b'KRRRRISSSSH',b'',b'Hrithik Roshan Fan',b'71',b'35',b'0',b'19029',b'17588',b'False',b'False',b'True',b'False',b'2019-11-10 13:36:13'
b'Correction *Violents pro CAA terror https://t.co/ZYCBO15quD',b'1232211189293289472',b'Mohammed Tarique Hasan Abdi',b'MdTariqueHasan1',b'Al-Hind \\U0001f1ee\\U0001f1f3',b'Nothing matters.... Only me and family',b'1407',b'3218',b'0',b'1112',b'13255',b'False',b'False',b'True',b'False',b'2019-02-03 15:51:52'
b'Protesters expressing their anger against pro CAA stand of @KeralaGovernor Arif Muhammed Khan by blockading Raj Bha\\u2026 https://t.co/FdoKHXyLKG',b'1232211150240206849',b'Rasheed Muhammed',b'Rasheed59616699',b'Saudi Arabiya',b'',b'1',b'4',b'0',b'6',b'0',b'False',b'True',b'True',b'False',b'2020-02-14 15:58:45'
"b""@ShashiTharoor Who's blaming anti CAA protests? We know this mayhem is created by them. So many rants against India\\u2026 https://t.co/unAt7eH2lN""",b'1232211141050408961',b'Santanu Ghosh',b'urs_shaan',b'Kolkata',"b'Avid football lover, loves my country, and fond of travelling around. a total foodie. Question your Government but in the right way, not by creating ruckus.'",b'240',b'237',b'3',b'3070',b'1994',b'False',b'False',b'False',b'False',b'2010-01-28 09:40:57'
"b""Checkout the Sickular mindest of Hindustan Times\\n\\n'Pro-CAA rioters go on a rampage' ? Pro CAA rioters?\\n\\nin subheadi\\u2026 https://t.co/TjDiL5myX1""",b'1232211111220396032',b'Hitesh Bansal',b'ihiteshbansal',"b'New Delhi, India'",b'Social Media | Media Monitoring | Reputation Management | Right Wing Enthusiast | Nature \\u2764\\ufe0f| Learner from Life | Followed by the Honorable PM @narendramodi ji',b'8994',b'1935',b'35',b'14770',b'1304',b'False',b'False',b'False',b'False',b'2015-10-30 13:32:13'
b'@Swamy39 Let me clear yourself - it is PRO CAA violence - anti CAA violence has been going since 2 months with peace \\U0001f64c',b'1232211106375979008',b'\\u0639\\u0645\\u06cc\\u0631 \\u092e\\u094b\\u092e\\u093f\\u0928',b'u_momin',"b'Maharashtra, India'","b""Godse murdabad Gandhi ji Zindabad Jay Hind Jay Maharashtra- social activist - against hate \\n\\xb0 if not us , then who \\xb0 if not now then when ? '' want the change !""",b'90',b'149',b'0',b'561',b'707',b'False',b'False',b'False',b'False',b'2012-10-06 18:24:08'
"b""So when anti CAA fails and pro CAA gains ground you call Pro CAA anti Muslims. Aren't anti CAA abhi Hindu. Why call\\u2026 https://t.co/ssIVu1sMYH""",b'1232211099392438273',b'Rajkst',b'rajkst',b'Delhi',"b'writer, editor, dreamer... and a liitle more'",b'344',b'318',b'3',b'5790',b'2144',b'False',b'False',b'False',b'False',b'2009-12-09 12:30:24'
b'Protesters expressing their anger against pro CAA stand of @KeralaGovernor Arif Muhammed Khan by blockading Raj Bha\\u2026 https://t.co/ZlCe3uGNAm',b'1232211066651844609',b'Ashfaque',b'Ashfaqu63156872',b'',b'',b'6',b'89',b'0',b'48',b'47',b'False',b'False',b'True',b'False',b'2020-02-14 05:58:49'
b'@sensumitmca @Parv05 @AdityaRajKaul That was pro caa idiot. They literally brought in a truck full of stones. Shahe\\u2026 https://t.co/kIGAcWAS71',b'1232210911349198849',b'southindian niqqa',b'pysgowindRagh1',"b'Kalyan Dombivali, India'",b'I am an indian and I am a Bakchodh',b'50',b'117',b'0',b'934',b'18423',b'False',b'False',b'False',b'False',b'2013-11-09 15:52:24'
b'@Swamy39 2 months of shaheen bagh anti caa protest no violence. 2 days of pro caa protest Delhi burning. You can tell which one is violent',b'1232210877895581696',b'Harmony',b'Harmony48339396',b'',b'Activist',b'11',b'89',b'0',b'1563',b'3456',b'False',b'False',b'True',b'False',b'2019-12-15 16:31:31'
b'Yes. Pakistan also run by Modi . So that he can win elections here. \\n\\nWhat next ??\\n https://t.co/fC2D16wvHy',b'1232210867103531008',b'#IndiaFirst \\U0001f1ee\\U0001f1f3',b'savitha_rao',b'\\U0001f30f',b'Passionate Indian who believes that Each One of Us Can Make a Difference.Together we make Change.\\n\\nHonoured to be followed by PM Modi \\U0001f33f\\n\\n\\u0927\\u0930\\u094d\\u092e\\u094b \\u0930\\u0915\\u094d\\u0937\\u0924\\u093f \\u0930\\u0915\\u094d\\u0937\\u093f\\u0924 \\U0001f6a9',b'9923',b'3174',b'141',b'190100',b'225166',b'False',b'False',b'False',b'False',b'2014-05-24 06:39:45'
"b""@SushantSin @Fatima_Z0hra Pro CAA's are protesting against road blocks by burning down whole cities. Jab road hi na\\u2026 https://t.co/0RZBG1fWKD""",b'1232210813315772416',b'Sana',b'Ego_twts',b'',b'next door local....',b'175',b'51',b'3',b'324',b'1524',b'False',b'False',b'False',b'False',b'2013-10-18 06:45:46'
