"b""Sebelum tidur, hari ini aku baca do'a (muslim). Lalu tidur miring ke kanan dengan lampu keadaan menyala dan musik dari laptop.""",b'1232014389315657728',b'Aulia Safitri',b'lsftr99',b'Yogyakarta',"b""Don't stress\\nDo your best""",b'90',b'97',b'0',b'2312',b'768',b'False',b'False',b'False',b'False',b'2015-07-09 00:06:34'
"b'Hindu girls are always allowed to make Muslim friends, but can a Muslim girl be allowed to have a hindu boyfriend?\\u2026 https://t.co/4XDTAMritC'",b'1232014381610721281',b'Prateek Vashishtha',b'ReallyPrateek',"b'New delhi, India '",b'| Nationalist | Hindu | Sanghi | Maths Student | Finance & Economy | Politics & Foreign affairs | National Security | Part time Poet |\\n| Proud Brahamin | \\U0001f1ee\\U0001f1f3',b'195',b'704',b'1',b'5290',b'3017',b'False',b'False',b'True',b'False',b'2019-10-08 09:19:43'
"b""@deepsealioness Waris Pathan statement caused this I don't think RSS would be such foolish to create riot especiall\\u2026 https://t.co/I8bk8bD6Mi""",b'1232014380411150336',b'Boney',b'Boneyxgnv',b'',b'',b'17',b'300',b'0',b'1822',b'3361',b'False',b'False',b'True',b'False',b'2019-12-07 17:20:58'
"b'@SoniaDzzz @sltcompatriotes musulmanes=automatiquement soeurs en Allah, moi tous mes followers muslim qui aiment Al\\u2026 https://t.co/QDB2Jm6zM7'",b'1232014379467649024',b'Alfirdaws',b'Alfirdawsssssss',"b""le lien de ma playlist coranique sublime exceptionnelle la plus belle de l'univers en dessous de ce message""","b'Je parle de diff\\xe9rents sujets dans la joie et la bonne humeur, et humour, savoir islamic fiable gratuit dans toutes les langues unfi\\xe9 dans mon tweet \\xe9pingl\\xe9'",b'5227',b'5625',b'1',b'36059',b'28653',b'False',b'False',b'False',b'False',b'2017-11-16 06:35:39'
"b'@AIPAC Bernie Sanders is being supported by muslim agents. His campaign manager is a pakistani muslim, a country kn\\u2026 https://t.co/Hb9dYSb3mi'",b'1232014378926362624',b'burningsenseoffire92',b'jo_powder1900',b'Hyderabad',"b'Youthful, Optimistic, student of linguistics'",b'65',b'882',b'2',b'1215',b'13130',b'False',b'False',b'True',b'False',b'2016-02-01 19:55:11'
b'@Bumba_007 @Praveen21810944 @vyassharad @sonusingh_611 @YawerShadab @ihansraj @realDonaldTrump @TribalArmy\\u2026 https://t.co/lFwTAvms8E',b'1232014376338481152',b'Shahid Barmare',b'barmare_shahid',"b'Mumbai, India'","b'Working in ZERODHA, Love Poet, Love for INDIA, Love for Islam, Anti Modi-Shah, Pets Lover.'",b'2',b'66',b'0',b'399',b'39',b'False',b'False',b'True',b'False',b'2019-02-26 05:17:10'
b'@tonybluechef @THEONEPLATINUM @MakerSaggar @afa_queer @17_4mn @bobbyhope123 @Muslim_Patrol_ @Granlovespizza\\u2026 https://t.co/sOcS4fRMqI',b'1232014359133589510',b'Hog_Life',b'HogLife4all',b'Wales (innit)',"b'Ex forces, Big ugly biker, friend of Israel. MBGA/MAGA...man/bloke/geezer/git. will talk with #FBPE up to a point. idiot = block.'",b'1164',b'1417',b'1',b'19509',b'12913',b'False',b'False',b'False',b'False',b'2019-03-09 16:33:25'
b'Difference between a Jehadi Muslim and a Hindu #DelhiViolence #DelhiBurning https://t.co/l9wn4fj3RZ',b'1232014349180579841',b'Satvik Kedia\\U0001f60e',b'KediaSatvik',b'',"b'proud Indian \\U0001f1ee\\U0001f1f3 viratian , cricket lover, Sports lover  \\U0001f600\\U0001f3cf|RCB \\U0001f493||ICT \\U0001f499| Bhakt \\U0001f1ee\\U0001f1f3\\U0001f6a9|Right Wingist |'",b'210',b'1121',b'0',b'12646',b'112400',b'False',b'False',b'True',b'False',b'2019-04-01 16:51:51'
"b""@ReallySwara Apne muslim bhaiyo ko bol.. wahin hai ye sab violence karne wale.. karma won't forget you bitch""",b'1232014348383588352',b'Sir Lundry',b'AawaaraHoon',"b'Mumbai, India'",b'',b'47',b'37',b'0',b'2028',b'1590',b'False',b'False',b'False',b'False',b'2013-05-04 07:52:40'
"b'Bagaimanapun mereka itu anak anak Indonesia, apalagi sesama Muslim https://t.co/n5b5Tbzcju'",b'1232014346642841600',b'Pak PUCUK #NemoMovement',b'sugi_0706',b'',b'\\u0627\\u0644\\u0639\\u0644\\u0645 \\u0631\\u062d\\u0645\\u0629 \\u0644\\u0644\\u0639\\u0627\\u0644\\u0645\\u064a\\u0646\\U0001f917\\nPengidap Dissociative identity disorder\\nKadang theis kadang atheis',b'4878',b'280',b'9',b'81609',b'5331',b'False',b'False',b'False',b'False',b'2016-02-28 07:43:23'
b'@ReallySwara @DelhiPolice Your muslim mobs are attacking people',b'1232014342788243459',b'Bharat Soni \\U0001f1ee\\U0001f1f3',b'BhrtShoni',"b'Nathdwara, India'",b'NATIONALIST \\nHINDU\\U0001f6a9\\nSANGHI\\U0001f6a9\\nmodi  bhakt\\U0001f6a9\\nI follow like minded people only\\nstay away if your liberal/sickular\\n\\nInsta -Bharatsoni1214',b'256',b'1040',b'0',b'5724',b'18111',b'False',b'False',b'True',b'False',b'2017-04-15 20:56:14'
b'The house of a local Muslim politician has been surrounded by the hindutva terrorists. \\nDelhi Police not helping at\\u2026 https://t.co/K55spLfKq7',b'1232014337604190209',b'Desi tintin',b'The_Telegraph58',b'Berlin',"b'MBBS, MD internal medicine. Vande Matram \\U0001f1ee\\U0001f1f3'",b'79',b'1134',b'0',b'9624',b'5955',b'False',b'False',b'True',b'False',b'2019-01-24 16:04:38'
"b'@Kritika_Kamra well, if u taking as a MUSLIM or NON- MUSLIM , then plz stop calling u as a SECULAR.\\nHere is just vi\\u2026 https://t.co/MbSdenbPNX'",b'1232014337004404736',b'Pince Raj Singh',b'RajPince',b'',b'failure comes before success..',b'1',b'83',b'0',b'116',b'311',b'False',b'False',b'True',b'False',b'2015-04-04 17:48:46'
b'@CABRAXAS10 @trixasis4 He is probably an undercover Muslim.',b'1232014327022047232',b'Jacques',b'Jacques08489239',b'',b'Afrikaner in murg en been',b'43',b'181',b'0',b'1220',b'192',b'False',b'False',b'True',b'False',b'2018-10-28 09:58:37'
b'@chitraaum @AMISHDEVGAN Bheed nahi  dam se bolo   muslim ne jalaya',b'1232014322622029824',b'BK Aam Admi',b'BrajkishorTiwar',b'',b'',b'8',b'29',b'0',b'1162',b'15',b'False',b'False',b'True',b'False',b'2012-04-05 23:02:26'
b'@republic @sambitswaraj Sir hindu goli mare to 3 din tak news par aata hai aur Muslim goli mare 4 lok mar par koi n\\u2026 https://t.co/OIA8YOTYZO',b'1232014320667484161',b'prabhash Mithlesh jha',b'iamcoolboy456',"b'New Delhi, India'",b'.',b'37',b'10',b'0',b'12',b'54',b'False',b'False',b'True',b'False',b'2010-08-18 11:37:34'
"b""@whitford747 @Plaid_Cymru I wondered why she won an award!!! So she's anti-Semitic, that accounts for a muslim award!!!""",b'1232014320265027584',b'Jenni Crystal',b'jennicrystal24',b'',b'',b'730',b'627',b'6',b'12751',b'87970',b'False',b'False',b'True',b'False',b'2015-01-31 09:46:18'
b'@SwetaSinghAT He is Muslim and he is terrorist https://t.co/AyjHezc2IF',b'1232014309594554368',b'FEARLESS WRITER \\U0001f6a9\\U0001f6a9\\U0001f6a9',b'hindustan_am',b'',b'Account suspend hote rahenge DESHBHAKTI KAISE SUSPEND KAROGE...BORN TO SPEAK TRUTH                            \\n JAI HIND \\U0001f1ee\\U0001f1f3\\U0001f1ee\\U0001f1f3\\U0001f1ee\\U0001f1f3  \\u0935\\u0928\\u094d\\u0926\\u0947\\u092e\\u093e\\u0924\\u0930\\u092e \\U0001f1ee\\U0001f1f3\\U0001f1ee\\U0001f1f3\\U0001f1ee\\U0001f1f3',b'14',b'74',b'0',b'1094',b'628',b'False',b'False',b'True',b'False',b'2019-12-16 03:18:26'
b'@gandiv_ @ANI Hindu muslim dange rss chadi pandi karani chahti he ham hone nhi denge 40 krod he dalit',b'1232014305010253835',b'Lankesh',b'Lankesh25880668',b'',b'love',b'15',b'5',b'0',b'487',b'485',b'False',b'False',b'True',b'False',b'2020-02-23 04:27:05'
"b""@Well_InformedWB FYI, folks - \\n\\nJanet Napolitano was Obama's DHS Secretary.    Philip Haney revealed DHS under Napo\\u2026 https://t.co/EJzvamc6TV""",b'1232014300623056896',b'JTTCOTM',b'JTTCOTM',b'DET MI USA',b'alive',b'685',b'17',b'5',b'13912',b'32753',b'False',b'False',b'True',b'False',b'2018-04-24 22:26:18'
b'Another shameful event of @narendramodi mimicking Gujrat Muslim killings. Civil indians must take action. https://t.co/Gun2zyCK2J',b'1232014299738103808',b'Anwar Motan',b'anwarmotan',"b'Sugar Land, TX'",b'Healthcare IT Professional. Love Consulting in IT Healthcare. Support PTI and Democrats at home in USA. Love my children and grandchildren.',b'82',b'39',b'1',b'6697',b'12361',b'False',b'False',b'True',b'False',b'2009-05-31 18:54:00'
b'@muslim_ladki Msg karo',b'1232014275721359360',b'Adi',b'AdityaA07467691',b'',b'',b'12',b'136',b'0',b'76',b'375',b'False',b'False',b'True',b'False',b'2017-07-13 08:28:51'
b'Horrified at the news coming through from Delhi today- keep watching/talking about what\\u2019s going on in India.\\nThe ho\\u2026 https://t.co/eCGncb9ErP',b'1232014271153917952',b'Samira Sawlani',b'samirasawlani',b'London',"b'Journalist, Writer, Analyst on East Africa|Eye on the rest of the continent| also love fashion,fitness & fiction. | samirasawlani3@gmail.com'",b'75372',b'1559',b'537',b'77285',b'29211',b'True',b'False',b'False',b'False',b'2011-08-04 18:39:36'
"b'@aflorian @jeremyscahill The same campaign and candidate who produced turban photos, when asked about dropping out\\u2026 https://t.co/FCHCAczXrl'",b'1232014265642450944',b'Anthony \\U0001f530 \\u571f\\u7740',b'Viscous_cree',"b'Phoenix, AZ'","b'USN veteran 2005-2011 (OIF 2007-08, prior active duty), Native American\\n------------------ sports & politics are mostly what I tweet about'",b'519',b'418',b'6',b'46191',b'127359',b'False',b'False',b'True',b'False',b'2015-11-02 05:20:00'
b'#Shoot_the_muslim_terrorists\\n\\n\\u091f\\u094d\\u0930\\u0947\\u0902\\u0921 \\u0915\\u0930\\u093f\\u090f \\u0907\\u0938\\u0947 \\u0938\\u092c\\u0932\\u094b\\u0917',b'1232014265374199809',b'\\u0935\\u0930\\u0941\\u0923',b'shuklavarun5733',"b'New Delhi, India'",b'',b'433',b'664',b'0',b'2623',b'1035',b'False',b'False',b'True',b'False',b'2016-09-29 12:55:19'
b'Women in Hauz Rani holding a condolence meeting for the lives lost today. Today attack by RSS members happened on M\\u2026 https://t.co/jZ8nOJzUJY',b'1232014261594906624',b'varun vasu narayanan',b'varunnarayanan1',b'',"b""My \\u03c3\\u0192\\u0192\\u0131\\xa2\\u0131\\u03b1\\u2113 \\u03bd\\u03b1\\u044f\\u03c5\\u03b7 \\u03bd\\u03b1\\u0455\\u03c5 \\u03b7\\u03b1\\u044f\\u03b1y\\u03b1\\u03b7\\u03b1\\u03b7 tw\\u0131tt\\u0454r p\\u03b1g\\u0454.\\nSharing things I'm learning through my work and other interest.\\nAuthor and Poet or Blogger.""",b'13',b'518',b'1',b'3242',b'377',b'False',b'False',b'False',b'False',b'2012-01-24 12:05:53'
b'A muslim woman MP for the communist party @PODEMOS at Spain\\u2019s parliament declared that muslim women enjoyed the rig\\u2026 https://t.co/EJY3Z66ICH',b'1232014259137236993',b'For King & Country\\u269c\\ufe0f\\U0001f1ea\\U0001f1f8',b'VivaElReyDeEsp',b'New Jersey\\u269c\\ufe0f\\U0001f1fa\\U0001f1f8\\U0001f1ea\\U0001f1f8',"b'""Somos un gran pa\\xeds. Tenemos una gran Naci\\xf3n. Creamos y confiemos en ella""- Felipe VI. Expat Spaniard, Army veteran tweeting about Spain for King & Country'",b'280',b'89',b'3',b'6614',b'3879',b'False',b'False',b'True',b'False',b'2019-08-16 01:41:37'
b'@AndrewAmsan @Reuters How do you know this person is Muslim or not',b'1232014258604367872',b'\\U0001f1ee\\U0001f1f3Global Puneri\\U0001f1e6\\U0001f1fa',b'MitalPatankar',b'',b'Proud Hindu\\nHave zero tolerance for hypocrisy',b'66',b'125',b'0',b'430',b'1313',b'False',b'False',b'True',b'False',b'2011-08-27 19:42:23'
"b""If there is one kafiri I have seen wearing a Muslim kanzu and Dera then you're one you should just join the neno ch\\u2026 https://t.co/68OtJfdVic""",b'1232014243710541830',b'Crissed',b'Crissed5',b'',b'Our life here in heaven',b'294',b'1251',b'0',b'1333',b'1992',b'False',b'False',b'True',b'False',b'2020-01-08 08:10:14'
b'this religiously abusive narrative is controlled by some men who love using our religion as a tool for control - it\\u2026 https://t.co/kamSugMuKL',b'1232014237599440897',b'\\U0001f31cnazia\\U0001f31b',b'sareeslayer_',"b'South of England, UK'","b""18 | \\U0001f1ec\\U0001f1e7\\U0001f1e7\\U0001f1e9 | DM's are open for women only. (\\u25e0\\u203f\\u25e0\\u273f)""",b'100',b'103',b'0',b'896',b'21395',b'False',b'False',b'True',b'False',b'2015-12-08 16:01:27'
b'@rewa_abhay @khalidsalmani1 @sardanarohit Sahi bola tu Brother Muslim mother chod hai khud ki maa ke sath rape kart\\u2026 https://t.co/vd1E9Bp1TH',b'1232014235154165762',b'Vcc studios Hari vishnu',b'HariVcc',"b'Hyderabad, Chennai,Banglore '","b""I am film financier and film distributor south film industry's Hindi film industry's but only working with Hindustani Hindus..Muslim existed spotted CAA""",b'2',b'53',b'0',b'61',b'5',b'False',b'False',b'True',b'False',b'2020-02-11 08:21:18'
b'Jewish Muslim Interfaith Harmony. @FFEUnyc @aslam_owaiz with @__Interfaith__ at the iconic Nakhuda Mosque. Great vi\\u2026 https://t.co/rEZGOTTyUY',b'1232014229927911427',b'Indian Pluralism Foundation',b'indianpluralism',"b'Kolkata, India'","b""The Indian Pluralism Foundation is Established to Promote Harmony, Knowledge, Understanding & Admiration Amongst The Youths of The World's Diverse Communities.""",b'628',b'2567',b'18',b'4506',b'3617',b'False',b'False',b'True',b'False',b'2017-07-13 05:19:58'
b'@empysunflower Christian eey you feckin unsoalihu get yo ass outta my gay muslim household',b'1232014226379530244',b'Ritsu\\u2606Gay tuna',b'alpharitsu',b'comms after olevels',b'\\u2728\\U0001d57d\\U0001d58e\\U0001d599\\U0001d598\\U0001d59a\\u2728 \\u25aa\\ufe0e they/them \\u25aa\\ufe0e Inami Anju is so breathtakingly pretty i cry\\U0001f975\\U0001f496\\u2728 \\u25aa\\ufe0e CEO of breaking Skyrim \\u25aa\\ufe0e Kanamori \\U0001f974\\u25aa\\ufe0ematching w/ @amxtsuki\\u25aa\\ufe0esmall frogs\\U0001f496\\u25aa\\ufe0e',b'319',b'552',b'3',b'9716',b'20948',b'False',b'False',b'True',b'False',b'2017-03-16 11:04:16'
"b""I'm sleeping with a lot of fear &amp; anxiety. &amp; I'm completely aware of the privilege with which I'm speaking.\\n\\nIf me\\u2026 https://t.co/AYwpMRXS2f""",b'1232014225007992832',b'Madhuvanthi Srinivasan | \\u0645\\u062f\\u0647\\u0648\\u0648\\u0646\\u062a\\u06cc \\u0634\\u0631\\u06cc\\u0646\\u06cc\\u0648\\u0633\\u0646',b'MadhuvanthiS95',b'Bombay-Bangalore-New Delhi',"b'24. Journalist. Foreign Policy, Politics & Languages Enthusiast. Past Life Turk. Follows South, Central & West Asia. Tweets in English, Hindi & Turkish.'",b'1839',b'4371',b'12',b'8291',b'29040',b'False',b'False',b'False',b'False',b'2016-05-11 10:03:27'
"b'@amnestyusa look what is happening in NEW INDIA,\\nThe police and extremist together targeting the protesters.\\nThe pr\\u2026 https://t.co/kmZY9e8EFH'",b'1232014217051504641',b'YAWAR ZAFAR',b'YAWARZFR',"b'Maharashtra, India'","b'HUM DEKHENGE,LAAZIM HAI K HUM BHI DEKHENGE....'",b'1',b'28',b'0',b'68',b'4',b'False',b'False',b'True',b'False',b'2014-08-28 08:53:07'
"b'Where were the so called secular Hindus, rational Hindus? Where was #AAP and @ArvindKejriwal who won on a wave of M\\u2026 https://t.co/CYZ4th2oYA'",b'1232014216107679750',b'True Indian',b'True_Indian47',b'New Delhi',"b""A true nationalist. Not the hypocrite sort like BJP and RSS. Am a secular and believe in the philosophies and dream of Gandhiji's India.""",b'1350',b'103',b'38',b'44652',b'1188',b'False',b'False',b'False',b'False',b'2010-12-06 15:07:05'
b'@FatemeMohebbi \\u0627\\u062e\\u0647 \\u0645\\u0634\\u06a9\\u0644 \\u0627\\u06cc\\u0646\\u062c\\u0627\\u0633\\u062a \\u06a9\\u0647 \\u0628\\u0639\\u0636\\u06cc \\u0627\\u0632 \\u0645\\u0631\\u06cc\\u0636 \\u0647\\u0627 \\u0634\\u0626\\u0648\\u0631 \\u0627\\u06cc\\u0646\\u0648 \\u0646\\u062f\\u0627\\u0631\\u0646 \\u06a9\\u0647 \\u0645\\u0627\\u0633\\u06a9 \\u0628\\u0632\\u0646\\u0646\\u060c \\u062a\\u0627\\u0632\\u0647 \\u062a\\u0648 \\u062d\\u0644\\u0642\\u062a\\u0645 \\u0645\\u06cc\\u0627\\u0646 \\u0642\\u0634\\u0646\\u06af \\u0646\\u0641\\u0633 \\u0645\\u0628\\u0627\\u0631\\u06a9\\u0634\\u2026 https://t.co/CJCtfGnAg5',b'1232014211276034049',b'Muslim Girl',b'Muslim_Girl313',b'',b'\\u200f\\u06cc\\u0647 \\u062f\\u0647\\u0647 \\u0647\\u0634\\u062a\\u0627\\u062f\\u06cc \\u062c\\u0630\\u0627\\u0628\\U0001f609\\n\\u06cc\\u0647 \\u0622\\u062f\\u0645 \\u0645\\u0639\\u0645\\u0648\\u0644\\u06cc \\u0646\\u0647 \\u0642\\u062f\\u06cc\\u0633\\u0645 \\u0646\\u0647 \\u062a\\u0628\\u0647\\u06a9\\u0627\\u0631\\u060c \\u0647\\u0645 \\u06a9\\u0627\\u0631 \\u062e\\u0648\\u0628 \\u0645\\u06cc\\u06a9\\u0646\\u0645 \\u0647\\u0645\\u0645 \\u0645\\u0645\\u06a9\\u0646\\u0647 \\u0646\\u0627 \\u0622\\u06af\\u0627\\u0647\\u0627\\u0646\\u0647 \\u06a9\\u0627\\u0631 \\u0628\\u062f \\u06a9\\u0646\\u0645\\U0001f607\\n\\n\\nMuslim girl from Iran \\U0001f60a\\n\\nFallow=back \\U0001f609',b'157',b'203',b'1',b'155',b'1668',b'False',b'False',b'True',b'False',b'2020-01-13 18:57:50'
"b'2/2 \\nReuters witnesses saw outnumbered policemen mostly stand beside those backing citizenship law, a majority Hind\\u2026 https://t.co/OaWzcNzHWm'",b'1232014210869190656',b'\\U0001d649\\U0001d656\\U0001d659\\U0001d65a\\U0001d65a\\U0001d662 \\U0001d649\\U0001d656\\U0001d666\\U0001d66b\\U0001d65e \\U0001d649\\U0001d649\\U0001d65c',b'NadeemNaqviNNg',"b'Delhi, India'",b'If alphabets changed LISTEN will become SILENT and peace will be everywhere!',b'349',b'446',b'32',b'8352',b'1572',b'False',b'False',b'False',b'False',b'2010-09-24 06:08:48'
b'@mtfa_ as long as ur muslim misogyny will follow u. islam teaches misogyny',b'1232014207748648960',b'Sagan Carl',b'sagancarl33',b'',b'Not looking for followers. What i retweet is also for myself to read/watch later on or again.',b'34',b'48',b'0',b'248',b'4276',b'False',b'False',b'True',b'False',b'2019-03-17 19:11:26'
b'A Reuters witness saw at least one Muslim man and a burqa-clad woman beaten by dozens of pro-law protesters with st\\u2026 https://t.co/TogVjt4tNS',b'1232014207530471424',b'\\U0001d649\\U0001d656\\U0001d659\\U0001d65a\\U0001d65a\\U0001d662 \\U0001d649\\U0001d656\\U0001d666\\U0001d66b\\U0001d65e \\U0001d649\\U0001d649\\U0001d65c',b'NadeemNaqviNNg',"b'Delhi, India'",b'If alphabets changed LISTEN will become SILENT and peace will be everywhere!',b'349',b'446',b'32',b'8352',b'1572',b'False',b'False',b'False',b'False',b'2010-09-24 06:08:48'
b'@inside_context @Kritika_Kamra Dekh katuye pahle mc tum log desh ke leye kalank ho jis desh me Muslim hai us desh m\\u2026 https://t.co/G2yPbq7g1g',b'1232014206771159041',b'Aarav\\U0001f1ee\\U0001f1f3\\U0001f6a9',b'Gumnam21996100',b'',b'\\u092e\\u0941\\u0938\\u094d\\u0932\\u093f\\u092e \\u0926\\u0942\\u0930 \\u0930\\u0939\\u0947  \\u0928\\u0939\\u0940\\u0902 \\u0924\\u094b \\u092a\\u094b\\u0938\\u094d\\u091f \\u0926\\u0947\\u0916 \\u0915\\u0930 \\u0939\\u0930 \\u092a\\u0932 \\u092e\\u0930\\u094b\\u0917\\u0947 \\u0964\\u0938\\u0902\\u0938\\u094d\\u0915\\u093e\\u0930\\u0940 \\u092c\\u0939\\u0941\\u0924 \\u0926\\u0942\\u0930 \\u0930\\u0939\\u0928\\u093e \\u0917\\u094d\\u092f\\u093e\\u0928 \\u092f\\u0939\\u093e\\u0901 \\u092c\\u093f\\u0932\\u094d\\u0915\\u0941\\u0932 \\u092e\\u0924 \\u0926\\u0947\\u0928\\u093e \\u0964\\u092d\\u093e\\u0930\\u0924 \\u0915\\u0947 \\u0916\\u093f\\u0932\\u093e\\u092b \\u090f\\u0915 \\u0936\\u092c\\u094d\\u0926 \\u092d\\u0940 \\u092c\\u0930\\u0926\\u093e\\u0938 \\u0928\\u0939\\u0940\\u0902 \\u0915\\u0930\\u0942\\u0902\\u0917\\u093e \\u091c\\u092f \\u0939\\u093f\\u0902\\u0926 \\u091c\\u092f \\u092d\\u093e\\u0930\\u0924',b'227',b'296',b'0',b'1887',b'2351',b'False',b'False',b'True',b'False',b'2020-01-21 15:33:18'
"b""This is the reason behind #DelhiViolence , this is what hindus want, what BJP wants, Modi Ji's dream, a muslim free\\u2026 https://t.co/TLvfaBfE6n""",b'1232014206171521025',b'Junaid Ahmad dar',b'JunaidAhmaddar8',"b'Anantnag, Jammu And Kashmir'",b'BeingHuman_Student_NatureLover_TechEnthusiast. RTs are not endorsement.',b'7',b'122',b'0',b'139',b'459',b'False',b'False',b'True',b'False',b'2018-10-16 17:17:13'
b'No muslim is a terrorist.\\nNo muslim was a terrorist.\\nNo muslim be a terrorist ever.\\nCome out from fake propaganda o\\u2026 https://t.co/7DCi4QAbSY',b'1232014204636295171',b'Md.Meraj khan',b'merajuddin92',"b'india, Bihar'","b'Proud to b an ummati of muhammad sw,Leader,BPCC, dreams about hate free https://t.co/g3kcF2FGxg justice. Born to fight,wanna die as a shaheed, Inshallah.'",b'934',b'3590',b'11',b'40346',b'15786',b'False',b'False',b'True',b'False',b'2013-04-07 21:13:41'
"b'@MogliTadipar You brought in econmy, detention center, Assam, NRC everything in this conversation but,\\nstill escapi\\u2026 https://t.co/Sousi8UeEW'",b'1232014199238352896',b'Unspoken',b'Unspoke08658020',b'India',"b'Nothing special,\\nJust unspoken opinions.'",b'0',b'16',b'0',b'292',b'48',b'False',b'False',b'True',b'False',b'2019-08-01 09:34:47'
b'@FaithlessAlbion @DavidLammy Did you not read my previous tweet? Who do you think will be the law in the communitie\\u2026 https://t.co/aluReEkxHr',b'1232014195392221191',b'Neil Trebble',b'trebbsy',"b'Saint Neots, England'","b'Part time Radio pundit, ex soldier ex footballer ex Teacher, business owner, Brexiteer with a Polish partner. A Patriot not a racist. Views all my own honest'",b'959',b'1462',b'3',b'2870',b'5147',b'False',b'False',b'True',b'False',b'2014-09-06 06:35:12'
b'@RohitKesari2 @SevadalWB 5 muslim ppl killed by  ppl who were chanting jai shree ram and bharat mata ki jay... poli\\u2026 https://t.co/cN01k2PqZI',b'1232014193970204672',b'ansari',b'ansari99833602',b'',"b'lecturer, research scholar ( proud to b muslim)'",b'4',b'158',b'0',b'285',b'195',b'False',b'False',b'True',b'False',b'2017-09-21 18:07:38'
"b'@DuttYogi Sir, you are role model for many.\\n\\nBut a big request please stop spreading such news because both pro and\\u2026 https://t.co/THxmf4yvii'",b'1232014186391142402',b'nayan agrawal',b'nayanagrawal',"b'New Delhi, Delhi'","b'talent acquisition @heromotocorp, formerly IR manager @ heromotocorp, cricket lover, #digital world, #economy #startup world # family'",b'161',b'573',b'9',b'495',b'1259',b'False',b'False',b'True',b'False',b'2009-08-27 20:21:59'
"b'@toniboyy @commondreams Except for the Muslim minorities in India along with the Sikhs, Jainists, Christians and others...'",b'1232014182930882560',b'Diego',b'CountDVB',b'',b'Mexican-American democratic socialist humanist',b'229',b'197',b'3',b'89800',b'9368',b'False',b'False',b'False',b'False',b'2010-09-06 01:05:28'
b'@suhasinih @shoaibalam07 Kejriwal ko bolo agar aap ke Muslim mla se appeal karenge to wo log manenge un mla ki nat',b'1232014164349992960',b'Reshu',b'Reshu72511262',b'',b'',b'65',b'93',b'0',b'6570',b'2977',b'False',b'True',b'True',b'False',b'2019-03-02 10:09:06'
"b'@kafiradikal Sdah lompat pagar buknya minta maaf malh bikin rame ,kan pekok tuh orang.....liat kata pnutupnya di tw\\u2026 https://t.co/FECNzNJLFa'",b'1232014157806882816',b'Gue',b'ciprutciprut6',b'cikupa',"b'selow woles ,dalam menjalani hidup.'",b'348',b'763',b'1',b'11653',b'11415',b'False',b'False',b'True',b'False',b'2015-10-04 23:15:36'
b'@Reuters Nonsense... Is he a Muslim man?',b'1232014157031014401',b'Heeng Goli',b'gaurav1392',b'',"b'KNOWS TOO MUCH , SPEAKS TOO LESS. Tweets and RTs are personal opinions.'",b'109',b'280',b'4',b'10466',b'14148',b'False',b'False',b'True',b'False',b'2012-05-26 12:19:10'
b'@SabinaBasha @rjfahad Muslim itny buzdil q hen?',b'1232014147245805568',b'Junior',b'iba_313',b'',b'',b'7',b'518',b'0',b'31',b'15',b'False',b'True',b'True',b'False',b'2019-12-26 15:13:16'
b'@AndrewAmsan @Reuters #Radical_Islamic_terrorist \\n#Muslim_are_not_Minority they are 2nd largest religion in India.\\u2026 https://t.co/AfXEqw5gMA',b'1232014146717220866',b'\\u09b8\\u09cc\\u09ae\\u09bf\\u09a4\\u09cd\\u09b0 \\u09ad\\u099f\\u09cd\\u099f\\u09be\\u099a\\u09be\\u09b0\\u09cd\\u09af\\u09cd\\u09af \\U0001f1ee\\U0001f1f3',b'soumitra_bhatt',"b'Agartala, India'",b'',b'10',b'237',b'0',b'322',b'308',b'False',b'False',b'True',b'False',b'2014-01-23 09:17:11'
"b""@_sabanaqvi The term 'Muslim Areas' itself says a lot !!!""",b'1232014145446404096',b'Vinay Pujari',b'vinaypujarigwl',b'Nottingham (UK) /Gwalior (IND)',"b'CRM Product Consultant with a MNC & Keen Observer of Indian Politics.\\nTo know more about me, read my blogs !'",b'645',b'1159',b'17',b'2939',b'2796',b'False',b'False',b'True',b'False',b'2014-04-05 15:47:56'
b'A picture of a Muslim human being brutally beaten up by fellow humans of RSS in Delhi today.#DelhiViolence https://t.co/qhJWUMYny7',b'1232014138244812800',b'Farhan',b'Sheraza47405017',"b'\\u06af\\u0648\\u062c\\u0631\\u0627\\u0646\\u0648\\u0627\\u0644\\u06c1, \\u067e\\u0627\\u06a9\\u0633\\u062a\\u0627\\u0646'",b'',b'17',b'40',b'0',b'804',b'1038',b'False',b'False',b'True',b'False',b'2017-03-04 14:39:30'
b'@ANI Godse ki aulaad\\n\\nNaam suna nahi ki\\nHindu muslim shuru kar diya',b'1232014138043486208',b'ROHIT KUMAR',b'Rohitksonkar',b'',b'Ex Modi fan....',b'114',b'69',b'0',b'16353',b'36413',b'False',b'False',b'True',b'False',b'2014-12-17 21:53:40'
b'@SidrahDP I am having same feeling of anger and helplessness. Inshallah we will emerge more stronger as sahabah did\\u2026 https://t.co/vl3ShbJ1r9',b'1232014130388688903',"b""'Democracy' my ass""",b'HeTheRebel',b'Lynchinistan',b'Musanghi=Muslim+Sanghi Please upvote \\U0001f447 https://t.co/12kvKISnYP',b'98',b'236',b'0',b'34363',b'22828',b'False',b'False',b'True',b'False',b'2019-06-21 15:44:30'
b'@YashMeghwal @RahulGandhi Muslim Peaceful protesters who are killing police Hindus n Sikhs',b'1232014126043389952',b'Indian Rise',b'IndianRise',b'',"b'my country rises from centuries of slavery to build itself into a strong, tolerant and prosperous nation.'",b'11',b'213',b'0',b'439',b'596',b'False',b'False',b'True',b'False',b'2020-01-24 22:31:20'
"b'@HerNameIs_Bea @NC_CyberLaw @TwitterSafety if  there is no muslim,there is crime  \\nthe whole world do not denied of\\u2026 https://t.co/k6er3wuHoh'",b'1232014125368299520',b'Pcaccesspk',b'pcaccesspk',b'Lahore',b'Games Games And Games',b'44',b'503',b'0',b'139',b'239',b'False',b'False',b'True',b'False',b'2020-01-15 14:26:23'
b'Don\\u2019t blame only Kapil Mishra for anti-Muslim riots in Delhi. BJP is punishing people of Delhi for not voting for t\\u2026 https://t.co/wq6GwgvOoM',b'1232014123514388481',b'Asheem PK',b'peekeymon',b'',b'newspaper boy',b'1039',b'719',b'3',b'5869',b'25159',b'False',b'False',b'False',b'False',b'2011-11-04 08:49:41'
