"b""@winkkoo I'm Muslim no relationship out of marriage  and I'm not sad about this I feel fine not a big deal""",b'1232086942499647488',b'rayjkyan\\U0001f49b\\U0001f407\\u06677\\u2077\\u0633\\u062a\\u0631\\u064a\\u0645 ego',b'jk7Rayan99bts',b'\\u0633\\u0644\\u0637\\u0646\\u0629 \\u0639\\u0645\\u0627\\u0646',b'\\u200f\\u200f\\u200f\\u200f\\u200f\\u200f\\u0627\\u0644\\u062d\\u0645\\u062f \\u0627\\u0644\\u0644\\u0647 \\u0627\\u0644\\u0630\\u064a \\u062c\\u0639\\u0644\\u0646\\u064a \\u0645\\u0646 \\u0627\\u0644\\u0645\\u0633\\u0644\\u0645\\u064a\\u0646\\nl am a fan for bts \\nkpop',b'204',b'314',b'2',b'5748',b'4423',b'False',b'False',b'True',b'False',b'2018-05-08 15:56:09'
b'#twittercats #CatsOnTwitter #CatsOfTwitter #MondayMotivation #MondayMood. N before u slag me off... I speak as a Mu\\u2026 https://t.co/rct3ApSbeK',b'1232086906139181057',b'LadyTruth who knows not that much \\U0001f914\\U0001f644\\U0001f44d',b'LadyTruth11',"b'London, England'",b'Mad \\U0001f640 lady..... Just mad cat person. Loves animals n humans who r kind to them. Fierce defender of abused n neglected.....',b'1300',b'1858',b'3',b'6594',b'1664',b'False',b'False',b'True',b'False',b'2019-02-20 18:34:06'
b'@ReallySwara @DelhiPolice Why the police is in civil dress or they Hindu or Muslim',b'1232086884425269248',b'Umar Farooq',b'mepetriotic',"b'Quetta, Pakistan'",b'I follow human who do care about humanity and doesnt care about politics\\nJournalist columnist social worker',b'278',b'67',b'1',b'8122',b'298',b'False',b'False',b'False',b'False',b'2013-01-02 09:40:44'
b'@PressTV Anti Muslim',b'1232086882470723584',b'Hdstrakhi',b'hdstrakhi',b'',b'Hussain D Silwa Town North Nazimabad Karachi',b'91',b'1580',b'0',b'6484',b'11916',b'False',b'True',b'True',b'False',b'2019-03-06 09:52:42'
b'Sanders wins endorsement of top Muslim group | TheHill https://t.co/3CZnU4ZCvQ',b'1232086868575113217',b'Lyle Klich\\u274c',b'LyleKlich',b'',"b'Conservative Rep, pro Israel, anti #ObamaClintonCabal #Qanon #MAGA #KAG . Interior Designer #MAGA #TrumpTrain #Deplorables #HillaryforPrison #FBICorruption'",b'15970',b'15939',b'326',b'438924',b'140639',b'False',b'False',b'True',b'False',b'2012-04-21 15:30:31'
b'Bgmn ketika muslim sebagai minoritas.  @GPAnsor_Satu ? https://t.co/7JGY1i0bWa',b'1232086830691934208',b'Gus-sah salam yg aneh aneh',b'jacktherock5',b'',b'i read infoh for dakwah',b'382',b'329',b'0',b'8199',b'4199',b'False',b'False',b'True',b'False',b'2019-06-10 14:46:24'
b'Old America Hating Communist Sanders wins endorsement of top Muslim group | TheHill ... #BernieIsACommunist #Bernie\\u2026 https://t.co/4wfXAqc9RX',b'1232086827403816963',b'Lyle Klich\\u274c',b'LyleKlich',b'',"b'Conservative Rep, pro Israel, anti #ObamaClintonCabal #Qanon #MAGA #KAG . Interior Designer #MAGA #TrumpTrain #Deplorables #HillaryforPrison #FBICorruption'",b'15970',b'15939',b'326',b'438924',b'140639',b'False',b'False',b'True',b'False',b'2012-04-21 15:30:31'
"b'Apparently ""practical Judaism"" means helping AIPAC actively steer US foreign policy in an anti-Muslim direction? https://t.co/jDwnKDX9am'",b'1232086774513618947',b'Steve Phillips',b'elimisteve',"b'San Francisco, CA'","b'Thinker & doer. Founder, @EffectiveAF: Making activists 10x more powerful via action-oriented communities & autonomous software. Join: https://t.co/g0rit5c2Iu'",b'1928',b'3194',b'111',b'7944',b'7409',b'False',b'False',b'True',b'False',b'2007-11-20 04:20:15'
"b'@ParkerMolloy @tedcruz Black?? You think we\\u2019re \\u201ctriggered\\u201d that she\\u2019s BLACK?? Or Muslim? No you don\\u2019t, and neither\\u2026 https://t.co/Bk0LNtqkY8'",b'1232086748068536320',b'Independent2020',b'BSNJDInTX',"b'Texas, USA'",b'',b'12',b'41',b'0',b'612',b'452',b'False',b'False',b'True',b'False',b'2018-05-15 00:07:14'
b'@ICYTWAT I be just thankin him for being awake and healthy. Grew up muslim but not i am really religious.',b'1232086747980423168',b'Hustoosleepy',b'Hustoosleepy',b'',b'Too weird to live/Too rare to die',b'188',b'652',b'1',b'8562',b'28583',b'False',b'False',b'True',b'False',b'2013-08-07 12:18:24'
b'@KhanG34689247 @GulBukhari Muslim societies deserve to be in the state they are',b'1232086746290171909',b'TarzanKiWapsi',b'TarzanKiWapsi',b'',"b'""One must live the way one thinks or end up thinking the way one has lived.""\\n- Paul Bourget'",b'68',b'1395',b'0',b'4156',b'3422',b'False',b'True',b'True',b'False',b'2018-10-29 03:17:34'
"b'#DelhiPoliceWithBhagwaTerror \\nkeita muslim david moyes north east delhi abhsar\\nLikeHumanSoul,1God is invisible poin\\u2026 https://t.co/7DaqJv7hJ5'",b'1232086732641730560',b'rs',b'rs48659383',b'',"b'Quran:24.35&Bible:John1:5-9&Gita:Chapter 6,12&RIGVEDA,10:48,5, Buddhism, Sikhism etc.All tells same""God is light"".Like human soul God is invisible point light.'",b'2',b'0',b'0',b'564',b'1',b'False',b'False',b'True',b'False',b'2019-10-12 16:38:37'
b'#SahamAkhirat: Kami membuka peluang untuk sesiapa sahaja untuk bersama kami menaja tidak kira berapa nilainya bagi\\u2026 https://t.co/5hsuldbCfo',b'1232086713012387840',b'Volunteer MISI7',b'VMisi7',"b'Petaling Jaya, Selangor'",b'',b'542',b'25',b'5',b'7026',b'769',b'False',b'False',b'True',b'False',b'2016-01-21 13:32:59'
b'@nitinkjain @narendramodi @AmitShah @ArvindKejriwal They want shariya rules in India. \\n\\nCan you tell me any single\\u2026 https://t.co/tOuopOZcDZ',b'1232086706297417728',b'Sunil Bhardwaj',b'sksbhardwaj',b'Mahadev ke charno main ',b'Mahadev bhakt & I love \\U0001f33f\\U0001f343nature.',b'228',b'182',b'5',b'21488',b'11910',b'False',b'False',b'True',b'False',b'2009-09-14 01:50:01'
"b'@IlhanMN Glad you left ""American"" out bc you really really aren\'t and need to be deported like yesterday. You aren\'\\u2026 https://t.co/fQE3MZjMNO'",b'1232086698185588737',b'Ck',b'lavindir75',b'',b'Mex Amer/MAGA/offended by trans anything/illegal crossing=BAD PARENTING!!! B.T.W.!!!',b'1417',b'392',b'2',b'64084',b'72382',b'False',b'False',b'False',b'False',b'2017-01-27 01:27:38'
b'@nonamehombre @TrumpGirlOnFire Church bells greatly differ from speakers blasting the Islamist Call to Prayer.\\n1A:\\u2026 https://t.co/1wiL0UmXGE',b'1232086625540354050',b'Cindy Stuart',b'CindyStuart15',"b'Tuscumbia, AL'","b""I'm back; deciding for now. Had deleted but old BF had my info & put it back. Not looking for followers as I may not stick around.""",b'766',b'157',b'11',b'41608',b'26555',b'False',b'False',b'True',b'False',b'2012-11-03 04:11:21'
b'STILL MY MUSLIM KING JUNGKOOK I KISS UR FEET https://t.co/Od0NeB2EGk',b'1232086612768690177',b'\\uc2dc\\ucc28 \\u2077',b'itboykook',b'',b'\\u201cstop making everything about My Time\\u201d no... i don\\u2019t think i will \\U0001f914',b'2379',b'169',b'13',b'10779',b'6415',b'False',b'False',b'True',b'False',b'2019-06-02 03:17:07'
"b'@saltyreign The Muslim religion does not commemorate such events, so out of respect we should not do anything to ma\\u2026 https://t.co/x6wa07WsRP'",b'1232086607454515200',b'\\U0001f3f3\\ufe0f\\u200d\\U0001f308\\U0001f4a7\\U0001f49aSofia \\U0001f3f3\\ufe0f\\u200d\\U0001f308\\U0001f4a7\\U0001f49a',b'pulpyfictorious',b'',b'#RightWing #MAGA #Conservative #ProLife #USA #patriot #Trump2020 #BuildTheWall #AbortionIsMurder #nzpol #auspol #UK #Brexit  #LatinosForTrump #BLEXIT #KAG2020',b'3701',b'4281',b'13',b'28490',b'38642',b'False',b'False',b'True',b'False',b'2018-10-14 06:14:19'
"b'Bernie has a scheduling conflict the evening of the AIPAC conference, he will be appearing at a Muslim Brotherhood\\u2026 https://t.co/qhjfQyUj4s'",b'1232086604229021696',b'Scott Wheeler',b'GOPTrust',b'Washington D.C.',"b'Author, former journalist, television producer/correspondent/veteran, U.S. Army/ executive director, the National Republican Trust pac'",b'1189',b'1060',b'32',b'10581',b'213',b'False',b'False',b'False',b'False',b'2010-09-16 14:18:47'
b'@yettiaka Anda  muslimah?..kok anda tdk tahu jilbab syariat..apalagi mesjid tempat plg suci bagi muslim.non muslim\\u2026 https://t.co/LJ7VJb6H8P',b'1232086590027026434',b'Paijo',b'paijomarkojo',b'Aceh - medan..',"b'Semua bakal jadi kisah,sejarah dan proses...'",b'38',b'48',b'0',b'414',b'20',b'False',b'False',b'True',b'False',b'2013-05-31 13:36:59'
"b'Kadang sikap kalian yang suka mengkufurkan sesama Muslim, membuat sebagian Muslim jengah.\\n\\nhttps://t.co/utqWnIPOV6'",b'1232086575384649729',b'Annisa SAFANTA',b'safanta92',"b'Jakarta, ID'",b'I can\\u2019t conceive. cashtag: $safanta makasih! \\U0001f339',b'1362',b'975',b'7',b'88684',b'1557',b'False',b'False',b'False',b'False',b'2009-07-01 16:44:53'
"b'Serial Fiqh Zakat (Bag. 1):: Pengertian, Keutamaan dan Hukum Zakat https://t.co/2SIBmxmHqM'",b'1232086569470742529',b'Cilik-Cilik Tuo',b'TuyulMuslim',b'',b'Siap gondol uang para rentenir & koruptor | Suka main ikan hias di kolam depan rumah',b'237',b'73',b'1',b'5733',b'1',b'False',b'False',b'False',b'False',b'2013-11-16 11:04:38'
"b'Serial Fiqh Zakat (Bag. 1):: Pengertian, Keutamaan dan Hukum Zakat https://t.co/FSWrEsJsqU https://t.co/4y5dg2jYji'",b'1232086568363409408',b'Nur',b'nursetya7878',b'Indonesia',b'Hamba Allah yang selalu sehat dan bahagia... hari ini harus lebih baik dari kemaren.',b'425',b'745',b'2',b'21712',b'5814',b'False',b'False',b'True',b'False',b'2012-10-30 21:18:52'
"b'Serial Fiqh Zakat (Bag. 1):: Pengertian, Keutamaan dan Hukum Zakat https://t.co/uO0rFQDDYC'",b'1232086568036265984',b'BuatMuslim',b'Buat_Muslim',b'Bumi Allah ',b'',b'2621',b'1519',b'1',b'3803',b'13',b'False',b'False',b'False',b'False',b'2013-07-22 02:11:38'
"b'Serial Fiqh Zakat (Bag. 1):: Pengertian, Keutamaan dan Hukum Zakat https://t.co/cfdoayhIOw https://t.co/yLO9AWo6qP'",b'1232086567105118208',b'Jawa Muslim',b'JawaMuslim',b'Indonesia',b'Jawa Muslim Sejati yang ingin selalu menapaki kebenaran dalam hidup.#Jawa #Islam #Ilmu #Amal sesuai dengan Al Quran dan Assunnah.',b'18',b'49',b'1',b'3505',b'0',b'False',b'False',b'True',b'False',b'2015-01-08 06:11:21'
"b'Serial Fiqh Zakat (Bag. 1):: Pengertian, Keutamaan dan Hukum Zakat https://t.co/n6dCBo5dns https://t.co/B3HYNb5nui'",b'1232086567054823425',b'amir abdullah',b'amierabdu',b'bengkulu city',b'Just for dakwah .\\nfind us :\\nFacebook : @amirabdu07\\nFanpage FB : @amierabdoe\\nTwitter : @amierabdu\\nIg : @amierabdu',b'83',b'202',b'0',b'4965',b'4',b'False',b'False',b'False',b'False',b'2015-02-08 04:47:23'
"b'Serial Fiqh Zakat (Bag. 1):: Pengertian, Keutamaan dan Hukum Zakat https://t.co/8kHSWStOYZ https://t.co/YJyRp3nCDe'",b'1232086565494521856',b'HijabStuffs',b'HijabStuffs',b'Tangerang',b'Cadar \\u2022 Niqab \\u2022 Purdah \\u2022 Handsocks \\u2022 Gloves \\u2022 Socks \\u2022 Gamis Al Hauraa || WA +6282210124234 \\u2022 Line: @hijabstuffs',b'1903',b'16',b'4',b'10712',b'10',b'False',b'False',b'False',b'False',b'2011-10-01 09:53:48'
b'\\u201ea muslim terrorist\\u201c......ausl\\xe4ndische Presse wei\\xdf mehr. \\u2066@DJVde\\u2069 ist am Ende https://t.co/5mbyN61vcr',b'1232086554941820928',b'Klarname G.G\\xf6sebrecht',b'GGosebrecht',b'Weltweit',b'Mit der Zensur begann die Suche nach subtileren Mitteln der Unterdr\\xfcckung von Meinungen und Informationen.',b'293',b'189',b'6',b'5807',b'14131',b'False',b'False',b'True',b'False',b'2015-10-15 16:59:13'
b'@seanstormV4 @nutn2dowichu now u wanna be Muslim u kuff',b'1232086553318522880',b'\\u2122\\ufe0f',b'ReformedTKB',b'',b'Wholesome man tweeting football | MbappeHive',b'64',b'63',b'0',b'81',b'34',b'False',b'False',b'True',b'False',b'2020-02-24 22:17:44'
"b'\\u201cHis Name Is Shahrukh, a Muslim, and he is a terrorist\\u201d https://t.co/F6p5K10aOl'",b'1232086551083003914',b'Leo \\u0938\\u0942\\u0930\\u094d\\u092f\\u0935\\u0902\\u0936\\u0940\\U0001f4af\\U0001f1ee\\U0001f1f3',b'TheSuryavanshi',"b'Chicago, IL'","b'\\u0913\\u092e\\u094d \\u0924\\u094d\\u0930\\u092f\\u0902\\u092c\\u0915\\u092e \\u092f\\u091c\\u093e\\u092e\\u0939\\u0947 \\u0938\\u0941\\u0917\\u0902\\u0927\\u093f\\u092e\\u094d \\u092a\\u0941\\u0936\\u094d\\u091f\\u093f\\u0935\\u0930\\u094d\\u0927\\u0928\\u092e\\u094d, \\u0909\\u0930\\u094d\\u0935\\u093e\\u0930\\u0942\\u0915\\u094d\\u092e\\u0947\\u0935 \\u092c\\u0902\\u0927\\u0928\\u093e\\u0928\\u094d \\u092e\\u094d\\u0930\\u093f\\u0924\\u094d\\u092f\\u0941\\u0930\\u094d\\u092e\\u0941\\u0915\\u094d\\u091b\\u093f \\u0905\\u092e\\u093e\\u092e\\u094d\\u0930\\u0924\\u093e\\u0924\\u094d \\u0964 \\u0926\\u0947\\u0935\\u093e\\u0927\\u093f\\u0926\\u0947\\u0935 \\u092e\\u0939\\u093e\\u0926\\u0947\\u0935 \\u0936\\u093f\\u0935 \\u0936\\u0902\\u0915\\u0930 \\u0906\\u092a\\u0915\\u093e \\u0915\\u0932\\u094d\\u092f\\u093e\\u0923 \\u0915\\u0930\\u0947'",b'5540',b'5154',b'1',b'4337',b'3815',b'False',b'False',b'False',b'False',b'2011-02-03 06:39:35'
"b""@ire_eireann Ireland has a cultural Marxist oligarchy like the UK's LibLabCon.   Even the laughably nationalist Sin\\u2026 https://t.co/G6YVIEtAMN""",b'1232086543898152960',b'Brian Williams',b'BGwilyms',b'',b'',b'326',b'516',b'1',b'21169',b'14416',b'False',b'False',b'True',b'False',b'2017-04-26 15:25:35'
"b'@rabia_ejaz 01\\n\\nI would rather look at our society through the eyes of Muslim woman who is alive, i.e. you; than a\\u2026 https://t.co/XrHAPG2YXB'",b'1232086517226455040',b'Phony-Tolerance',b'PhonyTolerance',b'Cyberville',"b""Brain's more gooey than entrails.""",b'91',b'1438',b'0',b'139',b'20',b'False',b'False',b'True',b'False',b'2019-04-19 00:33:34'
"b'""Barangsiapa Allah menghendaki baik maka Dia memberikan kepahaman kepadanya (hamban-Nya) tentang agama"" (HR. Al-Bukhari Dan Muslim)'",b'1232086506874929152',b'Terjemah Hadits',b'TerjemahHadits',b'Indonesia',b'kalimat paduan untuk hidup lebih baik :)',b'3798',b'22',b'11',b'110532',b'0',b'False',b'False',b'False',b'False',b'2013-06-06 19:06:50'
"b'Sir hats off to you, as soon as they realised thata they are gonna be on trouble. Muslim started there real motive\\u2026 https://t.co/uib3bJiL3L'",b'1232086503628693504',b'Kapil',b'Kapil76643848',b'',"b""If secularism is fashion than i'm not fashionable. If being Hindu is communal than i'm communal.if being communist is modern than i'm not modern.Vande Mataram.""",b'5',b'10',b'0',b'612',b'840',b'False',b'True',b'True',b'False',b'2019-06-08 09:32:08'
b'@Ayahanda_MD @KhalidSamad @RameshRaoAKS @mijjemije @Alamurni @fikhwanBait @NajibRazak @umnoonline @PASPusat\\u2026 https://t.co/AP8sQwiVPR',b'1232086500042391554',"b'A KONTAR Yusup MBA , AR, UW-Madison, USA, BIG 10'",b'kontarOP',"b'57000 Kuala Lumpur, MALAYSIA'","b'Design Thinking; Productisation 4 Commercialisation; Facilitation 4 Bus/Marketing Plan; UWisconsin, UArkansas. Consulting AND Training forumaxservices@gmail.com'",b'2168',b'2703',b'16',b'32788',b'1128',b'False',b'False',b'True',b'False',b'2012-02-02 15:01:51'
"b""@Mike2020 Why haven't you apologized for violating the civil rights of the Muslim community of NY? You're the total\\u2026 https://t.co/DrijriScqY""",b'1232086497039388674',b'maximumjoy\\U0001f3f3\\ufe0f\\u200d\\U0001f308\\U0001f1f5\\U0001f1f7\\U0001f1ee\\U0001f1f9\\U0001f1e6\\U0001f1f7',b'minimum_waste',b'',b'nuyorrique\\xf1x queer #coops #blockchain #p2p #socialenterprise #postscarcity #postescasez #antiimperalismo #antiracismo #antifacist',b'669',b'2491',b'22',b'13497',b'49565',b'False',b'False',b'False',b'False',b'2011-11-03 00:30:46'
b'@patriot_memin @vimalmishra88 @RenukaJain6 @DelhiPolice @CPDelhi @HMOIndia @AmitShah @narendramodi @PMOIndia One ki\\u2026 https://t.co/9QgfpEpanI',b'1232086493788807168',b'SwePost',b'sweposten',"b'Hyderabad, India'","b'The greatest crime in a history is Not a WAR, It is Our \\U0001f910 Silence.'",b'1408',b'847',b'9',b'15135',b'20193',b'False',b'False',b'False',b'False',b'2018-04-14 20:23:47'
b'Bloomberg Ran Police Style Surveillance Operations On Muslims.  https://t.co/rJOkjG1Ncy',b'1232086476789338113',b'Nationalist MAGA & Tactical Martial Arts Sensei',b'Alexbobby2262C',"b'North Bethesda, MD'","b'Private Martial Arts Instructor, Handgun, Edged Weapons & knife katas, 3% ers, Proud Boys, Blue Lives, Molon Labe, MAGA, Vet Company & Fu*k ANTIFA Commie Trash.'",b'2934',b'4426',b'13',b'34949',b'9233',b'False',b'False',b'True',b'False',b'2013-03-08 11:23:53'
b'@MzPoliTweetz @smtravis @Fla_Mom @DeAngelisCorey @JenVanderputten @Bethany11588401 @AustenErblat @AMarranara\\u2026 https://t.co/A2DZrixp6d',b'1232086449576525825',b'Jason Bedrick',b'JasonBedrick',"b'Phoenix, Arizona, USA'",b'Director of Policy at @EdChoice. The views expressed here are my own. #schoolchoice #edreform #edchoice #scw',b'4260',b'3097',b'152',b'18678',b'13305',b'True',b'False',b'False',b'False',b'2010-03-14 20:44:57'
"b""'The Middle East is in many ways the perfect place to spawn a #pandemic, experts say, with the constant circulation\\u2026 https://t.co/65ydpgdcuZ""",b'1232086445386543105',b'Kendall Harmon',b'KendallHarmon6',"b'Summerville, S.C.'","b'Theology, Religion and Culture, Economics, Anglicanism, Science and Technology'",b'1539',b'2466',b'257',b'51998',b'606',b'False',b'False',b'True',b'False',b'2013-11-13 14:15:15'
"b'@paragp @vimalmishra88 @RenukaJain6 @DelhiPolice @CPDelhi @HMOIndia @AmitShah @narendramodi @PMOIndia One killed, d\\u2026 https://t.co/hIEPbdeqEx'",b'1232086439233499136',b'SwePost',b'sweposten',"b'Hyderabad, India'","b'The greatest crime in a history is Not a WAR, It is Our \\U0001f910 Silence.'",b'1408',b'847',b'9',b'15135',b'20193',b'False',b'False',b'False',b'False',b'2018-04-14 20:23:47'
b'If this is the case @patel4witham then why has an act of TERRORISM against a peaceful Muslim man been disregarded a\\u2026 https://t.co/FW5YK5diyZ',b'1232086393276522496',b'Sutton&CheamLabour',b'SuttonCheamCLP',"b'Sutton, Cheam, & Worcester Pk'",b'Labour Party in Sutton & Cheam #ItsTime our community had a Labour voice. \\U0001f339 https://t.co/vbWxb5FqMM',b'787',b'607',b'13',b'2388',b'2359',b'False',b'False',b'False',b'False',b'2010-10-11 23:58:58'
"b'@etammooR @LastWeekTonight @HBO @POTUS Hindu mob beating Muslim man, just because he is a Muslim and against CAA NRC and NPR'",b'1232086342898552832',b'Mohd Sadiq \\u0645\\u062d\\u0645\\u062f \\u0635\\u0627\\u062f\\u0642 \\U0001f1ee\\U0001f1f3',b'Mohd_sadiq92',b'',b'\\U0001f91f',b'64',b'103',b'0',b'4550',b'7533',b'False',b'False',b'True',b'False',b'2018-04-12 12:28:58'
"b'She was talking about things that easily trigger other people, and being an American does not trigger people like b\\u2026 https://t.co/5wEnsLoaY2'",b'1232086334971334656',b'meena sarwar',b'_meeenaaa',b'',b'ig: meenasarwar',b'153',b'114',b'2',b'2550',b'3749',b'False',b'False',b'True',b'False',b'2014-03-10 03:58:38'
b'As someone who organized around both Stop &amp; Frisk and Muslim Surviellance in 2011 I can assure you this is 100% fal\\u2026 https://t.co/aRabh5K8NF',b'1232086327128096768',b'Will \\u2018The Mandalorian\\u2019 Gir\\xf3n a.k.a Hamz',b'hamzgiron',"b'Queens, the foundation '",b'@ShahanaFromBK for City Council | Alum: @mvmtschool | Born & bred New Yorker | Psychonaut | Luke Skywalkin on these haters.',b'705',b'555',b'13',b'9255',b'11410',b'False',b'False',b'False',b'False',b'2009-12-18 03:20:17'
b'@random_inanity @smart_fool @ishkarnBHANDARI @PadmajaJoshi CAA for three countries. Why??? Because Muslim Majority\\u2026 https://t.co/qS8kblYr6J',b'1232086325626466306',b'Neeraj Mishra',b'intel_neeraj',b'',b'',b'18',b'80',b'0',b'405',b'100',b'False',b'True',b'True',b'False',b'2009-09-20 16:25:01'
"b'@Ndhra_a @__lr0M0rl__ @DukeCondet @yettiaka @adiazhari Yang bgmn? Yg kek twit lu ini? Sebelum lu ngetwit bgni, udeh\\u2026 https://t.co/lNjMRAAG3B'",b'1232086324623994880',b'\\u039bY\\u01acI\\u0389D\\u039b \\u04e8\\u0389\\u04e8\\u042fG\\u0426\\u041f',b'Adhit_1909',b'Indonesia',b'Allah - Rasullullah - Family - friends | #AntiJILSyiah dkk | #Tripoter | #mufc #juventus |',b'1291',b'723',b'12',b'57206',b'89855',b'False',b'False',b'False',b'False',b'2009-07-31 12:18:24'
"b'@JacquiDillon His chained to the bed...we have to produce at least 50 kids by 2030, there is Muslim takeover u know!'",b'1232086318089461760',b'RepStar',b'RepiakaMoni',"b'England, United Kingdom'","b'Muslim British Bangladeshi, daughter,mum, wife & solicitor. Views expressed are my own & Retweets are not endorsements- may or may not even agree with them!'",b'1070',b'739',b'6',b'24784',b'23105',b'False',b'False',b'True',b'False',b'2015-03-23 22:16:15'
"b'@PuteriSrimaya ""Janganlah engkau meremehkan kebaikan sekecil apapun, walaupun itu berupa cerahnya wajahmu terhadap\\u2026 https://t.co/TOBm11g6Vx'",b'1232086310703124480',b'\\u039b\\u1102BI\\u042f\\u0426\\u041f\\u04e8V',b'albirunov',b'di atas bumi',"b""\\U0001f194 #akunbaru lagi.\\n\\U0001f53b Makhluk dhoif yang sedang belajar 'Hidup' agar lebih HIDUP\\U0001f53a""",b'35',b'57',b'0',b'302',b'617',b'False',b'False',b'True',b'False',b'2019-10-07 06:17:42'
"b'The man in the picture is Indian PM Narendra Modi, once banned from entering the US because of his role in the 2002\\u2026 https://t.co/Uicd316Fbz'",b'1232086306068598785',b'Gigi the Crazy',b'DeyoungGigi',"b'Appleton, WI'","b'In the words of Katharine Hepburn, I\\u2019m just an \\u2018old character\\u2019'",b'261',b'344',b'1',b'4911',b'6836',b'False',b'False',b'True',b'False',b'2019-09-09 04:02:38'
b'Da Chang Muslim Cultural Center in #China Reflects a sanctuary that shows people both the brilliant Islamic culture\\u2026 https://t.co/6UOUeD7ptg',b'1232086293120790529',b'NADIA',b'naddesignz',b'london',"b""\\U0001f4d0Interior Designer & Stylist | Blogger \\nLet's design spaces that reflects you.""",b'159',b'208',b'24',b'1673',b'3035',b'False',b'False',b'False',b'False',b'2014-06-09 10:12:30'
b'@IlhanMN What Muslim ban???',b'1232086251353735169',b'Michael Larocque',b'Michael79L',b'',b'',b'8',b'46',b'0',b'105',b'111',b'False',b'False',b'True',b'False',b'2017-12-19 02:42:50'
b'I want to convert to islam and become a Muslim !!!!!',b'1232086241031544832',b'xx',b'heroinboy666',"b'San Francisco, CA'",b'',b'417',b'694',b'0',b'1923',b'2204',b'False',b'False',b'True',b'False',b'2013-11-20 20:43:36'
b'@MirchiSayema Yes. The way kashmiri pandit minorities were taken care by the muslim majority. The women were taken care safely especially.',b'1232086232768765952',b'\\u0930\\u0919\\u094d\\u0917\\u093e \\u0bb0\\u0b99\\u0bcd\\u0b95\\u0bbe \\u0d30\\u0d19\\u0d4d\\u0d15\\u0d3e Renga',b'SanathanaDharm3',b'',b'Nation First! Bharath my karma bhoomi# Jai Hind #\\nKerala born Chennaite! Love Bharath!',b'73',b'440',b'0',b'1666',b'86',b'False',b'False',b'True',b'False',b'2019-12-22 02:42:46'
b'https://t.co/LsFPJB54Ee\\n\\n@realDonaldTrump \\n@POTUS\\n@FLOTUS\\n@WhiteHouse\\n@USAndIndia\\n@USAmbIndia\\n@UN\\n@UNHumanRights\\u2026 https://t.co/FHXbooRNyx',b'1232086212917121024',b'Shadan Ahmad',b'ShadanA63086087',b'',b'',b'16',b'17',b'0',b'173',b'5',b'False',b'True',b'True',b'False',b'2019-12-31 11:48:18'
"b'Belgium declares war on Sharia4Belgium, all Muslim members of the organization were arrested - The Free Speech Time\\u2026 https://t.co/xN6CedhwXV'",b'1232086171746029568',b'David Holt',b'HoltDaved',"b'Brighton, England'",b'Environmentalist & Animal Rights Activist         Help Stop Islam taking over the UK',b'150',b'124',b'6',b'20688',b'2',b'False',b'False',b'True',b'False',b'2016-07-15 20:05:35'
b'Musalmano jab tak jalte aur marte rahoge.\\nUthao hathiyar jihad farz ho gaya hai.\\nAur musalmano kya tum apne mazloom\\u2026 https://t.co/HN4zCf1yup',b'1232086140125093888',b'\\u0641\\u062f\\u0627\\u0626\\u064a\\u0646 \\u0627\\u0633\\u0644\\u0627\\u0645 \\u0645\\u062c\\u0622\\u06c1\\u062f\\u06cc\\u0646 \\u0627\\u0633\\u0644\\u0627\\u0645',b'MJ88351556',b'konkan region Maharashtra.',b'\\u200f\\u200fYouths revolutionary motivational & inspirational personality\\n\\u06a9\\u0648\\u0634\\u0634 \\u0628\\u06be\\u06cc \\u06a9\\u0631 \\u0627\\u0645\\u06cc\\u062f \\u0628\\u06be\\u06cc \\u0631\\u06a9\\u06be \\u0631\\u0627\\u0633\\u062a\\u06c1 \\u0628\\u06be\\u06cc \\u0686\\u0646 \\u067e\\u06be\\u0631\\u0627\\u0633 \\u06a9\\u06d2 \\u0628\\u0639\\u062f \\u062a\\u06be\\u0648\\u0631\\u0627 \\u0645\\u0642\\u062f\\u0631 \\u062a\\u0644\\u0627\\u0634 \\u06a9\\u0631',b'59',b'21',b'0',b'13589',b'23836',b'False',b'False',b'True',b'False',b'2019-01-05 20:21:57'
"b""@Shaheenbaghoff1 Wonderful strategy Women children on the front. Muslim men behind rioting killing so police can't\\u2026 https://t.co/wlVvl4OYpJ""",b'1232086139546132480',b'Dexter White',b'DexterW76432347',"b'Miami, FL'","b'Ultra Right Nationalist, Animal Activist, conspiracy Theorist, Libertarian, Gaming, Movies, Pop culture, Books, world war II,'",b'26',b'51',b'0',b'1658',b'4632',b'False',b'False',b'True',b'False',b'2020-01-25 16:32:35'
"b""this people are totally Muslim and chanting jai shree ram to look #rss .. don't get confused its #DelhiRiots\\u2026 https://t.co/ww2WJeUsB5""",b'1232086129328848896',b'Mahesh  Sharma\\U0001f1ee\\U0001f1f3',b'Mahesh____7',"b'Hyderabad, India'",b'EDM LOVER @djsnake is love \\U0001f60d',b'22',b'146',b'0',b'192',b'2260',b'False',b'False',b'True',b'False',b'2017-09-25 19:00:45'
b'To learn the Knowledge of the Deen is fard upon every Muslim man and woman.',b'1232086124174045184',b'LA',b'la_wiwin',b'surabaya|indonesia',"b""\\U0001f495If you can't do great big things, do great little things\\U0001f495""",b'238',b'1003',b'0',b'2530',b'42',b'False',b'False',b'True',b'False',b'2015-02-28 04:07:35'
b'@MohCipto1 @faridmohmdMF @yettiaka Khas pengikut muslim halal darah nya..',b'1232086119065407489',b'Wiwit \\u30b0\\u30ec\\u30fc\\u30b9',b'wywiet',b'',b'',b'61',b'66',b'0',b'4584',b'641',b'False',b'False',b'True',b'False',b'2011-05-10 10:23:21'
"b'""Sesungguhnya dlm Syurga terdapat satu sungai yg bernama Rejab, airnya terlebih putih daripada susu dan terlebih ma\\u2026 https://t.co/frGkQnNQky'",b'1232086103303176192',b'Haf Zaf',b'jnalover',"b'Kuala Lumpur City, Kuala Lumpu'",b'shadows of regrets',b'359',b'2429',b'3',b'17176',b'28157',b'False',b'False',b'True',b'False',b'2012-03-11 06:53:14'
