"b'@AmitRAY15691446 Sorry, ich bin raus. Sie nennen nie Argumente. Wie kommen Sie darauf, dass radikaler, widerw\\xe4rtige\\u2026 https://t.co/jvLC9UE1Rn'",b'1232017097380814849',b'Lorenz Rubner',b'rubner_lorenz',b'',b'',b'5',b'203',b'0',b'230',b'81',b'False',b'True',b'True',b'False',b'2016-10-21 08:18:58'
b'@BernieSanders at the ISNA conference \\n\\nFeatured: Two Democratic Presidential Candidates To Attend 2019 US Muslim B\\u2026 https://t.co/dVChShQPcZ',b'1232017096336453633',b'\\U0001f98bDonna\\U0001f98b',b'MonarchinMN',"b'International Falls, MN'",b'Living my story from up north in the Ice Box #Minnesota \\U0001f49c L\\u10e6ve is the way \\U0001f310 #photography \\U0001f4f7 #naturelover #vegan my \\u2764 is in \\U0001f1ee\\U0001f1f1',b'538',b'372',b'5',b'51978',b'13951',b'False',b'False',b'True',b'False',b'2019-01-21 18:39:22'
"b'@Go4Noctis @Miriam2626 They don\\u2019t care about China\\u2019s involuntary organ donor program, or workers having suicide net\\u2026 https://t.co/mfkS128KB0'",b'1232017089000546305',b'Michelle Obama\\u2019s BULGE',b'engine26medic',"b'Brigadoon, U'","b'Fire Captain/Paramedic,hunter. I have seen the underbelly of our country. please, firmly press your sarcasm button while reading. Proud of your boy!'",b'463',b'645',b'9',b'20015',b'3417',b'False',b'False',b'True',b'False',b'2013-09-03 20:02:56'
"b'\\u0928\\u093e\\u0932\\u093e\\u092f\\u0915 \\u092c\\u091a\\u094d\\u091a\\u093e \\u091c\\u092c \\u0924\\u0915 \\u091a\\u093f\\u0932\\u094d\\u0932\\u0924\\u093e \\u0939\\u0948\\u0964 \\u091c\\u092c \\u0924\\u0915 \\u092d\\u0940\\u0921\\u093c \\u0907\\u0916\\u091f\\u094d\\u091f\\u0940 \\u0928 \\u0939\\u094b \\u091c\\u093e\\u090f , \\u0914\\u0930 \\u091c\\u0948\\u0938\\u0947 \\u091c\\u0948\\u0938\\u0947 \\u092d\\u0940\\u0921\\u093c \\u092c\\u0922\\u093c \\u091c\\u093e\\u0924\\u0940 \\u0939\\u0948 ,\\u0914\\u0930 \\u0924\\u0947\\u091c \\u0906\\u0935\\u093e\\u091c \\u092e\\u0947\\u0902 \\u0930\\u094b\\u0924\\u093e \\u0939\\u0948\\u2026 https://t.co/7hOHz5Lll7'",b'1232017081903661056',b'chetan rajput',b'chetanr95391790',b'',b'Indian',b'6',b'92',b'0',b'201',b'471',b'False',b'False',b'True',b'False',b'2020-01-07 17:51:50'
b'@AMISHDEVGAN Muslim kaun bahut shantipriya kaum hai woh kabhi aisa nahi kar sakti allah hu akbar.usme kabhi kuch na\\u2026 https://t.co/XAkgEwFQdw',b'1232017072059711491',b'dheeraj kumar',b'dheerajpandey97',b'',b'',b'3',b'160',b'1',b'395',b'168',b'False',b'True',b'True',b'False',b'2016-11-12 17:56:29'
b'https://t.co/c0D0x8MJL1',b'1232017071208157184',b'D Miller',b'56Dwight',"b'Tennessee, USA'","b'Botanist, Respiratory therapist and nature lover'",b'149',b'352',b'5',b'6689',b'9204',b'False',b'False',b'True',b'False',b'2015-04-02 13:54:07'
"b'@AndColorPockeT This is time to publicly boycott every muslim. In Myanmar, buddhist organization MA BA THA publicly\\u2026 https://t.co/O7HeWFS4Cr'",b'1232017063691968514',b'Shubham Doneria',b'Shubhamdoneria',"b'Jaipur, India'","b'Into Servers, swayamsevak, I tweet facts, Technology, Dharma, Politics and life. Fan of Swami Vivekanand and @narendramodi\\ninsta - https://t.co/x7CZP0U79f'",b'643',b'1152',b'6',b'21159',b'9198',b'False',b'False',b'False',b'False',b'2010-04-10 14:29:17'
"b""@BDUTT What about those faces who are beating a helpless muslim? Why don't u raise the same voice there?""",b'1232017047061553152',b'Confused_World',b'ShahedJeelani',b'',b'',b'70',b'287',b'0',b'9447',b'11043',b'False',b'False',b'True',b'False',b'2019-04-02 12:05:54'
b'@oecvmk @odegloss @enbyvmon HEY MUSLIM MEN GET FOUR WIVES SO',b'1232017043504947200',b'seokjinnie & 6 aoetannies',b'vrtuaIs',b'',b'#JUNGKOOK: the pretty girls are... a! o! a!',b'446',b'229',b'26',b'24354',b'144527',b'False',b'False',b'False',b'False',b'2018-01-25 15:40:28'
"b'@rohaan_j @JustVent6 halal is some procedure in islam in which muslims ask apology to the animal being killed, trip\\u2026 https://t.co/uKFNPXrVZl'",b'1232017043081158659',b'#IndiaAgainstCAA \\U0001f5a4\\u2764\\ufe0f\\U0001f499',b'thetamileniyan',"b'Chennai, India'","b'\\u0b87\\u0ba8\\u0bcd\\u0ba4\\u0bbf\\u0baf\\u0bbe \\u0b8e\\u0ba9\\u0bcd\\u0baa\\u0ba4\\u0bc1  \\u0ba4\\u0bbf\\u0bb0\\u0bbe\\u0bb5\\u0bbf\\u0b9f \\u0ba8\\u0bbf\\u0bb2\\u0baa\\u0bcd\\u0baa\\u0bb0\\u0baa\\u0bcd\\u0baa\\u0bc1\\u0ba4\\u0bbe\\u0ba9\\u0bcd. \\u0ba4\\u0bbf\\u0bb0\\u0bbe\\u0bb5\\u0bbf\\u0b9f\\u0bae\\u0bcd \\u0b8e\\u0ba9\\u0bcd\\u0bb1\\u0bbe\\u0bb2\\u0bcd \\u0ba4\\u0bae\\u0bbf\\u0bb4\\u0bcd \\u0ba4\\u0bbe\\u0ba9\\u0bcd. \\u0b95\\u0bb0\\u0bc1\\u0ba4\\u0bcd\\u0ba4\\u0bbf\\u0baf\\u0bb2\\u0bcd \\u0bb0\\u0bc0\\u0ba4\\u0bbf\\u0baf\\u0bbe\\u0b95 \\u0ba4\\u0bbf\\u0bb0\\u0bbe\\u0bb5\\u0bbf\\u0b9f\\u0bae\\u0bcd \\u0b8e\\u0ba9\\u0bcd\\u0baa\\u0ba4\\u0bc1 \\u0b86\\u0bb0\\u0bbf\\u0baf\\u0ba4\\u0bcd\\u0ba4\\u0bbf\\u0bb1\\u0bcd\\u0b95\\u0bc1 \\u0b8e\\u0ba4\\u0bbf\\u0bb0\\u0bbe\\u0ba9\\u0ba4\\u0bc1, \\u0b9a\\u0bbe\\u0ba4\\u0bbf\\u0baf\\u0bb1\\u0bcd\\u0bb1 \\u0ba4\\u0bae\\u0bbf\\u0bb4\\u0ba9\\u0bc8 \\u0b95\\u0bc1\\u0bb1\\u0bbf\\u0baa\\u0bcd\\u0baa\\u0ba4\\u0bc1.'",b'524',b'872',b'0',b'2931',b'5398',b'False',b'False',b'False',b'False',b'2017-08-30 18:39:10'
"b'""I Am Hijabi, Muslim, Black..."": Rep. Ilhan Omar Posts List Describing Herself to Troll Conservatives; Rival Candid\\u2026 https://t.co/Y5uOJXn5FE'",b'1232017042615783426',b'Gaetano DeCaprio \\U0001f1ee\\U0001f1f9',b'decapriogaetano',"b'Toronto, Canada'","b'Love Jesus,wife,kids, grandkids,and work.\\n\\U0001f1ee\\U0001f1f1\\U0001f1fa\\U0001f1f8\\U0001f1ec\\U0001f1e7\\U0001f1e8\\U0001f1e6\\U0001f1e6\\U0001f1fa\\U0001f1f3\\U0001f1ff\\nA heeding to us .\\nASAIAH 1'",b'79',b'287',b'0',b'9022',b'6161',b'False',b'False',b'True',b'False',b'2016-11-19 10:52:39'
"b'@RanaAyyub Muslim rioter named Shah Rukh fired gun at police, muslim rioters burnt bikes, buses &amp; houses, muslim ri\\u2026 https://t.co/FLoFvEFwwI'",b'1232017035481079808',b'\\U0001f643\\U0001f643',b'TerraformedMoon',b'',b'',b'1',b'19',b'0',b'42',b'23',b'False',b'False',b'True',b'False',b'2018-05-28 07:16:06'
b'A muslim being beaten by RSS Nazi regime of Indian govt BJP. You see the wooden rod in Pic it broke to beat him. Th\\u2026 https://t.co/VAqkb2sC8I',b'1232017035456131074',b'\\U0001f345 Farmer',b'pain___killer',b'Pakistan',b'blogger at https://t.co/G33xgeEtuW\\n\\n\\na humble tomato farmer. Some where in wilderness I am growing tomatos to add flavor to dull reality of life.\\nPakistani to core.',b'2325',b'3275',b'14',b'22819',b'8040',b'False',b'False',b'True',b'False',b'2011-02-28 00:20:24'
b'@lfrayer @ahmermkhan Agreed. \\nBut what is up with your NPR puff piece on the Modi-Trump Nuremburg rally? Not a peep\\u2026 https://t.co/QjiVBQKa15',b'1232017035409776641',b'ignatz rats',b'ignatzrats',b'',b'',b'15',b'276',b'0',b'2704',b'6186',b'False',b'False',b'True',b'False',b'2011-12-20 17:50:15'
b'@saket71 @AmitShah @narendramodi @PMOIndia @DelhiPolice Time to show might of state.\\n\\nWhy Police becomes toothless\\u2026 https://t.co/j3YlJtB6kH',b'1232017032364736512',b'Vineet Bhardwaj \\U0001f1ee\\U0001f1f3',b'vin_bhardwaj',b'',b'A Bhartiya Hindu. Views expressed are personal and have no link with any organization or person',b'166',b'473',b'11',b'19104',b'2211',b'False',b'False',b'True',b'False',b'2013-11-19 14:37:08'
b'#IslamicTerrorism HE IS MUSLIM AND HE IS TERRORIST https://t.co/XcmA0s4n6R',b'1232017031073075200',b'FEARLESS WRITER \\U0001f6a9\\U0001f6a9\\U0001f6a9',b'hindustan_am',b'',b'Account suspend hote rahenge DESHBHAKTI KAISE SUSPEND KAROGE...BORN TO SPEAK TRUTH                            \\n JAI HIND \\U0001f1ee\\U0001f1f3\\U0001f1ee\\U0001f1f3\\U0001f1ee\\U0001f1f3  \\u0935\\u0928\\u094d\\u0926\\u0947\\u092e\\u093e\\u0924\\u0930\\u092e \\U0001f1ee\\U0001f1f3\\U0001f1ee\\U0001f1f3\\U0001f1ee\\U0001f1f3',b'14',b'74',b'0',b'1094',b'628',b'False',b'False',b'True',b'False',b'2019-12-16 03:18:26'
b'Jaha bharat ke economic development conectarte karne chahiye wahi humare desh me kya chl rha h? toh  hindu muslim kar rhe h #DelhiBurning',b'1232017025708498946',b'me',b'meenuism',b'',b'take as a point of view\\U0001f917\\n not as a revange',b'23',b'5',b'0',b'1844',b'3069',b'False',b'False',b'True',b'False',b'2020-01-04 08:43:46'
"b'@Manesha76 Ok so CAA is anti Muslim, anti national, anti constitutional. \\n1. it is part of constitution as it passe\\u2026 https://t.co/g0eSLzJQIh'",b'1232017021946101760',b'Vishal Upadhyay',b'VishalU15',"b'Mumbai, Bharat'","b'Engineer, Hindu Nationalist. RTs not endorsements. followed by Lt.Gen @pashasehgal @GenPanwar @brigvkagrawal @PiyushGoyalOffc @kaalateetham'",b'591',b'1925',b'2',b'14883',b'20755',b'False',b'False',b'False',b'False',b'2015-04-02 12:28:28'
"b""@DonJuli49810164 @RobertFife agree and let's not forget the Muslim's voter's guide!""",b'1232017006586519552',b'Ronnie',b'ShareElizabeth3',b'',"b""Please, no DM's. I'm here to see the arrests.. Canada is finished if we don't get rid of our corrupt Liberal gov't. Vote red or America is dead. IFB Patriots""",b'2423',b'2496',b'1',b'13084',b'25098',b'False',b'False',b'False',b'False',b'2016-10-01 22:38:40'
b'Killer named Shahrukh a Muslim arrested. https://t.co/3d58hUVGPY',b'1232017004799746056',b'Indra Swami',b'ibschauhan',b'Varanasi/Laxamanpuri',b'Bharat Vikas Parishad',b'349',b'298',b'15',b'25824',b'11524',b'False',b'False',b'False',b'False',b'2010-05-06 08:42:42'
b'@realDonaldTrump @ImranKhanPTI Exhibit B: This guy wants to carry out a genocide of Muslims in India and change the\\u2026 https://t.co/zvh2WceMIx',b'1232017003025719298',b'Danial',b'defilibrator',"b'Islamic Republic of Pakistan, '",b'Freelancer | Writer | ACCA | Finance and GeoPol student | #Ravenclaw | #Kashmir | #Palestine',b'5727',b'457',b'34',b'93244',b'6681',b'False',b'False',b'False',b'False',b'2013-01-01 19:55:20'
b'@muuhtoddunga @Salehasiddique3 Tere jaise chutiye se baat ni karni use to hindu muslim? Waah jhaatu aage jayega bohot.',b'1232017000299261952',b'Saif',b'itzsaifkhan_',b'',b'instagram meme page: @another__memer',b'3957',b'92',b'11',b'34466',b'28431',b'False',b'False',b'True',b'False',b'2017-02-17 17:07:45'
b'@realDonaldTrump @narendramodi Check this also https://t.co/W6x32LXpOf',b'1232016985594191877',b'Mallik',b'mallik_muslim',b'',b'',b'5',b'27',b'0',b'10',b'2',b'False',b'False',b'True',b'False',b'2013-02-05 14:59:55'
b'@BalramS55671001 @BillGates FYI jakar 2011 ke India ke census ko padh lo usme mention se ki muslim ki birth rate gh\\u2026 https://t.co/hbVJ69uO2W',b'1232016982762872835',b'Ghufran Ahmed',b'ghufranahmed199',b'Rajarhat kolkata 700135',"b'Not all battles are fought for victory. Some are fought simply to tell the world that someone was there on the battle field,'",b'137',b'45',b'1',b'2186',b'145',b'False',b'False',b'True',b'False',b'2013-01-01 11:15:41'
b'Just exchanged the most heartfelt eye roll with a Muslim woman on the bus after some old white dude kept saying \\u201csa\\u2026 https://t.co/a19zNBKHza',b'1232016981978578944',b'Aly Laube',b'godalyshutup',"b'Vancouver, British Columbia'","b'Know-it-all (journalist), loudmouth (musician), control freak (event producer & EIC). Lebanese-Chilean-French, so you don\\u2019t have to ask \\U0001f942'",b'294',b'1215',b'2',b'255',b'900',b'False',b'False',b'False',b'False',b'2015-03-28 05:31:36'
"b'@Shehzad_Ind Abe Dallal isko bhool gaya, jab koi Hindu Terrorist hota hai to Tu moo me rakh ke baithta hai, jab koi\\u2026 https://t.co/Gor7ffT2Lv'",b'1232016980808327171',b'Azad',b'farooqmd291',"b'Nizamabad, India'","b""Alhamdulillah I'm an Engineer,\\nSocial Media Activist,\\nIUML Nizamabad Town General Secretary,\\nI Never Lose Either I Won Or I Learn...""",b'131',b'119',b'0',b'563',b'19646',b'False',b'False',b'True',b'False',b'2016-07-28 13:12:57'
b'@ruh_bika_ji Ek police Wala Mara hai Baki Muslim hi mare tum Dalal chatna kaam tumhara talwe chato',b'1232016976614023172',b'mushab noori',b'NooriMushab',"b'Mumbai, India'","b'own business \\U0001f4af follow ,,, unfollow= unfollow'",b'288',b'305',b'0',b'3200',b'4003',b'False',b'False',b'True',b'False',b'2020-01-29 07:10:34'
b'Itna To Samajh Aagya ke Pro-CAA ka Mtlb Anti Muslim h...\\nOr Kuch Nhi..\\U0001f4af\\U0001f4af\\n#DelhiPolice #DelhiBurning \\n#DelhiRiots\\u2026 https://t.co/938PD83pDU',b'1232016976601440259',b'Tamjeed Farooqui',b'FarooquiTamjeed',b'',b'',b'10',b'63',b'0',b'43',b'407',b'False',b'False',b'True',b'False',b'2020-01-05 19:21:27'
"b'@Imamofpeace @Expedia Now u scream discrimination, when a few days ago @ryanair CEO calls for all muslim men to be profiled. Get fucked.'",b'1232016976031158272',b'\\U0001f1ea\\U0001f1f8/\\U0001f1e9\\U0001f1ff/\\U0001f1eb\\U0001f1f7',b'Galiciangold',b'\\u262a\\ufe0f\\u271d\\ufe0f\\U0001f54e',b'A los tontos no les dura el dinero.',b'41',b'57',b'0',b'1706',b'9385',b'False',b'False',b'False',b'False',b'2019-01-18 15:12:01'
b'@doamuslims Where is the community ?\\nWhere is humanity ?\\n#UnitedMuslims \\U0001f914\\n#Muslim https://t.co/pSNO57YHct',b'1232016973594316800',b'Samir 75',b'Samirvision75',b'France Paris',"b'Graphic designer fich\\xe9 couscous \\n\\U0001f1eb\\U0001f1f7 \\u0698\\u2d63Z #Shalom #Peace #Salam  \\n""Le racisme est une mani\\xe8re de d\\xe9l\\xe9guer le d\\xe9go\\xfbt qu\'on a de soi-m\\xeame""\\nRobert Sabatier\\n\\U0001f5e3\\U0001f6d1'",b'351',b'1274',b'12',b'7062',b'20479',b'False',b'False',b'False',b'False',b'2009-10-01 14:47:54'
b'@kumarrakesh231 @fab_sunil @MdAnwarRais3 @ArvindKejriwal Acha ek chij batao aap mante ho ki nhi ki muslim par julm ho rha he',b'1232016964094218241',b'Danish Khan',b'DanishK75108377',b'',b'',b'246',b'390',b'0',b'945',b'18',b'False',b'False',b'True',b'False',b'2019-12-15 16:35:56'
"b""You can beat this poor Muslim body to death but you can't touch his soul. But for bhakts n BJP only their body will\\u2026 https://t.co/zrs6bo0Itv""",b'1232016960344313856',b'Ritambara',b'Ritambara_d',b'',b'Human Being. Educator and Activist',b'114',b'241',b'0',b'1035',b'6727',b'False',b'False',b'True',b'False',b'2016-06-11 10:56:11'
b'@LindaRo27856935 Mmm make you right young lady.. tbis little shit aint interested in tbis really its mouthsucking a\\u2026 https://t.co/E6IFpJURmX',b'1232016940174057472',b'kev kirkby',b'KevKirkby',b'',b'',b'200',b'67',b'0',b'6380',b'15338',b'False',b'False',b'True',b'False',b'2019-04-01 11:53:32'
b'@DVATW Hindu is terrorist mindset culture these people think they can kill him if victim trying stand for against t\\u2026 https://t.co/jSm7kSxmzo',b'1232016935950352384',b'Umer',b'Umer74248291',b'',b'yes I can',b'1',b'1',b'0',b'25',b'9',b'False',b'False',b'True',b'False',b'2019-12-28 19:39:26'
b'@MWLOrg Help Indian Muslim in danger https://t.co/MK5ongHbtC',b'1232016925984743430',b'Saif Allahabadi',b'Saifhuda786',"b'Allahabad, India'",b'First Time Reports',b'37',b'264',b'0',b'702',b'397',b'False',b'False',b'True',b'False',b'2017-06-20 19:30:12'
"b'Ted, we really don\\u2019t want her here. \\n\\nWake Up, America.\\n\\nThe Truth about ISLAM by a recovered MUSLIM : Bosch Fausti\\u2026 https://t.co/djEiWTaOjj'",b'1232016924839677962',b'\\U0001f31f\\U0001f31f\\U0001f31fTrump4 ALL Americans \\u23f3IFB',b'B13_suMCovfefe',"b'TheDanCrenshawWay, QAnon'","b'#WalkItForward We don\\u2019t hv 2agree, but shld we not want 2get along w/all? Hate is lonely. The world is our oyster, or hell. #TrustThePlan #TheStQrmIsHere'",b'8192',b'9013',b'12',b'89570',b'31599',b'False',b'False',b'False',b'False',b'2015-07-15 14:35:49'
b'@ThePerilousGirl @DoctorRichaBjp \\U0001f9d0\\U0001f917 thank you but hyd is not only owaisi. it has 3 mp constituencies\\n1 - old city (\\u2026 https://t.co/ZdgvMdlN0d',b'1232016911568756738',b'Anirudh Devulapally',b'Anirudh4d97',"b'Hyderabad, India'",b'',b'352',b'957',b'0',b'1170',b'129293',b'False',b'False',b'True',b'False',b'2015-09-30 13:03:58'
"b""Accompanied by the Indian PM who is overseeing a potential Muslim pogrom, so don't really know what to make of this? https://t.co/DAP15LcvSn""",b'1232016904317022210',b'Nusrat Zahra',b'nusrat_xahra',b'Out of place',b'Pathology and everything else.',b'2306',b'4029',b'14',b'37796',b'115373',b'False',b'False',b'False',b'False',b'2009-06-17 07:01:42'
b'@tweet_forindia @realDonaldTrump @PMOIndia she is not your sister She\\u2019s Muslim:)... and Because of her her Family a\\u2026 https://t.co/8isSPK9IXg',b'1232016895928344576',b'Ibn Yusuf.',b'Aly61265741',b'Azad Kashmir Province',b'The command to rule according to what Allaah has revealed: \\u201cAnd so judge between them by what Allaah has revealed . . .\\u201d [aayah 49]',b'146',b'29',b'1',b'4550',b'859',b'False',b'False',b'True',b'False',b'2019-12-17 14:40:04'
b'@MysterySolvent The White supremacist *ruler of U.S.A. visits the Hindu supremacist ruler of India \\u2014 who is current\\u2026 https://t.co/8oJCRafiSd',b'1232016888810467328',b'Sufi',b'SufiSoof',b'',"b'i carry your heart with me(i carry it in my heart)i am never without it(anywhere i go you go,my dear;and whatever is done by only me is your doing,my darling)'",b'235',b'588',b'1',b'32759',b'20691',b'False',b'False',b'True',b'False',b'2015-03-31 00:19:12'
b'@PJkanojia @DelhiPolice @HMOIndia \\n\\nYe bkl @PJkanojia hame aur Muslim bhaiyon ko ufsaa rahaa he... \\n\\nKindly take re\\u2026 https://t.co/UwqZSMo64l',b'1232016875384475648',b'Teju Joshi',b'TejasJo47505511',b'BHARAT',b'',b'94',b'189',b'0',b'8359',b'23316',b'False',b'False',b'True',b'False',b'2019-07-12 19:34:12'
b'YHE Muslim NAHI h ok https://t.co/MTSvnKILCT',b'1232016869932007429',b'Shaikh Naavied',b'shaikh_naavied',"b'Maharashtra, India'",b'NRC CAA CAB NPR AMENDMENT BILL protests',b'206',b'812',b'1',b'5201',b'6622',b'False',b'False',b'True',b'False',b'2016-08-22 20:46:37'
"b'@coolix88 Once again, no one has said Muslims are terrorists. The discussion point was related to the majority of m\\u2026 https://t.co/pyazqCQOF3'",b'1232016869734985732',b'TheScouseTory',b'thescousetory',"b'North West, England'","b'Scouse conservative, yes they do exist. Pro-Brexit, Pro-Boris and Pro democracy. Dislike remoaners (not remainers), Corbyn zombies, lefties and the PC brigade.'",b'103',b'57',b'4',b'6074',b'2385',b'False',b'False',b'True',b'False',b'2013-08-02 15:52:54'
"b'...""In some respects, I believe that that Gandhi\'s martyrdom shamed Hindus. It gave us 20-25 years of relative peac\\u2026 https://t.co/OhHuGmQj1G'",b'1232016866618404864',b'_',b'anirudhdbz',"b'\\u091a\\u0947\\u0928\\u094d\\u0928\\u0908, \\u0b87\\u0ba8\\u0bcd\\u0ba4\\u0bbf\\u0baf\\u0bbe'",b'Likes/ RTs are not endorsements. Opinions at the time of tweeting not a reflection of current opinion.',b'416',b'1166',b'1',b'15554',b'137235',b'False',b'False',b'False',b'False',b'2010-05-23 06:56:59'
b'@Hazz510 @muslim_012 @mansori_fcb @farsalzalam94 @AlkaabiAs @Barca1st \\u062a\\u0633\\u062a\\u0627\\u0647\\u0644 \\u062c\\u0627\\u0626\\u0632\\u0629 \\u0642\\u0644\\u0629 \\u0627\\u0644\\u0627\\u062f\\u0628 \\u0627\\u0644\\u0630\\u0647\\u0628\\u064a\\u0629 \\u0644\\u0642\\u0644\\u064a\\u0644\\u064a\\u0646 \\u0627\\u0644\\u0627\\u062f\\u0628.',b'1232016862759788547',b'\\u0646\\u0627\\u064a\\u0641. 96:36',b'N__if2',"b'\\u0627\\u0644\\u0631\\u064a\\u0627\\u0636, \\u0627\\u0644\\u0645\\u0645\\u0644\\u0643\\u0629 \\u0627\\u0644\\u0639\\u0631\\u0628\\u064a\\u0629 \\u0627\\u0644\\u0633\\u0639\\u0648\\u062f'",b'\\u200f\\u200f\\u200f\\u200f\\u2022\\u200f\\u064a\\u0631\\u0649 \\u0628\\u0623\\u0646 \\u0627\\u0644\\u062d\\u0642\\u064a\\u0642\\u0629 \\u0641\\u064a \\u0627\\u0646 \\u0645\\u064a\\u0633\\u064a \\u0623\\u0639\\u0638\\u0645 \\u0644\\u0627\\u0639\\u0628 \\u064a\\u062c\\u0628 \\u0623\\u0646 \\u062a\\u064f\\u062f\\u0652\\u0631\\u0643.     \\n\\n\\n          \\u2022\\u0645\\u0647\\u062a\\u0645 \\u0628\\u0627\\u0644\\u0644\\u063a\\u0629 \\u0627\\u0644\\u0627\\u0646\\u062c\\u0644\\u064a\\u0632\\u064a\\u0629-\\u0627\\u0644\\u0627\\u0633\\u0628\\u0627\\u0646\\u064a\\u0629-\\u0627\\u0644\\u064a\\u0627\\u0628\\u0627\\u0646\\u064a\\u0629\\n\\u200e\\u200e\\u200e\\u200e\\u200e#\\u0627\\u0635\\u062f\\u0642\\u0627\\u0621_\\u0627\\u0644\\u0644\\u063a\\u0627\\u062a',b'520',b'232',b'7',b'15095',b'143',b'False',b'False',b'True',b'False',b'2015-11-29 16:26:57'
b'(Also super proud because I pitched a Muslim fashion icon and I\\u2019m thrilled that she\\u2019s going to be highlighted here)',b'1232016854111150080',b'Trickster Goddess\\U0001f33bJester Lavorre',b'MissSunFlower94',b'St. Louis MO',b'Maggie Peters (she/her) | Tangy | Content Writer | German Countess | In a Long Distance Relationship with the Ocean | \\U0001f496\\U0001f49c\\U0001f499',b'722',b'288',b'11',b'26189',b'53246',b'False',b'False',b'False',b'False',b'2009-06-24 01:40:14'
b'@elIiotsays @sa1leha You believe in shiaism which is very racist religion subanallah I am a Muslim not an shia.Come\\u2026 https://t.co/Ud2b559dXu',b'1232016850709598219',b'AhlulSunnah',b'AhlulSunnah2',b'Jannah al Firdous inshallah',b'Promoting good and disproving https://t.co/Lpenugv9HX people to the worship of their creator.\\nMy channel\\nhttps://t.co/aKEo86AMVT\\u2026',b'26',b'68',b'1',b'1082',b'812',b'False',b'False',b'True',b'False',b'2020-02-01 02:11:54'
b'picture of a Muslim human being brutally beaten up by fellow humans in Delhi today..India should be careful. https://t.co/rUwXT8bMRT',b'1232016849661026304',b'Amb Isah Babayo',b'isahguru',"b'Gombe State, Nigeria'",b'Writer| Journalist| An Award Winning Essayist| Commonwealth Correspondent| B.Ed Educational Administration & Planning |Youths Agent|',b'216',b'664',b'0',b'732',b'79',b'False',b'False',b'True',b'False',b'2013-01-20 16:41:51'
b'@vigil_nte @desimojito Their Muslim husbands. Take example of Urmila .. so much of  Hindu men wasted sperms for her\\u2026 https://t.co/8ijLVd9I8Q',b'1232016825363226625',b'Vishal',b'Vishal91786471',b'',b'NA',b'9',b'63',b'0',b'207',b'707',b'False',b'True',b'True',b'False',b'2019-12-06 11:40:49'
"b'\\u0927\\u094d\\u092f\\u093e\\u0928 \\u0930\\u0916\\u093f\\u092f\\u0947 \\u0939\\u093f\\u0928\\u094d\\u0926\\u0942 \\u0915\\u093e \\u0915\\u0941\\u0924\\u094d\\u0924\\u093e \\u092d\\u0940 \\u0915\\u093f\\u0938\\u0940 \\u0915\\u094b \\u0915\\u093e\\u091f \\u0932\\u0947\\u0924\\u093e \\u0939\\u0948 \\u0924\\u094b \\u0909\\u0938\\u0947 \\u0939\\u093f\\u0902\\u0926\\u0942 \\u091f\\u0947\\u0930\\u0930 \\u0915\\u0939 \\u0926\\u0947\\u0924\\u0947 \\u0939\\u0948\\u0902 \\u0932\\u094b\\u0917, \\u0906\\u0915\\u094d\\u0930\\u093e\\u092e\\u0915 \\u0928\\u0939\\u0940\\u0902 \\u0939\\u094b\\u0902\\u0917\\u0947 \\u0924\\u094b \\u092a\\u0940\\u091b\\u0947\\u2026 https://t.co/3oPXf6WqTv'",b'1232016824293740544',b'Er. Dushyant Kumar Upadhyay',b'Dkupadhyaybjp',"b'Gwarau kalan, Hathras (U. P.) '",b'#\\u0930\\u093e\\u0937\\u094d\\u091f\\u094d\\u0930\\u0939\\u093f\\u0924\\u2694\\ufe0f#\\u0938\\u0930\\u094d\\u0935\\u094b\\u092a\\u0930\\u093f BJP #Dushyant_Upadhyay \\u0915\\u093e \\u0906\\u0927\\u093f\\u0915\\u093e\\u0930\\u093f\\u0915 \\u091f\\u094d\\u0935\\u093f\\u091f\\u0930 #\\u0939\\u0948\\u0902\\u0921\\u0932 (\\u0928\\u094d\\u092f\\u0942\\u091c \\u0930\\u093e\\u091c\\u0928\\u093f\\u0924\\u093f \\u092a\\u094d\\u0930\\u0947\\u0915\\u094d\\u0937\\u0915 \\u0914\\u0930 \\u0935\\u093f\\u0936\\u094d\\u0932\\u0947\\u0937\\u0915) \\u092e\\u0948\\u0902 \\u091c\\u093e\\u0928\\u0915\\u093e\\u0930\\u0940\\u092a\\u0942\\u0930\\u094d\\u0923 \\u0924\\u0925\\u094d\\u092f\\u094b\\u0902 \\u092a\\u0930 \\u090f\\u0915 \\u0930\\u093e\\u092f \\u0914\\u0930 \\u091f\\u094d\\u0935\\u0940\\u091f \\u0915\\u0930\\u0924\\u093e \\u0939\\u0942\\u0901',b'454',b'925',b'0',b'5747',b'8650',b'False',b'False',b'True',b'False',b'2016-07-08 07:53:39'
b'Muslims are doing perceuction of minorities in Pakistan. Muslims are taking rights of that minorities in India.and\\u2026 https://t.co/8JtVc6wAfF',b'1232016823538704390',b'Abhinandan Bodale',b'_ImMrAB_',b'Maharashtra',"b""I am lefty\\u270b\\ufe0f, Not leftist, and that doesn't mean I support right wing.\\U0001f1ee\\U0001f1f3\\U0001f1ee\\U0001f1f3""",b'14',b'108',b'0',b'665',b'642',b'False',b'False',b'False',b'False',b'2012-10-14 09:51:59'
"b""@shembi79 I get u. I have Muslim friends who'd msg me while sitting across a table, they'd rather not voice it. The\\u2026 https://t.co/m6opTIkrA7""",b'1232016822171586560',b'Natasha',b'yeskaybe',b'',b'Migrant Mallu. Unapologetically opinionated & Mildly narcissistic',b'481',b'265',b'1',b'5243',b'17718',b'False',b'False',b'True',b'False',b'2017-01-31 04:49:13'
"b""@_LeCartographe_ @muslim_flower5 @ramireztweetos @CCastaner C'est ton testament ces twitts ?""",b'1232016811434168323',b'Ryadh il est temps de rallumer les \\xe9toiles\\U0001f680',b'SansBagues',b'Sion\\xe9sie',b'\\u270cil est temps de rallumer les \\xe9toiles',b'943',b'3139',b'3',b'19600',b'8369',b'False',b'False',b'True',b'False',b'2018-09-20 19:23:06'
"b'@TimRunsHisMouth I saw a tweet before, that you wish to visit #India once. Also you said something good about us. B\\u2026 https://t.co/kAs3btEmMx'",b'1232016798783922179',b'Mano',b'mano_reports',"b'Chennai, India'","b""|Journalist|Chennai|Love to Cook|Melomaniac|Reports:Politics, Crime, Weather, Entertainment|Views #Strictly_Personal|RT's at #Own_Risk|""",b'227',b'650',b'0',b'2499',b'4192',b'False',b'False',b'True',b'False',b'2019-11-19 20:23:24'
"b""They can't blame Muslims even for as HEINOUS a crime as #Godhra where 25 women &amp; 15 CHILDREN were burnt. As\\u2026 https://t.co/vXRbSghz5r""",b'1232016797508853760',b'Gujaratriots.com',b'Gujaratriotscom',b'',b'Admins of http://t.co/OFVtrpqLhP  Retweets are NOT an endorsement! Written book Gujarat Riots: The True Story http://t.co/AnH5RePNqi',b'4367',b'613',b'26',b'21267',b'268',b'False',b'False',b'True',b'False',b'2012-03-07 09:17:15'
"b'@realDonaldTrump Modi is a racist , anti Muslim, supports a Caste system and more.  Its no wonder Trump likes him.'",b'1232016787501436928',b'Crustacean King',b'CrustationK',"b'St. Louis, Misery '","b'new main account. I was once an Emperor of the Mollusk, but was a bad boy..  \\U0001f30a\\U0001f30a\\U0001f308\\U0001f308'",b'344',b'679',b'0',b'5872',b'7797',b'False',b'False',b'True',b'False',b'2019-10-28 16:27:54'
